,가게이름,리뷰아이디,리뷰,맛평가
462,닥터로빈,예랑,"한줄평: No MSG, No Sugar, No Butter을 내건 건강한 레스토랑전에 상암에 미팅갔다가 먹었던 닥터로빈 상암. 닥터로빈은 No MSG, No Sugar, No Butter, No Fry를 추구하며 건강한 재료로 만드는 컨셉. 우리 먹거리로 만드는 곳. 생크림이나 버터 같은 동물성 지방 대신 100% 국내산 콩으로 만드는 건강 크림소스를 사용. 예전에 여의도점을 자주 갔었는데, 이렇게 상암에서도 오게 됐다. 대표메뉴인 단호박 스프. 단호박을 통으로 사용하고 안에 크림스프를 넣어주는데, 단호박 내용물이랑 같이 잘 긁어먹으면 고소한 단호박스프가 돼서 좋아함! 고소하고 맛있다.버섯리조또도 시켜먹었는데 표고버섯이랑 느타리버섯 등 버섯을 듬뿍 올려주는게 특징. 크림 베이스라 되직한데, 꽤나 맛있음! 토마토파스타도 하나 시켰는데, 무난하니 먹을만 했다.이런 체인 레스토랑 중에서 그래도 나름 먹고나면 속도 편하고 맛있는 곳!instagram @yeh_rang #먹히영",맛있다
463,닥터로빈,하루별,"건강한 컨셉이라 좋아하는 닥터로빈! 이대지점보다 여기가 더 맛있었어요 매콤 연어 스테이크 파스타가 신메뉴라서 주문해봤는데 소스가 꽤 매웠어요 매운거 잘 못먹는 편이라 처음 먹었을땐 많이 맵다 싶었는데 크림류라서 좀 덜 느끼한 맛이 괜찮기도 했구요 까수엘라에 사이드로 빵이 나오는데 3500원 추가하면 빵 추가도 할수 있어요 저는 추가해서 먹었는데 기본적으로 주문할 때 보다 추가할때가 빵 양이 더 많았어요 다 먹고 나서 젤라또를 먹었는데 원플원 행사중인데다, 한스쿱의 양에서 한스쿱 더 주는 이벤트 하더라구요 그래서 저렴하게 먹었구 커피두 1+1해서 주문했는데 커피 맛은 그냥 쏘쏘했어요 젤라또는 느끼하지 않고 건강한 맛이라 다음엔 젤라또랑 크림계열 파스타 이렇게 다시 먹으러 가고 싶어요",괜찮다
464,닥터로빈,MadMaxMarMan,상암점이 반포점이나 광화문점 보다 맛이 좋음.파스타는 두유맛이 나는데 난 원래 두유를 좋아해서 그런지 건강하고 담백한 맛이 좋았음.여긴 추천!,맛있다
465,닥터로빈,GABY,"가격이 싸지 않은데, 조미료,설탕 등 안쓰고 만든거인데도 맛있어요~ 굳이 탄산 안먹어도 느끼하지 않은 편이에요! 피자보단 리조또가 더 맛있어요!",괜찮다
466,뚜띠쿠치나,윤숙령,샐러드 퍼스타까지 잘 먹고 스테이크로 입맛버렸어요.바삭이 아니라 완전 태워줬네요.,별로
467,뚜띠쿠치나,상암동주민,그냥 무난하게 괜찮은 이탈리안 레스토랑서비스도 괜찮고 맥주 맛이 일품음식들은 적어도 돈이 아깝지는 않다,괜찮다
468,뚜띠쿠치나,핏짜,"스테이크피자 넘 맛있습니당!^^위에 고기도 많이 올려주고, 분위기도 괜찮았어요",맛있다
469,뚜띠쿠치나,ㅇㅇ,전에 홍합메뉴 가을할인때문에 혼자 들어가서 먹었는데 할인된 홍합이나 시켜먹은 해물파스타나 둘다 그닥이었습니다.. 일하는 분들은 친절하시던데...안타깝네요.,괜찮다
470,뚜띠쿠치나,So So Def,"2인메뉴가 샐러드+에피타이져+파스타+피자+음료두잔(맥주or 와인or에이드) 39900원으로 알찬구성으로 보이나 부가세 불포함 가격이라 계산할때 43000원이 나옴.기본 샐러드와 에피타이져는 각각 정식메뉴 처럼 나올거라고 생각했으나 조금씩 덜어 한그릇에 나오고 토마토소스의 숏파스타, 마게리따피짜 와인두잔까지 구색은 전부 갖췄는데... 많이 아쉬운 느낌!별로와 괜찮다 사이를 드리고싶네요.",별로
471,매드포갈릭,아지,상암에 매드포갈릭이 있어 좋다 ! 내부도 넓은편내부가 넓고 상암 엠비씨 몰플라자 2층에 위치해있어 회식장소로 추천한다 - 계절 스테이크 좋았고 음료리필 계속 해주시는 서비스가 좋았다 :),맛있다
472,매드포갈릭,ㅇㅇ,너무 많이 처먹었지만 역시 이곳은 쿠폰이랑 할인이 없으면 사기당하는 기분이다..,괜찮다
473,매드포갈릭,우왛ㅎ,랍스터랑 스테이크 같이 나오는 음식이랑 페투치니 면 들어가는 크림파스타 먹었어요맛은 다 괜찮았는데 스테이크가 이상하게 너무 늦게 나왔어요 주방에서 주문 처리에 문제가 생겼었나봐요,괜찮다
474,매드포갈릭,추억의도나쓰,바삭하고 고소한  마늘이  한가득  들어있는  갈릭  스노잉  피자와  호브갈릭  스테이크를  먹었다.마늘을  굽거나  튀겨  나오기  때문에  매운  마늘을  상상하면  오산.11월  말까지 3만원  이상  메뉴를  주문하면  특정 메뉴 5가지  중  한가지를  5천원에  먹을  수 있는  행사중이다.오픈키친이어서 믿고 먹을 수 있고  테이블도  넓어서  여유롭게  식사를  즐길  수 있다. 스테이크에  힘줄이  많아서  썰고 씹어먹기가 조금  힘들었지만 소스는 아주  맛있었다.,맛있다
475,브로일하우스,ParkJieun,버거 맛있어용 감자도 완전굳,맛있다
476,베란다,김나물,"대로변, 2층에 있는 예쁜 파스타집♡지나갈 때마다 궁금하던 곳.평일 점심 때 갔는데 사람이 우리 포함 2팀 밖에 없었다. 깨끗하고 조용히 먹을 수 있어서 좋긴 하지만...난 시원한 하노이파스타.그리고 카르보나라를 주문.음식 나오는데 좀 시간이 걸렸어요.근무 중이었으면...점심 시간이 다 날라갈 뻔.하노이 파스타는 샐러드처럼 여러가지 제료와 고기! 마늘! 고수!의 강한 향으로...제료 각각은 맛있는데 섞으면 뭔지 모르는 재밌는 맛이었어요~.그래도..더운 날엔 시원하고 좋았어요.그리고 토마토쥬스, 신선하고 맛있었어요~!전체적으로 생각보다 그냥 그랬지만...분위기는 괜찮아요.",괜찮다
477,베란다,하루별,플레이팅이 일단 예뻤다 어니언스프를 좋아해서 주문했는데 생각보다는 쏘쏘ㅠㅠ 치즈가 좀 더 많이 들어가면 하는 아쉬움이 남았고 스테이크는 일단 예뻤는데 미디움웰던으로 부탁드렸는데 막상 받고 보니 안익은 부분이 좀 있어서 아쉬움이 남는다 인테리어와 분위기가 예뻐서 데이트할때는 괜찮을 곳,괜찮다
478,마치래빗,김혜진,야근할때 포장해 가져온 샐러드! 기본샐러드에 소고기 추가했더니 버섯이랑 계란중 뭘 올려드릴까요 물으셔서 버섯으로 부탁드렸다. 그리고 오리엔탈소스 추가. 야채가 굉장히 신선해서 씹는맛이 좋았고 고기도 맛있었다. 직원분들도 친절하셨다!,맛있다
479,마치래빗,min,건강하게 한끼하기 좋으나.. 솔직히 비싸단 생각이 든다 ㅋㅋ 양이 다른 샐러드 집에 비해 넘 작고 야채는 엄청 싱싱하지 못함,괜찮다
480,마치래빗,ㅇㅇ,소고기들어간 스태미나 도시락을 먹었는데 고기가 너무 질겼어요..ㅠㅠ 이거 소고기 많이 안구워봐서 무조건 핏물 사라질때까지 익혀야 된다고 얘기하던 옛날 어른들 생각나는 정도의 굽기... 샐러드의 끝은 재료의 특성을 다루는데에 있다고 생각하는데 그런면에서 정말 아니었네요 드레싱도 딱히 특출나지도 않아..,별로
481,마치래빗,MJ,"가로수길에 있는 샐러드 전문점 마치래빗의 상암 분점입니다! 가로수길점도 한번 가봤는데 일단 아무래도 여긴 공간도 작고 메뉴도 몇 개 안돼요- 그래도 이 부근에서 샐러드 전문점이라는 메리트는 확실히 있으나.. 사진 속 샐러드, 무려 만이천오백원? 하는 다이어트 콥인데.. 요즘 샐러드 잘나오는데가 정말 많다보니 이건 특별할게 없어서 너무 비싸다고 느껴졌어요 (아 빵은 원래 있는데 제가 빼달라고 함!) 대신 6천원 중반의 좀 더 저렴한 메뉴들도 있으니 그걸 먹으면 좀 괜찮을듯... 조금 더 든든히 드시고 싶으신 분들은 샐러드+잡곡밥 같은 것도 선택하실 수 있어요.. 그런데 제가 더 비쌌던 다이어트 콥을 굳이 시켜본건 두부 아니면 닭가슴살 아니면 치킨... 이라는 협소한 선택지 때문 ㅠㅠ 샐러드 전문점에서 '치킨' 이라는 메인은 조금 아쉽네요 만이천 오백원이면 이 근처 마마스에서 샐러드 먹어도 되는 가격.... 다만 조금 더 오래걸릴 수는 있겠졍 ㅠㅠ 여기선 저렴이 메뉴를.. 혹은 밥 메뉴를 추천!",괜찮다
482,아고야,핏짜,분위기 좋은 고깃집입니다. 가격도 괜찮구요.,맛있다
483,아고야,감자도리,모든 고기 존맛. 오뎅탕도 국물과 어묵 모두 완벽함. 고기 양 은근 많음.,맛있다
484,포나향,나의사랑들,쌀국수가 넘 맛있어요 사이드도 다 기본이상은 합니다 국물맛도 진하고 양도 푸짐해서 넘 만족했어요,맛있다
485,포나향,구름아저씨,예전 홍대 살때 일주일에 두번이상은 가던곳돼지고기 쌀국수가 상당히 맘에 들었던 집이다육수도 일반쌀국수처럼 개운하면서 돼지고기육수라 깊은 감칠맛도 나면서 한끼 든든하게 먹는집볶음밥 보다 쌀국수가 맛있고 매콤한것도 맛있다해장으로도 추천점심으로도 추천~근처에 사는 사람이라면 가볼만한 곳,맛있다
486,포나향,tokak,양많고 맛있음.쌀국수 양좀 많이 달라고 하면 엄청 많이주심.회사옆이라 점심때 자주감.,맛있다
487,포나향,어젠,소고기쌀국수 8.5국물이 정말 좋다. 맑지만 진한 육수..소고기도 듬뿍 주셔서 다 못먹고 올 정도,맛있다
488,싸이공레시피,ChoEunnarae,껌승 야채 신선하니맛있구 쌀국수도 맛있어요 !! 나오면서 카페쓰어다 한 잔 주문해 마셨는데 진한 본토의 맛이!!! 커피만 마시러 한 번 더 갈거에요 ㅋㅋ,맛있다
489,싸이공레시피,So So Def,왜케 점점 쌀국수육수가 어마무시하게 달게 느껴질까....아무래도 쌀국수 정체기가 온듯.짜조는 맛없었어요! 고기 비린내 많이 남. . .,괜찮다
490,생어거스틴,라멘은나를봐,맛대가리없다. 기억하기도 싫음,별로
491,생어거스틴,Purple,"이렇게 짠 쌀국수 처음 먹어봄...너무 짜서 육수를 좀 더 달랬더니 육수자체에 뜨거운물 부어서 끓이는거라고 뜨거운물 한컵 갖다 줌.한컵 다 부어도 짬......하....신메뉴 커리는 소스는 맛있었지만, 소스향이 너무 강해 게 향이 안느껴짐...닭튀김은 소스 안찍어도 될만큼 짬.전반적으로 50%할인이라 그냥저냥 먹었지만, 제값내고는 여기선 못먹을 듯.다른 지점으로 가시길......",별로
492,하노이의아침,유리지아,코로나 전 주말에 상암동에 갔는데그 근처에 주말 저녁에 하는 식당이 얼마 없길래그냥 무난한 곳 골라서 들어감가게는 넓은데 직원이 얼마 없어서 민망바나나 스프 찔러봤는데 뭐 나쁘지 않음쌀국수도 나쁘지 않음,맛있다
493,하노이의아침,VERYGOOD㋛,"메뉴 : 파인애플 볶음밥, 볶음국수<파인애플 볶음밥>맛은 그냥저냥 맛있었으나 양이 아쉬웠다.<볶음국수>내가 결정적으로 '별로'를 준 이유... 가격에 비해 면이 별로 없고 숙주가 더 많은 느낌이 들었다. 난 뭐 숙주 좋아하니까 그냥 먹는데 그보다 더 심한 것은 맛이.. 없는 것은 아닌데 팟타이 특유의 시큼한 맛이 많이 났다. 그리고 해산물이 조금 더 들어갔더라면 좋았을 것 같다. 나름 상암에서 규모 큰 베트남음식점인데 실망했다ㅠ",별로
494,하노이의아침,상암동주민,"무늬만 하노이의 아침...전반적으로 음식들이 맛이 없고, 서비스도 엉망몇번을 요청해도 주문은 안받고, 주문하지 않은 메뉴가 나오기도 함쌀국수 국물에서는 진함이 느껴지지 않고, 볶음밥/면에는 재료가 부실무엇보다 생맥주는 정말 맛이 없음그래도 인테리어만큼은 깔끔함",별로
495,하노이의아침,JeonPil-Jae,생각보다 별로 맛이없다.,별로
496,하노이의아침,So So Def,밖에서봐도 안에서봐도 조명이 참 특이해요.핑크색 주황색 노란색 조명들이.... 대체 먼일인가 싶음.양지쌀국수랑 레드커리 시켰는데 쌀국수도 괜찮았고 레드커리는 매콤달콤 맛있었어요.커리소스 흥건하게 먹고싶었는데 양이 좀 부족해서 좀 더 달라고했는데 안된다고...하심 ㅡㅜ뜨아......마감전이라 그런건지 아님 원래 안되는건지 모르겠지만 주문전에 커리소스 넉넉히 달라고 부탁하세요.추석연휴에 갔었는데 사장님 내외분으로 보이는 두분이 일하셨는데 여자분이 참 불친절 하셨어요.,괜찮다
497,쿠우쿠우,muk_so.o,"고등학생 때 홍대 쿠우쿠우가 처음이자 마지막으로 간건데 7-8년만에 상암 쿠우쿠우를 방문했다.주말/ 생각보다 전체적인 가짓수는 많은 것 같으면서도 적은 듯 적당했던 것 같다. 주력 메뉴는 초밥이지만 초밥보다 다른 걸 더 많이 먹었다...내가 먹은 건 연어초밥, 묵은지광어초밥, 연어롤이 다이다.초밥 / 밥과 회가 워낙 작은 사이즈라 부담 없었다. 롤은 밥의 양이 크기에 비해 밥이 두꺼운 편이었음.훈제 연어 / 정말 많이 먹었다. 양파랑 홀그레인 소스랑해서 많이 먹은 듯. 먹을수록 느끼하지만 얇게 썰어서 다른 때보다 많이 먹었음.튀김류 /  따뜻하긴 한데 전반적으로 너무 기름지다. 튀김중에는 꿔바로우가 괜찮았다. 고기도 얇고 바삭바삭했음.로제떡볶이 / 소스 맛은 배X에 육수를 좀더 부어 가벼운 배X맛이 난다. 소세지는 정말 별로였음.통삼겹이랑 차돌숙주 볶음 / 고기가 별로였음. 잡내가 살짝 났음.봉골레 파스타는 / 정말... 처음느끼는 맛...0어떻게 보면 진한 조개육수맛 나는 봉골레 파스타같기도 하고... 암튼 센세이션한 맛이었음.식혜 / 안 달고 맛이었음.음식이 전반적으로 살짝 자극적이라 자꾸 물 마시게 된다.그래도 근처 뷔페보다는 나아서 괜찮다로.",괜찮다
498,훈고링고브레드,사과맛다시,"이전부터 궁금했던 훈고링고브레드! 망플에는 최근 리뷰가 없네요 ㅎㅎ 예전에는 덜 흔했던 까늘레나 구움과자를 팔던 곳이었는데 최근엔 이곳저곳에서 많이 팔다보니 그럴까요? 접근성이 애매한 곳이긴 하지만요... 아무튼 방문했을때 치아바타나 바게트, 깜빠뉴 등 식사빵들이 눈에 띄어서, 바게트샌드위치와 핸드드립을 주문했습니다.직접 말린듯한 말랑한 선드라이토마토, 짜지않고 고소한 햄과 치즈, 맛있는 바게트 샌드위치였어요 핸드드립 커피도 고소하고 맛있었구요치아바타나 바게트가 3천원, 까눌레 2천원으로 예전 가격을 쭉 가지고 가는 것 같고 망원의 안정적인 동네빵집으로 자리잡은 느낌입니다. 여기만을 위해 갈만큼은 아니지만 주변에 가신다면 강하게 추천하고싶어요! 맛 뿐 아니라 가게 분위기도 좋거든요 ㅎㅎ 붐비는 거리랑 거리가 조금 있어 비교적 조용하기도 하구요!",맛있다
499,훈고링고브레드,행복회로,맛 : ★★★★☆양 : ★★★☆☆위생 : ★★★☆☆서비스 : ★★★★★분위기 : ★★★★☆가격 : ★★★☆☆,맛있다
500,훈고링고브레드,akamato,"망원동에 위치한 훈고링고 브레드. 즐겨보는 네이버 블로거 분의 잦은 리뷰와 칭찬으로 꼭 방문하고 싶었는데 드디어 방문하게 되었다. 한파를 뚫고 들어와 우리가 시킨 메뉴는 고등어 샌드위치, 스팀 우유, 드립 커피였다. 아 그 전에 이곳의 분위기를 얘기해야겠다. 이 곳의 분위기는 정말 따스하다. 인테리어가 따스하고 귀여운 느낌이다. 세련되고 엣지 있는 스타일이라기보다 귀엽고 아기자기하면서 따듯함을 담은 분위기다. 내 취향이 바뀌기 전에는 참 좋아했던 인테리어 스타일이기에, 구석구석 사장님의 손길이 닿은 소품과 그들의 배치가 보는 재미가 있었다. 특히 아이팟 클레식으로 노래를 틀어주시는 것이 옛날(?) 생각도 나게 만들면서 집에 와서 구석에 박힌 내 아이팟 클레식을 찾게 만들었다.다시 우리가 시킨 메뉴로 돌아오면 기대했던 고등어 샌드위치는 솔직히 많이 실망했다. 일단 고등어 맛이 느껴지지 않을 정도로 조금 들어가 있다. 오죽하면 한 입이라도 제대로 느끼고 싶어서 잘게 찢어 놓으신 고등어를 구석에 몰아 놓고 한 입 베어 물어 겨우 느낄 수 있었다. 물론 재료나 빵은 더할 나위 없이 맛있었다. 다만 고등어 샌드위치인데... 라는 아쉬움을 잊게 할만큼은 아니었다. 드립 커피는 가격 대비 무난했다. 요즘 왠만한 카페들이 드립 커피의 원두를 고를 수 있게 해서 까다로운 고객들 취향을 맞추면서도 가격대는 7,8천원 대로 형성하고 있는 것에 비하면 이곳에서 단일 원두로 7천원을 받는 것은 조금 무리가 있다는 생각이 들었다. 맛은 그냥 평범한 드립이었다. 조금 더 솔직히 말하면 첫맛은 기분인 살짝 안 좋아질 정도의 맛이었지만 그 후부터는 무난했으니 그러려니 했다.마지막 스팀 우유는 그냥 따듯한 우유였다. 집에서 전자레인지 돌리면 나오는 우유. 그 이상 이하도 아니였다. 그냥 추워서 먹었다.이곳은 개인적인 생각으로 맛만을 위해 가는 곳은 아닌 것 같다. 대한민국에 이제 맛있고 개성있는 빵을 취급하는 카페가 너무 많기에 빵이 특별한 강점을 가지고 있다고 보기에는 경쟁력이 부족하다 생각한다. 대신 특유의 감성과 그동안 쌓아 온 팬층으로 이 정도의 평가를 받는게 아닌가 싶다. 맛과 분위기의 시너지가 이곳을 만들었다고 생각한다. 각각의 개성은 개인적으로는 보통이다.",괜찮다
501,훈고링고브레드,맛둥이,갬성으로 가는 빵집맛도 맛이지만 너무 아기자기해요!!구움과자 먹으러 종종가는데갈데마다 왜이렇게 길을 헤매게되죠???!마감시간이라구 치아바타도 하나 공짜로 들려 보내주셨어요,맛있다
502,훈고링고브레드,Sue,까눌레 넘 맛있!일요일 점심에 슬렁슬렁 들어갔는데까페 한적해서 너무 좋았어요! 앉아있는것만으로도 힐링되는 느낌하지만 좌석이 많지 않아 올때마다'웨이팅 없을까' 걱정하는 집국밥을 배불리 먹고 갔는데도 까눌레가 너무 맛있었어요겉이 바삭 보다는 쫀쫀 쫄깃이 더 맞는 표현인것 같은데 두개 세개 먹을수 있는 맛이었어요스콘은 원래 좋아하는 편이 아닌데잘 부서지긴 했지만 맛있게 먹었고같이 주시는 잼이랑 슈크림?도 좋았어요하지만 스콘 안쪽에서 약간 밀가루 날내가 나는것은어쩔수 없나봄ㅠㅠ 다시가면 까눌레만 한 3개씩 먹고 올듯커피 대신 스팀밀크 먹었는데 우유랑 조합도괜찮은것 같아요!나무컵에 주셔서 굉장히 자연자연함,맛있다
503,훈고링고브레드,토요미식회장,훈고링고안 좋은 위치에 있는 좋은 카페파운드케잌의 비쥬얼에 혹해서 오게 된 곳생각보다 망원역에서 꽤 걸어야한다. 아마 더워서 더 그렇게 느꼈을까? 아무튼 망원동의 메인 골목과는 거리가 상당했다. 2층에 위치해 있다보니 약간 지나치기 쉬웠다. 살짝 지나갈 뻔 했었다.도착하니 넓은 듯 하면서 좁다. 얼핏 보기엔 넓은데 테이블이 몇 개 안된다. 약간 불편한 자리로 앉았는데 그래서 내부가 예뻐서 있을 만 하다. 운이 좋아서인지 웨이팅은 없었다.마리아주프레르 니느와르 4500바닐라크림소다 3900아이스아메리카노 5500당근파운드케이크 3800까눌레 1800니느와르는 크게 인상적이진 않았지만 안정적인 맛과 향을 갖고 있었다. 성공적인 선택은 아니지만 딱히 실패할 선택도 아니다. 크림소다는 그럭저럭 괜찮지만 익숙한 맛이라 한다.아아는 잘 모르겠고당근파운드케이크 진짜 맛있다. 당근파운드 와 비이커 같은 것에 시트러스? 맛의 커스터드크림이 같이 나왔다. 조금씩 발라 먹어보면 꾸덕하기도 하고 달달하기도 해서 좋았다. 비쥬얼도 맛도 추천할 만한 메뉴다.까눌레 너무 겉딱하지 않아서 좋았고 안이 부드럽고 촉촉했고 달달했다. 위치랑 테이블 수 적은 것만 빼면 마음에 들었던 카페다.,맛있다
504,훈고링고브레드,JeongHye Min,ㅜㅜ맛이고 뭐고 다 뛰어넘는 훈고링고링고링고링ㅜㅜ,맛있다
505,훈고링고브레드,우영,진한 녹차맛을 가진 녹차 파운드 케익이 인상적이었던 카페. 생크림을 얹은 녹차 파운드케익 한입에 커피 한모금이 굉장히 맛있다. 다만 테이블 외에는 자리가 좀 불편하고 공간이 협소한데 비해 사람이 많으므로 복작한게 싫다면 클로징 1시간 반정도 전에 가자,맛있다
506,훈고링고브레드,미루,평일 낮에 방문하니 손님이 나뿐이라서 여유즐기기 좋았던 시간;-) 인테리어도 부족함이나 과함없이 좋구 테이블도 편하구 사람만 없으면 딱 좋은 공간이다! (그러나 웨이팅있는경우가 많다고 들었다..)녹차파운드랑 커피 주문했고 올리브치아바타는 포장-녹차파운드는 크림이 있어서 포장은 안된다고 들었다. 녹차맛도 씁쓸하지않고 적당한 달콤함과 포실함-커피랑 파운드케이크는 역시 좋은 짝꿍;-) 사실 커다란 파운드는 부담스러운데 조각으로 포장 예쁘게 해서 파는게 신의한수- 여기 파운드 몇번 사봤는데 대부분 맛있었구 포장도 넘 귀여워서 일부러 포장하고프다ㅋ치아바타는 처음 먹어봤는데 담엔 무조건 치아바타도 사오려고한다- 담날 근처 베이커리서 사온 치아바타랑 비교해서 먹어보니 여기가 훨씬 맛있었다- 치아바타샌드위치도 판매하는듯한데 맛있을것같다!,맛있다
507,훈고링고브레드,낙지,"진진가기전에 잠깐 쉬려고 들렸는데..뭐 홍차맛이야 좋고 라떼맛이야 좋았는데그날 우산을 들고가서, 우산을 가지고 매장내 테이블아래쪽에 내려놓아두었는데일행한테 우산맡겨준다고하고 밖에 꽂아놓는다고 했다더라구요.전그냥 그러나보다하고 나갈때 깜빡하고 못챙기고 2시간후에 그걸 알아차리고 전화를 드려서 여쭤보니까 우산이 없다고 하더라구요. 다른사람이 가져간것같은 뉘앙스였습니다. 그래서 저는 당황스러웠죠. 굳이 저희가 가지고 있었으면 (젖어있는우산도 아니였습니다) 잃어버리지 않았을거를,, 그래서 암튼 맡겨주신대서 밖에둔건데 ,,,뭐 어떻게해야하나요 이런식으로 여쭤봤는데 (배상이나 책임에대한 이야기는 먼저하지도않았습니다) 근데 뭐 그쪽에서 말하기를 손님께서 원하시면 저희가 같은모델로 구매해드릴순있는데 그렇게 말씀하시면 저희도좀 그렇네요 이런식으로 말씀을 하시더라구요 ;; 아니 해당가게에서 관리소홀로 분실한건데 저희도 좀그렇네요 라는표현은 오히려 분실당한제가 진짜 마음이 불편해져서 괜찮다고하고 전화를끊었는데도 집가는내내 불편했네요. 아마 다시는 안갈것같습니다.",별로
508,훈고링고브레드,굿걸,"두번 다녀왔고, 파운드케이크와 오픈 샌드위치 먹어봤어요 :) 아기자기한 공간에 커피도 맛있고 디저트도 넘 좋았어요! 커피 시키니까 조그만 쿠키도 같이 주시네요 ㅎㅎ",맛있다
509,훈고링고브레드,노찡,까눌레는 품절 ㅜ ㅅ ㅜ 파운드는 정말 맛있고 공간도 예쁜데아무래도 협소해서...그거 말고는 만족만족,맛있다
