,가게이름,리뷰아이디,리뷰,맛평가
607,리치몬드과자점,권오찬,"* 한줄평 : 왜 하필 성산동에 자리잡았을까?!1. 외식업 격전지인 서울에서 전통과 맛으로 유명한 베이커리를 꼽으라면 제빵 사관학교로 유명한 나폴레옹 제과점, 바게트 샌드위치와 발효빵으로 유명한 김영모 과자점, 밤식빵을 최초로 만든 리치몬드과자점이 있으니 이들이 곧 호사가들이 말하는 <서울 3대 빵집>이다.2. 1968년 개업한 나폴레옹제과는 국내 제과점 중 유일하게 서울미래유산으로 선정된 곳으로 김영모 명장과 리치몬드의 권순범 명장 역시 나폴레옹에서 제과 제빵 기술을 배우며 일본 유학을 다녀온 것으로 알고 있다.3. 1982년 문을 연 김영모 과자점은 타워팰리스 샌드위치로 알려진 <바게트 샌드위치>와 하얀 눈이 소복히 내린 것 같은 몽블랑 빵이 유명하며 강남 지역에 여러 지점을 내는 등 최근 성장세가 더욱 괄목할만 하다.4. 1979년 권순범 명장이 개업한 리치몬드 제과점의 최초 상호는 나폴레옹 제과점으로 창업주가 몸담았던 빵집의 이름을 빌려 개업한 독립매장의 첫번째 사례이기도 하다.5. 김영모 과자점은 본격적인 강남 시대를 맞이하여, 나폴레옹은 전통을 기반으로 일반인들에게도 인지도가 꽤 높은 편인데, 서울 서쪽 성산동은 상대적으로 지리적 한계를 갖고 있음인지 빵의 퀄리티와 스테디셀러 라인업에 비하면 초라한 인지도를 갖고 있다.6. 그나마 홍대에서 리치몬드가 자리를 지켰던 시절만 해도 괜찮았을터인데 하는 아쉬움이 있다.7. 대부분 빵집이 베스트셀러를 앞세우고 다른 빵들을 주변에 포진시키는데 반해 리치몬드는 레몬파이, 밤식빵, 밤파이, 슈크림, 호밀빵 등 베스트셀러가 많다보니 차라리 이들을 <스테디셀러>라 불러야할만큼 라인업이 좋다.8. 개인적으로 슈크림빵을 엄청 좋아하는데, 기존 나의 원픽은 나폴레옹(본점)이었지만 리치몬드의 풍성한 크림과 부드러운 슈를 맛보는 순간 원픽이 이 곳으로 바뀌었다.9. 참고로 갈색으로 구운 빵을 조개처럼 벌려 크림을 채운 크림빵은 여전히 나폴레옹이 원픽이고, 냉장매대에 구비된 <슈크림>이 바로 그러하다. (8번째 사진)",맛있다
608,리치몬드과자점,꺄항,"활기가 넘치고 빵 종류가 엄청 많은 빵집1.까눌레 2900럼맛이 많이 나는, 매력있는 까눌레2.공주밤파이 3200디스플레이도 그렇고 박스포장에 택배서비스까지.. 요즘 대표상품 인듯, 달지않고 안달지도않고 새로운 맛에다 바삭한 식감까지 아주 맛있었다3. 레몬마들렌 3100마켓컬리에서 절찬리 팔고있는오랜만에 맛봤는데 생각보다 레몬맛이 안나서 아쉽요즘 워낙 잘하는집이 많으니까4. 동그란 샌드위치 4900고기가 아주 얇게 들어있는데 짜다.. 평타정도5. 검은 식빵 두 조각 (맛보라고 포장해주심)식빵이나 식사빵(식빵 한묶음 6000~9000)이 가격이 세고 포장단위가 커서 사지 않았는데 (개인적으로 뭐든 큰 단위 먹거리는 안사는편)맛보라고 주셔서 잼발라먹었는데 크게 특이점이없어서 식빵류를 구매하진 않을 것 같다.고르는 재미가 있지만 가격대가 다 높은편이고 (5년전의 두 배에 가까워지는 것 같더) 대신 통신사 T 10프로 할인받았다.",괜찮다
609,리치몬드과자점,테레사메이,대존맛 슈크림,맛있다
610,리치몬드과자점,졸리,"우와앙 리치몬드 제과점의 시그니처 메뉴인 밤파이를 야식으로 먹었다앙,,, 만쥬인줄 알았는데 겉은 바삭바삭,, 달달,, 하고 안에는 밤도 포슬포슬해서 넘 좋앗당,, ㅎ,ㅎ 사실 원래 밤 별로 안좋아하는데 이건 마음에 들었음,, 이것도 역시 살찔거 같은 맛이지만 넘 마싯,,, 헤헤,,, 하나를 다먹긴 좀 크고 사등분해서 먹으면 죄책감을 덜 수 있당! 다음에 근처에 간다면 다른 파이류도 시도해보고 싶다!",맛있다
611,리치몬드과자점,미동이,마시따,맛있다
612,리치몬드과자점,머큐리 ,"볼드한 럼향이 매력적인 나의 첫 슈톨렌, 성산동 <리치몬드과자점>. 슈톨렌 소/15000슈톨렌은 독일의 크리스마스케이크로 1년동안 럼에 건과와 견과을 절여 만들며 크리스마스를 기다리며 조금씩 잘라 차 혹은 커피를 곁들여 먹는다.  들어가는 견과와 건과, 술에 따라 맛이 극명히 달라지기에 취향이 참 잘 드러난다.  슈톨렌으로 유명한 집은 우스블랑, 프릳츠, 오월의 종, 장띠끄, 쉐즈웰 등이 있으며 품절이 빠르다.  내 선택은 클래식한 리치몬드과자점이었다. 가성비는 떨어지지만 기본에 충실하고 실패없는 곳이라 선택했는데.. 강렬한 럼향에 풍미가 대단했다. 역시 클래식! 홍차인 아쌈과 곁들었는데 잘 어울렸고 지인은 버번위스키가 생각나는 맛이라고 하더라. 내년에도 리치몬드 슈톨렌은 필수로 구매할 것 같다.",맛있다
613,리치몬드과자점,NIWOOW,"아직 안 먹어본 베이커리의 슈톨렌을 찾다가인터넷에서 평이 좋아서 예약하고 픽업했어요.일반 슈톨렌, 밤 슈톨렌을 하나씩 주문했습니다. 일반 슈톨렌은 럼향이 생각보다 꽤 강했어요.제가 먹어 본 슈톨렌 중에서 제일 강하게 나는데,저는 맛있게 먹었지만 동생은 단맛이 하나도안 느껴진다고 한 입만 먹고 안 먹더라구요.마지펜에서 나는 단맛이 약한 것 같지는 않으나럼의 향과 맛에 묻히는 느낌은 있었던 것 같아요. 밤 슈톨렌은 올해 새로 나왔다길래 사왔어요.건포도나 견과류 대신에 초코칩이 들어가고밤을 사용한, 달달한 맛의 마지펜이 들어가네요.그 덕에 럼의 쌉쌀한 향과 맛은 거의 안 나는데,마지펜이 생각보다 달아서 많이는 못 먹겠어요.슈톨렌보다 디저트에 가까운 느낌이었습니다. 다른 종류의 빵은 어떨지 모르겠으나, 이번에 먹은두 가지의 슈톨렌은 모두 마음에 들어 [맛있다]로.이번 겨울이 끝나기 전에 하나 더 사와야겠어요.",맛있다
614,리치몬드과자점,로로,⭐️⭐️⭐️⭐️⭐️슈크림빵 좋아하신다면 여기꺼 꼭 드셔보세요... 꼭!,맛있다
615,리치몬드과자점,조진성,"레몬쉬폰케이크,슈크림빵을 샀습니다.슈크림빵은 커다란 슈크림 슈를 먹는느낌이었고생각보다 안달아요 맛있어요 ㅎ하지만 가격이... 쌔네요..레몬쉬폰케이크는무난무난한 쉬폰케이크맛일줄 알았는데하얀색으로 코팅된 단맛이랑레몬향이 은은하게 나는게강추드려요!",맛있다
616,리치몬드과자점,낑깡,레몬케이크 사먹으로 종종 가는 유우명한 빵집본래 레몬처돌이라 디저트 이름에 레몬만 들어가면헐레벌떡 사먹는 사람인데여기 레몬케이크는 레몬맛 낭낭한것이라에스키모 레몬머랭타르트와 함께낑깡픽 레몬디저트 투탑에 오름;;다만 가격이 좀 비싸다#아무리뷰,맛있다
617,리치몬드과자점,chanwook_ie,모든 빵에서 40년의 내공을 느낄 수 있는 빵집이다. 매일 아침마다 운영하는 조식 뷔페는 가성비가 좋아서 주말에는 대기가 있을 정도로 인기가 많다.여름이 되면 빙수나 음료를 자주 사 먹는데 웬만한 카페보다 훨씬 수준이 높다. 전반적인 가격은 비싸도 항상 최상의 맛을 보장해서 늘 만족스럽다.,맛있다
618,리치몬드과자점,맛집체험가,"공주밤파이랑 따뜻한 우유어릴때 부모님과 리치몬드에 많이 갔어서, 지나가다가 발걸음을 멈춰버렸어요. 자리도 편안하고, 분위기도 편안하고, 빵이랑 음료를 시키면 자리로 가져다줘요. 너무 좋았어요. 공주밤파이는 아몬드로 만든 필링과 통밤이 들어있었어요. 많이 달지 않은게 좋았어요. 겉에가 바삭바삭한 페스츄리였어요. 아주아주 바삭바삭했어요.역시 어릴 때 맛있는걸 먹었던게 맞았어요.다음에도 또 갈거에요-",맛있다
619,리치몬드과자점,어젠,호밀빵192g 3840원성산동의 유명 베이커리. 매번 꼭 가봐야지 했는데... 이삿날 다 되어서야 왔다. 평소 지나는 길에 있는 빵집이 아니라서..독특하게 호밀빵을 그램당 가격으로 판다. 적은 양이긴 하지만 맛이 궁금해서 식빵 말고 호밀빵으로 픽.호밀 특유의 시큼함은 있지만 과하지 않아서 오히려 그게 매력적이다. 버터와 먹어도 맛있고 라즈베리잼과도 잘어울린다ㅎㅎ,맛있다
620,리치몬드과자점,tokak,비싸고 평범한맛,괜찮다
621,리치몬드과자점,HanDongheon,밤파이먹고 감탄슈크림은 얼마나 맛있을까 기대기대한 분야에 정통한다는 것의 기적,맛있다
622,리치몬드과자점,미루,"성산동의 리치몬드본점- 규모도 크고 고풍스런 분위기의 좌석들도 꽤 있어서 음료와 빵을 먹고갈 수 있다- 평상시엔 커피 리필도 되고 발렛도 가능한 훌륭한곳;-)빵부터 샌드위치, 케이크, 구움과자류까지 없는게 없는 멋진곳이고 맛있는 빵도 많다 집근처라 자주 놀러가는데 가격이 좀 비싼편이라 먹어본건 몇개 없다...(ㅠㅠ) 오늘 리뷰는 오전에 운영하는 조식빵뷔페에 포커스-아침8시부터 9시반까지 운영하고 커피, 음료포함 1인 7500원의 아름다운 가격! 손님 많음 주의!! 리치몬드의 빵이라 옴총 기대해서인지.. 약간 실망했다일단 갈색빵류-잡곡많이함유, 건강한맛- 입맛에 안맞았다 너무 시큼하거나 뻑뻑하거나 아침부터 턱운동 지대로했다.. 먹다보니 크로아상모양의 모닝빵이 나왔는데 갓 구워졌는지 고녀석은 맛있었음;-) 치즈,햄,잼,버터 등이 준비되어있어서 샌드위치 만들어먹으면 맛있다- 예전 페이머스램의 빵뷔페를 기대하고가서인지 조금 아쉬운 부분이 있긴하지만.. (내입맛엔 별로지만)커피 포함 가격을 생각하면 멋진 조식뷔페! 충분히 훌륭한것!! 조식뷔페 재이용은 글쎄..지만 베이커리 자체는 여전히 사랑합니다♡",괜찮다
623,리치몬드과자점,김나물,"이런 빵집 참 좋아~~~~~!!!이 분위기...ㅋ평일 오후...근처 여사님들 잡담중...ㅋ넓은 공간에 빵, 과자, 케이크~.종류 다양~~보기만 해도 가분이 좋 아 요ㅋ가격이 생각보다 저렴~~.가끔씩 가서 사 먹고 싶어요~.",맛있다
624,리치몬드과자점,슈기,빵투어 하면서 공주밤과자 하나만 사서 먹었어요달달하면서 디저트로 하나먹기 딱 좋아요너무 달다 싶으면서도 계속 먹게 되는 중독적인 맛!!,맛있다
625,리치몬드과자점,KimJohn,커피는 맛이 없었지만 시그니처 메뉴인 밤파이는 흔한 밤만주 맛보다 훨씬 고급지고 부드러운 맛이었다,맛있다
626,리치몬드과자점,YooYoungSik,슈크림이 시그니쳐누군가가 방문선물로 리치몬드 슈크림박스를갖고온다면 그의 센스를 칭찬해줄것이다.버리지않고 맛있게 다먹을것이다.어딘가 선물로 들고갈게 필요할때 애용했다빠바 롤케이크 보다훨씬낫다4.1/5.0,맛있다
627,리치몬드과자점,ㅇㅇ,공주밤파이 드세요..,괜찮다
628,리치몬드과자점,맛있어야한다,너무 맛있다. 맛 인정. 근데 직원이 너무 불친절하다.,괜찮다
629,리치몬드과자점,diadia,밤파이ㅠㅠㅠ 앓다죽을 밤파이ㅠㅠㅠ 정말 맛있어요 처음 먹어본날 이후로 자꾸 생각나서 며칠뒤에 또 사러갔었어요ㅋㅋㅋ,맛있다
630,리치몬드과자점,_Oh_,호밀빵을 찾아찾아다니다가 마침 합정에 일이 있어 방문했습니다! 호밀함량 90프로의 정통호밀빵! 시큼한듯 푸석한듯한 호밀빵이었습니다ㅎㅎㅎ 빵순이가 다이어트한답시고 빵을 끊지는 못해서 이거라도...ㅋㅋㅋㅋㅋㅋ 그래도 맛있었어용ㅎㅎㅎ 그치만 보들보들 달콤달콤한 빵맛이 그립긴해요... 아메리카노는 산미가 있는걸 안좋아하는데 산미가 좀있어서 커피는 제스타일은 아니었어요~ 유명제품은 밤식빵이랑 슈크림?이라고해서 먹고 포장해갈까봐요...,괜찮다
631,리치몬드과자점,맛있어서 엔돌핀,"완소 제품: 버터의 고소함과 콕콕 박힌 초코칩의 달달함이 좋은 스콘  스콘하면 버터냐 생크림이냐에 따라 호불호가 있는데, 난 그저 맛있으면 다 좋다ㅋㅋㅋ 리치몬드는 버터로 스콘을 만드는 것 같은데, 먹고나서 입 안에 남는 텁텁함이 없어서 매우 만족스럽다. 부담스럽게 버터리?ㅋㅋ 하지 않고도 넘나 꼬소꼬소한 것. 심지어 가격도 착하다 (2,300원) 바움쿠헨(5,200원)은 개인적으로 passion* 나 김*모 제품에 한 표ㅋㅋㅋ벌꿀 마들렌(2,200원)은 일반적인 마들렌과 비교하면 약간 더 촉촉한 편이고, 홍차 파운드(4,800원)는 향이 엄청 찐해서 상상을 초월한다ㅋㅋㅋ 저녁에 방문한 거라 빵이 많지 않을 거란 예상은 했지만 이렇게까지 없을 줄이야...! 결국 리뷰도 제과로만....빵 나오는 시간 확인해서 되도록 거기에 맞춰 방문하시는 게 좋을 것 같아요ㅜㅜ 매장엔 빵을 사서 음료와 함께 즐길 수 있는 공간도 마련되어 있어 좋아요~",맛있다
632,리치몬드과자점,minimo,"조리빵부터 건강빵까지 다양한 베이커리는 전문성떨어진다 생각해서 뒤늦게 방문하게 된 리치몬드. 종류 많은 베이커리에 대한 제 편견을 반성하게 됐네요ㅠ.ㅠ 여태껏 먹어본 빵들 다 맛있었어요.특히 스콘과 건강빵 종류를 추천해요! 미니무화과스콘은 적당히 버터리하고 밀도도 단단해서 정말정말 맛있어요! 무화과도 너무 달지 않아 밸런스가 잘 맞고 퍽퍽하니 진짜 맛나요!호밀감자빵은 반죽자체에 감자가 들어있어 그런지 빵 자체가 매우 텁텁하면서 고소해요~! 호밀함유량이 높지 않아서 호밀의 뻑뻑한 식감이 익숙치 않은 호밀빵 초보자들에게도 식사대용으로 좋아요.굳~이 단점이라면 건강빵들 크기가 모두 어마어마하다는 것 ㅠㅠ 여러 개 사고싶지만 도저히 다 들고다닐 수 없을만큼 커요! 다른 빵들 먹으러 재방문할거예요ㅎㅎI've always had that stereotype on bakeries with lots of breads until I came across Richmond. Even though they had like hundred and thousand kind of breads, every single breads I had really hit the spot. Had one of the best fig scones I've ever had. Fig was fairly sweet and the scone itself was properly buttery and thick! Rye Potatoe bread was really flavourful and chewy. Also highly recommend other rye breads.",맛있다
633,리치몬드과자점,오드리 햇반,맛있어요,맛있다
634,리치몬드과자점,chon,한국 최고 빵집은 여기. 지방빵집은 재미로 가는데고 진짜 빵은 여기가 최고임.,맛있다
635,리치몬드과자점,KangMinu,다녀감,맛있다
636,리치몬드과자점,michelle,유명한 빵집이라고 해서 우연히 소개받은 빵집빵은 그렇게 비싸보이진 않는데파이같은 종류는 좀 비싸더라구요~두부과자가 땡겨 하나 샀는데 (8000원)처음에 먹고 와~ 했는데 계속 먹으니조금 느끼하네요~하지만 계속 먹다가 반봉지를 혼자서 ㅋㅋㅋ모닝빵은 (45000원) 아직 안먹어봐서 모르겠네요샌드위치는 언니가 먹었는데맛있다고 하네용,괜찮다
637,리치몬드과자점,chon,내 생각이 짧았다. 여긴 정말 맛있다. 제대로 크러스트가 씹히고 누룽지 향이 나는 유럽빵은 여기가 최고인듯.,맛있다
638,리치몬드과자점,ㅇㅇ,매번 밤에가서 그런가 빵사먹고 속는기분..ㅠㅠ조식뷔페말고 가격대비만족도가 높았던 항목을 꼽기 힘드네여 호밀빵이나 바게트류가 젤 나은듯..특히 패스츄리..바삭함을 포기한다 와장창압구정 파리 크라상 크루아상이 더 바삭하면 어쩌자는.. 동네 빵집 부심에 금이 가자나요..ㅠㅠ,별로
639,리치몬드과자점,MJ,"새해 첫날 상암 하늘공원 가서 일출보고 추운데 살짝 허기나 달랠까 하다가 생각난 곳이 리치몬드 조식! 여기 조식이 무려 아침 8시부터 9시 30분 까지라.. 먼데 사는 저로선 엄두도 못낼 시간대라고 생각했는데 마침 해뜨는거 보고나니 시간이 딱 맞더라고요! 커피 한잔 + 빵 세 종류 + 치즈에 햄 두 종류 + 버터와 잼 + 우유와 주스 까지 6500원!! (커피는 리필시 천원, 나머지는 무한리필, 라떼나 차종류로 변경할 경우엔 2천원 추가 = 전 커피 못마셔서 티로 바꿨어요!!)인데 첨엔 생각보다 빵 종류가 적네~ 했었지만 커피만 3-4천원 하는거 생각하면 사실 매우 훈늉한... 다 맛있고 모닝빵 아 왤케 맛있엉ㅋㅋㅋㅋㅋ 오히려 그냥 깔끔하게 먹기에 적절한 양과 가격인듯 게다가 리치몬드 아니겠습니까 가짓수는 적을지언정 빵의 퀄리티는 언젠가 먹어본 독일 쉐라톤 호텔 조식의 그것 부럽지 않았음.... 아무튼 새해 첫날 아침부터 나름 럭셔리하게(?) 기분 내며 맛있게 잘 먹어 즐거웠어요 집만 가까우면 더 자주 가고 싶다는! 간 김에 빵도 이것저것 사와봤어여 팡뎅님 리뷰보고 슈크림 사봤는데 오.. 진짜 맛있었음 그리구 사진 속의 꽈배기 같은건 헤이즐넛에 크림치즈 들어있다해서 어머님 입맛에 딱이라 사봤는데 진짜 맛있음 ㅠㅠㅠㅠ",맛있다
640,리치몬드과자점,무나&뎅,리치몬드 슈크림은 정말 최고! 적당히 크리미하고 꾸덕한 슈는 내공이 느껴진다. 홍대서 가장좋아하는 슈크림빵,맛있다
641,리치몬드과자점,모이모이짱,"심하게 맛있는 빵집ㅋ홍대점 없어지기 전부터 본점까지 만 13년정도는 다닌것 같아요 ㅋㅋ예전엔 에그샌드위치랑 바게트, 쇼콜라쿠키를 좋아했는데 최근에는 쿠인아망, 참깨바게트러스크, 무화과빵이 맛있어서 자주 사요.빵은 100점 만점 350점커피는 나쁘지 않은편이고 리필도 해줘요. 근데 빙수는 맛이 없어요. 밀싹빙수라고 있는데 그냥 녹차맛이구 그저 그래요아이스크림 등등도 나쁜 재료는 안넣고 계란도 유정란 쓰고 그렇다고 들었어요. 주차가 매우 편해요.",맛있다
642,토스티 서울 x horizon16,은가이,아 되게맛있다... 이제 레시피가 바뀌는 몽블랑은 되게고소하고 묵직한맛이엇음 이제 좀더 상큼함이 추가될거라함파운드케이크역시 진하고 꾸덕하고 음 맛잇엇다 레몬케이크가 되게 상큼하고 맛있었음,맛있다
643,토스티 서울 x horizon16,stern,"가장 마카롱스러운 마카롱을 판다고 생각되는곳!!적당한 필링에 쫀득한 꼬끄, 특이한 맛들이 많아서 여기 마카롱은 정말 매력적이다파운드케익은 가격대비 크기가 커서 좋다휘낭시에도 정말 맛있는데 품절이 빨라서 일찍가야 겟할수있다!! 크리스마스나 기념일 스페셜 디저트가 호라이즌 만의 개성이 듬뿍 담겨있어서 기대되는 곳이다",맛있다
644,토스티 서울 x horizon16,준영,지나가다가 호라이즌16 오픈했길래 호로록 들어가서 마카롱만 쇼로록 겟해서 나왔어요! 테이크아웃 전문이라 먹을 공간도 없어 그냥 길마카롱으로 하나만 먹었습니다ㅎㅎ 이스파한이 마침 있길래 지나칠 수 없었는데 확실히 장미맛 진하고 너무 맛있었어요! 다만 텍스쳐가 생각보다 쫀득한 느낌이라 사르르 넉늑 식감을 좋아하는 저에게는 조금 아쉬웠네요ㅎㅎ,맛있다
645,토스티 서울 x horizon16,영구빵,진짜 다들 이런 데 어떻게 알고 찾아가는거에여.. 인스타의 힘인가... 파운드케이쿠가 맛있는 집이라 소개받고 정말정말 힘겹게 찾아감ㅋㅋㅋㅋㅋ 사실 파운드케익을 아주 좋아하는 편도 아니고 정말 맛있는지도 잘 모르겠어서 하나만 샀는데 후회 중임ㅠㅠ 얼그레이 파운드에 레몬 파운드도 하나 더 시켜볼걸... 휘낭시에도 사볼걸.. 진짜 맛없는 곳에서 여러 개 사서 처치 곤란이었던 적이 몇 번 있어서 그런지 처음 가는 곳에서는 왠지 몸을 사리게 된당ㅜ 그래도 좋은 디저트집 하나 알아냈으니까 다음에 꼭 다시 가바야지 히히 아 파운드케익이 어떻게 맛있냐면여 일단 크구요 묵직하구요 얼그레이 향이 엄청 마니 나여 그리고 촉촉해서 입에서 막 녹는 느낌이에요 파운드케익이 만들기 쉽다지만 또 막상 맛있게 만들라면 쉽지 않거든요 끼니 대신 하나 먹으면 짱배불배불,맛있다
646,토스티 서울 x horizon16,somg,우리 가족이 애정하는 호라이즌..이 집 코코넛파운드케이크는 진리ㅠㅠ가족들 나눠주고 난 세개 먹으려고 코코넛파운드 6개에 레몬파운드 하나 샀다. 무거워죽는줄 알았다..; 한달에 16일만 오픈하고 메뉴도 유동적으로 바뀌지만 (그래도 코코넛파운드케이크는 늘 있는듯!) 인스타에서 오픈 날짜 확인 후 갈 만한 맛이다. 꾸덕한 파운드를 좋아하신다면 강력 추천합니다!!!,맛있다
647,토스티 서울 x horizon16,Jessic,"이전부터 먹킷리스트에 저장해뒀던 호라이즌식스틴!한달에 16일만 영업을하기도하고 거리가 멀어 언제가나했었는데 드디어!!가게 내부는 좁고 코로나로인해 매장에 3명씩 입장해구매를 할수있어요.마카롱은 왠지 땡기지가않아 구매를 하지않았는데네이버 검색해보니 마카롱이 유명한듯하네요.(파운드비쥬얼만보고 가고싶다한 사람,,저요)파운드케이크도 종류별로 구매하고, 당근케이크와휘낭시에까지 주문해서 종류별로 먹어봤는데전부 맛있었어요 :)휘낭시에는 쫀득쫀득한데 겉은 바삭하고 속은 촉촉해서좋았고, 파운드 질감이 꾸덕하면서 무거워서 개인적으로 넘 좋았어요!!가장맛있었던건 코코넛과 얼그레이!당근케이크도 케이크지만 파운드처럼 되어있는데당근케이크도 꼬소하면서 딴딴해 독특하면서도맛있었구 가까우면 종종 방문하고싶은 곳!다음번엔 마카롱이랑 푸딩도 먹어보고싶어요!",맛있다
648,토스티 서울 x horizon16,HanPatrick,"다 너무 맛있지만, 트러플 마카롱 이랑 레몬진저 마카롱이 너무 맛있었어요! 코코넛 파운드 케익도 쫀득한 식감과 너무 달지는 안고 맛있어요!!! 계속 들러야겠어요!",맛있다
649,토스티 서울 x horizon16,머큐리 ,"맛있지만 ?, <호라이즌16>.몽블랑/8500 과 트러플마카롱/3000, 레몬파운드/4500 주문. 맛있는데 잘 모르겠다. 더 많이 먹어봐야 할 듯. 유명 메뉴는 먹지 못했으므로 재방문 시급 !",맛있다
650,토스티 서울 x horizon16,미루,"머리하러 갔다가 빵순이 디자이너쌤이 이곳 코코넛파운드 극찬을 하셔서 바로 달려가서 샀다! 세상에... 나 왜 이때까지 여길 안왔던거야ㅠㅠ 파운드라기엔 식감이 밀도있고 쫀쫀 촉촉한데 완전 취향저격. 고급진 단맛에 기분좋은 정도의 코코넛향. 코코넛맛이 까딱하면 느끼해지기 쉬운데, 너무너무 맛있게 먹었다;-) 휘낭시에도 먹어본것 중엔 손꼽히는. 일단 식감이 너무 좋았다. 식감타령 자꾸하는데ㅋㅋ 맛도 있지만 식감이 인상깊어서. 다른 시그니처 디저트들도 있던데 얼른얼른 먹어봐야지!!",맛있다
