,가게이름,리뷰아이디,리뷰,맛평가
211,마이클 돈까스,정뱅이,상암동에서 점심시간 제한 없다면 편하게 가서 먹고 싶은 가게언제나 점심시간때 잘못 찾아가면 언제나 대기열;;;추천은 기본 돈까스에 새우 추가를 추천 하지만….추천은 추천일뿐 ~ 알아서들 먹자 !여기에 장점 저녁에 찾아가서 먹으면 대기 없이 먹을 수 있다는 점! 단점은 주차에서 아쉬움이 아주 큰 가게 입니다.가게에서 주차권을 사야 주차비 부담이 없다는거 ;;; 아쉽!,맛있다
212,마이클 돈까스,식인달팽이,무난한 돈까스 맛집 매콤한 토마토소스 아라비아따느낌,괜찮다
213,마이클 돈까스,이두용,매운 치즈 돈까스는 솔찍히 맛있습니다. 그런데 서비스가 최악이네요. 샐러드와 나쵸를 추가로 요청했는데 귀찮은 듯한 태도로 샐러드만 대충 주고 나쵸는 그냥 못들은 척 하더라구요. 인사를 바라고 음식점에 가는 것은 아니지만 계산하고 나갈 때도 인사 없더라구요. 기분 더러워서 다시는 안가려구요.,별로
214,마이클 돈까스,송재민,굉장히 오래 전 부터 다녔던 집.. 두툼한 돈까스 확실히  다른 집 보다 두껍기는 하나 그 이외 장점은 없는 것 같다..요샌 다른 돈까스 맛집들이 더 많이 생겨서 그런지 더욱 이런점이 부각 되는거 같다,괜찮다
215,마이클 돈까스,Jane,맛있어요ㅠㅡㅠ  확실히 맛있어요. 고기도 완전 두툼하고 부드럽고 소스도 많이 안 맵고 맛있어요.11시30분에 갔더니 널널하던데 곧 금방 차더라구요. 그래도 메뉴 준비가 빨리빨리 돼서 회전율은 좋은 것 같아요아그리구 주먹밥도 짭짤하구 맛있어서 따로 추가로 포장해가고싶었어요ㅋㅋㅋ,맛있다
216,마이클 돈까스,둘리공원,"나는 이곳에서 매운치즈돈까스만 먹어봤지만, 앞으로도 계속 이 메뉴만 고집할 것 같다.전국팔도의 다양한 돈까스를 경험하지는 못했지만, 적어도 이 돈까스는 대체가 불가능하다는 느낌을 받았기 때문이다.처음 음식이 나오면 살사소스가 굉장히 푸짐하게 부어져 있어 돈까스의 형체가 분간이 가지 않는다. 이때는 어떤 각도로 사진을 찍어봐도 그 아름다움이 제대로 표현되지 않는다. 하지만 본격적으로 한 입 하기 위해 젓가락으로 그 사이를 헤집어보면 생각보다 크고 두툼한 치즈돈까스가 큼직한 크기로 썰려 있다. 크게 한 입 먹는 것을 선호하는 스타일이서 개인적으로는 더 잘 맞았다.어떤 집에서는 치즈돈까스를 먹다보면 금세 자른 단면에서 흘러내린 치즈가 굳어 건조하고, 질겨지는 경우가 있는 데 이 집은 마지막 한 조각을 먹을 때까지 치즈가 기름지고 고소하다. 그리고 고기도 너무 얇지 않아 씹는 맛이 배가된다.  그렇게 한 입 베어물면 매콤달콤한 소스에 풍부한 치즈, 두툼한 고기 삼 박자가 어우러져 풍성한 바디감을 형성한다.먹다보면 살짝 아른거리는 매콤함은 조미된 주먹밥과 유자드레싱이 뿌려진 신선한 양상추로 완벽하게 중화된다. 중간중간 느끼하다고 생각이 들면 밑반찬으로 제공되는 김치, 단무지를 먹으면 도움이 되는데 사실 단무지보다는 김치에 훨씬 손이 많이 가더라.끝으로, 함께 나오는 나초를 숟가락 삼아 남은 소스를 퍼 먹으면 깔끔하게 완돈을 할 수 있다 :)처음에는 나오자마자 먹었고, 두 번째는 일행을 기다리느라 돈까스가 나온지 5분 남짓 지나고 먹었는데 둘 다 따뜻하고 배부르게 잘 먹었다. 가격은 9.5천원으로 돈까스치고 많이 비싸지만 양과 맛을 생각하면 충분히 먹을만 하다는 생각이 든다.",맛있다
217,마이클 돈까스,김혜진,살사소스에 파묻힌 치즈돈까스. 살사소스를 찍어먹곤 하는 나쵸가 돈까스와 같이 나오는게 특이하다. 명성만큼 엄청 맛있지는 않았다. 카레돈까스를 얻어먹어봤는데 씹는맛이 살아있어서 더 맛있다고 느꼈다.오퍼레이션이 굉장히 빠르다. 이악물고 빨리 내주시는 느낌.점심시간에 웨이팅이 기니까 그런 것 같다.,괜찮다
218,마이클 돈까스,ParkJieun,"매운돈까스가 명물이라 유명한데, 엄청나게 맛있다 그런 건 잘... 특이해서 한 번 먹어볼만한 느낌이에요.",괜찮다
219,마이클 돈까스,까쓰까쓰,여기 왜 안가세요?????!!!!두번가세요 세번가세요또먹고싶은 맛ㅠㅠㅠㅠㅠㅠ어제 다녀왔는데 빨간 소스 매운맛이아직도 생각나요 다 맛있음 .....,맛있다
220,킹타코,연건동맛동산,"⭐⭐⭐⭐☆네기마요 타코야키 (8알, 7.0) 베이컨 야끼소바 (9.0).집앞에 있었다면 매일 출근도장 찍었을 것 같은 코지한 분위기의 가게. 타코야키, 야끼소바에 시원한 생맥주 한 잔? 참을 수 없지!.타코야키를 사이드로 파는 경우는 많았지만 이곳처럼 상호명에 넣을 정도로 주연인 곳은 쉽사리 보지 못했다. (우연히도 최애 유튜버 이름이 킹타'쿠'라 더 이곳 이름이 반갑기도 했고...) 들어가면 가게 이름처럼 다찌석 안쪽에서 사장님이 쉴새없이 타코야키를 돌돌 구워내고 계시고. 약간은 어두운 조명과 차분하지만 무언가 신나는 분위기는 내가 일본 골목 술집에 온건가 착각하게 만든다..타코야키는 문어/새우/돼지 중에 고를 수 있고 소스 역시 네기마요 (파) 카라이마요 (청양고추) 혹은 소스 없이 로 고를 수 있다. 종류를 섞은 반반야키도 물론 가능! 흥건할 정도로 마요이불을 덮은 타코야키의 비주얼은 그야말로 군침작렬. 특히 길거리 트럭과는 달리 정말 두-껍게 들어간 문어가 인상적이었는데 부들부들한 반죽, 쫄깃한 문어, 고소한 마요네즈가 풍성한 맛을 자아냈다. 맥주안주로 진짜 최고! 1차에서 너무 배불러진 상태에 방문했다는게 유일한 아쉬움이었다 ㅠㅠ.함께 주문한 야키소바는 우스타소스의 맛이 꽤 강했다. 이 부분은 호불호가 갈릴지도? 하지만 우스타의 향과 산미가 식욕을 돋구고, 적당하게 맛있게 익혀진 면과 풍부한 재료들의 조화가 맛있던 야끼소바였다. 개인적으로 재방문한다면 타코야키를 잔뜩 주문해 맥주랑 먹을 것 같긴 함 ㅎㅎ.맥주도 부드럽고 거품이 몽글몽글한게 관리 잘 된 생맥주 기계임을 알 수 있었으며 시종일관 친절하셨던 서비스도 좋았다. 동네에 있었다면 정말 참새방앗간마냥 퇴근길에 쏙 빠져들 것 같던 곳. 망원 인근에서 가볍게 맥주 한 잔이 필요한 모두에게 적극 추천!",맛있다
221,킹타코,anon,오코노미야끼 스몰사이즈가 있어서 좋았어요,맛있다
222,킹타코,muk_so.o,"예에전부터 가고 싶었던 곳!포장하려고 미리 전화했는데 되게 차분하고 친절하게 받으신게 인상깊었다.오코노미야끼(베이컨해물 S)/ 돼지고기는 별로 좋은 평같지 않아 베이컨 해물을 골랐다. 오코노미야키는 처음 먹는 것 같은데 아마 내 기억상,,, 팬케이크같이 폭신폭신하고 안에 내용물과 잘 어울리는 맛이라서 맛있다. 무난하고 크게 호불호가 갈리지 않을 것 같다.크기가 작은 것 같은데 두툼한 편이라 양도 괜찮은 듯.맥주랑 먹으니 환상!서비스로 요구르트 주셨당!!재방문 의사: 오코노미야끼, 타코야끼",맛있다
223,킹타코,포링,안주삼아 먹기 아주 좋아요 맛있게 먹었어요 ㅋㅋ,맛있다
224,킹타코,GABY,"사진으로는 구분이 안가지만ㅠㅠ 야끼를 종류별로 새우, 돼지고기, 문어 세개 다 먹어봤는데, 새우랑 문어가 더 맛있어요!돼지고기를 시킬바에 새우랑 문어를 또 시키는 게 나을 것 같아요~같이 나오는 청양고추랑 초생강이랑 같이 먹으니까 맛있는 거 같아요! 넷이 가서 세번이나 리필해서 먹었네요ㅎㅎㅎ",괜찮다
225,가쯔레쯔,맛따라,맛있어요~!!!,맛있다
226,가쯔레쯔,이진쓰,무난해요. 그냥 밥 먹을 때 방문하면 좋을 것 같네요. 돈가스치즈김치나베 시켰는데 국물도 찐하고 밥도둑이네여. 돈가스고 맨첨엔 적은 줄 알았는데 먹다보니 배불렀어요ㅋㅋㅋㅋㅋㅋ,괜찮다
227,미소야,하루별,걷다가 눈에 띄어서 다녀온 미소야! 약간 일식계의 김밥천국 같은 곳이죠!메뉴 다양하고 일식 위주라서 좋아하는 먹거리들 다양하게 있는 편이에요 소바 먹을지 알밥 먹을지 고민하다 알밥 먹었는데 밥 양이 정말로 많았어요 세상 든든하게 먹을 수 있던 양! 돌솥에 나와서 천천히 먹으니 누룽지까지 같이 먹을 수 있었구 정말 든든하게 먹었어요 양 많구 가격 착해서 부담없이 먹기 좋네요,괜찮다
228,미소야,포링,돈까스 질도 좋고 우동국물도 맛있다. 양도 충분해서 좋음ㅎㅎ,맛있다
229,미소야,muk_so.o,사진은 없지만ㅜㅠㅠ생선까스/ 돈가스만 3덩이가 나와서 엄청 배불렀다. 정식 추가 안 하게 다행인듯. 조금 느끼하긴 하지만 맛있었다. 생선가스에 있는 타르타르 소스는 괜찮은데 다른 돈가스 소스는 약간 치약맛 나는 것 같았다. 소스가 상쾌하다.전체적으로 양은 많다. 이 근처에 딱히 음식점이 많지 않아 식사시간에는 사람이 엄청 몰리는 것 같다. 식사시간 피해서 가는게 좋을것 같다.,괜찮다
230,코코이찌방야,민트,개인적으로 가격에 비해 너무 단촐하고 맛도 그냥 그래요.근처에 회사가 많아 점심시간에 들어가기 힘들어요.,별로
231,코코이찌방야,혜유닝♥,돈까스가 정말 바삭바삭 입천장 까지는지~^^;카레 매운맛 조절 가능해서 좋았어요카레에 쩔었는데도 바삭한 돈까스 식감!넘 맛있었어용~^0^,괜찮다
232,기소야,muk_so.o,미소라멘 / 미소라멘이라 그런지 미소맛이 강한데 별로인 미소맛. 별로였다. 그릇 엄청 커서 놀랐고 양도 많다. 숙주가 생으로 올라와서 숙주 특유의 향이 나서 별로였다. 그래서 면만 먹었는데 먹다 물려서 남겼다.교자3개 / 라멘보다 교자가 더 맛있었다. 친구한테 여긴 교자맛집이라고ㅎㅎㅎ 사실 엄청 맛있다기보다는 그냥 바삭하고 촉촉해서 괜찮았다.다음날부터 폭풍 화장실행ㅜㅠㅠ,별로
233,토모다찌,냠냠PD,"[상암 맛보장 된 라멘을 원한다면? 바로 여기]지난번에 상암에서 처음 본 가게에서 냉라멘 도전했다가 호되게 당하고, 역시 상암에서 라멘은 토모다찌다! 하고 단골가게로 회귀했습니다.상암에 되게 작은 라멘집이지만, 라멘도 덮밥도 모두 맛있어서 점심 저녁시간에 조금만 늦으면 웨이팅이 어마어마한 맛집이에요.1. 돈코츠라멘(7,000원)약간 매콤한 국물이 일품인 돈코츠 라멘. 육수의 찐함을 그대로 느낄 수 있어서 너무 좋습니다. 특히 여기에 천원 더 ㅈ추가하면 미니규동이 나오는데, 이것도 정말 별미에요 여자 혼자서 다먹기엔 양이 너무 많고, 성인 남성이라면 배부르게 먹을 정도로 양이 푸짐하게 나온답니다. 상암에서 실패하지 않고 라멘을 드시고 싶다면 토모다찌 추천드립니다!",맛있다
234,타코돈부리,민트,사케동을 먹었는데 양이 너무 적어서 놀랬네요.,괜찮다
235,온돈부리,jinee,"간단평: 연어뱃살덮밥이 젤 맛있고 나머진 무난했다.(뱃살덮밥은 이전에 먹은거라 사진X)- 계란이든 연어덮밥 (이름기억x)맛깔나는 간장+고소한 계란+잘게다진 회의 조화> 회덮밥을 먹는 느낌이 든다. 간장을 부으라고 하지만 약간 간간한 맛이 이미 난다.  - 아부리한 연어덮밥연어덮밥에 불향이 덮힌 맛이다. 건대입구쪽에 이이요의 야끼돈부리 느낌난다. 물론 이이요가 더 가성비 있구 맛있다.개인적으로 여긴 연어뱃살덮밥이 가장 맛있었던 것 같다.일부러 까진 아니고 상암쪽에 왔을 때, 방문할만 하다.",괜찮다
236,온돈부리,엄마어디가,"# 아이와함께 # 실패하지않는 맛집> 카이센동연어, 단새우, 성게알. 이 세가지로 극락의 카이센동이 펼쳐지다니이것저것 마구 올라갔지만 평범한 카이센동보다 훨씬 좋아요. 연어도 새우도 너무 맛있었어요><다만, 해산물이 좀 비리면 비누맛을 느끼는데오늘은 성게알에서 그 비누맛을 느꼈어요ㅠㅠ다음번엔 또 성공하길!> 에비동여기가 연어맛집이라고 소문이 나 있는데또 가츠동류도 기깔나게 잘해요. 평소에 다양하게 주문해먹는걸 좋아하는지라이렇게 팔방미인형 너무 좋아요!!> 유부우동우동마저 맛있네요…사기꾼같은 리뷰같긴 한데..진짜 맛있어요. 가츠오국물도 깔끔하니 맛나고유부는 말모… 사랑이에요. # 재방문의사 많음벌써 쿠폰 열개찍어서 가라아게 하나 받을수 있어요. 가라아게 먹으러 또 가야겠네..아. 오늘은 지난번보다 새우튀김이랑 성게알이 조금선도가 낮은듯 해서 아쉬웠어요. 다음번엔 평소 컨디션 회복하길!!> 아기의자 없음. 유아식기제공",맛있다
237,온돈부리,엄마어디가,"# 여전히 맛있다. 인기메뉴는..> 사케아마에비동우니 재료소진으로 주문했어요. 지난번 우니가 너무 맛있었는데 진짜 아쉬워요하지만 연어횟감도 좋고 단새우는 실망시키지 않으니 만족!!고슬고슬한 밥과 짭쪼롬한 양념, 거기에 신선한 회는..언제 먹어도 천국의 맛이네요> 사케네기도로동(..?)신메뉴인듯해요. 너무 배고파 주문한지라 설명을 못읽었는지아부리한 연어도, 숨어있던 초생강도 제스타일이 아니었어요. 초생강을 꽤나 싫어하는지라..없었다면 좀더 맛있게 먹었을수도 있겠네요. > 니꾸우동저희 아이가 다 먹었습니다..국물 들이켜가며..조금 얻어먹어본 바로는 맛있더라구요. 여전히면발이 쫄깃쫄깃한게 인상적이었어요. # 쿠폰 다 채워야징이런 맛집 치고 웨이팅 없는것도 너무 좋고이렇게 맛있는건 더더욱 좋고외식하고 쿠폰 받아온건 처음이에요. 또 가야지",맛있다
238,온돈부리,식인달팽이,그냥 사케동 보다 이게 더 맛있다,맛있다
239,온돈부리,엄마어디가,"> 아기와 함께유아식기 제공. 아기의자 없음> 카이센동 (27.5)일반적인 카이센동이라기보단사케동 + 아마에비+우니 라고 보면 될것 같아요. 연어도 새우도, 특히 성게알 신선도가 좋아 놀랐어요. 시그니처답게 맛있었어요. 다른말 필요 없이 “신선하다” “맛있다”> 믹스가츠동 (9.5)사케동 맛집이라서 가츠동류는 별로일 줄 알았는데가츠동도 맛있어요!맛있게 짜고 맛있게 달아요. 개인적으로는 돈가츠보다는 새우튀김이 더 맛있었어요. > 니쿠우동 (9.0)우동마저도 실패하지 않음..!메뉴가 많은데도 우동이 이 정도로 괜찮다니.노른자를 톡 터뜨려 먹으니 새로운 맛. 맛있음!가쓰오부시가 조금 많은 듯 한게 유일한 아쉬움이었어요> 재방문의사매우 있음… 오늘 저녁 또 먹어야하나..",맛있다
240,온돈부리,식인달팽이,사케동이 맛있어요 저녁에 갔었는데 연어뱃살덮밥은 솔드아웃이라 연어덮밥시킴 치즈튀김두상암동에서 흔치않은 프렌차이즈가 아닌 맛집 온미동이랑 메뉴구성이나 느낌이 비슷 치즈튀김은 별루더라...추천~,맛있다
241,온돈부리,정민,"NIWOOW님의 혼밥리뷰를 보고 근처에서 혼밥을 하기 위해 나도 온돈부리를 찾았다.이제 막 저녁 장사가 시작되는 타이밍이었는지 가게 안에 손님은 그리 많지 않았다.맛있어보이는 메뉴가 몇가지 있어서 고민하다가 무난하게 연어뱃살덮밥을 골랐다.배가 많이 고파서일 수도 있었지만 덮밥 한끼 깔끔하게 싹싹 비워 맛있게 식사할 수 있었다.느끼하지 않았고, 연어뱃살 덮어주신 양도 밥을 다 먹을 때까지 함께 먹을 수 있었다. 물론 아까워서 조금 나눠 먹기도 했지만…ㅎㅎㅎㅎ상암동 근처에서 깔끔하고 조용하게 혼밥을 할 수 있는 곳! 저도 추천 :-)",맛있다
242,온돈부리,신승수,개안음,괜찮다
243,온돈부리,GABY,"사케동 맛집에서 우나기동을 먹었다.-사케동이랑 부타동, 우동 등을 이미 먹어본 터라 다른 메뉴가 궁금했다. 이전에 먹었던 메뉴들이 다 맛있었던 편이라 그랬던 것 같다. 고민 끝에 플렉스할 생각으로 우나기동을 골랐다.장어는 일 년에 한두 번 근교로 나가서 장어구이로만 먹어봤다. 장어덮밥은 처음이라 이전의 경험과 비교할 수가 없어서 확실히 어떻다고 말할 수 없지만 개인적인 의견을 적어보자면, 양념도 적당히 진했고 양도 딱 배부를 만큼 나와서 좋았다. 다만 2만원이 넘는 가격이라서(다른 메뉴의 거의 2배인 가격임) 다음에도 또 먹을 거 같지는 않다.",괜찮다
244,온돈부리,하루별,기대하고 다녀왔던 온돈부리 야부리랑생연어 두가지 먹었는데야부리가 덜 맛있을거  같다고 생각하고 먹었는데 야부리가 더더 맛있었던!!연어의 질이 좋아서 맛있었어요밥 양 적다는 말도 있었는데 딱 배부르게 먹을 수 있을 정도였고!맛있어서 만족하고 먹었어요.재방문의사 있어요!,맛있다
245,온돈부리,송재민,"가츠동, 규동 먹어 봤으나 여느 돈부리 집과 비슷한 수준...굳이 줄 서서 먹을 이유는 없다고 본다",별로
246,온돈부리,agari-dieter,사케동망플 1위길래 점심시간 시작도 전에 후다닥 튀어나왔는디 그냥..사케동이다. 연어가 특히 맛있다거나 뭔가 특이점을 찾지 못했다.. 연어가 좋은 거 같기도 하고 기분탓 같기도 하고..왜 줄을 서는 걸까? 다른 메뉴도 먹어보고싶다.,괜찮다
247,온돈부리,망구,다행히도 점심시간 끝물에 브레이크 타임 전 막타임에 걸쳐서 기다리지 않고 무사히 주문 가능했습니다:)늘 웨이팅이 있는곳이라 들었는데 이유는 확실하네요.너무 맛있습니다.어느것도 과하지 않고 그렇다고 부족 하지도 않은 (굳이 따지자면 양..?) 밸런스가 아주 좋은 음식입니다.그냥 돈부리 최고의 맛 입니다:)가격이 쬠더 저렴했으면 한그룻 더먹었을듯...직원분 마저 친절하셨어요 맙소사,맛있다
248,온돈부리,NIWOOW,DMC 근처에서 간단히 혼밥할 식당을 찾다가인터넷이나 망플 평이 좋아서 방문했습니다.개인적으로 가츠동을 더 좋아하는 편이지만이번엔 호평을 많이 받은 사케동을 주문했어요.사진을 보니 양이 적어서 걱정을 조금 했는데실제로는 연어가 두툼하고 크더라구요.딱히 부족하다는 생각은 안 드는 양이었어요.연어 특유의 맛이 강한 편은 아니었습니다.하지만 끝에서 살짝 올라오는 단맛이 괜찮았고밥과 같이 먹으니 간이 딱 맞아 맛있었어요.무엇보다 비리지 않고 깔끔해서 좋았네요.연어를 굳이 찾아서 먹는 스타일은 아닌데여기 사케동은 종종 들러서 먹을 것 같네요.오랜만에 맛있는 연어를 먹어서 [맛있다]로.,맛있다
249,온돈부리,간기,"상암에 위치한 몇 개 안되는 맛집중에 하나인 온돈부리.확실히 직장인들이 모여있는 상권이기 때문에 이곳을 점심에 먹기위해서는 꽤나 큰 공을 들여야한다.연어를 위주로 하는 음식점이기 때문에 신선함이 중요할 수 있다. 주문후, 조금 시간이 걸려서 먹는 느낌이긴 하였지만 먹는 순간 ""아 여기가 왜 많은 사람들이 찾는 곳인가?""알 수 있는 느낌이다.밥을 살짝 올리고 연어 한점을 올려 식사를 하게 되면 연어의 부드러움 때문에 밥이 어떻게 넘어가는지 연어는 어떻게 없어지는 지 나도 모르는 순간에 그렇게 됨을 경험할 수 있다.상당한 실력이 있는 곳이지만 웨이팅이 상당한 곳이기 때문에 먹고 싶다면 일찍 가거나 아니면 점심 시간을 피해서 가길 추천한다.",맛있다
250,온돈부리,한송이,엄청 기대를 많이 하고 가서 그런지 특별하다는 느낌은 별로 없었다. 직원들의 응대와 서비스는 좋았다.,별로
251,온돈부리,Lizy,"돈부리와 사케동이 맛있는 집입니다. 점심, 저녁에 많은 사람들이 줄을 서는 이유가 있는것 같습니다. 한그릇 음식으로 딱 적당한 돈부리와 사케동을 즐기실 분들께 추천합니다!!",맛있다
252,온돈부리,홍순우,5/5,맛있다
253,온돈부리,강췻,상암동에 가면 이곳만 가요.,맛있다
254,온돈부리,어젠,사케동 13.0부타동 10.5수색역 인근에서 유명한 돈부리집에 가봤다. 상가들이 정말 많은 곳인데 독보적으로 평이 좋아서 궁금했는데 큰맘 먹고 찾아감. 베스트 메뉴 중에서 고른 건데 부타동은 사실 무난했고 사케동이 정말 맛있었다!!보통 일본덮밥집에서 사케동이 인기인 이유는 단지 연어이기 때문이라고 생각한다. 사람들이 연어를 좋아하고 정갈하게 나오며 부담없는 가격에 제공되기 때문에 주로 사케동을 주문하는 것 같다. 하지만 먹어보면 사케동이 정말 맛있었던 경우는 그렇게 많지 않다. 생선회라는게 여러모로 민감한 식재료인데 잘못하면 물컹해지거나 비린 맛이 나기 마련이다.이곳 사케동은 정말 맛있다. 연어를 주재료로 하는 요리들이 인기라고 하더니 온돈부리의 사케동은 신선하고 식감도 좋고 양도 적당하다. 연어를 많이 못 먹는다던 친구도 많이 먹는 걸 보니 맛이 있었던 모양.또 간다면 무조건 연어!! 사케동!!!,맛있다
255,온돈부리,muk_so.o,아부리사케동/ 여기도 아부리 사케동 먹으러 가야지하다가 드디어 다녀왔다!가격은 조큼 비싼데 생각했는데 순식간에 13000원 순삭함~~처음에 현미랑 흰쌀이랑 섞은 밥인가? 했는데 그건 아니고 밥에 이미 간이 되어있던 거였다. 짭짤하지 않아 괜찮다. 연어 밑에 보면 김도 얇게 있다. 연어는 비리지 않은 편이고 몇 번 씹지 않아도 그냥 넘어간다. 맛있었다. 또 먹고 싶다.포장비는 (+500) 별도.먹고나니 위로받은 느낌이 들었다.왜이제야 왔을까 진작 올걸.재방문 의사: 아부리사케동,맛있다
256,온돈부리,독새,"리뷰 같은 거 잘 안쓰는데..여긴 정말 칭찬하고 싶어서 씁니다.최고! 맛, 서비스, 어느하나 흠잡을데가 없다!",맛있다
257,온돈부리,서초구보안관,여기 진짜 맛있어요! 직장을 상암동으로 옮기고 나서부터 완전 단골집! 근데 가격이 좀 쎄긴해요ㅠㅠ가성비는 잘모르겠지만 그래도 맛있는 집입니다!재방문의사 4.2 / 5,맛있다
258,온돈부리,솔직하게 써보지,웨이팅이 엄청나다는 소문에 11:30에 갔습니다. 딱 저희가 만석 채워가지고 ㅎㅎ 이후로 웨이팅의 시작... 정말 친절하더라구요. 밥 먹기 전부터 기분이 좋아졌어요. 텐동은 12:45 이후인가부터 된다고 해서 큰 고민없이 사케동과 치즈스틱을 시켰습니다!!맛있어요.간도 딱 좋고 연어 싱싱하니 맛있었어요!!맛있는데 이렇게까지 줄을 설 일인가에 대해서는상암동에 그다지 맛집이 없다보니 생긴 일이 아닐까하는 추측을 ㅎㅎ 도리어 식당의 특수성은 치즈스틱이 아닐까 생각합니다. 치즈스틱 그만큼 맛있기 쉽지 않죠. ㅎㅎㅎ,맛있다
259,온돈부리,키킴,상암동 일대의 줄서는 음식점 중 하나인 온돈부리. 대중적인 단 맛으로 상암동에서 잘 자리 잡은 음식점.,맛있다
260,온돈부리,GABY,"오늘은~새로운메뉴우~부타카쿠니동(10,000원)달짝지근하고 매콤한 장조림덮밥맛이다.오늘은 너무 배고파서 둘이서 세 개 시켰는데, 양이 생각보다 많아서..분명히 중간까지는 맛있게 허겁지겁 먹었는데 뒤에는 꾸역꾸역 먹었다.이 집은 솔직히 딱 ‘보통맛있음’인데 직원분들이 너무 친절해서 또 가고싶다. 손님과 눈을 맞추고 웃으며 기운차고 밝게 인사해주셔서 들어가면서부터 기분이 좋았다:)",맛있다
261,온돈부리,앙금,단무지가 얼어 있었고튀김 시키면 곁들여 주는 양배추 샐러드에 키위 드레싱을 쓰길래 굉장히 별로였는데음식 자체는 나쁘지 않았어요..,괜찮다
