,가게이름,리뷰아이디,리뷰,맛평가
1304,트라토리아진,뿔뿔,"가격 생각하면 맛있다라고 할 수 있는데 맛만 따졌을 때 나한텐 그냥 그런 맛..으로 느껴지니까 괜찮다로~  위치가 너무 안좋다. 여기가려고 처음 쌍문역까지 가봤는데 밥 먹고 갈만한 곳은 근처에 없음.. 15분이상 걸려가면서 굳이 찾아갈 필요는 없을 것 같다고 느꼈다. 뭐 근처 주민이면 가볼만할 듯. 가게 분위기는 동네 조그만 식당임.. 실제로도 혼밥하는 주민이 대다수였다. 여담이지만, 온갖 날파리, x파리들이 달겨들어서 매장안에 있기 힘들었다..ㅠㅠ 이건 가게 잘못은 아니지만.. 문이라도 닫아주었으면 하는 마음이 들었음.",괜찮다
1305,트라토리아진,먹을 것에 진심,"새우 알리올리오(6000원), 버섯 크림파스타(9000원) 먹었습니다. 이미 블로그에는 꽤 많은 리뷰가 있지만 여긴 거의 없어서 좀 신기한곳! 최현석 셰프가 인스타에 직접 홍보했던곳으로, 이현채셰프님은 큰 레스토랑에서 일을 하시다가 자신만의 가게를 차리셨다고해요. 위치나 상권때문인지 상당히 저렴한 가격을 자랑하지만 퀄리티나 맛은 저렴하지않아요!가게 오픈하자마자 가서 여유롭게 셰프님의 불쇼를 지켜보았습니다 ㅎㅎ 뭘 먹을지 고민하고 있을때 추천해주신것이 새우 알리올리오. 원래 알리올리오를 내돈주고 안시켜먹는 저인데 만족스럽게 먹었습니다. 재료 자체도 넉넉히 들어있고, 살아있는데, 보통 이런경우는 건강한 노맛음식이 되기 쉬운데 그렇지 않았어요. (스미스 한옥... 아직도 잊지않았다 ㅂㄷㅂㄷ) 마지막 남은 마늘까지 잘 먹었어요. 버섯크림 파스타도 마찬가지고요.아쉬운건 가게의 규모 ;ㅅ;... 10석 안팍의 작은 규모라는 점, 위치가 좋은 편이 아니라는 점 등이 있겠네요. 막 분위기 잡는 그런 곳보다는, 동네 주민들이 편하게 와서 먹고가는 다락방? 같은 느낌인거 같아요 ㅎㅎ!",맛있다
1306,트라토리아진,야구소년,"최현석 쉐프님이 직접 인스타에 홍보글을 올렸던 곳. 인스타의 사진과 글을 볼땐 트라토리아 진 쉐프님과 친분이 있는 사이로 보여진다. 아무튼, 집에서 도보 30분 거리라 주말에 산책할 겸 부담없이 다녀왔다. 트라토리아 진은 트라토리아라는 상호 답게 격식없이 가볍게 파스타와 리조또를 맛볼수 있는 곳. 가장 먼저 눈에 들어오는건 사진 빨 잘받겠다 싶은 파스타와 무지막지한 양. 1인당 파스타 하나를 소화하기 버거울 정도로 양이 많다. 그리고 충분히 맛있는 (또 조금은 예상가능한) 파스타다. 그렇기에, 멀리 이 곳 쌍문까지 와서 맛본다면 갸우뚱할수있다. 분명 다른 동네에도 이처럼 맛있는 트라토리아가 하나씩은 존재하지 않을까? 나는 개인적으로 멀리있는 유명 맛집 보다는, 집 근처 숨어있는 맛집들을 더 좋아한다. 동네 맛집들은 나에게 맛뿐만 아니라 새로운 이야기를 담아갈 수 있는 공간이다. 며칠전, 트라토리아 진에서 나는 동네 친구들과 떠들수 있는 새로운 이야기를 담았다. 여긴 우리 동네 주민 대부분이 좋아할만한 맛있는 트라토리아다.",맛있다
1307,노말키친,ybbing,오후2시쯤 갔는데 아무도 없어서 조용하게 식사할 수 있었어요!가게 분위기도 좋고 깔끔했어요. 둘이가서 세트메뉴 시켜서 먹었는데 완전 배부르게 먹었어요! 세트메뉴는 파스타1 덮밥1 에이드1 사이드메뉴1 이렇게 구성되고 파스타랑 덮밥은 고를 수 있는 종류가 정해져있어서 조금 아쉬워요. 일단 제가 먹은 삼겹살 로제랑 치킨덮밥은 진짜 완전 백번 맛있어요...그리고 저 로제 새우볼이 너무 맛있었어요...완전 새우가 탱글탱글 살아있고 소스도 맛있어요...,맛있다
1308,노말키친,북극곰,"합리적인 가격에 파스타를 즐길 수 있다. 메뉴판의 맨 앞에 있던 세트메뉴를 주문했다. 삼겹살 로제 파스타와 치킨 스테이크 덮밥, 사이드메뉴와 에이드가 나오며 가격은 26.0. 나오는 메뉴들을 생각하면 꽤나 저렴한 가격이다. 파스타는 맛있었다. 삼겹살을 수비드 조리하고 겉부분을 시어링한것같은데, 나는 꽤 괜찮았으나 느끼해서 싫어할 사람들도 분명 있을것이다. 나도, 맛은 있었지만, 수비드 조리를 할거였다면 목살이 더 좋았을 것 같다. 덮밥은, 계란볶음밥에 치킨스테이크를 올렸는데, 무난했다. 볶음밥을 더 중화풍으로 고슬하게 볶았다면 좋을 것 같고, 곁들인 빨간 소스는 좀 별로였다.그래도 전반적으로 가성비있게 맛있게 즐긴 한끼였다~",맛있다
1309,노말키친,최의선,아내와 기념일에 다녀간노말키친..작은곳에 마련된 아기자기한 식당입니다.맛은 훌륭하고.. 흠 잡을 곳이 없네요!추천합니다!,맛있다
1310,노말키친,냥 냥,가성비가 좋아요음식은 그냥 그저그런데 가성비 좋아서 가끔 양식 생각날때 먹으러감항상 느끼는건데 소스가 따로 놈,괜찮다
1311,노말키친,ninoppp,웨이팅도 20분 걸렸는데 주문하고 한시간 넘게 걸렸어요 맛도 그냥 평범... 사람없으면 몰라도 기다려서 먹을맛은 아님,별로
1312,헤비앤라이트,준영,"배달의민족으로 주문,,해쉬브라운 서비스 제일 입에 맞았어요ㅠ버거 패티 너무 얇아서 흩어지네요,,매운 치킨텐더도 주문,,맵기는 괜찮은데 붙어있는 크럼블? 같은 것들이 너무 써서,,입에 맞지 않아 아쉬웠습니다ㅠㅠ",별로
1313,헤비앤라이트,장희,"수유에 있는 트렌드에 민감한 버거집. 스매쉬드, 슬라이더버거, 치킨버거까지 나름 최근에 유행했던 버거는 다 하고 있어서 멀리 나가지 않고도 유행하는 버거들을 즐길 수 있어 좋다. 치킨버거빼고 봉류별로 다 먹어봤는데 야채 들어간 것보단 고기고기한게 더 맛있다. 슬라이더도 맛있게 먹었고. 피넛버터 쉐이크도 잘한다길래 먹어봤는데 맛있었다.",맛있다
1314,헤비앤라이트,북극곰,"가격대도 꽤 괜찮고 준수한 수제버거집. 제일 기본이 5500원이고 세트 만드는게 4000원에 칠리치즈로 만드는게 추가금 2000원인가 그렇다. 이정도면 꽤나 리저너블한 가격. 제로콜라 있어서 좋고.맛은 무난하게 좋다. 스매시해서 얇고 바삭하게 굽는게 이곳의 패티 스타일. 그래서 육즙이 터진다거나 그런 느낌이 아니라, 빠삭하게 구워진 마이야르 패티를 먹는 느낌이당. 더블패티도 좋은데 오늘은 간단하게 싱글패티로 먹었음.다만… 오늘이 3번째 방문이었으나 처음으로 칠리치즈 소스가 완벽하게 데워지지 않고 냉기가 남아있어 놀랐다. 이건 좀 문제가 잇고, 배달 주력 매장인건가 매장 서비스를 기대하기는 힘듦",맛있다
1315,헤비앤라이트,규릐,수유역 근처 수제버거 가게!패티가 일반 패티가 아니라 스매쉬드 패티인데 그래서인지 더 맛있었다!버거 번도 퍽퍽하지 않았고 카러멜 라이즈드 된 양파도 조화가 좋았다.감자튀김도 통통하니 맛있었다!,맛있다
1316,헤비앤라이트,정민,"망고플레이트를 통해 포장전문 잇딜을 사용했는데,매장에 있는 두 직원분들은 망고플레이트가 뭔지도 모르고 있었고 망플에서 안내 된 결제방법인 큐알코드 표시도 그 어디에도 없었다.괜히 내가 엄한 곳에서 이상한 쿠폰을 구해와서 메뉴를 가져가려는 약간… 이상한? 사람이 된 기분이 들어서 좀 별로였다.심지어 사장님께 전화를 해서 “망고플레이트라는데요?”하고 물어보는데도 한참 통화가 마무리 되지 못하고 여전히 우왕좌왕하는 거 보니, 사장님이라는 분도 망고플레이트로 결제한 손님이 올거라고 아예 생각조차 안 하고 있었던게 틀림없었다.나의 예측이지만, 너무 자명한 예측이었다….주방을 모두 뒤지는데도 망고플레이트 큐알코드 판넬은 나오지 않았다.이것만으로도 나는 충분히 입맛이 사라졌다.그래도 나는 망고플레이트를 위해서 매장 사진을 열심히 찍었다.결국 결제는 그 자리에서 하지 못했고,뭐 시키셨어요? 그럼 일단 그냥 가져가세요.라는 말을 들으며 나는 햄버거를 포장하고 나왔다.기분이 되게 이상하게 불쾌한 건 나는 분명히 돈을 내고 구매 했고 설령 할인된 가격이라고 해도 내가 즐겨먹는 곳도 아니라 이번 기회를 통해서 접해보려는 나름의 선의(?!)로 시작된 구매가 이상하게 찌그러진 느낌이었다.헤비버거세트를 먹었고패티 120g을 먹었는데, 패티가 너무 얇은건지 240g을 시켰으면 안 그럴지는 모르지만 식감자체가 아예 느껴지지 않았다.먹자마자 치즈와 패티가 바로 부서지면서 씹지 않아도 섞여서 입안에서 잘 느껴지지 않았다.240g 패티로 시켰다면 이렇지 않았을 거라면, 굳이 120g 패티 버거는 아예 안 만드는게 어떨까 싶은 정도다.개인적인 취향으로는 양파를 졸여서 넣은 버거는 별로 안 좋아하는데 이 햄버거가 그런 것 같았고 먹는 내내 시큼한 맛이 계속 따라다녀서 아마도 양파 졸인 이 소스에서 나는 맛인 것 같은데 나에게는 명확히 불호였다.",별로
1317,헤비앤라이트,북극곰,퀄리티 매우 높은 수제버거를 맛볼 수 있는 곳. 순쇠고기 패티의 완성도가 매우 높다. 겉부분이 크리스피하게끔 눌러 구운 패티는 바삭하면서도 쥬시하다. 또한 번과의 조화도 훌륭하다. 베이컨과 할라피뇨가 추가된 멕시칸버거도 좋다. 또한 칠리치즈후라이의 완성도도 높다. 추천한다!,맛있다
1318,헤비앤라이트,ethanghymn,그젠가 야구소년님의 리뷰에서 본 이 가게의 햄버거가 나름 좋아보여 아침을 스킵하고 아점을 여기서 먹기로 하고 시계를 보니 가게까지 지하철을 타고 가면 1시간 정도 걸리는데 혹시나 인기있는 가게면 웨이팅 같은 게 있을까 오픈시간인 11시 반에 맞춰 가고 싶은데 오픈시간에 맞추긴 이미 시간이 늦었고 아무튼 서둘러 준빌하고 집에서 나섬.수유역에서 내려서 네이버지도에서 안내하는 대로 강북구청을 지나 골목을 더 걸어 드디어 헤비앤라이트에 다 와가는데 혹시나 손님이 많아 웨이팅이 많을까 했는데 소위 힙한 동네는 아니어선지 웨이팅 줄이 보이거나 하진 않고 가게 안을 보니 예상과는 달리 12시가 거의 다 된 시간인데도 손님은 보이지 않아 안도의 한숨을 쉬고 가게 안으로 들어감.메뉴는 대강 알고 왔는데 멀리 온 거라 여기만 들르고 돌아가기엔 아까워 다른 가게도 들를 예정이어서 너무 많이 먹으면 안되는지라 야채가 들어가는 흔한 타입의 홈메이드 말고 좀 더 미국 느낌의 치즈버거 타입인 헤비와 라이트 중에 뭘 먹을까 하다 차이점을 물어보니 헤비는 흔한 햄버거 번을 사용한 레귤러 사이즈면서 볶은 양파와 피클이 들어가고 라이트는 모닝빵을 사용해서 사이즈가 작고 볶은 양파가 아닌 일반 양파 슬라이스랑 피클이 안 들어간다고 하셔서 그래도 레귤러 사이즈 정도는 먹어야 되는 거 아닌가 해서 헤비 싱글 패티를 세트로 주문함.사이드로는 혹시 생감자를 매장에서 튀기는 거면 맛볼까 했는데 제품감자라고 하셔서 코울슬로도 좋아해서 그동안 연희동 센트그릴에서만 내가 찾던 맛과 80-90% 정도 비슷한 맛의 코울슬로를 발견했을 뿐 다른 어디서도 좋은 코울슬로를 맛봤던 적이 없어 혹시나 좋을까 기댈하며 코울슬로로 부탁드림.음료는 혹시나 내가 좋아하는 닥터페퍼가 있을까 했는데 그렇진 않아서 무난한 코카콜라로 부탁드림.가게는 지난번 이 동네의 또 다른 수제버거집인 버거브라더뫄 비슷하게 깨끗하고 트렌디한 느낌으로 꾸며져 있고 벽에 설치된 모니터에선 딱 저렇게만 스매쉬 버거 타입으로 조리되어 나왔으면 좋겠다 싶은 아마도 헤비 트리플 패티와 홈메이드 그리고 칠리 치즈 프라이 사진이 계속 로테이션되며 보여지고 테이블 위에 놓인 빨간색과 노란색의 케첩과 머스터드 바틀은 내가 좋아했던 지금은 노스트레스버거로 바뀐 해방촌 슈퍼마켓화이트버거스탠드에서 봤던 것과 같음.콜라를 마시면서 기다리댜 보니 드디어 헤비 싱글 패티와 코울슬로가 준비됐다고 하셔서 받아서 플라스틱 포크 등이 준비된 카운터에서 포크와 냅킨 등을 챙겨 자리로 돌아옴.헤비 싱글 패티는 종이 래퍼에 싸여 종이 케이스에 들어가 있어 이태원 빌리언박스의 슬라이더가 생각남.먼저 코울슬로를 살펴보니 세트 메뉴에 들어있어선지 일단 사이즈가 기대보단 아담한 느낌이고 비주얼은 후추도 보이고 혹시나 괜찮은 건가 싶은데 포크로 떠서 한 입 맛을 보니 음 함.코울슬로라고 어떤 특정한 맛이어야 하는 건 아니지만 아무튼 흔히 생각하는 코울슬로의 맛을 재현하려는 느낌이었는데 아삭함까진 나름 좋았지만 맛이 비교적 밋밋해서 좀 아쉽게 느껴지고 밋밋함은 그렇다치더라도 맛이라도 뭔가 이 가게만의 오리지널 느낌인 게 아닌 그냥 흔한 카피캣의 느낌이어서 인상적이진 않음.이번엔 헤비 싱글 패티로 눈을 돌려 보니 최근 홍대에서 들렀던 올드루키스버거의 것처럼 들고 먹기에 적당한 사이즈면서 자가제조하셨다는 피클도 제법 두껍게 썰려 들어가 있고 소스는 파프리카 가루가 들어갔는지 빨간 점들도 얼핏 얼핏 보이고 패티는 모니터에서처럼 스매쉬 버거의 느낌으로 끝부분이 크리스피하게 구워진 정도까진 아니지만 전체적으로 좋아보임.어떤 맛일까 두근대며 한 입 베어무니 패티는 쥬시하면서 잡내 1도 없어 나름 좋은 고기를 쓰는구나 알 수 있고 소스는 소위 tangy해서 가끔씩 수제버거 가게들에서 볼 수 있는 밋밋함이 1도 없고 번도 패티와 따로 놀지 않고 일체감이 좋은데 다만 수제 피클은 식감이나 맛이 우리나라사람의 입맛에 맞춘 듯 마일드한 느낌이지만 전체적으론 밸런스가 좋아 지난번 버거브라더가 응원의 느낌으로 맛있다라면 여긴 좀 더 내 타입의 버거여서 좋아 맛있다의 느낌임.햄버거의 종이 래퍼에 묻은 소스나 패티 조각도 포크로 긁어서 깨끗이 먹고 분리수거 후 가겔 나옴.전체적으로 야구소년님의 리뷰에서 보고 궁금해 들러봤는데 코울슬로는 맛이 없거나 한 건 아니었지만 살짝 어설픈 카피캣 느낌이어서 좀 아쉬웠는데 햄버거가 나름 좋아 이 동네에서 햄버거가 먹고 싶으면 또 생각날 것 같은 방문이었음.가겔 나오니 강북종합시장이라고 보여 들르고 싶었지만 다른 가겔 들를 계획이어서 패스함.,맛있다
1319,헤비앤라이트,야구소년,"여지껏 강북, 도봉, 노원구에서 맛 본 수제버거 중 1등을 꼽으라면 헤비앤라이트다. 가격도 괴물인데 맛도 괴물이다. 특히 패티의 퀄리티, 번과 함께 으스러지는 조화도 서울 왠만한 수제버거 이상이였다.헤비는 더블패티로 해서 다른 풍미가 옅게 느껴졌지만. 홈메이드는 완벽했다. 타코집에서 만나 볼법한 멕시칸 풍의 칠리 치즈 프라이즈도 별미. 이제 버거킹 행사해도 안갈 예정이다.",맛있다
1320,호감,야구소년,맥주한잔 즐기기 좋은 스몰비어. 감튀는 언제나 옳듯 호감의 감튀도 그렇다. 분위기도 괜찮고. 안주들도 적은 양을 저렴히 판다. 2차로 찾기 매우 적절했다.,괜찮다
1321,호감,dally116,말 그대로 동네술집 호감. 방학역 근처에 있어요. 정직하고 깔끔한 감자튀김은 늘 매력적. 치킨가라아게 새우튀김 등등 튀김류는 거의 다 기본 이상. 그 외에도 스몰 핑거푸드가 다양해서 부담없이 여러가지를 마구 시켜먹기 좋아요. 자그마한 규모치고 술 종류 특히 맥주 다양하고 칵테일도 맛있어요!!,맛있다
1322,백란,야구소년,"요근래 우이동에 새로 생긴 카페들 중 백란은 유일하게 애견 동반이 가능한 카페다. (산아래, 릴렉스는 애견 출입 불가) 그리고 다른 카페들 보다 좀 더 깊숙한 곳에 있어서 그런지 사람도 많지 않은 편. 케이크와 빵, 음료도 맛있어서 당 충전도 문제없다. 횟수로 치면 가장 자주간 우이동 카페 인 것 같다.",맛있다
1323,백란,야구소년,"크로플의 산아래, 쉼의 릴렉스. 그리고 베이커리의 백란. 근처 두 곳의 만족스런 카페를 먼저 다녀왔음에도. 오늘 백란도 너무 만족스러웠다. 케이크와 음료도 맛있고. 프라이빗한 시간을 즐길수 있게. 공간을 다양하게 활용한 좌석도 인상적이다.딴 건 몰라도 3명 이상의 자리라면 세 카페 중에선 제일 나을 듯. 유일한 단점은 좌석에 비해 주차장이 작다는 정도? 공원만큼 넓어서 강아지 데리고 카페 한바퀴 산책했다.",맛있다
1324,백란,빵수니,"북한산 밑에 새로 생긴 카페 계곡 자리도 있고 아주 넓었어요. 디저트류도 많고, 음료도 생각보다 맛있었어요! (아몬드라떼 추천)",맛있다
1325,잔디불,야구소년,"엘비스의 로큰롤 멜로디와 쎄시봉의 포크송이 흘러나오는 올드 감성 호프집. 돈까스 맛집이라는 소리에 반신반의 하며 입장했는데. 빈자리가 없을 정도로 빼곡. 생선까스도 맛있다는 리뷰가 많아. 돈까스, 함박, 생선까스가 함께 등장하는 정식으로 주문하려 했지만. 여자친구가 자기는 생선까스를 절대 안먹을꺼라고 엄포를 놓는 바람에. 그냥 돈까스와 오징어덮밥을 주문했다.아까 정식은 3가지 종류로 나온다면. 돈까스는 돈까스 2조각이 나온다. 사진으로 볼땐 살짝 인스턴트처럼 보이는데. 막상 먹어보면. 직접 두드려 얇게 핀 듯 아주 부드러운 돈까스였다. 왜 맛집 소리가 나왔는지 알 것 같았다. 하지만 성인 남자가 이것만 먹었다면 굉장히 허기질 듯. 둘이 와서 오징어덮밥도 함께 주문해야 비로서 완벽한 잔디불을 만날 수 있다.오징어덮밥 맛집으로 알려졌어도 전혀 위화감 없을만큼. 돈까스 이상 맛있는 오징어덮밥. 빨간양념도 자극적이지 않고 깔끔한데다. 양파보다 오징어가 더 많은 덮밥을 만난 것도 참 오랜만이다. 방금의 허기짐을 완벽히 채울 뿐더러. 돈까스만 먹었다면 심심하다 싶을 포인트들도 꽉 채워준 음식. 나에게 잔디불의 원픽은 단연 오덮이었다.우리 자리만 그런지 몰라도. 테이블이 평균보다 낮은 편이라 자리가 조금 불편한건만 단점. 그래도 정감가고 맛있는 경양식 돈까스를 오랜만에 만난 기분이 크다. 아직 보지도 않은 영화. 엘비스 시사회를 보고 온 것만 같은 그런 맛과 감성을 느낀 호프집이었다.",맛있다
1326,맘스터치,핑크구아바,맘스터치 해상운송 불안정으로 인해 감자튀김 제공불가....치즈스티과 할라피뇨너겟도 나쁘지 않지만 감자튀김을 메인으로 먹으러 간건데ㅠㅠ내년에 다시 갔을때 꼭 있길!,맛있다
1327,맘스터치,핑크구아바,맘스터치 케이준후라이와 화이트갈릭버거는 주기적으로 먹게 되는 것 같아요항상 맛있어요,맛있다
1328,맘스터치,핑크구아바,맘스터치 화이트갈릭버거는 항상 최곱니다,맛있다
1329,맘스터치,핑크구아바,치킨패티도 작아졌고 경영진 바뀐 이후로 예전의 명성엔 여전히 못미치지만 그래도 종종 가게 되네요,맛있다
1330,맘스터치,핑크구아바,화이트갈릭버거를 젤 좋아하는데예전에 비해서 치킨패티의 크기가 좀 줄어든것 같아요,괜찮다
1331,맘스터치,dally116,인크레더블버거에 꽂혀서 맘스터치 자주 가네요. 언빌리버블 버거도 핫하길래 같이 시켜봤어요. • 치킨 부위가 달라요. 인크레더블은 쫄깃 다리살 언빌리버블은 퍽퍽살 부위. 개인적으로 퍽퍽살 빠라서 언빌리버블이 더 맛있는 것 같아요~ •나머지 소스 양상추 피클 계란프라이 다 같아요맘스터치는 화이트갈릭휠레버거가 원픽이었는데 이제는 바뀌었네요. 양도 푸짐하고 맛도 최고!!!!!,맛있다
1332,맘스터치,핑크구아바,"애정하는 맘스터치 화이트갈릭버거부드러운 소스와 치킨패티,  느끼함을 잡아주는 양파와 피클까지 아주 조화로워요ㅎㅎ오늘은 찜햇닭 강정 싱글까지 주문해서 먹부림 부리다왔어요처음 먹어보는 찜햇닭 강정은 짭짤하면서도 살짝 매콤한 간장양념에 버무려져 누룽지를 얹어서 나오는데 많이 먹으면 물리는 맛이라 맛보는정도가 딱 적당한것 같아요조금 아쉬운점은 강정 찍어먹는 포크가 삼지창 포크가 아니라서 누룽지 집어먹기가 어려웠다는점ㅠㅠ그래서 포크로 감자튀김 찍어서 누룽지 건져먹었네요ㅎㅎ주문즉시 조리되서 항상 따뜻하고 창동점은 쾌적해서 좋아요",맛있다
1333,블루밍,망고,라쟈냐 맛있어용용용,맛있다
1334,블루밍,fallinautumn,다 브레이크 타임에 걸려서 찾아서 들어갔는데 생각보다 맛있었다! 수플레팬케이크와 아라비아따를 먹었는데 다른 메뉴도 맛있을 거 같아서 다시 한 번 꼭 가볼 예정!☺️,맛있다
1335,블루밍,dally116,"가고싶다 도장깨기. 쌍문역 안쪽 주택가에 자리잡은 블루밍. 수플레팬케이크가 유명하길래 방문해 봄. 식사로 시킨 에그인헬, 버섯베이컨까르보나라. 에그인헬에 바게뜨는 추가주문. 후식으로 팬케이크와 커피 주문. *에그인헬- 계란이 너무 퍽퍽하게 익어서 아쉬웠지만 혜자스런 치즈와 미트소스가 괜찮았다. 예상보다 많이 매워서 크림파스타나 오일파스타외 같이 먹는 걸 추천. *까르보나라- 큰 특색이 없었던 무난한 맛. 소스가 넉넉해서 에그인헬 먹다가 매우면 입 안 불끄기 좋음. 스파게티면은 딱 좋게 삶아져서 잘 먹음.*수플레팬케이크- 제일 맛있었다. 손으로 머랭을 치댄듯한 부드러움이 최고 압권. 폭신하구 부드러워서 웃음이 절로 나는 맛. 크림이나 시럽을 안 곁들여도 맛있어서 그냥 먹었을 정도~식사가 빼어나게 맛있거나 좋진 않았지만 팬케이크는 정말 맛있게 먹어서 종종 생각날 것 같다. 그래서 맛있다로. 총평: 수플레팬케이크 맛집. 식사메뉴는 괜찮다쯤.",맛있다
1336,블루밍,푸린,칵테일이랑 수플레팬케이크 괜찮은데?재방문의사 매우 있음칵테일 별 기대 안하고 먹었는데상당히 맛있었다수플레케이크도 맛있고...칵테일 마시러 또 가고 싶다가볍게 먹기에 괜찮은 곳,맛있다
1337,버거파크,규릐,수유에 위치한 버거 가게!혜화에 있는 가게와 마찬가지로 버거가 훌륭하다!방문할 때마다 대부분 더블 치즈 버거 세트에서 감자튀김을 치즈스틱으로 바꾸고 주문하는데 이 조합은 훌륭하다!뭐 하나 빠짐없는 버거 맛집이라고 생각한다!,맛있다
1338,버거파크,ㅇㅇ,생긴지 얼마 안된 매장이라 쾌적하고 깔끔하다 사장님도 친절하시고 무엇보다 버거가 조오오온맛탱이다ㅋㅋㅋㅋㅋ,맛있다
1339,버거파크,야구소년,서울 동북부를 대표하는 수제버거 버거파크. 그간 꽤 외도를 했는데도 너무 맛있다. 다만 1층 자리 잘못 앉으면 병원 뷰가 한번에. 햄버거 먹으면서 앰뷸런스가 오고가는 모습을 보고 있으니 뭔가 아이러니 했다.,맛있다
1340,버거파크,정민,"여윽시 버거파크 따봉이다.버거파크가 수유역에 생기다니, 득템하는 기분.내가 좋아하는 아보카도 햄버거를 먹었다.물론 혜화점에 비하면 뭔가 살~짝 2% 정도 다른? 아쉬운? 느낌이 없지않아 있지만 그래도 수유역에서 이제 수제햄버거는 버거파크가 1위일 것 같다.패티의 고기씹는 즐거움과 토마토의 싱싱하고 두꺼움!깨가 듬뿍 박힌 번과 치즈, 양파! 부드러운 아보카도.감자튀김도 완전 바삭한 겉의 식감이 올드스쿨같은 느낌이 들면서 맛도 좋고 즐거웠다.명불허전!",맛있다
