,가게이름,리뷰아이디,리뷰,맛평가
429,맥켄치킨,야구소년,내 동년배들 사이 치맥 하면. 노원역은 (지금은 사라진) 압력구이로 유명한 월드호프였고. 창동역은 2번출구 구석에 위치한 맥켄치킨이였다.넓은 홀 겸비한 프랜차이즈 닭집들이 많이 생겨났지만서도. 빠삭하고 짭쪼름한 맥켄 특유의 후라이드는 흉내내기 어려운 맛. 특히 창동점에만 볼 수 있는 알싸한 마늘 소스는 특 별미. 여기에 술 맛 돋우는 코리아 올드펍 분위기까지 겸비했으니. 얼굴 시뻘게진 채 집에 가지 않으면 유죄.,맛있다
430,삼청동샤브,야구소년,방학동 신상 모비우스 스퀘어에 생긴 샤브샤브집. 체인점이라 그런지 그야말로 가족 외식의 정석. 가격 부담없는데다 깔끔 푸짐 친절의 완벽한 3박자를 갖췄다. 아마 여기에 생기는 다른 식당들 중 가족단위 손님들한테는 가장 인기가 많을 식당 같다.,맛있다
431,한우고기농장,유에난,갈비찜 소자 먹었는데 3명이서 배터지게 잘 먹었어요! 매운거 잘 먹는편인대도 끝에는 좀 매웠어서 잘 못드시면 간 조절하시는게 좋아요! 무생채 지인짜 존맛 무생채 지이이인짜ㅏㅏㅏ 맛있어요,맛있다
432,한우고기농장,soulage007,한두 투뿔 살치살소고기 예술입니다이집 괜찮네!,맛있다
433,한우고기농장,멍,생삼겹살하고 총각김치볶음밥  맛있어요^^막걸리 새로나온거 너무 맛있어요~~,맛있다
434,한우고기농장,soulage007,골뱅이 면이 특이함,맛있다
435,한우고기농장,soulage007,산에갔다오늘길에 막걸리에 골뱅이,맛있다
436,한우고기농장,soulage007,매콤명태조림하고 갑오징어 숙회 맛있어요,맛있다
437,대찬식당,Ming♪,입담 좋은 사장님과 함께 술을 마실 수 있는(?) 숨겨진 맛집! 저렴한 가격에 대창 곱창 삼겹살 등 고기를 맛볼 수 있고 사장님과 함께 술을 하게 된다면 무심한듯 나오는 안주 서비스들이 있다,맛있다
438,대찬식당,GraceP92,사장님께서 음식을 정말 정성으로 해주세요. 회사 근처라 종종 가는데 갈때마다 매번 색다른 서비스에 양도 정말 푸짐하게 주십니다.,맛있다
439,대찬식당,Soo,허영만 선생님의 식객에 소개된 식당으로 사장님이 정말 친절하시고 좋다. 회사 근처라 가끔 점심으로 제육짜글이를 먹으러 가곤 하는데 정말 맛있다! 먹다가 스파게티면과 치즈로 파스타식으로 마무리하는데 조합이 정말 괜찮다.  점심이 괜찮아서 저녁에 회사 회식장소로 정해버린 곳!,맛있다
440,족발야시장,임여사,코로나로 인해 안나가고 시켜먹었어요 그리하여 배달음식을 올립니다^^;;족발껍질은 쫀딕이 아니고 흐믈이^^개인적으로 쫄깃식감을 좋아하여~저는 냉장고에 숙성을~ㅎㅎ차게식혀먹는것도 은근 꿀맛입니다이집은 족발보다 왠지 쟁반국수가 더 맛있느거 같군요 새콤달콤해서 너무 맛있게 잘 먹었어요~코로나로 힘들지만 다들 화이팅!!,맛있다
441,족발야시장,핑키뚱,"점심시간에 병원 가려고 수유로 가야해서 구청 동생한테 근처 맛집좀 알려달라고 함동생이 여러군데 알려줬는데 그중 여기를 강력 추천해서 족발야시장에 방문!혼자 갔는데도 친절하게 안내해주심. 보쌈세트(점심특선) 1인시켰는데 밥도 잘나오고 보쌈도 꽤 많이나옴! 가격은 무려 7,000원 워메~~~~~~ 또 가고싶다",맛있다
442,돝제주흑돼지,pigizm,"동네 삼겹살집 같은데 내공이 있는 집.오겹살은 정말 먹어본 역대급으로 쫄깃했고,목살은 엄청 부드럽고,껍데기는 고소함 끝판왕-웨이팅도 거의 없는지라 맛있는 돼지가 먹고 싶을 때훌륭한 선택지가 될만한 곳이다",맛있다
443,돝제주흑돼지,갈색곰도리,유튜버의 추천으로 방문하게 된 곳! 엄청 번화가도 아닌데 저녁시간에 테이블이 거의 꽉 찰 정도로 나름 입소문이 난 집인 것 같다. 오겹살(17000) 2인분 주문하고 사이드로는 계란찜(4000)이랑 물냉면(6000) 주문! 된장찌개 서비스로 나오는데 매콤하니 맛있었다.고기는 진짜 근래 먹은 고기 중 가장 맛있었다. 쫄깃하고 육즙도 가득 머금고 있어서 쌈을 싸먹어도 명이나물과 먹어도 소금이나 멜젓만 찍어먹어도 존맛...결국 1인분 더 주문해서 먹었다.서비스로 껍데기를 주시는데 두께가 엄청나게 두꺼워서 껍데기가 맞나 싶을 정도였다. 근데 웬 걸...바삭하고 쫄깃해서 존맛 그 자체 ㅠㅠㅠ 콩가루도 진하고 맛있었다사이드로 시킨 계란찜도 사장님께서 전자레인지로 조리한 게 아니라 증기로 조리한다고 하셨는데 너무너무 맛있었다 냉면도 고기 싸먹으니 존맛이고...아니 이 집 도대체 맛없는 게 뭐야...?,맛있다
444,돝제주흑돼지,@tonyparkofficial,강북구 미아동의 돼지고기 맛집1인분 기준이 200g인데 가격이 참 착하다. 난 오겹살과 목살을 먹었다. 점원이 직접 큼지막하게 잘라서 숯에 구워준다. 다만 오겹살은 오래 구우니까 껍질 부분이 좀 딱딱해져서 맛은 있었는데 좀 아쉬웠고 목살은 정말 맛있었다. 육즙이 팡팡 터졌음. 그리고 반찬이 많이 나오는 것도 이 집의 장점. 파절이가특히 맛있었음 파절이 맛집임.,괜찮다
445,뽀빠이족발,새벽,아주 맛있다,맛있다
446,뽀빠이족발,야구소년,"수유/도봉/강북에서 먹어본 족발집들 고민없이 첫번째로 꼽을 수 있는 족발집. 여기 맛볼 수 있는 레벨이 S급이라고 하던데. 소문대로 또 명성대로. 오후 6시28분 정확히 3번 통화 시도 끝에 간신히 통화했으며. (당시 앞다리는 매진. 뒷다리만 판매) 정확히 오후 7시 7분에 품절 메세지가 떳다. 아마 그날, 나는 뒤에서 다섯번째 안에 드는 손님이였다. 정말 운이 좋았다. 뽀빠이족발의 위대함을 몸소체험하며. 더 큰 기대치가 쌓였지만. 이 맛은 나를 배신하지 않는 완벽한 맛이였다. 고기 자체로 원체 맛있어. 새우젓과 쌈장을 절로 치워버렸다. 껍질만 먹어도. 고기만 먹어도. 뼈를 들고 뜯어먹어도. 어떻게 먹든 흠이 없다. 고기 위 찐득히 묻은 돼지기름조차 맛있다. 포장할때. 투명한 유리창 사이로 작은 테이블들을 꽉 채운 사람들은. 그 날 선택받은 사람들이구나 라는 생각이 들었다. 내가 좋아하는 갓 담근 배추김치가 없어도. 새콤달콤한 막국수가 없어도. 족발 맛 외엔 아무것도 눈에 들어오지 않는다. 다음엔 더 부지런하게 행동해서 앞다리를 먹어볼테닷.",맛있다
447,뽀빠이족발,코리 ,"My friends aunt owns this small restaurant....maybe I’m biased, but I love this jokbal! My friends and I all agree that this is one of the best jokbal restaurants around. If you are in the area give it a try, but come early because they sell out fast!",맛있다
448,순돌이네연탄집,식객,생각이상으로 별로였다. 고추장삼겹살을 먹었는대 이건... 초벌이되어나와 편리하기만 하고 맛이나 고기질은 정말 별로였다.,별로
449,동네식당,글쟁이,"쌍리단길에 자리한 낙곱새와 대창덮밥이 있는 작은 식당낙지와 새우, 대창을 함께 넣고 매콤달콤한 양념에 끓여 먹는 낙곱새탱글한 새우와 쫄깃한 낙지, 큼직한 대창까지원 재료를 워낙 상태 좋은걸 쓰다보니 맛이 좋고간도 너무 자극적이지 않게 적당히 잘 맞췄다대창덮밥도 잡내없이 불향나게 구워낸 대창을계란노른자에 찍어 양파와 함께 먹는데고소하니 맛이 좋음 ㅎ후리가케 뿌려 비벼먹는 밥은 덤마지막으로는 적당히 졸아들은 양념에김가루 뿌려 비벼먹는 밥까지 ㅎ오픈한지 얼마 안되어 작지만 깔끔한 매장에도란도란 수다떨며 먹기 딱 좋은 곳",맛있다
450,바우네곱창,푸딘싸,김혜자 곱창전골이다. 양은 혜자스럽고 국물은 그래 이맛이야. 이다. 새로운 막걸리 충전소다. 소주파. 맥주파는 모르겠지만. 소수인 막걸리파의 선택은 제약이 많다. 막걸리를 아무 곳에서 채울 수 없다. 막걸리 한 통은 거뜬히 끝낼 수 있는. 곱창전골이다.매일 마장동에서 받는 신선한 곱창이다. 돼지 곱창 특유의 냄새도 잘 잡았다. 이래도 되나 싶을 정도로 양이 많다. 이 정도 곱창을 씹으면 턱이 아플만한데. 곱창 자체가 부드러워 술술 넘어간다.곱창은 미리 삶아 나와 국물이 끓으면 바로 먹으면 된다. 처음에 깻잎이 전골을 덮듯이 나온다. 잡내 없이 칼칼하고 시원한 국물을 깻잎 향으로 한 번 더 샤워를 시킨다. 밥을 같이 못 먹은 게 아쉬운 국물이다. 내 위는 왜 우주가 아닌가. 원망스럽다.맛만큼 모두 친절하시다. 손님들 부담 없게 조용히 테이블을 살펴보시는 게 느껴진다. 혼자 먹기에 양이 많으니 남으면 포장해 주시겠다는 사장님 말씀도 다정하다. 그런데 다 건져 먹었다. 또 일 킬로 쪘다. #곱창전골 (소) 19000원 #장수막걸리 4000원 #인스타그램 푸딘싸 @foodinssa,맛있다
451,제주왕돌판구이,임여사,점심특선 뷔페식전라도 특유의 맛 반찬들이 양은 냄비에~덜어서 먹으라는 어명이오~~~ㅋㅋㅋㅋ반찬은 조금씩 맛본다고 가져오긴 했는데..제가 늦게 간건지..반찬 남은게 별로 없어 보였구영찌게는 넘나 맛있었지만 고기강 잡내가 났어영..ㅜㅜ이집은 구이가전문인데..저는 뷔페식이라는..걸 보고 들어감 일단 뷔페식은 맞는데..^^ ㅎㅎ찬도 여러가지 이긴 한데 저의 생각과는 다르게 많은 종류가 없었어영..그래도 단촐하니~딱 정량~먹을만큼 소량씩 내놓으시는거 같아영맛은 전라도 특유 그맛이 맞군요~친정어무니가 전라도 분이라 제가 전라도음식을먹으며 자라왔는데..역시~어무니맛 ~ 잘 먹었습니다찌게양은 엄청많아서 2분이 드셔도 될듯한 양~다음번엔 구이 먹어보러 올게요~,맛있다
452,땅스부대찌개,임여사,음식 맛은 약간 로제떡볶이 양념맛 같아영참고로 개인적으론 로제맛을 겁나게 싫어하는스타일 이지만~ 완전 강한 로제 맛이 아니라서 어묵을 집중 공략하여 먹었어영~^^땅스 부대찌게 즐겨 먹는데 떡볶이도? 부대찌게에 들어갔던 비슷한 사리들~너무 낯이 익어서 ㅎㅎㅎ담번에는 부대찌게에 떡사리 추가해서먹는게 ~제 입장에선 디게디게 맛있게 먹을듯 합니당부대찌게 육수가 맛있거든요약간 로제맛 좋아 하시는 분 이시라면 이거 추천 드려영~^^배달 포장~맛 !!양~ 신선도~편리성~모든게 좋았습니다^^비조리로 주문 배달 했어영~가격은몽땅떡볶이 3인분 18900원!!알차게 먹었네용~^^,맛있다
453,황금코다리,꼭행복해야돼,코다리&시래기 조림. 보통맛으로 시켰는데 매운맛으로 해도 맛있을것 같음. 코다리 살이 엄청나게 많아서 밥을 먹지 않아도 배가 부를수 있을 정도임. 양념도 짜지 않고 안에 떡이랑 시래기도 있어서 조합이 너무 괜찮았음. 옆에 카페가 있다고 했는데ㅋㅋㅋㅋㅋ 그냥 자판기 커피같은 거였음. ㅠ 게다가 맛도 진하지 않았음. 코다리만 먹으러 와야할듯. 옆쪽에 아이들이 놀수 있는 공간이 있어서 아이들도 꽤많이 보였고. 음식도 꽤 깔끔해서 어른들이 좋아하실만한 곳. 막걸리 무제한이라 대낮부터 취해있는 사람들도 있어서 그건 너무 보기 안좋았음.,맛있다
454,황금코다리,ㅂㅅㅎ,"코다리찜이라는게 급식실에서 어떤 음모에 의해 탄생한 불경한 음식 쯤으로 믿고있던 제게는 혁신이었던 곳. 질기고 차갑지 않은 코다리란 이토록 멋진 음식이었습니다. 집 바로 근처라 종종 포장해와서 반찬으로 먹기도 합니다만, 가게에서 먹으면 콩나물과 샐러드, 연두부 등 꽤 충실한 반찬이 무한리필이라 가서 먹는게 더 행복! 여긴 마을버스로 접근 가능한 범위라면 한번쯤 일부러 와보심직 합니다. 오래 영업해주세요!",맛있다
455,한일산장,뇽뇽,"우이동 계곡에 위치한 한일산장!백숙 맛집을 찾다가 우연히 방문하게 되었어요.일단 요런 곳은 처음 방문해 봤는데 가게 안에계곡이 있어서 진짜 신기했어요. 완전 신세계!하지만 물이 더러워서 들어가진 않았어용,,,ㅎㅎ우리는 토종닭백숙을 주문했는데 백숙과 함께나오는 반찬이 생각보다 푸짐해서 좋았어요.닭백숙도 그냥 평범! 먹을만 했어요.친구들이 사진보고 닭이 넘 말랐다고 웃었는데먹을 땐 몰랐는데 사진으로 보니 마르긴 했네용ㅋㅋ이날 넘 더워서,, 선풍기만으로는 넘 힘들었지만요런 곳은 처음이였기에 신기하고 재미있었어요:-)",괜찮다
456,한일산장,맛따라란,계곡물에 발정도 담가볼 수 있는 곳~주차장도 넓고 자리도 많고 화장실도 나름 깨끗해서 좋았다.닭백숙 고기가 연하고 밑반찬이 종류도 많은데 너무 맛있어서 또 리필했다.,맛있다
457,고기포차서민상회,singsing:p,여기오면 항상 주문하는 갈치(갈비살+살치살)! 사장님만의 고기숙성에 비법이 있는건지.... 고기살이 두 부위 모두 쫄~~깃하고 탱탱하니 너무 맛있어요!! 어떻게보면 회를 먹는 질감 같기도 하고요 ㅎㅎㅎ 가성비도 좋고 강추입니당!!,맛있다
458,고기포차서민상회,우이리,"돼지와 곱창 위주의 식당들이 많은 미사에 보석 같은 소갈비살과 살치살 파는 집이네요.2년쯤 되셨다는데 젊은 손님이 많은 여기 상권에서는 비싸게 느껴질수도 있지만, 미국산 갈비살에 이 가격이라면 경쟁력이 있다고 생각됩니다.",맛있다
459,왕땅떡갈비,임여사,아따 이집 모르면 섭해용~얼마나 맛있는지~ㅎㅎㅎ직접 드셔보시면 제가 왜이러는지 아실꺼예요양념 ~맛 ~사이즈 씹는식감~자태!!이얼마나 아름다운~떡갈비인고?입속에 한가득~어~쫀득한 느낌도 들다가 양념맛이 훅 ~향과 같이 자극을먹고있는대 젓가락이 또 가있어!!잠깐만 그거 나 먹으껀대~나 아직 밥 남았는데눈을 크게 뜨면서 ~압박을~ㅋㅋㅋ미안 나는 맛있는거 양보하기 싫어 ~근대 이거 크니까 반반 나눠 묵장 ㅎㅎ밥 세그릇 기본 묵게되는 이 떡갈비~대박 맛있쥬~따따봉~담부턴 두팩씩 사와야겠어영 ㅎㅎ집근처에 이렇게 맛있는집이 있어 행복해~신창시장안에 있어용 ㅎ,맛있다
460,왕땅떡갈비,임여사,"#창동맛집#왕땅떡갈비신창시장에 있는 맛집이쪽에 사시는 분이시라면한번은 사 드셨으리라~떡갈비가 예술이지 암요~수제입니다 양도 많고 맛도 조하^^이집 족발도 유명하고신창시장에 이집 그냥 지나치면 섭해용^^맛집으로 유명합니다~매콤미니족발사가는 분도 디게많아요 껍데기 였던가?여튼 이집 맛있게 잘맹글어~ㅎㅎ#위드인기맛집#""찐""맛집",맛있다
461,무안왕족발,야구소년,수유 시장 족발집. 수유시장 족발집 2곳에서 먹어봤는데. 둘 다 비슷하다. 맛있는 족발이라 보긴 어렵고 그냥 족발이다. 그래도 가야되는 이유를 찾아보자면. 2만원2천원으로 배터지게 족발을 먹을 수 있다는 정도.,괜찮다
462,오봉집,쿠리뷰,"가게이름 : #오봉집 미아점⠀위치 : 서울 강북구 솔매로46길 6(4호선 미아역 6번출구)⠀메뉴/가격 : 오봉스페셜 45000원⠀평가 : 9점 / 10점세상 푸짐한 한식 한 상 차림이 나오는 곳 오봉집 미아점을 다녀왔습니다! 요즘 수유, 미아쪽 올 일이 많은데 오봉집에도 들리게 되었네요⠀오봉집은 협찬으로도, 내돈내산으로도 꽤나 여러번 방문을 했던 브랜드인데 갈때마다 먹었던 메뉴들이 다 만족했는데 수유점에서 먹은 오봉스페셜도 역시나!⠀직화낙지볶음과 가브리살 보쌈, 막국수가 메인으로 나오고 오봉집 특유의 밑반찬 세팅이 어우러진 오봉스페셜은 한눈에 봐도 세상 푸짐해서 사진찍을 맛도 나고 좋아요ㅎㅎ⠀불맛이 진하게 느껴지는 매콤한 직화낙지볶음을 흰 밥에 가득 담고 참기름을 살짝 둘러주면 세상 맛있는 낙지덮밥이 만들어집니다⠀통통한 낙지와 매콤한 양념의 조합이라 맛없없이면서 입맛을 확 살려주는 메뉴죠⠀낙지볶음만 먹으면 살짝 허전할 수 있는데 이때 필요한게 바로 가브리살 보쌈! 세상 부드럽고 쫀득한 가브리살 부위를 깔끔하게 잘 삶아낸 보쌈인데 살살 녹는 식감이 기가 막힙니다⠀삼겹이나 목살로 만든 보쌈과는 한 단계 다른 클라쓰의 부드러움을 가진 가브리살 보쌈과 시원한 보쌈김치 조합 넘나 좋죠⠀보쌈을 먹게되면 또 생각나는게 막국수죠?! 오봉스페셜은 이렇게 스토리텔링이 있는 메뉴구성입니다(??)ㅋㅋㅋ⠀푸짐한 채소와 충분한 소스로 비벼서 호로록 먹는 상큼한 막국수는 호불호가 없지요⠀직화낙지볶음과 가브리살 수육, 막국수에다가 큰 쟁반을 꽉 채우는 탄탄한 밑반찬 조합까지 식사와 안주 둘 다 완벽하게 커버할 수 있는 맛있는 메뉴 조합입니다..사진에서 볼 수 있듯 양이 어마어마해서 웬만큼 잘 드시는 분이 아니시면 최소 3인 이상일 때 주문하셔야 합니닼ㅋㅋㅋ ⠀공기밥도 추가해서 낙지덮밥과 수육정식으로 먹거나 술안주로 먹게되면 (코로나 시국 아닐 때) 4인분 이상의 양입니다..!!⠀여러 메뉴들이 같이 나온다고해서 대충 나오는게 아니라 부족함 없이 각각의 맛을 제대로 살려주는 곳이라 아주 마음에 드네요",맛있다
463,아씨네족발,박남호,동네에없는 화덕족발이라 신선했고 족발냄새도 안났어요!다들 친절하시기도하구요.식감이 아주 좋습니다!또 방문할게영,맛있다
464,푸라닭,핑크구아바,처음 먹어보게 된 푸라닭이예요두마리 주문한거에 비해 엄청 큰 까만 부직포 가방에 넣어주셔서 깜짝 놀랐어요한번 오븐에 굽고 다시 튀겨내는 방식이라고 하는데 껍질이 바삭하고 오븐에서 기름이 많이 빠져 평소 먹던 치킨보다 느끼함이 덜하더라구요후라이드 주문하니까 고추마요소스랑 양념소스를 주셔서 이맛저맛 다 맛볼 수있어서 좋아요생각보다 고추마요는 매워요블랙알리오는 간장베이스의 치킨인데 이제 교촌은 생각이 안날것 같아요닭자체도 크기도 더 크고 좋은 닭인 것 같다는 생각이 들었어요블랙치즈볼도 맛있었구요바삭한것도 좋지만 오븐구이 치킨도 좋아하는데 두가지를 절충한 치킨인것 같아 맘에 쏙드네요ㅎㅎ,괜찮다
465,참숯돌판삼겹살,리끼,맛) 삽겹+참기름+고추+양파+상추 조합 최고분위기) 동네 맛집 스멜가격) 완전 혜자위치) 미아동재방문) 거의 매주 가는 곳,맛있다
466,청화가든,써니♡,인수재 대체제로 왔다가 반했네요위의 한 줄 평이 어색한 광고 문구같이 느껴지긴 한다. 그래도 진짜 너무 맛있게 먹은 갈매기살 집이다.북한산에 놀러 왔다 인수재가 유명해서 도전하려고 했으나 실패하였다. 후기 등을 보니 위생 이야기도 있고 해서 쿨하게 찾아서 간 곳이 이 곳이었다.간단하게 주차할 곳도 있고 의외로 술을 드시려고 해서인지 택시나 걸어오시는 분들도 많았다.통갈매기살을 주문했는데 한 덩어리씩 나눠서 구워야 타지 않고 맛나게 먹을 수 있다. 고기도 통통하게 실하고 반찬 중에 파김치 너무 맛있어서 계속 리필해서 먹었다.고기가 메인일 것이라고 생각했는데 국밥을 드시는 어르신들도 많았다. 노포 느낌에 최근에 보기 힘든 실한 고기까지~ 만족한 식사였다!,맛있다
467,청화가든,따따따따,"수유동 북한산 아래에 있는 고깃집입니다.인터넷에서 보니 인수재 웨이팅때문에 실패하고 대체로 많이 가시는 것 같더라고요. 저희는 차를 가지고 가서 애초에 인수재는 생각이 없었고, 청화가든으로 갔어요.갈매기살이 정말 괜찮습니다!!갈매기살을 먹을 때 제가 가장 중요하게 생각하는 부분은 근막 제거 여부입니다. 근막을 제거하면 쫄깃함이 사라지고 육즙도 쉽게 빠져나가 갈매기살 특유의 맛이 사라진다고 생각합니다.이곳은 갈매기살 근막도 제거하지 않고 고기가 통통하니 빛깔도 좋고 정말 질이 좋아보입니다~ 숯불에 구워먹으니 더 맛있고요~여름 저녁에 또 한번 방문해서 갈매기살 먹어야겠습니다~",맛있다
468,원조웰빙용두동쭈꾸미,Ki__,"야외석에서 먹어서 넘 좋았어요~~테이블이 작을만큼 기본 반찬? 들이 많이 나와요!찌개, 계란찜, 천사채 등등!중간맛으로해서 먹었는데도 생각보다 매워요-!그래고 천사채랑 같이 싸먹으면 중화돼서 짱맛있습니다!다 먹고 배불렀는데 볶음밥 너무 맛있어서왕창 먹었어요-!일하시는 분들이 다 관리해주시고 너무 친절하세요~~",맛있다
469,원조웰빙용두동쭈꾸미,준영,낙지랑 쭈꾸미 반반 섞어서 주문했어요. 낙지는 뭔가 질겨서 아쉬웠고 쭈꾸미는 좀 딴딴? 직원분도 안친절하시고 위생도 별로라서ㅜㅜ 주신 접시에 막 뭐 묻어있고.. 또 가진 않을거같아요! 평일 저녁에도 만석이니 참고하시길!,괜찮다
470,겹,한잔해,"수유에 새로생긴 삼겹살 ""겹""먹자골목 안쪽에 위치.외관부터 분위기있는 인테리어로가보고 싶은 생각이 들게하는 곳.1층에는 바탑 형식으로 2인 커플석으로 6자리 정도 있었고2층은 2인 이상 손님들이 모여앉을 수 있는 곳이 마련되어있다.구운 고기지만 냄새도안나고 기름도 튀지않아데이트하기 최적인 곳인듯하다.무엇보다 삼겹살을 구워주시는데,요란하게 고기를 굽는 타 가게들과 다르게정말 조용하고 단아하게 구워주신다ㅎ대화하며 고기한점,  술한점 하기 좋은곳.스페셜 오마카세를 시키면 화요&일품진로+토닉워터 한잔을 주신다.고급스러운 분위기가 돋보이는 삼겹살집이지만가격은 너무 합리적인곳!단품메뉴로 간장계란밥도 맛이 좋았고매운갈비찜은 7천원으로가격구성과 메뉴를 잘 선택해 놓으신것같다.개인적으로 겹마카세의 목살보다는삼겹살이 조금 더 맛있었다.곧 맛집으로 붐빌것같은 곳이다.",맛있다
471,벼락고깃집,mong,"대로변에서 약간 숨은 곳에 있어서 한눈에 가게를 찾기는 어려워요!큰 요양병원 1층에 있고, 앞에 주차장 공간에 테이블 펼쳐서 야장으로 사용하고 있어요 주소대로 가면 바로 앞에서 보입니다 ㅋㅋ주먹고기랑 막창을 같이 먹는 메뉴가 좋아서 가봤어요!!항상 사람들도 많고요 ㅋㅋ가격은 저렴한 편입니다.  고기는 평범하고요, 막창은 약간;;; 기대에 못미쳐요 ㅠ고기를 먹고 약간 실망해서 ㅋ 소고기 갈빗살을 주문해봤는데 ;;;흑 ㅠㅠ 냉동인듯?  ㅠ 가격이 저렴해서 이해는 했지만, 고기류는 패스하고,   껍데기도 주문해보았습니다. ㅋㅋㅋ하나하나 크게 만족하지 못했는데 종류별로 먹어보는건 뭔지 ㅋㅋ껍데기는 평범무난 맛있었어요 껍데기 워낙 좋아해서 껍데기에  관대한 편입니다 ㅋㅋ가운데  찌개 끓여주는거에 라면사리를 무료로 주시는데 ㅋㅋ결국 된장라면이 매우 맘에 들었다는!!주차 안될줄 알았는데 ㅋㅋ주차장한쪽으로 주차도 가능해요!이렇게 밖에서 먹는 분위기가 주는 맛이 있잖아요:)그걸로 이미 합격점이입니다 ㅋㅋㅋ고기맛을 아주 기대하고 가시면 안되고,  저렴한 가격의 평범한 고기랑 된장라면을 밖에서 먹겠다!! 하는 분위기로 가시면 추천해요 ㅎㅎ",괜찮다
472,북새통,장희,3인분이 기본인데 3인분이 소갈비살 3.8 소생갈비/La갈비는 3.9에 판매하는 가성비 좋은 집. 생맥도 한잔 2500.소갈비살 주문. 미국산이고 완전 부드러운건 아니고 근막도 좀 있는 씹는맛이 있는 고기. 2명이 먹기에 괜찮았다.  서비스로 나온 순두부가 의외로 정말 맛있었다. 밥을 부르는 맛.멀리서 오기엔 안좋은 위치지만 가성비 아주 좋고 서비스도 좋은 곳,맛있다
473,BHC치킨,핑크구아바,치킨은 말이 필요없죠,맛있다
