,가게이름,리뷰아이디,리뷰,맛평가
873,하이쿠,혁명적스시,괜찮은 가격대에 퀄리티 좋은 카이센동집!멀리서 와서 찾아올 정도는 아니지면 근처라면 버스나 지하철로 방문할법하다.하이쿠의 독특한 점은 다찌 형식의 테이블인데 오마카세 집에서나 보던 분위기가 나서 고급스럽고 대접 받는 기분이 든다.차완무시(계란찜)-밑반찬과 카이센동이 순서대로 나오며 나름의 코스 형식을 가지고 있다.아쉬웠던 점은 셰프님 두 분 중 한 분이 좀 무뚝뚝하시다는 것이었는데 서비스 측면에서 좀만 더 친절하시면 (오마카세 느낌이라는 점을 고려해서) 좋을거 같다.,맛있다
874,하이쿠,김미경,"내돈내고 눈칫밥먹고옴ㅋ두분중 한분은 잘 모르겠고(좀 나은 것 같기도)저희 테이블 가까운쪽 응대하던 분 정말 불친절하네요!근처 참치 돈부리집 가려다 비싸도 망플 평이 좋아 간건데 겨우 이런 대접 받으려고 하이볼 포함 1인 3만원 가까이 지출했나 싶어요. 재방문 의사 전혀 없습니다. 아, 맛도 가격 생각하면 별로에요^^",별로
875,하이쿠,킬ㅈㅁ,정말 맛있긴한데회를 다루는 일식집 화장실에 비누 없는게 너무 충격적이다다행히 주방엔 손비누가 있긴했다주방장들이 화장실 다녀오고 손을 두번 씻는지는 모르겠지만,괜찮다
876,하이쿠,옴뇸뇸,"고양이 간장종지가 넘 귀엽다 내가 사진으로 찍은 거 말고 다른것도 있는데 그게 더 귀엽다. 카이센동, 장어덮밥, 타다키 연어 덮밥을 먹었었는데 가격대비 가장 만족스러웠던건 연어 타다키 덮밥이였던 것 같다. 일단 회가 참 맛있고 양념이랑 참 잘어울린다. 밥을 많이 먹는편이 아닌데 양념장에 적셔진 밥이 맛있어서 아 배부른데~하면서 계속 먹게된다. 가루녹차가 깔끔하게 잡아주고 디저트로 나오는 계란 카스테라?가 폭신폭신해서  주는대로 먹다보면 배가 터질 것 같다. 양 적은 사람은 조심하세여ㅠ 어쨌든 타다키연어를 먹으러 재방문하고 싶당",맛있다
877,하이쿠,꼬꼬닭,"이번이 2번째 방문이다. 가족들이랑 같이 와서 즈라시 2개랑 오늘의 카이센동 2개 주문했다.지난번과는 달리 카이센동에 단새우 대신 연어알이 들어갔다는 것 빼고는 다를 게 없이 맛있었다.가족들도 잘 먹어서 다행이었고, 미리 전화를 해서 4명 전원이 같이 먹을 수 있었다. 2.2만원이라는 가격은 다소 부담스럽지만, 그만한 값은 한다.",맛있다
878,하이쿠,CDS,가볼만한 집양도 맛도 괜찮음,맛있다
879,하이쿠,foodie_alex,신선하고 다양한 재료로 승부를 본다. 하지만 특별한 맛을 기대하긴 힘들다.,괜찮다
880,하이쿠,핑크구아바,가고싶다에 있던 하이쿠에 드디어 다녀왔어요토요일 한시정도에 도착해서 사람 많을줄 알았는데 바로 앉을 수 있었어요마침 방문한 날이 골목축제하는 날이어서 골목이 어수선하더라구요내부는 한 열명정도 앉을수 있구 만드시는걸 볼 수 있었어요오늘의 카이센동과 사케동 주문했어요오늘의 카이센동은 식초와 양념한 밥위에 갖은 해산물들이 올라가있어요날씨가 좀 추워지고 회먹을 철에 오려고 아껴뒀던 곳인데 회상태가 최고로 신선한건 아니었어요대체적으로 미지근하고 광어는 오늘 질기더라구요후식으로 카스테라가 나오는데 촉촉하고 달달해서 좋았어요해산물로 느끼해진 입안을 녹찻물로 헹구고 나니 깔끔~가루녹차를 쓰시는것 같아요생각했던 것 만큼 신선하고 맛있진 않아서 그냥 한번 가본걸로 만족합니다~,괜찮다
881,하이쿠,지원리,"동네맛집리스트 +1 쌍리단길에 위치한 조그만 일식집이다.내부에는 자리가 8석 정도 있고 두 분이 손님들과 마주보며 요리하는 구조. 하이쿠 카이센동을 먹었는데 18000원이라는 가격에 비해 정말 고퀄리티라는..! 밥은 후리가케로 간 되어 있고 청어, 참치, 연어 등이 두점씩 올라가있는데 기대 안했던 청어가 많이 비리지도 않고 맛있었다. 연어도 맛있어서 사케동 시켜도 좋을듯. 후식으로 나온 교꾸도 촉촉하니 너무 맛있었다. 그런데 흰생선 하나 먹다가 큰 가시 하나가 나온건 좀 아쉬움..ㅜ녹차가 떨어질 때마다 말 안해도 리필해주시고 맛은 어떤지 체크하시고 궁금해하면 재료 설명도 친절하게 해주시는 점이 좋았다. 다음엔 오늘의 카이센동을 먹어봐야겠다.",맛있다
882,하이쿠,맛되디,"휴가 나온 쌍문러 동생과 하루종일 수유, 쌍문 데이트한 날, 점심 돈까스 이후 상큼한 저녁 식사를 위해 방문한 하이쿠 후기입니다ㅎㅎ 쌍문역 2번 출구쪽에서 시장으로 이어지는 골목길에 눈길 가는 식당들이 많아졌습니다. 동생 말로는 이 일대가 요즘 쌍리단길?이란 이름으로 핫해지고 있다고 하더라구요! 확실히, 양식집, 중식집, 태국요리집, 낙곱새집 등 다양한 식당들이 많이 생겼네요ㅎㅎ 하이쿠는 그 중에서, 일식을 담당하고있는 작은 가게로, 카이센동이 대표메뉴입니다ㅎㅎ 리뷰에서 많이 본 오늘의 카이센동을 주문하고 싶었으나ㅠ 흰살생선이 다 떨어졌다는 사장님 말씀에... 참치연어덮밥을 주문했습니다! 카이센동은 다음 기회에 맛보기로..ㅠ사장님이 횟감을 손질해 담아주시는 모습을 볼 수 있는데 정말 크고 두툼하게 썰어 얹어주시는 편입니다.  카이센동 류가 다 그렇듯, 돈부리 크기는 참 작은 편이나, 올라간 회 크기와 두께는 후덜덜해요... 구성을 대강 살펴보면..두께에 양까지 실한 참치, 연어에  깻잎?차조기 여튼 이파리 한 장, 김 두 장, 밥 적당량이 담겨 있습니다. 한 입 먹어보고 바로 느낀 건, 눈으로 느꼈던 이상으로 회가 실하고 맛있어요! 무식하게 두껍기만 한 게 아닌! 적당히 맛있는 두께여서 씹는 맛도 좋고 신선도도 좋습니다. 간장도 살짝 뿌려진 정도라 자극적이지 않고 회맛도 해치지 않는 수준이구요. 계속 흡입하게되는 준수한 사시미 덮밥이네요ㅎㅎ음식 양과 퀄을 생각하면, 가성비(참치연어덮밥 16000)에 또 한 번 놀라게 되는 곳이에요.. 옆 테이블의 1인 사시미도 참 맛있어보이던데 28000원..! 다음엔 저 아이를 먹어보겠노라 다짐하며 나왔습니다 ^기대하지 않은 곳에서 기대 이상의 기분 좋은 한 끼였습니다. 이 동네에 맛있는 식당 거의 없다고 생각했는데.. 괜찮은 곳 발견해서 기분이 좋네요ㅎㅎ 쌍문역 인근에서 깔끔한 밥류로 식사하고 싶으실 때! 일식이 땡기실 때 좋은 선택이 될 듯 합니다  :)",맛있다
883,하이쿠,이동창,"너무 만족한 곳애매한 초밥집 갈빠엔 여기서 카이센동 먹을 듯솔직히 이 날 오마카세를 갈지 고민했는데방문해보니 조금 경제적으로 부담이 되는 날엔이 곳이 아주 좋은 대안이 되겠다는 생각을 했다우니, 전복, 참치, 도미, 연어 모두 퀄리티가 좋았고두툼하게 썰어서 올려주는게 너무 튼실했다식전으로 주신 차완무시도, 다먹고 나서 주신 후식도 이런 것까지 나오리라 기대하지 못했는데 좋았다다 먹어갈때쯤 옆테이블에서 사케동 시킨 것을 봤는데12000원에 그렇게 두툼한 사케동은 처음봤다타 가게와 비교해봤을때, 남는게 있을까 싶을정도충분히 찾아올만한 가게라고 생각하고손님이 많아서 계속 유지됐으면 좋겠다..동슐랭 3스타",맛있다
884,하이쿠,Kevin Seungho Jeong,보통이네요,괜찮다
885,하이쿠,정뱅이,강북에 괜찮은 카이센동을 먹을 수 있는 곳 입니다.다 먹고나면 후식으로 주시는게 있는데 이름은 기억이 나지 않았지만 계란과 새우살로 만든 카스텔라 인데 겉은 살짝 유부 느낌이 들고 속은 부드럽습니다.고급스럽고 맛있는 카이센동 종류를 드시고 싶다면 추천 드립니다.,맛있다
886,하이쿠,무스비,존맛탱!!!오늘의 카이센동을 시켰는데 모든 사시미가 부드럽게 잘 관리 된 것 같아요! 특히 전복!! 근데 우니맛이랑 전복맛을 제대로 못 즐겨서 다음에는 일반 카이센동만 먹어도 충분할 것 같네욤 재방문의사 100%!!!,맛있다
887,하이쿠,ChoYeonhee,동네에 이런 곳이 있다니 감동입니다. 회가 입에 들어가는 순간 녹아내리는 기적! ❤️,맛있다
888,하이쿠,seul,"오늘의 카이센동. 22000원의 가성비 넘치는 한그릇을 맛볼 수 있다.우니와 단새우, 김, 깻잎, 생연어와 아부리한 연어, 전복, 관자, 광어, 참치 등 다양하고 조화로운 구성이 마음이 들었고 재료들도 신선했다.기본 상차림으로 나오는 자완무시와 샐러드, 장국은 무난했는데 후식으로 나온 교꾸가 약간 비렸다.그래도 메인이 만족스러웠기 때문에 카이센동이 먹고 싶다면 가격 이상의 만족을 얻을 수 있는 이곳으로 향할 것 같다.",맛있다
889,하이쿠,ㅂㅅㅎ,좋아요 좋아요 가성비 굿! 동네에서 누구 대접할만한 곳이 마땅치 않았는데 분위기도 좋고 밥도 맛있어요 쪼끔 아쉬웠던건 하이볼이 위스키랑 토닉이 잘 안섞여서... 그 와중에 좁고 긴 잔에 찰랑찰랑 차게 주셔서 섞어 먹을수가 없었네용. 담에 저녁에 사시미랑 사케 먹어보고 재평가하겠습니다.,괜찮다
890,하이쿠,권오찬,"* 한줄평 : 쌍리단길에서 기분좋은 일식 한끼언젠가부터 쌍문동에도 감성 식당이 들어서면서 <쌍리단길>로 불리고 있는데, 오늘 방문한 곳은 6월 개업한 카이센동을 전문으로 하는 <하이쿠>!오더 메뉴는 <오늘의 카이센동 ; 22천원>, <사시미 정식 ; 28천원>, <점심 한정 메뉴 한국식 회덮밥 ; 9천원>으로 서울 중심가 대비 가격이 굉장히 경쟁력 있다.# 카이센동훗카이도의 대표적 요리이자 한그릇에 각종 해산물을 얹어 바다를 온전히 느낄 수 있게한 해물덮밥이다. 잘 방문하지 않던 동네 식당을 굳이 찾아간 것은 아이가 인근에서 과학 영재 테스트를 받아서인데!서울에서도 쉽게 찾아보기 힘든 <카이센동>이라는 메뉴와 이 집의 다양한 해산물 사용을 통한 화려한 색감 등 어디하나 흠잡을데 없이 만족스러웠다.카이센동은 시메사바, 우니, 전복 등 무려 10여가지 해산물이 올라와있었는데 최고의 한입은 일본 깻잎인 <시소 ; 우니 뒤 초록잎>로 회쌈을 먹은 것.. 예전 유후인 료칸에서 접했던 가이세키 정식의 기억이 떠오를만큼 시소의 향이 대단했다.# 사시미 정식회를 좋아하는 아이를 위해 주문한 메뉴인데, 이렇게까지 푸짐하게 줘도 되나 싶을 정도로 양과 질 모두 만족스러웠다. 서비스로 받은 오징어 초절임 역시 어찌나 맛깔나던지 입맛을 계속 돋구어줬다.사시미정식의 구성은 샐러드와 차완무시, 사시미와 생선조림, 미니 카이센동과 카스테라까지 이 모든 걸 불과 28천원에 즐길 수 있다. # 한국식 회덮밥굳이 일식집에서 한국식 회덮밥을 오랫만에 먹어보고 싶다고 아내가 주문한 메뉴인데, 점심 한정 메뉴에도 샐러드와 차완무시를 주는지! 아니면 다른 메뉴를 주문한 일행과 함께 먹으라고 주는지는 모르겠으나 단돈 9천원에 전채와 후식까지 다.. 카이센동이나 사시미정식에 나오는 잘 숙성된 회를 굳이 초장에 비벼야 하는 메뉴에 사용하진 않았을 것이나 싱싱한 무순과 에린 맛을 찬물로 뺀 양파 등 기본이 아주 잘 지켜졌기에 이 메뉴도 합격!# 추가잡설일본은 지리적으로 섬나라이기 때문에 대표적인 재료가 바다 생선이다. 대체적으로 일본 요리 풍토는 자극적인 향신료의 사용이 제한되어 있어 요리의 특징은 <조리>하는 것이 아니라 원래의 맛을 극대화하기 위해 <보존>하는 것에 있다. 일본 요리의 또다른 특징은 눈으로 먹는 음식이라는 별명답게 화려한 식기와 색조합까지 감안한 예쁜 담음새가 아름답다는 것이다.",맛있다
891,하이쿠,장희,오늘의 카이센동 2.2만. 비슷한 느낌의 서울동에 비하면 메뉴당 만원정도씩은 저렴한 것 같다. 카이센동이 양이적고 비싸다는 이미지가 있는데 가격에 비해 재료도 좋고 충분히 배부를만한 양. 옆에앉은분들은 배부른데 적은양으로는 안파냐고 물아볼정도.맛은 스시집 정도를 기대하지만 않는다면 만족할만함. 맛이 대단해서 우와 하는건 없었지만(근데 그건 서울동도 마찬가지)다행히 비린게 없었고 오징어랑 전복이 제일 맛있었다. 푸짐하고 저렴하게 먹을수 있으니 다시 가볼예정. 혜화 위쪽으로 이런가게가 생겼다는게 좋다,맛있다
892,하이쿠,ben,worth the money,맛있다
893,하이쿠,ChungPatrick,"I'm a huge sushi lover and im picky with my sushi. However, I also don't like spending a fortune for high quality sushi so it's hard to find a place that satisfies both... And this place is just the right place! Super fresh and they prepare each fish with utmost care. Very few times have I been so satisfied with the food and the value of the food but this place is it.",맛있다
894,겨리,홍익인간,카이센동에 사진처럼 장어 안들어가고 전복도 올라온 사진보다작음  성게알은  페루산 냉동같은데  본연의맛은 안남   그냥 사진하고는다름  굴튀김도 시켜봤는데 냉동 기성품 이고 좀작고 오버후라이드로 살짝탓음  보관문제인지 빵가루 눌려서 튀긴관계로 개선 필요할듯 밥위에 후리가케좀뿌리고 회를 덮었는데  맛은 보통 수준  같이나오는  일식 된장국은  텊텊함,괜찮다
895,겨리,미식가가 될테야,"- 하이쿠가 예약이 다 찼다고 하여 간 차선책이었으나 만족스러웠다.- 흰생선과 연어가 함께 있는 메뉴와 연어를 야부리한 메뉴를 먹었는데 둘 다 나쁘지 않았다. 하지만 데코로 올린 시소잎을 잘라서 넣어주면 중간중간 같이 먹기 편할 것 같다.- 인테리어는 좀 아쉬웠는데..좀 더 위생적으로 보일 수 있도록, 그리고 실제로도 그럴 수 있도록 노력하면 좋겠다.- 헹슐랭 점수 3.8/5",맛있다
896,겨리,북극곰,"마구로사케동과 시로미사케동 주문!둘 다 가격은 1.5 근처였던 것 같다. 퀄리티를 생각하면 꽤 괜찮다고 생각하는 가격. 이곳은 회를 꽤 두툼하게 썬다. 그래서, 밥이랑 같이 입에 딱 넣었을때 만족도가 높은 것 같다. 연어도 손질을 잘 한 것 같았고, 참치도 꽤 괜찮았다.",맛있다
897,겨리,북극곰,"만원의 행복. 무조건 점심에 한번은 와야한다.물론 카이센동이 구성이 더 좋고 생선 종류도 많겠다만, 여기의 런치박스는 가격과 맛 모두 흐뭇하다.일단 생선회가 매우 두툼하고 넓적하다. 물론 연어회 두피스, 흰살 두피스니 양이 많은 건 아니지만 사이즈 자체가 크니 한 입에 딱 넣었을때의 만족도는 너무 좋다.저녁엔 하이쿠에서 카이센동을 먹겠다만 점심엔 때로는 가성비 좋게 이곳에서 런치박스로 해결하고싶다.",맛있다
898,겨리,준영,"만원으로 누릴 수 있는 소소한 카이센동! 런치박스라고 메뉴판에는 12000원이라 적혀있었는데 사장님께서 만원이라 하시더라구요? 인하하신건가..? 이벤트인가?? 만원인만큼 퀄리티나 구성이 엄청 좋고 다채로운건 아니지만 숙성한 정도나 소소한 점들이 마음에 들어서 너무 만족스러운 식사였어요. 미소시루도 미역,양배추 가지고 어떻게 이리 시원하게 끓이셨나 궁금했는데 조개살이 들어있더라구요ㅎㅎ 어쩐지 넘 시원햇슴ㅎㅎㅎ 카이센동 구성은 토치로 구운 소고기, 연어, 광어, 초새우, 문어, 방어, 아까미, 가리비 이렇게 있었어요. 소고기는 좀만 덜익었으면 좋겠고.. 광어랑 연어가 정말 숙성 잘되어서 좋더라구요. 다음에 카이센동 먹으러 또 와볼 듯!",맛있다
899,겨리,sjisdreaming,‘,괜찮다
900,겨리,ethanghymn,"날씨가 서늘해지기 시작해선지 엊그제부턴가 왠지 카키후라이(굴튀김)이 당겨서 검색을 하는데 우리나라에선 그다지 인기가 없는 건지 잘 보이지도 않고 그나마 거의 술안주 느낌으로만 내놓는지 보이는 건 대부분 이자카야 타입의 가게들이어서 카키후라이 먹으러 굳이 저녁에 나가서 술과 같이 먹어야 하나 하던 중에 여기 교리가 눈에 띔.이 가게는 전에 장희님의 리뷰에서 보고 가성비만 뛰어난 게 아니라 맛 자체도 뛰어나서 놀랐던 근처의 이코이처럼 또 다른 좋은 카이센동 가게인가 싶어 가고싶다에 세이브해뒀었는데 마침 잘 됐다 싶어 아침에 일어나 집에 있던 초콜릿 브라우니 한 개를 데워서 가볍게 먹고 혹시나 인기가 많은 가게일까 싶어 가게 오픈시간인 11시 반에 맞춰 도착하려고 시간에 맞춰 집에서 출발함.망플을 하면서 이쪽 동네에 와보기 시작한 것 같은데 이젠 여러번 오다 보니 더 이상 낯설진 않게 느껴지고 제법 익숙한 정도까지 느껴짐.마침 위치도 이코이 근처였고 도착하니 아직 오픈시간 약간 전이어서 가게 앞에서 잠시 기다리다 뭔가 전에도 다른 가게들을 방문했었을때 오픈시간이 되면 오픈이라고 안내를 할 거라고 기다리고 있다 오픈시간 약간 전인데도 나보다 더 늦게 온 손님들이 가게문을 열고 먼저 들어가는 걸 한두 번 경험하다 보니 오픈시간이 다 되서 나도 가게문을 열고 들어가도 되는지 묻고는 들어감.가게는 닷찌석으로만 이루어져 있었고 대표메뉴인 카이센동도 궁금했지만 카이센동의 구성이 전복이나 아나고 등이 들어가 호사스럽게 보이는 효과는 있어서 사람들이 가성비가 좋게 생각할 수 있는 느낌이지만 그런 구성은 내가 덜 좋아하는 구성인데다 카이센동의 구성으로는 살짝 어색한 느낌이기도 하고 난 원래 카키후라이가 당겨서 온 거기도 해서 가성비가 뛰어나다는 점심 한정메뉴인 모둠도시락, 런치박스를 먼저 맛보고 좋으면 재방문시 카이센동을 맛보기로 하고 런치박스와 카키후라이를 주문함.먼저 시원하지만 맛은 밋밋한 편이었던 말차를 내어주시고 산고추 절임도 들어있어 역시나 좀 어색하게 느껴졌던 츠케모노도 내어주심.곧 이어서 흔한 오일베이스 드레싱이 뿌려진 샐러드와 작은 새우도 들어가고 맛 자체는 괜찮았지만 데커레이션을 위해 뿌려진 것 같은 여러 색의 작은 토핑들이 뭔가 살짝 눅눅해진 씨리얼의 식감이어서 차라리 안 들어간 게 나을 것 같이 느껴졌던 차완무시 그리고 양배추와 당근, 바지락이 넉넉히 들어간 미소시루가 나옴.다음으로 런치박스가 나왔는데 뚜껑을 여니 그래도 제법 다양한 생선류가 올라가고 이 가게의 또 다른 메뉴인 것 같은 비프동에 올라가는 소고기도 몇 점 들어있음.생선류를 살펴보니 흰살 생선으로는 광어와 도미, 그리고 붉은살 생선으로는 연어와 참치 아카미가 올라가고 그 외에 시메사바, 아귀간인 안키모, 가이바시, 교꾸, 오이, 시소잎 등도 들어가서 나름 다채롭게 구성되어 맛만 좋으면 가성비가 좋을 느낌임.거기다 사이드로 레몬이 곁들여진 삼치조림도 내어주셔서 호사스럽게까지 느껴짐.간장을 따르고 먼저 광어를 간장에 찍은 후 와사비를 얹고 밥과 같이 맛을 보니 음함.광어는 두툼하지만 살짝 질깃한 식감이면서 맛도 평범해서 가성비가 뛰어나구나라고 생각이 들진 않음.도미도 그렇고 참치 아카미도 마찬가지임.연어나 시메사바는 내가 등푸른 생선류를 좋아해선지 그래도 나름 좋게 느껴졌는데 그 외에 가이바시나 새우 역시 특별히 할 말은 없고 소고기는 제법 씹어야 하는 질감의 것인데다 당연히 수입 소고기겠지만 역시나 수입 소고기 특유의 향은 테리야끼 소스 같은 게 발라졌어도 느껴져 그냥 그랬음.런치박스를 어느 정도 먹었을 때 드디어 기대했던 카키후라이 3피스가 자가제조 느낌의 타르타르소스와 같이 나왔는데 제법 볼륨감이 좋아 기대가 됨.타르타르소스에 찍어 맛을 보니 당연히 냉동 굴이어서 신선한 굴 만큼의 풍미는 아니더라도 볼륨감이 좋고 먹고 싶었던 거여선지 타르타르소스가 특별하진 않았지만 그래도 나름 좋음.다 먹어갈 때쯤 카스테라 느낌의 교꾸도 디저트로 내어주셨는데 가운데 부분은 크림 같은 질감이었는데 좋기보단 덜 좋게 느껴졌지만 런치박스가 고작 12,000원이고 카키후라이 3피스가 4천원인 걸 생각하면 입틀막해야 하는 호사스러움임.전체적으로 날씨가 슬슬 서늘해져선지 카키후라이가 생각나 맛볼 수 있는 곳을 찾던 중 카이센동이 나름 좋은가 싶어 가고싶다에 세이브해뒀던 여기 겨리에서 카키후라이를 맛볼 수 있어서 겸사겸사 들렀는데 근처 이코이 마구로동 만큼의 뛰어난 가성비나 퀄리티는 아닌 그냥 가격대에 맞는 퀄리티 느낌이었지만 그래도 카키후라이가 있어서 좋았고 나름 다채로운 구성과 저렴한 가격을 생각하면 나쁘진 않다고 생각이 들었고 그래서 괜찮다로..",괜찮다
901,겨리,장희,하이쿠랑 이코이 그리고 이곳까지 쌍문동에 해산물 덮밥집이 세곳이나 있다. 다른 음식은 많은것도 아닌데 이런거만 몰려있는게 좀 뜬금없는 동네. 세곳 다 다른 지역 생각하면 가격도 좋다. 하이쿠가 예전보다 구성이 아쉬워져서 가본곳인데 구성 좋았다. 맛도 비슷하게 괜찮았던거같음. 점심에 파는 런치박스가 가성비 아주 좋아보였다. 비프동은 무난,맛있다
902,쉐프마인드,베어빈이히,"주문메뉴: 스페셜초밥, 마제소바분위기: 가게를 조금씩 확장했는지 복도를 끼고 자리가 분리되어 있다. 고급진 분위기는 아니지만 동네에서 술한잔 하기엔 좋을 것 같음두번째 방문한 쉐프마인드요리가 나쁘지 않았던 기억이 있었는데, 너무 배가고파서 스시를 주문했다.스페셜초밥: 가격 대비 스페셜한 구성은 아니었지만 기본이 되는 스시들도 다 맛있었고, 마끼가 엄청 크게 나와서 엥간한 여자는 한입에 먹을 수 없음. 도미랑 광어가 특히 맛있었다.마제소바: 큰 기대하지 않았는데 밸런스가 무진장 좋다.먹고 있는데 사장님이 어떻게 아시고 밥 반공기를 주시면서 비벼드시면 된다고 했다.면도 맛있었지만 밥 비빈 게 더 맛있었다 ㅋㅋ지난 번에 이어서 서비스로 연어구이를 받았는데, 연어구이도 아주 잘 구워져서 맛있게 먹었다.후식까지 챙겨주시고 작은 코스를 먹은 것 같아서 좋았다.",맛있다
903,쉐프마인드,Jinny,"며칠전부터 매운탕이 너무 먹고싶어서 들리게 된 쉐프마인드.지난번 복지리를 너무 맛있게 먹어, 이번엔 복어 매운탕을 주문했다!결과는...쫄깃한 복어살과는 다르게 국물 맛이 너무 실망스러웠다. 깊은맛은 커녕 그냥 맵기만 한 국물은 반 이상 남길 수 밖에 없었...ㅠㅠ그래도 항상 재료를 좋은걸 쓰시는 듯 한 느낌은 받고오는 쉐프마인드다!연어스테이크덮밥은 잘먹었습니다~(이곳은 서비스가 아주 후하다!)",괜찮다
904,쉐프마인드,맛잇츄,"지역 주민으로서 말씀드립니다 여기 맛집입니다. 늘 손님으로 가득하고요, 그래도 매장 자체가 한 건물에 여러개 있어서 대기는 별로 없어요. 추천 메뉴는 꽃게 라멘과 연어사시미샐러드 그리고 돈까스 입니다.(돈까스가 은근 맛있어요) 서비스 진짜 많이 주시고 아이스호두 라는걸 주시는데 너무 맛있어요 진짜 추천….",맛있다
