,가게이름,리뷰아이디,리뷰,맛평가
1,스마일닭강정,봄잇,스마일닭강정 박스부터 예쁘다이번엔 고추마늘이랑 마늘 대로 2개 시켰다바싹바싹 마늘향도 팡팡 고추향도 팡팡아주 굿!!잡내도 안난다. 번창하세요!!,맛있다
2,스마일닭강정,samludens,별⭐⭐⭐⭐⭐골목식당에 나온 맛집들이 다 엄청난 맛집이라고 보긴 어렵지만이 곳 만큼은 인정하고 싶다.영업종료 시점 방문한 이 곳의 닭강정은 여전히 밝은 사장님과 귀여운 스마일이 맞이해 주었고골목식당 초창기에 많은 손님들이 한꺼번에 밀려 스마일 닭강정이 새드 닭강정이 되었던 이야기에 웃음지으며 대화도 해주시고마지막 땅콩 가루를 정말 푸짐하게 뿌려주는 이 곳 닭강정은포장시에 뚜껑을 닫지 않고 완벽하게 바삭함을 유지하게 해주었다ㅋ첫 한조각을 입에 넣었을때 양념이 발라져 있음에도 바삭함이 느껴지고 우와 하는 말이 절로 나왔다.다녀온지 3일이 지난 지금도 떠오르는 닭강정내일 가야지 이젠 닭강정은 여기다만석 닭강정보다 훨 낫다,맛있다
3,스마일닭강정,우이리,마늘간장(중) 7500주문하고 20분뒤에 찾으러 오라네요. 마늘향이 진하네요. 튀김옷이 딱딱한 편인데 먹기어렵지 않아요. 짭쪼름한데 생각보다는 달지않았어요. 덜달아서인지 제 아들넘은 별로라네요.,맛있다
4,스마일닭강정,dally116,골목식당 창동시장편에 나온 닭강정집. 요즘은 전화없이 가도 바로 픽업이 가능해서 집오는 길에 포장~ 고추마늘로 샀는데 끝맛만 맵고 달달구리해서 맛있었어요. 요즘 닭강정집이 워낙 많고 뭐가 다르겠냐 했는데 다르더라구요. '자극적이지 않고 짜지 않은데 맛있다'는게 제일 큰 차이점이예요. 게다가 2-3인 먹기 딱 좋은 양~근데 대가족인 분들을 위해서 특대 17000원에 1.5배정도 담아주는 메뉴도 있음 참 좋을 것 같네요! 친정에서 여섯식구 먹으려니 2박스 사야해서 불편하더라구요^^;; 총평: 내 아이에게 먹여도 안심될 것 같은 닭강정.,맛있다
5,스마일닭강정,준영,골목식당에 나왔던 닭강정집! 방송 직후에는 문 닫아서 계속 못먹었었는데 드디어 전화 예약하고 픽업했어요ㅎㅎ 요즘은 계속 8시까지 하시나봐요! 가족들이 매운걸 못먹어서 간장으로 했는데 짭쪼롬 달콤한게 너무 맛있었어요ㅎㅎ 닭강정하면 노맛 속초닭강정 밖에 생각이 안나서 비호감이었는데 바뀌었습니다ㅎㅎㅎ 나오자마자 하나만 몰래 쇽 먹었는데 진짜 육집 부드럽고 좋았어요.. 식어도 적당히 파삭하니 맛있더라구요.  근데 왜 제일 작은 컵이 제일 싸고 중자가 제일 비싼지 알 수 없는 노릇ㅋㅋㅋ 사장님들은 방송 나왔던 것처럼 친절하셨습니다!,맛있다
6,스마일닭강정,야구소년,야구시즌에 딱인 주전부리. 동네 닭깡정 중 유일하게 1일 1깡 가능한 맛. 간혹 20퍼센트의 확률로 잡내나는 피스도 있긴하지만. 방탄조끼를 입은 듯 얇고 빠삭한 튀김 옷과 꾸럭미가 더해진 달콤한 소스가 한층 맛을 살린다. 이정도면 화려한 조명이 나를 감싸네.공원에서 먹으려. 사장님이 꼬치 몇개 드릴까요 묻길래 3개 주세요 라고 답했는데. 막상 꼬치가 없는 건 함정. 무척 당황스러웠지만. 근처 편의점에서 젓가락을 급하게 공수. 하지만 젓가락 마저 부러져. 이번엔 화가 나 비효과 레인이펙트.,맛있다
7,엘림들깨수제비칼국수,SYKim,설명이 필요없는 식당이죠. 개인적으로 들깨요리가 꼭 먹고싶다 땡기지는 않는 편인데 가서 먹어보면 왜 이걸 안먹었지 싶은 만족감이 가득한 집. 추천해요,맛있다
8,엘림들깨수제비칼국수,야미야미,"들깨칼국수부터 비빔밥, 수육까지 맛볼 수 있는 푸짐한 가게!주문 메뉴: 들깨칼국수분위기: 요즘 분위기의 트렌드한 가게는 아니고 그냥 동네 칼국수집 같은 곳. 인기가 많아서 손님이 끊임없이 들어온다.양: 들깨칼국수만 시켰을 뿐인데 에피타이저로 간단한 보리비빔밥과 수육, 칼국수까지 푸짐하게 즐길 수 있다. 메인인 들깨칼국수 양도 푸짐하다.질: 보리비빔밥은 그냥 딱 아는 맛. 수육은 촉촉하고 부드럽다. 들깨칼국수는 들깨 맛이 제대로 나는 고소한 칼국수. 김치가 좀 짜다 생각했는데 칼국수랑 잘 어울리는 맛이다. 고소함 가득한 들깨칼국수 먹다가 좀 질릴까 싶을 때 김치가 개운하게 만들어준다. 전체적으로 밸런스가 좋은 가게.추천이유: 이 가격에 이렇게 여러 요리를 이정도 퀄리티로 다 맛볼 수 있다니!",맛있다
9,엘림들깨수제비칼국수,야구소년,첫 리뷰를 쓸때 6천원이였던 칼제비가 지금은 9천원으로 올랐다. 하지만 여전히 가성비는 훌륭하다. 보리밥 - 보쌈 - 칼제비로 이어지는 구성은 똑같고 맛도 변치 않았다. 부드럽고 고소한 칼제비와 아삭한 겉절이. 그리고 부드러운 보쌈까지. 서울 강북구의 대표 칼국수가 아닌가 싶다. 요즘엔 밀키트도 판매하던데 기회되면 도전해봐야지.,맛있다
10,엘림들깨수제비칼국수,레드블랙,"들깨칼국수 좋아하는 1인공구로 밀키트를 주문하여 집에서 손쉽게 조리!본점은 우리집에서 거리도 상당하니 이렇게 간편히 유명 들깨칼국수와 김치를 먹을 수 있음에 상당히 만족함.육수분말, 매우 새롭게 껍질을 벗겨 곱게 빻은 들깨가루, 매밀면으로 후루룩 식사 한끼 완료",맛있다
11,엘림들깨수제비칼국수,찻집고냉이,"칼제비 2인. 웨이팅이 사악하게 길기때문에 이로인한 쇼크 주의. 애매모호한 4시타이밍에 가서, 이마저도 15분정도 웨이팅 후 착석. 그런데 의외로.. 처음 먹었었던 그 센세이션은 없고 뭔가 '맛있긴하지만 이걸 2시간씩 기다려서 먹는단 말인가요?' 싶은 맛. 그 긴 시간을 감수하지 마십시오,, 기대하지 않은 수육+보리밥이 센세이션이었는데, 사람들이 수육때문에 줄을 서는 것같진 않고. 약간 미스테리. 이번 방문은 재방문 한거지만, 앞으로는 재방문 의사 없음. (웨이팅이 없다면 수육은 먹으러 갈 수 있을듯? 그러나 멀리서 갈 정도는 아닌듯하다)",괜찮다
12,엘림들깨수제비칼국수,메롱,짱맛짱맛,맛있다
13,엘림들깨수제비칼국수,mong,"와 여기는….진짜 찐이에요 ㅋ 제발 가보세욤, 들깨칼국수 안좋아하시는 분들도 한번만 가보세요:)여기 다닌지는 이미 몇년전인데  여기 다니기전에는 들깨칼국수 안좋아했는데 여기서 한번 먹고는 이제는 꽤 잘먹어요. 물론 먹을때마다 엘림이 낫네…하면서 약간 실망하기는 하지만ㅋㅋ들깨국물이 진짜 걸죽하고 진해요. 거의 콩국수국물수준으로 뽀얀색이라 칼국수 국물이라기 보다는 들깨죽 먹는 느낌이에요. 실제로도 저는 가면 면이나 수제비 건더기보다는 국물위주로 먹어요!먹기전에 열무비빔보리밥을 에피타이져로 주고, 수육도 몇점나와요 거기에 양푸짐한 칼국수까지.한번도 국물끝까지 다 먹고 와본적이 없을정도로 양도 많아서 진짜 가성비라는걸 실감하고 옵니다.",맛있다
14,엘림들깨수제비칼국수,남기,맛있다.,맛있다
15,엘림들깨수제비칼국수,김쿵철,"여기서 먹은 들깨 칼국수를 뭐라고 칭찬해야 할까 한참을 고민했다. 내 변변찮은 필력으로는 뭐라고 이야기해도 충분하지 않으리라는 것을 깨닫고는, 그냥 '맛있다'하나 추가하는 것으로 만족하기로 했다. 정말 맛있는 곳이니까.",맛있다
16,엘림들깨수제비칼국수,syj701,칼제비는 여전히 맛있어요~근데 김치가 너무 짰어요.,맛있다
17,엘림들깨수제비칼국수,Noah,"수제비, 김치, 만두, 수육 모두 맛있어요.들깨 국물도 너무 좋아요:)",맛있다
18,엘림들깨수제비칼국수,지적생활의즐거움,"감동적입니다. 저는 서민이라 저렴한 가격에 푸짐한 음식점을 사랑합니다. 이곳에서 1인당 7천원 내고 먹은(사진은 2인분) 들깨칼제비는 맛도 좋고 정말 푸짐합니다. 칼제비 먹기 전에 보리밥 한그릇 슥삭 비벼먹고, 감칠맛 나는 겉절이와 김치에 담백한 칼제비를 후루룩 먹고 있는데 갑자기 등장한 수육 한접시? 잉? 저희 수육 안시켰는데? 했더니만 원래 주는 거랍니다~ 세상에나, 맛도 좋고 인심 좋고 다음에도 또 가고 싶은 맛집",맛있다
19,엘림들깨수제비칼국수,맛둥이,어휴 여기 진짜 맛있어요저렴하고 양많은 동시에 맛도 있어요북한산 등산갔다가 내려와서 먹으면 맛있음이 배가 되어요등산안갔다와서 구냥 먹어도 맛잇어요,맛있다
20,엘림들깨수제비칼국수,깡,엘림 매우 맛있당근처 주차도 못할정도로 사람도 많다,맛있다
21,엘림들깨수제비칼국수,배고파,가격에서 일단 합격인데 맛도좋다밀가루 덜익은 풋내도 안나고 그렇다고 푹익어서퍼지지도 않음보리밥도 탱글탱글 씹히니 기분좋아지는 맛이다주인분도 굉장히 친절하심!테이블간격이 좁은건 약간아쉽다 ㅠㅠ,맛있다
22,벼랑순대국,정민,"아, 여기 무조건 추천합니다. 진짜 핵핵핵쫀맛! 대박!오후 4시부터 4시40분까지 브레이크라서 기다리다가 첫손님으로 들어가서 먹었는데, 와! 와!! 와와!! 진짜 맛있어요.내장이 진짜 신선함이 느껴졌어요. 쫄깃쫄깃함을 순대국에서 오랜만에 느껴봅니다.피순대도 엄청 고소하니 맛있어요.이곳에서만 있는 마늘이 많이 들어간 장이 있는데 여기에 살코기를 찍어먹는 것도 엄청 맛있어요.그리고 작은 깍두기들도 엄청 잘 익어서 순대국에 딱이였습니다. 친구랑 먹으면서 와 맛있다 여기 진짜 맛있다를 한 10번은 말한 것 같아요.가족들이 하는 곳 같아요. 서빙하시는 분이 따님같은데, 순대국에 대해서 엄청 꿰고 계시고, 친절하시고 설명도 엄청 잘 해주세요.들어가는 종류에 따라서 순대국 종류를 세세하게 나눠놨는데, 저는 다 먹고 싶어서 특순대국 시켰습니다ㅋㅋㅋㅋ그냥 특순대국 드세요!!!! 진짜 맛있어요!!!!!!와 강북구에 순대국맛집이 있다니>_<유명해져서 웨이팅 생기면 어쩌지 걱정이..",맛있다
23,벼랑순대국,신승수,굿,맛있다
24,벼랑순대국,반말했다존댓말했다,주말아침 택시타구 해장하러 갔는데 문 닫혀있었음공휴일이면 토욜두 쉬심다음에 평일저녁 재도전웨이팅 은근 했고 들어가서 벼랑순대국그냥순대국 주문벼랑은 뼈해장국느낌이 강하다평소 순대국귀신인데 맛이 타맛집에 비해 좀 자극적이고강한 느낌?!크게 재방문의사는 없다,괜찮다
25,벼랑순대국,개꿀,"강남에 농민이 있다면, 강북엔 벼랑이 있다!(물론 개인적으로 농민이 더 맛있긴 하지만..)사진 한장으로 리뷰를 끝낸다가격도 6,000원 대박아 개인적으로 아쉬운게 있다면, 고추가 없다.. 들깨가루도 추가가 안된다..",맛있다
26,벼랑순대국,깽민,랑종 보고 난 뒤에 순댓국을 먹는 선택이 탁월했다. 돼지에게 감사한 마음이 든다. 일반 순댓국과 가게 이름을 본 뜬 벼랑순댓국 메뉴가 따로 있다. 여쭤보니 벼랑순댓국에는 내장과 우거지가 함께 들어간다고 한다. 옆테이블 주문한 것도 슥 보니 일반 순댓국과 비주얼도 차이가 난다. 혹하는 마음도 있었으나 이 집에서는 일반 순댓국을 시켜야 한다길래 일반으로 주문했다.적당히 진하고 맛있는 국물과 더불어 큼직큼직한 고깃덩이가 맛있다. 먹어 본 순댓국 중 가장 알이 큰 살코기를 쓰는 것 같다. 고기가 맛있고 고기 찍어먹으라고 매콤한 마늘 쏘스도 주는데 이것도 특이하니 괜찮다. 순대도 약간 독특하다. 알알이 부숴지는 식감이다. 일반적인 정통 순대와 분식집 순대의 특징을 잘 조합한 느낌도 든다. 개성이 느껴져서 좋았다.돼지 꼬랑내도 별로 안나고 깔끔하면서도 진한 순댓국에 큼직하니 맛있는 고기가 가득 들어갔다. 훌륭한 가격에 훌륭한 맛이다. 커피 값 아껴서 배나 든든히 채우자.,맛있다
27,벼랑순대국,김범,깔끔하지도 친절하지도 않지만 맛있다.,맛있다
28,벼랑순대국,E.T Jun ,순대국,괜찮다
29,벼랑순대국,야구소년,"도봉 노원 강북의 모든 순대국집을 가본 건 아니지만. 현재까지 맛 본 순대국 중엔 여기가 가장 맛있다. 이 곳의 순대국은. 우리 동네에서 그토록 찾던. 입 안에서 쫙 하고 달라 붙는 국물이 가득 담긴. 아주 훌륭한 순대국이다. 먼저 벼랑순대국은 매콤함이 가득 풀어진 국물에. 살코기, 순대, 돼지부속도 한가득 들어있고. 여기에 우거지까지 풀어져. 씹는 맛이 배가 되는 국밥이다.  벼랑순대국은 가명이고. 진짜 이름은 벼랑해장국이 더 어울리는 이 국밥은. 저절로 땀샘이 몽글 몽글해지니. 가끔 매콤한 음식이 생각나는 날에 떠오를듯 하다. 일반순대국은 뽀얀국물에 살코기와 순대가 담겨 나온다. 또, 굳이 특으로 주문할 필요가 없는 양이다. 한술 가볍게 뜬 국물은. 다대기와 새우젓이 없이도 이미 훌륭하게 벼랑 스타일로 간이 되어 나온다. 더 덧붙일 필요가 없다. 몇몇 사람들은 벼랑순대국보다. 일반순대국이 여기의 진짜 진국이라 하던데. 정말 그렇다. 주인공은 단돈 6천원짜리의 이 녀석인듯 하다. 이 맛을 공유하고자. 이번엔 쫄깃한 머릿고기도 한접시 더해. 바리바리 싸들고 와. 친구들과 젓가락을 나누었더니. 틀어논 티비보다 순대국에 더 매진하게 된다. 역시 나만 이 맛에 반한게 아니였다. 오픈 시간대도. 애매한 시간대에 찾았을때도. 이 곳은 항시 바글 바글했다. 이제야 끊이지 않는 사람들이 이해가 간다. 이 근방 유일하게 보약을 파는 곳이니. 그리 사람들이 찾았구나.",맛있다
30,참만두,글쟁이,"창동 특산품이라 불리울만한 손만두창동에 살았다면 왠만하면 다 아는, 다른 동네로 이사를 가도 가끔 기억이 나서 찾아오는 곳원래 트럭에서 판매하셨는데,작년부터 가판대로 옮기셨고,그 뒤로 사람들이 몰리는 바람에 한참을 못먹게 된 ㅜ 오랜만에 찾았는데 이모님의 친절함은 그대로, 맛은 더 업그레이드 되었다이곳의 매력은 쫄깃한 만두피와 넘치도록 담아주시는 푸짐한 만두소에 있다특히 김치만두가 ㅎ깔끔한 매운맛에 마늘과 생강이 더해져서눈몰 쏙 빼는데 계속 생각 나는 맛 ㅋ 다만 고기만두에도 그 마늘맛이 세서 호불호가 있었는데 그걸 좀 조정하신 듯 ㅋ 담백하고 아삭하고 촉촉하고 여간 맛난다 ㅎ갓 쪄나온걸 바로 먹는게 가장 맛나지만포장해 와서 기름에 지져먹으면 그게 또 다른 매력이 있다ㅎ",맛있다
31,참만두,다나,"별점도 높고 나쁜 리뷰가 없어서 들렸는데, 제 입맛에는 안맞네요. 매콤하고 맛있는 김치 만두를 생각했는데 김치는 모르겠고 양배추 같은 식감과 고춧가루의 텁텁함,  마늘의 자기주장이 너무 강하네요.",별로
32,참만두,김재형,도봉구 이틀 연속 방문입니다 이제 당분간 갈 일이 없지 싶습니다사실 어제 참만두를 코스에 넣고 싶었는데 사장님 전화기가 계속 꺼져있어서 검색해보니 아침 7:00-7:30 동안만 예약을 받으시고 예약받은 물량만 판매 하신다고 합니다오늘 아침 출근길에 예약을 하고 칼퇴 후 방문했습니다예약 시간에 맞춰서 방문하니 찌고 있다고 좀만 기다리라고 하셔서 얼마 후 만두를 받았습니다 고기반 김치반 1인분입니다만두는 모두 얇은 피인데 잘 찢어집니다 찜기에서 집게로 옴기는 과정에서부터 그렇습니다조금 식힌 후 고기만두부터 맛을 보니 굉장히 아삭합니다 그러면서도 단 맛이 많이 나는게 아마 예상에 양배추를 많이 쓰신 것 같습니다그런데 피가 두꺼운 부분이 안 익었습니다 덜 익은 칼국수 면 맛이 났습니다김치만두는 꽤 맵습니다 제가 매운걸 잘 못 먹어서 그럴 수도 있는데 두 개 이상은 힘듭니다 마늘향과 살짝 불족발 양념 맛이 나는데 제가 느끼기에는 좀 인위적인 맛으로 느껴졌습니다 김치맛이 많이 안 느껴져 아쉽습니다평소 길거리 만두집들의 맛과는 다른 이 집만의 색깔이 있는 것은 분명합니다 다만 아침부터 부러 예약을 해서 멀리까지 찾아갈 정도의 맛은 아니고 동네분들 생각날 때 편하게 드시는 정도의 만두집이라고 생각합니다재방문 의사 : x,괜찮다
33,참만두,신승수,개안음,괜찮다
34,참만두,규릐,"창동 맛집을 말하면 대부분 얘기하는 참만두..!트럭에서 장사하시다가 국민은행 앞 노점으로 옮기셨다.사람들이 예약을 많이 했을 때는 예약이 너무나 밀려있어서 구매하지 못하고 돌아올 때도 많다.고기만두, 김치만두 둘 다 맛있지만 그래도 김치만두의 매콤한 맛은 늘 생각이 난다!",맛있다
35,참만두,망고,창동역에서 엄청 유명한 만두라고 하길래 너무 먹고 싶었는데 갈때마다 휴일이더라구요ㅠ 평일에 저녁 6시쯤 갔더니 거의 다 마감했다고 맛별로 한판씩만 요청드렸더니 다행히 한시간 뒤에 오라고 해서 드디어 맛보았습니다전 김치만두를 더 좋아하는데 만두 속이 진짜 꽉차있고 가판에서 파는 퀄리티 치고 엄청 알차더라구요! 요새 시중에 나오는 얇은피만두의 원조가 여기인듯? 한 느낌이랄까요가격도 진짜 저렴하고 타이밍이 잘 맞는다면 자주 사먹고 싶은 만두집이네요,맛있다
36,참만두,dally116,"창4동 주민센터 사거리에 위치한 만두가게 노점포. 내가 본 것만 22년 이상된 터줏가게. 원래 얼마전까지 지금의 와플 노점포가 있는 옆 길가였는데 위치만 살짝 바뀌었다. 사장님께서는 늘 그 미소 그대로~ 만두 맛도 그대로~고기만두,김치만두 각 4000원. 반반은 메뉴에 안 써있지만 말씀드리면 친절하게 해주신다. 생각나서 8시쯤 가보면 이미 솔드아웃일 만큼 단골이 꽤 많다. 낮에 오픈하셔서 만두소진시 문 닫는 인기만두집. 고기만두는 육즙 팡팡 고기찐빵 맛도 좀 나는게 진한 뒷맛이 있고, 김치만두는 당면과 김치소 등을 쳐덕쳐덕 버무린 스타일로 꽤 매워서 첫 도전자라면 반반을 권유~ 사실 첫 도전자가 아니라도 고기와 김치를 번갈아가면서 먹을때가 제일 맛있어서 나도 반반을 제일 자주 사는 편~오늘은 6시에 갔는데 고기만두 오래 걸린다 하셔서 김치만두로만 포장했음ㅠㅠ 결국 매워서 2개는 남겼지만, 여기 만두는 속편한 매움이라서 탈이 나지 않아 믿을 수 있다. 게다가 반들반들 윤기가 돌고 투명하다시피한 얇은 피가 이 집 만두의 찐매력이다. 찢어질 듯 찢어지지 않고 얇은데도 쫄깃하다는 점. 기가 막히지!!! 이쯤이면 만두의 달인으로 생달에 나와야 할 듯~단, 만두소가 아작거리고 씹는 식감이 살아있는 만두를 좋아한다면!! 살짝 실망할 수도 있지 싶다. 여기 소는 다져서 다같이 버무리는 스타일이라 참고할 것. 총평: 근처에 올 일이 있다면 일단 들려서 묻자! ""어머니!! 만두 남았어요?""",맛있다
37,참만두,준영,눈 오는 날 전화하고 방문! 다행히 웨이팅?이 하나도 없었어요ㅎㅎ 저를 비롯해 가족들이 다 매운걸 못먹어서 김치만두는 안사려했는데 그래도 시그니처라는 글을 많이 봐서 고기만두랑 하나씩 구입했어요. 결론은 김치만두 괜히 시켰고 고기만두나 하나 도 시킬걸 그랬습니다ㅜㅜ 김치만두 뭔가 매력적으로 맵긴한데 그래도 너무 매워서 땀뻘뻘 흘리며 먹어야해요... 고기만두가 은은하게 슴슴하면서 정말 맛있었는데 애호박? 같은 소가 낭낭해서 그런지 포근한 느낌이었어요. 9개에 4천원이면 가격도 너무 혜자롭!!,맛있다
38,참만두,야구소년,망고플레이트에 등록된 곳 중 가장 오래다닌 곳. 동네 친구들끼린 참만두라고 불렀는데 요즘은 창동트럭만두라고 소개되는 듯. 다시 영업 시작하시고 유튜브 여기저기에 소개되서 한번에 포장하기 쉽지 않다. 그래도 유명해진 덕분에 휴일이나 영업시간이 정확히 고지되는 게 장점.막 대단한 맛은 아닌데 어릴적부터 길들여진 맛이라 가끔 생각난다. 고기보단 김치가 시그니처. 근데 많이 맵다. 일반 김치만두 생각하고 먹었다간 입과 배에서 쌍으로 불 날 수도. 매운 음식을 즐기는 사람이 아닌 한 고기랑 반반은 필수다.만두 포장해서 바로 먹은 적이 근 10년 간 없다. 먹고 자면 다음날이 고통스러워서 항상 금밤이나 토밤에 포장하고 주말 아침에 먹는다. 그래야 뒷탈이 없는 만두다.,맛있다
39,참만두,야구소년,"창4동의 마스코트. 언제가 시작이였는지 모르지만. 다른건 변해도. 창4동 국민은행 앞 참만두 푸드트럭만큼은 변하지 않았다. 학창시절, 참만두가 담긴 김이 모락모락 나는 검은봉다리는 지금도 설렘이라는 단어를 표현 할 수 있는 존재다. 동그란 얇은 만두피 속. 아삭하고 짭쪼름한 고기소와 아삭하고 매콤한 김치소가 가득찬 만두가. 3천원에 9알이라하니. 신호등이 초록불을 밝히고 있어도 잠시 쉬었다가 건너야겠다. 학창시절엔, 땀 뻘뻘 흘리며 혀가 화끈하던 김치만두였는데. 이젠 물 없이도 김치만두 정도는 너끈하다. 그때보다 참만두가 덜 매워진건지. 내 입맛이 철이든건지는 모르겠지만. 예나 지금이나 만두 알알이 속에 박힌 감칠맛만큼은 변하지 않은 것 같다.",맛있다
40,여러분평양냉면,민님,"냉면을 좋아하지만 그동안 함흥냉면만 고집하던 내가급 평양냉면이 먹고싶어 검색해서 후기를 찬찬히 살피고이집이다하고 찾아간 여러분평양냉면.큰길에서 골목으로 들어가자마자보여서 찾기는 어렵지않았다.외관은 깔끔하고, 너무 더운 날씨였는데 내부 들어서자마자 시원한 바람이 너무 마음에들었다. 처음 간거고 처음 평양냉면을 맛보는거라 물냉 비냉에 아쉬움을 달래고자 군만두도 추가했다.간단한 밑반찬이 나오고 군만두가 나왔는데,만두를 직접 만드신건지 속이 꽉찬 맛있는 만두 군만두라기보단튀긴만두에 가까웠다.물냉  비냉이 나오고 그냥 맛을보고싶어 먼저 국물을 한번 먹었는데늘 들어오던 심심한 맛이 아니라 깔끔한데 감칠맛이 도는그런 내 입에는 딱 알맞는 맛이었다. 면은 일반 냉면 식감이 아닌 메밀면과 비슷하게 끊기는 식감이었고비냉을 먹어보니 오와 맛있어!하며 달큰함과 매콤함이 있지만아주 적당히 부드러운 매콤함이라 맵찔이인 나에게는적당한 맛이었다.첫평양냉면 성공후 곧 두번째 방문이 이루어질듯한 곳이다.",맛있다
41,여러분평양냉면,장희,예전 사진은 이쁘게 담아냈는데 이번걸 보니 진미평양냉면처럼 좀 막담은 느낌. 고기 부위도 바뀐것 같고..일단 육수는 꽤 짭짤한 편인데 맛있었다. 면도 괜찮았음. 저번엔 면이 약간 별로에 온도도 마음에 안들었는데 이번엔 맛있게 먹었다. 다른 테이블 보니 불고기를 많이 먹는 듯.,맛있다
42,여러분평양냉면,북극곰,저렴한 가격에 곁들임메뉴를 먹을수 있는 것이 강점인 곳. 국내산 삼겹 제육 반접시가 8000원. 혼자와도 부담이 없다. 비빔냉면도 꽤 괜찮은 편,맛있다
