,가게이름,리뷰아이디,리뷰,맛평가
350,애란궁,Luscious.K,"#수서동 #애란궁""특별함이 있는 오리 전문점""1. 현재 수서지역은 SRT의 시점 역으로 인해 교통의 중심지가 되었다.그러나 약 10여년 전까지만해도 수서아파트단지를 중심으로 주거지역의 느낌이 강했고 수서역 사거리는 커다란 화훼단지가 있어서 서울 인근에 많이 형성되어 있는 화훼단지와 별반 다를 것이 없는 평범한 시골 분위기의 장소였다.(여기가 강남구라고???)2. 지금은 일원-수서-가락을 잇는 3호선 지하철과 SRT 수서역을 중심으로 전국에서 모이는 유동인구가 많아지면서 서울역과 마찬가지로 <회의, 회식용 식당>들이 하나 둘씩 늘어가기 시작했다.애란궁도 10년 전에 개업을 하신 오리 전문점으로 회의와 회식, 인근 주민들 모임의 장소로 꽤 유명한 곳이다.수서 인근에서 농장을 운영하시던 사장님께서 주로 <蘭>을 키워 판매를 하셨는데, 화훼업을 접으시고 음식솜씨 좋은 사모님과 함께 오리 식당을 시작하신면서 예전 ""난""을 키우던 추억으로 만든 식당 이름이 <愛蘭宮>이다. 또한 예전부터 이 동네를 궁마을이라고 불렀는데 아마 그 지명도 이집 작명에 한 몫 했으리라 추측해 본다. 3. 수서지역의 특징상 도심 근교 분위기라 시골 가든식당에 온 느낌이 나는데, 이집도 비포장 마당의 주차장과 넓은 텃밭, 야외 테라스 좌석 등 서울이 아닌 듯한 착각을 불러 일으킨다.토지-건물주 사장님이라 장소도 넓게 사용하시는데, 직접 운영하시는 오리농장에서 신선한 오리를 공수해 오시고 식당 뒷편에 장작구이 및 훈연시설을 갖추고 오리를 대량으로 조리를 하신다고 한다.사다쓰는 곳과는 다른 진짜 직접 만든 오리집이라고 할 수 있겠다.4. 이집의 주요 메뉴는 오리이고, 돼지고기와 소고기도 함께 판매를 하지만 역시 이집에서 맛봐야 하는 것은 오리.그것도 <장작구이 오리>와 <오리 샤브샤브>다.따로 주문한다면 양과 가격에 대한 부담이 클 수도 있지만 둘을 합친 정식메뉴가 있으니 주문에 대한 유연성이 있다이번 방문에서는 4인용인 <애정식>을 주문했는데, 통오리 장작구이 한 마리와 오리 샤브샤브로 구성이 된다.5. 그리 크진 않지만 먹음직스러운 갈변화가 일어난 오리 한 마리가 나온다.이모님께서 통오리를 보여주시고 그 자리에서 오리를 찢어서 두 접시로 나눠주셨다.부드러워 보이는 오리살과 쫄깃해 보이는 껍질, 그리고 다리가 무려 네 개.... ㅎㅎ(사실 오리 날개봉이 너무 커서 다리처럼 보여서 다리가 네 개 처럼 보인다)6. 냄새 없이 부드럽고 연한 염지와 훈연맛이 나는 오리는 햄 같은 시판 훈제오리와는 차원이 다르다.오리 특유의 적육의 맛과 향에 누구나 좋아할 수 있는 연한 감칠맛이 공존한다.함께 주신 특제 소스와 함께 먹으면 아주 맛이 좋다.특히 정성스럽게 만든 <깻잎지>나, 부드러운 <메밀전명>에 싸서 먹는 맛은 기가막히다.7. 두 번째 코스로 나온 오리샤브샤브는 온전한 한 그릇이라기 보다는 마무리 식사 수준인데, 그 맛이 여간내기가 아니다.오리뼈로 낸 육수에 간장으로 연하게 간이 되어 있는 기본 샤브 육수가 참 시원하고 맛있다.함께 서빙된 채소와 고기가 맛있기는 하지만 샤브로 먹기에는 턱없이 부족한 양이기 때문에 국수와 함께 끓여 국수전골로 먹는 것이 바람직하다.8. 그런데 함께 나온 국수가 비범하다.자가제면한 <우동> 수준의 국수인데, 오동통하면서 쫄깃한 식감이 아주 맛있다.보통 국수전골집은 면 익는 시간을 줄여 회전율을 높이기 위해 얇은 생면을 쓰는 것이 보통인데, 이집은 익는데 최소 15분이 걸리는 우동을 쓴다는 것은 맛을 위한 진심의 표현이라고 생각이 된다.9. 게다가 이집의 반찬들이 아주 맛있다.너무 강하거나 감칠맛이 확고한 것은 아니고 싱싱한 채소들과 정성으로 만들어낸 맛들인데, 연하게 절여진 짠지 종류들이 참 좋다.특히 깻잎과 무를 한켠 한켠 겹쳐 쌓아 만든 정성의 깻잎지는 오리의 맛을 한층 더 살게 하고, 신선하게 맛있는 열무김치, 더덕무침 등 뭐 하나 빠질 것 없이 정갈하고 맛있다.신선한 참나물은 말해 뭐하랴...10. 재료들의 신선함, 반찬의 수준, 자가제면 우동의 정성, 직접 훈제하는 오리의 맛 등 이집 사장님은 요리를 제대로 할 줄 아는 분이고 맛에 대한 진심을 아는 분인 듯 하다.비록 사장님과 음식에 대한 대화는 하지 못했지만, 맛본 음식만으로도 이집의 진지함을 느낄 수 있는 즐거운 한 끼 식사였다.11. 수서지역에는 회식용 식당만 있는줄 알았다.그런데 의외의 장소에서 <맛에 진심>인 식당을 만나니 너무나 행복한 식사가 되었다.PS: 서빙해 주시던 이모님도 참 친절하셔서 감사했다.PS2: 배가 허락된다면 국수 섭취 후 죽도 추가하시는 것이 완벽한 마무리가 된다. 그 정도로 국물이 맛있다.PS3: 애란궁이 위치한 동네를 <궁마을> 이라고 불렀다. 생각보다 유서 있는 마을이다. 궁마을의 유래를 보면 1470년(성종 원년)에 세종의 손자인 영순군(永順君)을 당시 경기도 광주 수토산(水土山)인 궁마을 앞의 대모산(大母山)[293m]에 예장(禮葬)하면서부터 시작되었다. 그 후 1496년(연산군 2)에 무안 대군(撫安大君)과 광평 대군(廣平大君)의 묘소를 광주 서촌 학당리에서 이곳으로 이장하였다. 이에 영순군의 아들 3형제가 수토산 아래에 집을 짓고 삼궁(三宮)이라 일컬었기 때문에 이 마을을 궁촌이라 부르기 시작하였다. 궁마을이 지명으로 정착하게 된 것은 영순군의 차남 청안군(淸安君)의 손자인 아산현감 이인건(李仁健)이 궁촌에다 재실을 지은 후 대대로 제사를 지내게 되면서부터라고 알려져 있다.※ 출처 : [네이버 지식백과] 궁마을 [宮-] (한국향토문화전자대전)",맛있다
351,애란궁,Jessica,"회식이 상당히 많고 대부분 50대 중년 남성들이라 시끄럽고 추운게 아쉽다. 다만 맛없을 수 없는 오리! 와 친절한 직원분들, 다양한 반찬(계속 리필해주심)이 다했다! 주차도 바로앞에 가능. 평범한 오리 구이 식당",괜찮다
352,애란궁,레츠고맹,가족끼리 가기 너무 좋은 분위기!음식도 정갈하고 괜찮아용,맛있다
353,통나무집,•S•,발레 1.,맛있다
354,통나무집,아무거나,고기가 굉장히 부드럽고 신선해요A정식?으로 주문했는데 괜찮았어요생각보다 양이 적지 않더라구요직원분께서 계속 체크하고 구워주셨어요저는 밑반찬 잘 안 먹었지만 같이 간 어른 분들은 모두 반찬도 굉장히 만족하셨어요어른들이 계셔서 고기사진은 못 찍었지만 고기도 도톰해서 식감이 좋았어요가게도 깨끗하고 밖에서 보는 것 보다 넓었어요저희는 룸 예약하고 들어갔는데 공간이 좁지않아서 좋았습니다,맛있다
355,통나무집,K,원래 최애집이라 일부러  멀리서 찾아갔는데 양념갈비 2인분 주문하니 1인분밖에 안된다해서 1인분에 탕하나 주문하려고 했는데 고기는 2인분이상이라 다른 고기 주문하라해서 그냥나옴.시간이 오후 4시 였는데 고기가 벌써 떨어지다니 저녁장사는 안하나.,별로
356,통나무집,Jㅐ,"내곡동에 위치한 횡성한우 집 “통나무집”. 좋은 분위기에서 좋은 가격으로 한우를 먹을 수 있는 곳. 나는 그냥 괜찮다고 생각하는데 아빠가 좋아하는 집이라 불가피하게(?) 자주 가게되는 집. 괜찮다. ‘A정식’, ‘B정식’. A정식은 살치살, 치마살, 갈비살. B정식은 등심. 때문에 섞어서 시키는 게 좋아요. C정식은 여러 종류의 고기가 나오는데 개인적으로 별로라고 생각함. 고기 퀄리티도 좋고 고기도 잘 구워주세요. 밑반찬도 맛있는 편인데 간장게장이 나와서 좋음ㅋㅋ 정식에 나오는 밥 양이 많지는 않기 때문에 후식 냉면까지 꼭 추가로 먹게 되네요ㅋㅋ분위기는 좋은 편!! 가게 앞에 정원이 있는데 예쁘게 잘 꾸며놔서 밥 먹고 잠깐 앉아서 쉬고 가기도 좋아요. 손님들은 거의 다 대가족 단위로 오시더라구요. 발렛도 가능.",괜찮다
357,통나무집,K,"고기 사진이 없어져서 못올림..외관도 내부 인테리어도 넘 아기자기 잘해놓았고,직원분들도 바쁜 와중에 잘 챙겨주심고기 진짜 맛있음 녹아요.. 양념갈비 강추!!양도 많고 맛있고 샐러드도 맛있어요. 근처에 꽃시장 있어서 꽃구경하고 옵니다.",맛있다
358,교수마을초원복집,꺄먀,복사시미 맛있는 데 찾기 힘든데 완전 싱싱하고 맛있었어요!코스로 나온 복불고기 복가라아게 전복버터구이 모두 세상 존맛그치만 가와초회는 간이 좀 셌고 복국 잘하는 곳은 더 찾아봐야겠다는 생각이 들었당 그치만 7만원에 이 퀄리티라니 효도식당으로 강추해용,맛있다
359,홈크랩,jace,킹크랩 배달전문점 많지만 여기가 단언코 최고! 킹크랩을 반반으로 먹어볼수 잇다. 스팀의 오리지널의 맛을 맛보면서 오븐으로 색다른 맛을 본다는 아이디어가 좋다.,맛있다
360,홈크랩,박주혜,맛잇어요,맛있다
361,홈크랩,은지,저는 랍스터 칩스 먹었었는데 바싹아싹 맛있었어요. 여긴 대게 킹크랩 배달전문점인데 포장도 깨끗하게 맛도 깔끔하게 잘 배달되어 왔어요.,맛있다
362,만강,최은창,"병어회와 병어찜을 주로 내는 사교 모임용 식당덕자회는 병어의 뱃살 부분만을 떼어내어 얇게 저며서 큰 접시에 듬성듬성 놓는다. 병어맛을 충분히 느끼기에는 아쉬운 두께와 식감. 그러니 봄동에 싸서 이것 저것 올려 함께 쌈을 싸 먹으라고 시범을 보이고 권하기도 한다. 회뜨고 남은 병어는 큰 사각 냄비에 넣고 고사리와 야채 넣고 육수를 잔뜩 부어 끓여 먹게 나온다. 이건 찜이 아니라 탕이다. 병어탕. 병어를 가장 맛없게 먹는 방법.  이렇게 병어회와 찜 일인에 오만원. 이인분 시킨 사진. 소고기낙지탕탕이. 낙지는 너무 다져서 움직이는 녀석들이 거의 없다. 이건 김에 싸먹게 권한다. 김도 좀 바삭거리면 좋으련만. 눅눅하다. 육만원. 헐. 민어전은 먹을 만하다. 따듯하고 촉촉하게, 고소하게 잘 지져냈다. 팔만원. 방방이 있는 구조라 코로나 시대에 최적화 된 식당. 다른 손님 마주 칠 일이 없어서 접대나 사교모임에 적절한 해산물 식당. 그러나 자기 돈내고 가기에는 좀 아깝다. 더구나 대중교통이 전혀 없는 율현공원 한 가운데 있는, 접근성이 좋지 않은 남도음식을 표방하는 식당. 어떻게 공원 한 가운데 이런 식당이 있을 수 있냐고 물어보니까 대답이 걸작.  이 식당이 공원보다 먼저 생겼다네. 뷰는 좋다. 밤이라 볼 수 없지만.",별로
363,치마오,Pearl,"본격 가라아게동 주문했는데 양이 엄청 많네요. 따뜻할때 바로 먹으면 괜찮은데, 식으면 닭냄새가 약간 올라오긴 해요. 튀김옷이랑 소스가 맛있지만 양도 많고 느끼한 맛도 좀 있어서 혼자는 하나 다 먹기는 힘들것 같네요.가라아게 밑에는 양배추 샐러드가 있어서 채소를 먹을수 있어 좋았고 돈가스는 무난했는데 탄탄면이 맛이 제일 별로였어요. 라면에 스프 반만 넣고 고추장 풀어놓은 맛이라 많이 아쉬웠어요. 예전에 카레를 맛있게 먹은 기억이 있어서 방문했는데 카레나 덮밥종류는 괜찮지만 탄탄면이나 라면종류는 추천 안할것 같습니다.",괜찮다
364,치마오,박길동,수서역 현대벤처빌 안에 있는 일본 음식점깔끔 인테리어는 아니고 약간 아저씨들 갈법한 분위기 ㅋㅋㅋ 하지만 웬만한 요리는 다 맛있답니다! 사장님이 일본분인거같은데(?) 메뉴도 다양한데 다 중간이상의 맛조금만 더 깨끗한 분위기면 더더더 좋을거같은ㄷ 말이쥬 위생이 걱정되는바 맛있지만 괜찮다로 눌러보아요~~,괜찮다
365,치마오,Jejee,학생때 부터 많이 갔던 곳 사장임 인삼도 좋으시고 음식도 맛있고 진짜 숨겨진 맛집입니다,맛있다
366,치마오,HONGURI,없는 메뉴가 없는데다가 맛까지 챙긴 핵핵핵맛집.. 저녁시간대엔 손님이 많아서 20~30분까지도 대기해 봤음. 라멘은 조금 평범하지만 다른 메뉴들은 무슨 메뉴를 골라도 평균 이상은 한다. 동네 소문난 맛집답게 로컬 현지인들이 많이 방문하는 듯.,맛있다
367,치마오,페로브스카이트태양전지,전체적으로 음식들이 매우 기름져요~양은 정말 안섭섭할 정도로 많지만 너무 느끼해요 ㅠㅠㅠㅠㅠㅠ그래도 근처에서는 제일 맛있어요 ㅋㅋ,별로
368,치마오,lsh,"자리가 몇 개 없어 여차하면 대기할 수도 있다. 푸짐한 양과 보장된 맛으로 늘 손님이 한두 명은 있는 곳인데, 일본 교외에서나 보일 법한 감성의 작은 일식 요리집이 뜬금없이 서울의 한 지하철역 상가에 있다. 다양한 정식, 덮밥 메뉴, 김치찜, 면 요리.. 수많은 메뉴를 먹어봤는데, 정말 거의 모든 메뉴가 맛있다. 가정식 느낌이라 집밥을 먹은 듯한 든든함이 있다. 식사하기에도, 한 잔 하기에도 아주 좋은 곳이다. 일일 한정 특별 메뉴도 있고 신메뉴도 이따금 등장한다. 바로 옆 중동고 학생들이 많이 찾아와 '중동 세트'라는 구성도 생겨났다. 언제부턴가 메뉴판에 추가된 '본격 가라아게동'이 인기를 끌어 요즘엔 SNS도 뜨겁게 달구는 중. 단골도 많고 꾸준히 사랑받고 있다. 이런 가게들이 많이들 하는 현금 결제 유도도 왠지 전혀 하지 않는다. 학생 때부터 자주 들렀던 곳이라 내 추억의 일부이기도 한데, 변하지 않고 오래오래 번창했으면 :>",맛있다
369,치마오,mustit_korea,주문실수 가라아게 대참사#본격가라아게덮밥 시켰어야했는데 #메가본격가라아게덮밥 시켰다 깜놀 하루 5개만 판매하는 한정판 #니코미함바그 .#치마오 #대청역맛집 #가라아게 #가라아게맛집 #푸드파이터 #푸파 #덮밥맛집 #도전먹방,맛있다
370,치마오,맛찾소,"<대청역, 치마오>대청역에 들릴일이 있을때 방문하는곳항상먹어보고싶었던 1일5인 한정인 니코미함바그를 드디어 먹어볼수 있었다.정성이 느껴지는 부드러움의 함바그였다.다만 함박스테이크의 한계랄까.. 먹다 보면 소스와 고기의 느끼함에 물리게 된다.맛은 있지만.. 집근처면 몰라도 멀리까지 찾아올맛은 아닌..그렇지만 역시 대청역의 숨은 맛집이라고는 할수는 있겠다.",괜찮다
371,치마오,Pearl,"다이너마이트 카레가 매운 카레인줄알고 주문했는데, 양이 폭탄이라(4인분 수준) 다이나마이트 카레였어요.  카레랑 돈까스 다 무난하게 맛있고 가격도 착한편이에요. 사람들이 김치호루몬 나베, 야끼소바세트 많이 먹던데 다음에 밥먹을 일 있으면 도전해보려고요..^^  여기 주차비는 좀 비싼듯해요.",괜찮다
372,치마오,뭐래요,수서역 현대벤처빌 반찬 재활용하는 곳,별로
373,치마오,JangBaekGyoon,야끼소바와 시원한 생맥이면 말다했지,맛있다
374,치마오,Ethan Chae,"숨겨둔 아지트를 공개한다. 대청역에 있는 대청타워 지하에는 아기자기하고 알찬 상가식당들이 몇 있는데 그 중에 나름의 내공을 자랑하는 이곳. 가격 대비 퀄리티가 상당해서 근처 회사 분들이나 학생들이 자주 찾아오는듯 하다. 닭안심 정식이나 돈까스처럼 밥 정식 메뉴들이 매우 맛있다. 약간 달쪼롬 짭짤하면서도 선을 안넘는 듯한 요리, 어디선가 본듯한 일본의 구석탱이 단골집 같은 분위기를 내는 이곳. 다른 식당들이 닫아갈때쯤 이곳을 찾아 술한잔 하는 것도 좋은 선택이다.",맛있다
375,나미루라멘,소나무,맛있어요. 친구들이랑 같이 나가사끼/돈코츠/매운돈코츠 시킴. 매운돈코츠는 진짜 엄청 매운가보더라구요. 친구가 얼굴이 계속 빨개지고 정신이 혼미해진(?)걸 보면...,맛있다
376,나미루라멘,Jessic,"세상은 넓고 맛집은 많다고 생각해서 재방문하는가게가 극히 드문데, 그중 한곳인 나미루라멘.라멘이 먹고싶어 다시 방문했어요 :)이번엔 나가사키라멘을 먹어야지! 하고갔는데도역시나 원픽메뉴인 매운돈코츠라멘 매운맛으로 선택..나가사키라멘 매운맛 ₩8000+돈코츠 추가 (30g) ₩1000매운돈코츠라멘 매운맛 ₩8000맵기는 3단계로 순한,보통,매운 맛으로 선택가능한데요새 매운음식을 안먹어 그런지 이전엔 맛있게 먹은매운맛이 맵게느껴졌음에도 씁하씁하하며 열심히먹었네요. 라멘양도 많고 국물도 찌인하고 면도 적당히 익어꼬들꼬들한데 두껍지도 얇지도 않아 가면 항상맛있고 배부르게 먹고오는 곳이에요.",맛있다
377,나미루라멘,꺅콩,맛집 불모지 수서에 유일한 맛집인것 같아요 돈코츠라멘 국물이 진짜 진하고 위에 추가할 수 있는 불고기토핑도 1000원밖에 안하는데 양이 꽤 많아요 돈코츠라멘이랑 나가사키라멘인가 라멘 종류가 하나 더있는데 돈코츠라멘이 찐입니다.. 구석에 있어서 아는 사람만 오는것 같은데 더더 흥해서 절대 안없어졌으면 좋겠어요!!,맛있다
378,나미루라멘,Jessic,"원래 문정동에위치해서 점심시간때 종종 방문했던나미루라멘! 직원분들 모두 맛있게 먹는 곳이고 이 근처핫플레이스라 인기가 상당했는데 어느날 없어졌다는 소식을 듣고 망연자실하다 수서로 옮겼다는 걸 알고기쁜마음에 방문해봤어요 :)실로 오랫만의 방문이라 기대가되었는데 모처럼 정말맛있고 배부르게 한그릇 뚝딱한 라멘!!매운돈코츠와 나가사키라멘 매운맛 그리고 각각 불고기추가를 해서먹었는데 양도 엄청나게 많고 맛있고!주문과동시에 면을 삶고 조리를 시작하시는데 면의익힘도 좋고 국물이 정말 끝내줘요!전 매콤한 국물만좋아해서 매운돈코츠만 고집해왔는데이날 처음으로 나가사키를 먹어보니 엄청 깔끔하고확실히 돈코츠랑은 또다른 느낌!중간에 먹다가 취향껏 마늘도 넣을 수있도록 되어있어다양하게 먹을수있어 좋구요. 친절하신 사장님도 그렇고,항상 기분좋게 먹는 곳이라 재방문의사는 yes!!도보로 갈수있는 거리에서 옮겨진게 상당히 아쉽지만그래도 라멘 생각이날때마다 방문할것같아요!",맛있다
379,와후진,호두꽈자,"나카사키 라멘 12000[공간]오래되어 보이는 외관과 내부. 수서에서 실제로 좀 오래되기도 했어요. 수서 쪽에 직장 혹은 거주 오래하신 분들은 대부분 아시더라구요.일본 분들이 정갈하게 서비스 해주시고, 한국어도 잘하세요:)좁은 공간이지만 30명 이상 수용 가능할 것 같아요~점심에는 보통 식사 메뉴 드시고 저녁에는 이자카야로 술 드시는 손님들이 있는데 업무시간이 아주 늦게까지는 아니라 늦게까지 술 드시는 분들에겐 사장님이 동일하신건지 혹은 서로 도와주는 다른 가게인건 지 투다리(?)쪽으로 추천해주시더라구요이 근방에서 주차는 계속 체크를 해서 근처에 주차가 어렵지만 밤에는 할 수도 있긴 합니다^^;[맛]굉장한 맛집은 아니지만, 수서에서 무난하게 먹을 수 있는 맛집을 추천하라면 여기에요.돈부리, 카레, 라멘류 모두 다 괜찮았던 것 같아요.미소라멘이나 돈부리 무난히 다 괜찮았고,특히 이번에 먹었던 나가사키 라멘 괜찮았어요:)비주얼은 제가 사진을 못찍어서 영 아니지만 국물 시원하면서도 괜찮았고, 해산물 등 내용물도 실했어요.안주메뉴도 괜찮았던 걸로 기억해요.이 날 처음 가 본 친구랑도 저녁 무난하게 먹고 왔습니다.일원/수서 쪽 맛집 엄청 찾았지만 찾기 진짜 어려웠었던 저에게 좀 희망을 준 곳(?) 약간 허름한 듯한 매력이 있어서 밤에 술 마실 때도 괜찮을 거 같아요:)",괜찮다
380,와후진,Jurisprudence,그냥 적당한 가격에 적당한 식사가 가능해요 안주는 안 먹어봐서 모르겠어요,괜찮다
381,와후진,샘터지기,"수서에 있는 음식점들 중에맛집이라 할만한 집이 많지 않은데가성비도 제법 훌륭한 집.일본인 주방장 아주머니 두 분이정성껏 만들어주시는 음식들이다.돈까스 종류도 좋고, 덮밥도 좋지만느끼하지 않고 담백한 돈코츠라멘은 최고.차슈가 두조각이라 그게 아쉬울뿐.지인들이 수서에 오면 주저않고 데리고 오는 집인데2만원이면 돈도 적당히 남기고 배불리 먹을수 있음^^",맛있다
382,키와미,lsh,"동네마다 라멘집은 하나씩 있는 추세다. 그러다 보니 적당히 상권과 마케팅에 의존하는 곳도 많지만, 이 집은 아니다. 친절한 서비스는 기본이고 메뉴 구성과 차림새 모두 준수한 퀄리티다. 다양한 메뉴들을 시도해 봤는데, 매번 성공이었다. 사이드 메뉴들도 주메뉴 못지 않다. 라멘의 정체성은 분명하다. 딱 맛있게 짠 국물과 늘 좋은 컨디션의 면발. 완성도 있는 맛을 잘 유지한다. 최근 뭇 라멘집들의 시판 재료 의존이 논란인데, 잘은 모르나 확실한 건, 이 곳 라멘은 한 그릇 비우고 나면 충분한 만족감을 보장한다. 스펙트럼 넓은 맛. 가격은 결코 낮지 않지만 비싸다는 생각은 전혀 들지 않는다. 맥주 한 잔 하기도, 식사하기도 좋은 곳이다.",맛있다
383,키와미,Yumyum,라멘을 좋아해서 이곳 저곳 자주 가보는데 맛있는편에 속했어용ㅎㅎ면 익힘상태가 일단 무엇보다 좋았습니다. 국물은 조금은 더 연구 하시면 좋을거 같지만 그래도 맛있었어요!,맛있다
384,키와미,yes_bo2,6.5/10고명들에 좀 더 힘이 들어갔으면.,괜찮다
385,키와미,이영훈,라멘 맛있습니다 ㅋㅋ 사이드는 돈까스 교자 먹어봤는데 별로였어요,맛있다
386,돈 프리미어,kyo,"대청 토박이 돈까스 매니아입니다지금까지 이런 맛있는 돈까스를 먹으려면 신사역까지 나가서 한성돈까스를 먹는다던가, 강남역에 있는 정돈을 먹어야 성에 찼어요. 하지만 이제 거기까지 나갈 것 없이 여기 돈프리미어로 올 생각입니다. 튀김옷은 바삭하고, 고기도 너무 부드럽게 먹을 수 있어요. 육즙도 끝내주고요. 오픈주방이라 주문 직후부터 요리하시는 모습을 볼 수 있어 신뢰가 갑니다. 아파트상가인데도 이 정도 퀄리티인게 놀랍습니다. 오픈한지 얼마 안되셔서 이제 입소문이 나는 단계인것 같아요. 혼자만 알고 먹고 싶은데, 사장님 대박나시기를 바라는 마음에 리뷰 남겨봅니다",맛있다
387,돈 프리미어,현정석,촉촉한게 맛있습니다. 고기도 두꺼워서 식감이 좋아요,맛있다
388,스미식당,lsh,"수서역의 숨은 맛집. 가게 위치는 역 안에서도 찾기 어려운 위치에 있으나 두 테이블 정도의 손님은 계속 있는 게 포인트. 가격이 저렴하지는 않지만 확실히 좋은 식사를 할 수 있다. 특히 머리를 제거하고도 상당한 크기의 새우가 세 마리 올라간 에비동이 아주 좋았다. 이런 걸 세 개 올려주다니, 정말 최고야. 게 내장 파스타도 맛있었지만, 이건 조금 아쉬웠다. 15000원인데 크래미가 올라간 첫인상이 일단 좀 그랬다,, 차라리 조그만 게 반쪽 올라가는 게 만족감이 나을 듯. 내장 크림소스도 확실히 게 풍미가 있어 좋았지만, 조금 먹다 보면 마늘 향이 너무 세서 게 풍미가 잘 안 느껴진다. 근데 결론적으로는 맛있게 먹었다. 사이드로 주문한 우유튀김도 구색이 좋았다. 만족스러운 한 끼였고 또 오고 싶다. 수서역 상가 안 다른 식당들이랑 느낌이 다른 게 큰 메리트인 듯! 오래오래 있었으면 한다.",맛있다
