,가게이름,리뷰아이디,리뷰,맛평가
455,리엔,Jessica,"와... 정말 너무 맛있던 중국집!!!은근히 맛집이 구석구석 숨어있는 개포4동에 다소 평범해보이는 중국집을 방문.외관은 그저 평범하다.가게앞에는 주차를 서너대 할 수있고 사장님께 말씀드리면인근 다른 곳에도 주차 가능한 곳을 안내해주셔서 좋다.입구에 들어서니 다소 좁은 실내..2층이 분명 있을 것같은데 1층 식당이다.테이블별로 투명 칸막이를 설치했지만 방역에는 다소 허술한 것 같아양해를 구하고 간이 칸막이가 있는 구석자리로 이동!한국어가 능숙하지 않은 몇몇분의 직원이 있어 커뮤니케이션을 확실하게 해야 하는 단점이 있다.주문을 하면 흑임자소스가 과분하게 올려진 ㅋㅋ 샐러드가 나오는데야채가 싱싱하고 소스가 맛있다. 애피타이저로 더할나위없음1. 깐풍기다른 중식집의 깐풍기와 소스, 맛, 크기가 모두 다르다.소스는 약간의 양념치킨 소스처럼 달짝지근하고 매콤하면서 짭쪼름하다.닭은 작지않고 매우커서 정말양념치킨 시킨것같은 착각이온다 ㅋㅋ야채와 곁들여 먹으면 신세계! 방금튀겨서 바삭하고 뜨겁고 맛있다ㅠㅠ2. 탕수육상큼한 소스와 다양한 야채가 곁들여진 탕수육.평범하면서도 작고 얇아서 자꾸 들어간다.3. 삼선짬뽕국물이 상당히 맑고 깔끔하다. 최근 중식당에서 맛보지 못한 깔끔함이었다.풍부한 해산물과 넉넉한 양의 면이 있다.가리비도 많고 버섯도 많고 맛있었다.4. 짜장면짜장면도 맛있다ㅠㅠ 기본에도 충실함이 느껴짐5. 새우볶음밥맛있다맛있다! 평범하면서도 맛있음ㅋㅋ기대를 안했던 탓일까 생각보다 너무나 맛있어서싹싹 긁어 모든접시를 비웠다.정말 만족스러운 한끼였다.주말 1시쯤 도착했는데 웨이팅도 조금있었고 만석이었음사장님도 너무나 친절하시고 음식에 자부심이 느껴지는 곳이었다.추천식당!",맛있다
456,리엔,토템,"가장 애정하는 중식당홍합짬뽕(7천)과 굴탕면(7천)이 제 완전 취저탕수육도 보들보들해서 맛있고(탕수육은 대부분은 상향 평준화 되어 있어 잘 모르겠네요)홍합짬뽕은 대다수 다른곳보다는  미나리를 넣어서 시원한맛을 주는 동시에 칼칼한 맛이 좋습니다굴탕면은 양파가 많이 들어가 달달하면서 미나리, 굴의 풍미가 일품볶음밥은 적당히 무난한편이라는데 전 다른곳보다 여기 볶음밥이 적당히 찰기가 없고 좋은 것 같아요",맛있다
457,리엔,JJICJJA,"동네에 배달이 아니라 요리집은 이게 거의 유일한데 매장도 괜찮은데다 맛도 괜찮음. 추천 : 탕슉, 잡채밥, 짬뽕(엄청 매움)",맛있다
458,연경,꺅콩,중식을 워낙 좋아해서 중식에 대해 평가가 후한 편인데 여기는 진짜 너어무 심각하게 별로였다ㅠ일단 위생부터 -100점...테이블 너무끈끈하고 주방에 거의다 턱스크에 요리 하면서 계속 중국어로 수다떠는데 마스크도 안끼고 음식 하면서 침 다튀었을 생각하니까 먹기 전부터도 비위가 너무 상했다.탕짬면과 팔보쟁반짜장 시켰는데 짬뽕은 밍밍하고 짜장은 또 너무 달았다... 그리고 자극적인맛 좋아해서 웬만하면 잘 모르는데 조미료를 너무 많이 넣었는지 먹다가 입이 텁텁해서 반도 못먹고 남겼다;배달 주문이 많아서 재료 순환이 잘돼서 그런지 돼지고기나 해물맛은 괜찮았다. 계산하고 나가면서 주방에서 담배피는 모습을 보기 전까지는...,별로
459,연경,평냉쟁이,대모산 등산로 입구 아파트 상가 배달을 주로 많이 하는 중식당 고추간짜장 매운것 좋아 하시는 분들에게 딱 좋을듯 면발도 괜찮아요 친절하다 간짜장 9천원 좀 비싸다,괜찮다
460,백년교동짬뽕,Jessica,오랜만에 다시방문한 개포시장 내 짬뽕집소울리스한 동네 가게인지는 알았는데 진지하게 맛을 음미하며 먹어보니 아쉬운 점이 많다.불맛이 나는데 뭔가 인위적이고 맛있는 불맛이 아니다.쌀은 힘이 없고 윤기가 없다.영양이 없어 보이는 가벼운 쌀의 느낌순두부짬뽕밥을 주문했는데 사진과는 다르게 순두부가 시중에서 판매하는 순두부 기준 3분의 1가량 들어가있었음해물은 오징어 뿐이었고 배추가 많았음기름은 그릇을 기준으로 겉에 층층으로 묻어나고..볶음밥도 밥이 맛이없으니 그저 그렇다.식감이 없음새알물만두는 5천원을 받기에는 양도 적고 집에서 흔히 먹는 냉동만두의 맛전체적으로 아쉽다,별로
461,백년교동짬뽕,평냉쟁이,짬뽕 속재료가  배추 당근 오징어 단출 하지만 깊은맛을 낸다 고기 육수 인것같다 면발도 무척 부드럽고 찰기가 있어요,괜찮다
462,봉림장,평냉쟁이,세곡동 동네 중국집 이정도 내공이면 좀더 시내로 나와서 영업하면 대박 날텐데 친절하고 맛있고 가격 착하니 근처 가면 꼭 들리는 곳이다,맛있다
463,봉림장,평냉쟁이,가성비 맛집 11 오픈인데 10시30분에 주문 손님 입장고려해서 식사를 내준다 그리고 단무지 양파 뭘 더 많이 드립니까 라고 물어보는 세심함 맛있고 양많고 만족한 식사,맛있다
464,홍짜장개포점,평냉쟁이,옆집 오천원 백반집 점심시간 웨이팅 때문에 할 수 없이 들어갔는데 해산물볶음밥 생각보다 맛있고 친절하고 가격도 만족했다 근처 들리면 꼭 다시갈집,괜찮다
465,하우츠,말롱,짬뽕수제비 맛나요 밥도 주셔서 말아먹고 뚝딱김치맛집이어서 그런지 다 맛있음,맛있다
466,수타손짜장,평냉쟁이,여기는 짬짜면 짜볶밥 짬볶밥 니뉘어진 그릇에 함께 담아 내는것이 아니라 세트메뉴 짜장면 작은그릇에 볶음밥 작은그릇 그리고 짬뽕국물 맛 좋고 가격 또한 8천원에 두가지를 푸짐하게 먹을 수 있는곳 흡족한 한끼 추천합니다,괜찮다
467,자금성,Saejun,"늘 배달시켜 먹는 동네 중국집. 첫 배달 이후 2년 넘게 계속 시켜먹는 중.중식은 기본적으로 먹고나면 속이 좀 부담스러울 수 있는데, 여긴 전반적으로 음식들이 덜 자극적이라 먹고 나서도 속이 편하다. 탕수육 같은 튀김요리도 잡내 없고 굉장히 깔끔하다.전반적으로 간이 약간 심심해서 그런지 덮밥류는 전반적으로 실망스러운 편. 면요리를 추천한다. 짜장/짬뽕과 탕수육 기본 조합이 무난한 선택지. 고추짬뽕 같은 경우, 굉장히 매우니..주의..",괜찮다
468,자금성,치킨살인마,자랑은 아니지만 저는 볶음밥은 야채가 적고금방 익혀서 꼬슬꼬슬한 느낌을 좋아합니다.성공했어요. 여기 볶음밥이 이렇습니다 +_+,맛있다
469,복이네 짜장 짬뽕이야기,평냉쟁이,세곡동에 동네 중국집 이곳에서 근무 할 당시 점심시간에 자주 이용 하던것 오래만에 찾았더니 주인과 상호가 바뀌었다 면은 여전히 클로렐라 면 신메뉴 불타면 짬뽕의 일종 인줄 알고 주문 했는데 볶음짜장 스타일 엄청 맵다고 일러 주셨는데 그다지 맵지믄 않아요 가성비 굿,괜찮다
470,봉림,소금,"배달 전문 식당인 것 같은데양 정말 혜자입니다소문났으면 좋겠다 싶어요- 유산슬 : 이게 제일 맛있고 좋은 재료도 안 아끼고 넣어주신듯- 짬뽕 : 유산슬과 투탑인듯. 이 역시 좋은 재료 안 아끼고 잘 해주신듯. 미더덕도 있고 기억 안 날만큼 재료 다양히 많이 넣어주심- 쟁반짜장 : 많이 안 달아서 먹기 좋았고 간도 딱 적당했습니다.단, 비벼 나오는거라 좀 불어 왔길래 담엔 그냥 짜장 시켜먹으려구요 짜장에 좋은 재료 들어가는거 많이 못 봤는데가리비, 버섯도 들어가고 제대로 해주셨네요- 탕수육 : 동네 식당 탕수육 잘못 시키면 고기 딱딱하고 누린내 나는데 여기는 탕수육 고기가 부드럽고 누린내도 안 나서 맛있게 잘 먹었어요! 소스의 재료만 조금 아쉬운 정도.- 군만두 : 와 이거 킬링파트입니다ㅋㅋㅋㅋㅋ고기랑 부추가 느껴져요!당면만 들은 군만두에 많이 데였는데 이 식당에서 힐링받고 갑니다!",맛있다
471,서래향,마랑,"어릴때부터 한결같이 짜장면보단 우동이었다.짬뽕에 밀려 이제 파는 곳을 찾기 힘든 중식 우동;;;동네에 우동 사촌쯤 되는 기스면 맛집 서래향 분점이 있대서 가보았다.깔끔한 하얀 국물, 싱싱한 해산물, 얇은 면 다 좋았는데 면에서 중식면 특유의 그 냄새가 쫌 많이 나더라같이 사는 사람은 중식 비빔밥을 먹었는데대구서 먹던것보더 맛났다고",맛있다
472,서래향,박길동,무난하게 맛있는 수서 맛집이에요저는 이번엔 기스면이랑꿔바로우 먹었는데 꿔바로우는 소스가 특이해서인지 좀 별류였어요 ㅜㅜ 기스면은 언제나 맛있 ㅎㅎ여기 직원분들은 저녁때 갈때마다 느끼는 건데 다들 어디로 사라지시는걸까요??? ㅎㅎㅎ 주문벨이라도 있길바래요 ㅋㅋㅋㅋ,괜찮다
473,서래향,Luscious.K,"#수서 #서래향""큼 감흥은 없었지만 회식하기 좋은 넓직한 중식당""1. 수서에서 회의가 잡혀서 방문한 서래향인데 검색을 해보니 서래마을이 본점인 듯 하다. 동네 중국집 수준은 아니고 약간 고급화된 중식당 느낌인데 2층에 넓직한 룸들이 있어 모임하기 좋다.2. 유산슬, 깐풍기, 탕수육, 전가복, 멘보샤를 주문했는데, 맛은 모임 전문 중식당의 맛인데 해물, 특히 알새우에서 잡내가 느껴진다. 탕수육도 일일향의 육즙탕수육 형태의 고기 위주의 탕수육인데 돼지고기 잡내가 살짝 난다.3. 그 중 가장 맛있었던 것은 멘보샤인데, 풍성하게 넣은 새우소가 쫄깃하게 잘 튀겨졌고 간도 간간해 술안주로 제격이다. 다만 빵이 소에비해 얇고 많은 소를 다 익히려다보나 너무 오래 튀겨져 기름기가 너무 많아 식빵의 단맛은 사라지고 기름 쩐 맛이 동반되는 아쉬움이 있다.4. 전반적으로 찾아갈 정도의 맛은 아니지만 근처에서 모임하기는 넓직하고 괜찮은 음식을 서빙하는 곳으로 판단된다. 수서역 근처에서 간단히 식사 하기도 괜찬을 듯 하다. PS: 짬뽕국물이 생각보다 맛있었습니다!",괜찮다
474,서래향,쟌느,사촌동생네 회사에 아가랑 갔다가 회사 바로 옆건물이라 갔는데 대체적으로 무난하고 평타이상이었다. 중식 냉면 시켰는데 더울 때 간 거라서 꽤 만족스럽게 먹었다. 다만 뭔가 특별한 하나는 부족함. 다시 간다면 재방문하기에는 조금 부족한?,괜찮다
475,초원양꼬치,대치꿀꿀이,"가성비 좋은 양꼬치 집이다. 찾아보고 간 곳은 아니고, 양꼬치를 먹으려고 친구들을 만났는데 만나는 지역 바뀌면서 아무데나 들어간 곳! 세명이서 양갈비 2 양꼬치2 꿔버로우1 주문했다사실 살면서 맛 없는 양꼬치를 본 적이 없어서 모르지만,, 맛있었다!!! 근데 양갈비가 조금 작은건 알겠다.. 꿔버로우는 맛있었다!가게 내부가 매우 덥다!! 에어콘이 있긴 하지만 오래된건지 고장난건지ㅠㅠ 선풍기도 많이 있었는데 바닥으로만 바람이 간다 이날이 습도가 높기도 했다일원동에서 양꼬치가 땡긴다면 추천!",괜찮다
476,초원양꼬치,클레어,양꼬치엔 칭따오 ~~ 양갈비 꼬치에 뼈가 붙어서 나오는게 신기했어요. 그 덕에 살은 적은 편이라 아쉬웠지만 중국 손님이 많은 걸 보니까 제대로 하는 집인가봐요. 요리 종류를 못 먹어봤는데 후기가 좋으네요. 한 번 더 가봐야겠어요.,괜찮다
477,초원양꼬치,Gene,"자리는 많지 않고 작은 규모지만 양고기 질이 좋아요~ 질기지도 냄새나지도 않고! 옥수수 온면, 꿔바로우 탕수육도 맛있어요  고급양갈비 추천해요!!",맛있다
478,초원양꼬치,숭:),"일원동 먹자골목에서 최고 좋아하는 맛집중 한 곳! 이번엔 양꼬치, 매운양꼬치, 꿔바로우 2개, 냉면, 볶음밥 주문해서 먹었어요! 이 곳은 정말 모든 메뉴가 맛있는 놀라운 곳...ㅋㅋ양꼬치가 적당히 기름기 붙은거 좋아하는데 여기가 딱이에요! 매운양꼬치도 양념도 매콤하니 맛있어요. 꿔바로우는 이곳의 베스트 메뉴 중 하나에요. 저희는 이번에 작정하고 2개 시켜서 원없이 먹었습니다 ㅋㅋㅋㅋㅋㅋㅋㅋ 양꼬치 집에서 냉면이라니! 볶음밥이라니! 분식집메뉴같아서 놀라는 분들도 계시겠지만 이곳의 식사류는 모두 놀랍습니다...0.0 냉면은 오늘은 조금 쿰쿰해서 점수가 깎였지만 ㅠㅠ 볶음밥이 진짜 신기하게 맛있어요 ㅋㅋㅋㅋㅋㅋㅋ 집이나 분식집에서 팔 것 같은 비쥬얼인데 케챱을 챱챱 비벼먹으면 그 맛은... 끝장이에요 진짜 사진은 오늘과 그 동안의 방문 사진들을 여러장 올려봅니다:)",맛있다
479,라이라이,위장은 돌아오는거야,근처에 이런 중식당이 없다. 단지 이 이유만으로 장사가 되는 곳. 평범한 맛. 평범한 메뉴. 조금만 손님이 붐비기 시작하면 여지없이 드러나는 미숙하고 성의없는 서비스. 맛없어서 못먹겠다 정도의 수준은 아니라는게 그나마 장점.사무실에서 누가 사준다해도 별로인 곳.,별로
480,라이라이,자연산미꾸라지,등심탕수육+x.o볶음밥거의 5년만에 재방문하는 식당가격은 당연히 5년전보다 올랐지만여전히 맛있네요분위기도 고급스럽고 매니저분은 5년전과  같은 분이네요최근 먹은 탕수육 중 하남 탕수육맛집 다음으로 가장 맛있었습니다. 양도 많구요,맛있다
481,라이라이,Jessica,"개포/일원에도 맛집이 없어서 이런 식당 하나하나가 귀함평타만 쳐도 사람들이 자주 찾게된다라이라이는 이 부근의 모든 음식점을 통틀어가장 가족식당에 걸맞는 서비스와가격, 맛을 가지고있다뭐하나 특별한건 없지만 음식을 인원수에맞추어 나눠주시고 찬이 떨어지기전에 갖다주시고룸도 갖추고 있으며 가격도 나쁘지 않다어른들 마음을 저격하는 과일 디저트와 서비스도 포인트 ㅋㅋㅋ",괜찮다
482,라이라이,얌얌,괜찮다-별로 사이...사천탕수육 맛있음. 짜장 짬뽕 괜찮음. 찹쌀탕슈육 노맛.,괜찮다
483,라이라이,Ethan Chae,이 동네에 유일한 고급 중국식이라 잘했으면 좋으련만 실망만 가득,별로
484,피자리움,제이코코,"동네에서 먹을수있는 피자집은 항상 한정되어있었는데(배달전문피자집,프랜차이즈 등등), 색다른 포카치아 피자를 접할수있어서 좋았어요. 소문으로는 타 지역에서 유명했던 피자집으로 알려졌었다고 합니다. 집 근처에서 이런 색다른 맛을 접할수있는게 행운이지요. 언뜻보면 간단하게 만들수있는 피자처럼 보일수있습니다. 그렇지만 바삭한 포카치아 식감을 잘 살리고, 토핑재료의 느낌도 잘 살려서 그 어우러짐에 한번 더 놀랍니다. 개인적으로는 루꼴라랜치와 양송이가 너무 맛있었어요. 한조각에 약 7-8천원 선에 접할수있고, 처음엔 크기가 작아보여 많이 시킬수있지만, 사실 1조각이 1인분같아요. 배가부릅니다. 생각보다 1조각의 양이 크니 주문할때 고려해보시면 좋을것같습니다. 식당공간도 넓고, 주차장도 마련되어있습니다.",맛있다
485,피자리움,박길동,경리단길에서 율현동으로 이사한 피자리움기대하고 갔는데 그냥 무난한편:)무난히 예쁘고 무난히 맛있어요~피자 맛있지만 파스타가 더 맛있는거 같아요!조각피자만 판매중이셔서 다양하게 먹긴 좋으나 양이 좀 아쉬운건 있네요!,괜찮다
486,피자리움,스틱스강에맹세하는맛집,포카치아빵 피자 피자리움!달콤한 랜치소스와 폭신한 포카치아의 피자가 너무 맛있어요! 일반적으로 배달해먹는 피자와는 많이 다릅니다.이태원에서 이사오셨다고 하시는데 동네에 있어서 너무 좋아요... 가볍게 한조각만 포장할수도 있어서 혼자 먹기에도 적당해요.여러종류가 있는데 저는 기본인 루꼴라/양송이/비프갈릭/가지 추천합니다.,맛있다
487,피자리움,행복한 나나나,여기만의 특징적인 피자는 렌치 피자 !!!치즈와 루꼴라가 잘 어우러져 있고 맛이 독특하다 원츄 !! ㅋ소스도 너무 맛있고 상큼 달달한 느낌도 나는..여기는 무조건 렌치피자!!!! 렌치피자로 드세용~ 그리고 또 먹은건 감자피자 ...독특한 시큼한 맛이 있는데 타바스코 소스를 뿌려서 먹으면 더욱 맛있고 시큼한 맛도 느껴지지 않는다.,맛있다
488,피자리움,kc,"맛있다.이태원 경리단길 있을때 방문 했었는데, 없어져서 슬펐는데 다시 생긴걸 보고 방문하게 되었다.매장은 이태원에 있을 때 보다 커졌다.일층 매장에서 식사가 가능하고, 2층에 화장실이 있다.메뉴도 파스타류가 추가되어서 파스타도 추가해서 먹었는데, 맛있었다. 아무래도 위치가 지하철에서 멀다보니 가족단위로 오는걸 예상하신건지 이런 파스타 요리가 추가된거 같다.자가용이 없다면 추천하기 그렇지만, 반대로 가족과 함께 방문한다면 여유롭게 식사할 수 있을 거 같아 추천하고 싶다.",맛있다
489,피자리움,DD,"달콤한 랜치소스와 포카치아 빵이 잘 어울린다.두명이서 3조각 시켰는데 생각보다 양이 많음. 두조각 시켰어도 괜찮았을뻔 했다. 루꼴라랜치, 비프파스트라미는 달달한 랜치소스 베이스인지 비슷한 느낌이었고,  페퍼로니는 좀 더 익숙한 피자맛이다. 개인적으로는 비프 > 루꼴라 > 페퍼로니. 난 개인적으로 너무 맛있었고 리뷰를 쓰는 지금도 또 먹고싶은데, 미국식 피자를 좋아하는 남편은 다시는 안 올것 같다고 함^^;;",맛있다
490,피자리움,이영훈,맥주를 팔지 않는것이 치명적인단점피자 맛있음무겁지도 가볍지도 않게 뱔런스 좋음가격도 나쁘지않은듯,맛있다
491,피자리움,BINI,가볍게 먹는 빵느낌 맛은 보통내부가 협소하다 페스트푸드처럼 셀프서비스고 빨리먹고 나가는 분위기,괜찮다
492,피자리움,unes,"존맛탱,,,,비프페스트라미랑 루꼴라랜치 먹었는데 빵이 식감이 좋고 위에 올라가는 토핑도 아주 맛있다첨에 다른거 주문하려 했는데 오래 걸린다고 루꼴라랜치 권해서 시키고 불평하며 기다렸는데 기대 이상으로 맛났움 ㅠㅠㅠㅠ",맛있다
493,피자리움,hy,이태원에서 경리단길 가는 길에 위치한 피자리움! 여기 피자는 특이해요. 일반 피자들과는 다른 포카치아 빵위에 토핑을 올린 네모난 모양의 피자에요. 유럽의 기차역 점포 가판대에 있을 것 같은 그런 느낌이에요. 매장 분위기가 다른 이태원 피자집들처럼 절대 팬시하고 그러진 않아요. 루꼴라 피자가 제일 인기가 많다고 그래서 먹어봤는데 소스는 달콤하고 포카치아는 포송포송 맛있어서 순식간에 다 먹어버렸어요.,맛있다
494,피자리움,유우우웅,몇 해 전에 처음 소개 받을 때 우리나라에서 처음 모짜렐라생치즈를 쓰는 피자집이라고 들었다.!(나는 철썩같이 믿고있어요!) 랜치소스맛을 잊지 못해 밥먹으러 가기 전에 애피타이저 느낌으로 한 번씩 먹으러 가요...포카치아빵도 빵인데 이 랜치소스 정말 맛있어서 피자에 별다른 토핑이 없어도 완벽하게 맛있어요:),맛있다
495,피자리움,Ssammee,포장해서 바로 먹었는데 세가지 맛 다 짱짱♡먹다 남겨서 놔뒀다가 식었길래 프라이팬에 약한불로 뚜껑덮고 살짝 데웠는데 도우가 바삭해지면서 더존맛맛맛탱!!!!,맛있다
496,피자리움,노니노니,"루꼴라렌치(7000)와 비프파스트라미(7000)을 먹었어요!첫방문이라하면 루꼴라렌치를 꼭 한번씩 권하는데, 꼭 드셔보세요!! 특제 렌치소스라고 하는데 마늘의 감칠맛이 자꾸 피자를 먹게합니다!!ㅠㅠ 그리고 비프 파스트라미는 먹는 도중 씹히는 크림치즈큐브가 맛있고 굉장히 잘 어우러집니다!! 느끼한거 안좋아하시는분은 타바스코 소스 뿌려드시면 정말 잘어울리고 맛잇어요!!도우는 포카치아 빵이에요~ 그래서 약간 피자빵의 느낌이 들기도 합니다. 바삭하고 촉촉하고 폭신한 포카치아가 정말 잘 어울리고 빵 자체도 너무 맛있어요~",맛있다
497,피자리움,춥파춥스,와.. 너무 맛있어서 먹다가 사진 찍는걸 깜빡했어요베스트 셀러인 루꼴라랜치 핏자 진짜 진짜 맛있어요!!비프 파스트라미도 맛있고~!!제가 좋아하는 포카치아 빵이 도우라서 정말 짱짱입니다. 제 인생 핏자❤️,맛있다
498,피자리움,망둥,뭔가 패스트푸드점같은 묘한 불편한 분위기지만피자는 맛있어요ㅋㅋㅋㅋ 원하는대로 골라 먹을 수 있고요!,맛있다
499,피자리움,치아바타,전체적인 분위기는 로마의 피자 패스트푸드점과 비슷한 것 같아요~! 맛있지만 만들어 놓은 제품 데워서 나오기 때문에 살짝 마른 느낌이예요.,괜찮다
500,피자리움,YooYoungSik,스무살시절 사랑했던곳이다.여기서 조각피자를 먹고이탈리아여행가서 피자리움같은 피자를 먹기위해찾아다녔다이제는 맛난곳도 많이생겼지만4.0/5.0,맛있다
501,피자리움,정은,루꼴라 랜치 / 포테이토 & 베이컨,맛있다
502,피자리움,간다쏜다웩,오래된 식당 중 하나죠ㅎㅎ 피자보단 피자 빵에 더 가까워요. 가볍게 골라먹기 좋아요,괜찮다
503,피자리움,betterthanme,루꼴라 페퍼로니 그리고 치즈 올라간 것을 시켰다!신선하고 고급스러운 피자빵 느낌? ㅋㅋㅋㅋ루꼴라는 15분을 기다렸지만 기다린 것을 후회하지 않을 정도로 맛있었다ㅠㅠㅠ심지어 1인당 1개만 시켜 먹어도 어느 정도 배가 차서 아주 가성비가 좋다! 집에 사가고 싶을 정도ㅠㅠ,맛있다
504,피자리움,J,가본지 오래되긴했는데 요새 괜찮은 피자집이 많아서 여기가 딱히 더 맛있는지는 잘 모를 정도. 도우까지 바삭한 피자 좋아할 만한 사람에겐 좋을 듯. 지나가다는 들어가 먹겠지만 굳이 찾아가지는 않는 집.,괜찮다
505,피자리움,이재윤,"비프 파스트라미와 마르게리타 두 종류 시켜서 두 명이서 간단히 먹음.피자는 일반 피자 전문점에서 나오는것과 달리 손바닥 크기로 나온다. 칼집을 미리 넣어놓았기 때문에 부담 느끼지 않고 편하게 먹을 수 있다.비프 파스트라미는 크림치즈가 촉촉하게 포인트인 것 같음.마르게리타는 좀 더 보편적인 맛(?)인것 같다. 치즈피자 답게 치즈 맛이 제대로 난다.개인적 취향으로는 마르게리타가 더 맛있는 듯간은 살짝 센편이지만 괜찮은 편이다.피자 2,3만원대가 대부분이기 때문에 피자가 너무 먹고 싶은데 주머니 사정이 걱정이라면 강추.흔히 아는 피자보다 조금 요리스러운 것을 찾는 사람들도 고려해볼만 하다.가게가 작은 편이니 테이크아웃 하거나 일찍 가는것이 좋다.",맛있다
506,피자리움,쏘이쏘이,예전에 여기 루꼴라 피자에 넘 반해서 심심할 때마다 갔던 것 같아요ㅋㅋㅋㅋ 그 근처에서 과외를 했어서..ㅋㅋ 루꼴라는 정말정말 강추인데 다른 메뉴들은 다양하게 시켜봤지만 쏘쏘였어요그래도 루꼴라는 핵존맛이니까 맛있다로 리뷰남길께용><♡,맛있다
507,피자리움,푸딩,내부도 더럽고 가격 저렴한것 빼곤 두번 갈 이유가 없다,별로
508,피자리움,MadMaxMarMan,대략 5년전에도 있었는데 아직도 있어서 가 봄.렌치쏘오쓰로 만든 대표 메뉴가 아직도 있는데 그 맛이 여전히 좋고 가격도 괜찮았음.벌써 이런 음식점이 추억의 음식점이 되어가다니...ㄷㄷ,괜찮다
509,피자리움,숑아,루꼴라랜치 피자가 제일 맛있!간단히 피맥하기 좋은곳,맛있다
510,피자리움,mine,그냥 다른거먹음 안되고 루꼴라랜치피자 먹으러 가는곳,맛있다
511,피자리움,서울푸디,특이한 사각피자,괜찮다
512,피자리움,youjeong,으아!!!먹고싶다ㅠㅠ맛있음,맛있다
513,피자리움,루루,여기 피자 너무 맛있어요. 훅훅들어감,맛있다
