,가게이름,리뷰아이디,리뷰,맛평가
134,진영면옥,맛되디,"<순수 한식 필드에 흘러 들어온 반가운 젊은 피>독산역 쪽에선 이미 꽤 유명한 평냉집. 타협하지 않은, 준수한 퀄리티의 평양냉면을 선보인다.---------------------------------------------------------------------------------유독 젊은 피의 유입이 드문 필드가 한식, 그중에서도 평양냉면이다. 진입 장벽 자체도 높지만, 제대로 배우려면 최소 5년은 극한의 업무 강도를 견뎌내야 하는 분야이기 때문. 동시에 유명세를 타 성공하기도 쉽지 않은 분야다 보니.. 평냉의 세계에 뛰어드는 젊은 요리사는 정말 별로 없다. 평냉 고수분들이 하나같이 냉부나 마스터쉐프보다는, 한식대첩이 어울리는 지긋한 연령대의 명인들이신 이유가 있는 셈.진영면옥-그런 면에서 참 고마운, 젊은 쉐프의 젊은 평냉집. 인스타그램에서 준수한 신상 평냉집으로 우주옥과 더불어 주가를 올리고 있는 곳으로 특급 호텔에서 냉면을 배운 김상우 쉐프가 작년 칠월 독산역 근방에 오픈했다. 공간-독산역에서 삼십 분 정도 걸으면 모습을 드러내는 작은 공간에 화려함이나 고급스러움은 없다. 반지하라는 위치가 무색하게 냄새나 꿉꿉함도 전혀 없다. 수수함, 담백함만 가득하다. 냉면집 공간다운, 평냉을 닮은 공간.맛본 음식-평양냉면 곱배기(13000)녹두전(7000)평양냉면 곱배기_ 메밀 함량 80 이상의 면 타래 두덩이, 양지 고명 세 장, 무 절임, 배에 곱게 만든 계란 지단까지 13000원 곱배기 한 그릇에 담았다. 단아한 담음새 자랑하는 푸짐한 한 그릇이 보고 있자면 경건함까지 느껴질 정도. 단아함과 푸짐함, 두 마리 토끼를 다 잡은 한 그릇이다.면은 가공시, 향이 금방 날아가는 메밀 특성을 고려해 소량을 빠르게 빻기를 반복해 만든다고. 곡향을 제법 머금고 있고 부드럽게 씹히는 맛이 특히 훌륭하다. 육수와의 합도 좋은 편이니 전반적으로 흠 잡을 데 없는, 잘 만든 면.1등급 국내산 양지로 우려낸 육수도 참 좋다. 얼핏 생수로 보일 만치 잡티 하나 없이 맑은데 품고 있는 감칠맛, 육향은 꽤 진하다. 은밀하게 위대한 육수다.아쉬운 건 살짝 높은 염도.. 그래도 진미평냉이나 을밀대 육수보다 살짝 간간한 정도일 뿐 요즘 많이 보이는, 평냉 육수라고 하기 뭐한 육수 수준으로 짠 건 아니어서 큰 문제는 아니다. 워낙 매니악한 음식인 평냉의 진입 허들을 나름 낮춰 주는 나름 필요악이기도 하고.고명 사단도 빼놓을 수 없지. 아린 맛이나 지린내는 1도 없이, 상큼함과 새쵸롬한 식감만 간직한 무 절임. 쿰쿰고소한 맛, 적당한 씹는 맛으로 무장한 양지 고명. 달콤함과 아삭함 장착한 배. 너 나 할 것 없이 면과 함께 입 속에 넣으면, 그저 눈요기가 아님을 훌륭하게 증명한다.요약하면 가격, 양, 맛 다 좋은 평양냉면. 아주 맛있게 먹었다.녹두전_빠작하고 두툼한 녹두전. 당인동 국수공장 녹두전만큼은 아니어도, 두께가 예사롭지 않고 맛도 그렇다. 기름기가 과하지 않은 녹두전이라 담백한데 이 담백함이 은은하게 고소한 담백함이라 젓가락을 부른다. 풍부한 식감은 덤.그냥 먹어도 맛있고 양파 장아찌 올려 먹으면 더 맛있는 유니크한 녹두전이니.. 다른 건 몰라도 이 녹두전은 하나 주문해 맛보길 권함!서비스_좋다. 기본적으로 접객 담당이신 쉐프님 어머니께서 엄청 친절하시다.총평_모든 사람은 늙고, 언젠가 죽는다. 어느 분야건 후학 양성이 중요한 이유다. 더하여 여기 진영면옥과 우주옥처럼 고령화가 심한 필드에서 묵묵히 후학의 길을 걷고 있는 업장들이 중요한 이유다. 지금도 충분히 빛나는 가게지만 후학이 아닌 선학으로 거듭났을 때의 모습이 더욱 기대되는 곳.준수한 신상 평냉집이자 구로 인근에서 제대로 된 평양냉면 먹기 좋은 곳으로 추천한다.PS)사실 이 집 평냉의 진정 아쉬운 점은 염도가 아니다. 그릇이다. 냉면 그릇으로 얼마 전까지 일반 사기 그릇을 쓰시다 비교적 최근부터 유기 그릇을 쓰기 시작하신 것으로 알고 있는데 이 그릇이 쇠 맛, 쇠 냄새가 희미하게 나는 그릇이라 접시째 들고 국물을 마실 때 확실히 국물 맛을 망친다. 하는 수 없이 수저를 요청드려 떠 마셔야 했다. 평냉 국물을!! 아무래도 말씀 드려야 할 것 같아 식사 마치고 나오자마자 dm으로 알려 드렸음.PS2)별 거 아니지만 대단히 맘에 들었던 건 주문하기 전 주신 면수. 어느 순간부터 면수 만나기가 부쩍 힘들어져 요즘은 이 면수를 만나면 그렇게 반가울 수가 없다.PS3)반찬으로 나오는 백김치 맛은 심심하다.PS4)인근 주민들에게는 평냉 맛집보다는 곰탕 맛집으로 유명한 듯.PS5)상호 진영면옥의 '진영'은 보배 진 자, 맞을 영 자 조합의 단어다. 쉐프님 아버님께서 근처에서 수십년간 운영하신 전파상, '진영전기'의 이름을 이어나가면서 냉면집 오픈을 결심했을 때의 다짐도 잊지 않기 위해! 진영전기의 나아갈 진 자, 영원할 영 자 조합의 '진영'과 음은 같고 뜻만 보배로 맞이한다는 뜻으로 다른 '진영'이라는 단어를 상호로 정하신 것. 실제로 보배와 같은 냉면, 녹두전을 만난 곳이니 어울리는 이름이 맞는 것 같다.",맛있다
135,진영면옥,.,작년 말에 먹었는데 위치는 멀지만 지금까지 먹은 평냉중 가장 맛있었어요 더 널리 알려져야 하는 맛집…,맛있다
136,진영면옥,이매지,"냉면이 맛있다는 소문을 듣고 산책 삼아 가봤는데 맑은 물냉면 육수는 은근 진한 육향이 묻어났고 비빔냉면은 은근 매콤하니 입맛이 돋네요. 바삭바삭 겉바속촉 녹두전, 적당히 도톰하고 부드러운 수육 반접시도 좋았어요. 담음새도 맛도 정갈해서 대만족!",맛있다
137,진영면옥,kjh,최고네요. 모든 메뉴가.,맛있다
138,진영면옥,평냉쟁이,김포공항 부근 호텔 주방 경력 10년 이상과 한식조리장 내공이 평양냉면 한그릇애 담겨져 있다 메밀함량 80 기상에 따라 조금 변동이 있다고 하신다 독산동 4거리 부근 골목 안에 작은가게 대박날 조짐을 느껴본다 친절은 덤,맛있다
139,가산물갈비&백년불고기,빨강코알라,무난한 가격에 무난한 맛,괜찮다
140,가산물갈비&백년불고기,맛난거먹쟈,여자 둘이가서 4인분 시킨 날ㅋㅋㅋㅋ물갈비란 걸 이때 처음 먹어봤는데 신세계엿어요 자극적인 샤브샤브랄까ㅋㅋㅋ국물이 약간 떡볶이국물느낌이 살짝 나요. 거대한 콩나물 더미 깊숙한 안쪽에 등갈비가 잇어서 맛의 재미요소가 있네요. 덜 매운거 시켯는데도 저같은 맵찔이한텐 매웠는데 머리가 핑도는 느낌을 느끼며 계속 먹었네요볶음밥은 비추 별로에요,맛있다
141,가산물갈비&백년불고기,당그니,출장갈 일이 있어 가산디지털단지에 갔다가 네이버 검색을 통해 찾은 곳이다! 리뷰도 좋았고 물갈비라고 하는 음식 자체가 처음이라 경험해보고 싶었다! 사진으로 봤을땐 샤브샤브이려나 싶었는데 비슷한 맛이다. 좀 더 국물이 달짝지근하고 흔히 아는 샤브샤브 육수에 고추장을 더 푼 느낌! 콩나물이 수북하고 샤브샤브 고기랑 갈비도 양은 푸짐한 편! 그런데 인기가 엄청 많은 것 치고는 또 생각나는 맛은 아닌듯! 일행은 맵다고 했으나 평소 매운 음식을 잘 먹는다면 애매한 맛!,괜찮다
142,가산물갈비&백년불고기,혜긍,"물갈비 (15,000)가게가아주넓고 자리가 아주편리하게되어있다.칸막이있어! 단체로오면 회식하기 아주아주좋을듯.메뉴는 물갈비가대표!사실삔한비쥬얼이라 기대도없었는데 한입먹고 나의 오만함에 젓가락을 불끈쥐었다. 간장소스와 고기 콩나물 당면 양념이 아주잘어울려서 만족스러웠다. 근데 보통맛인데 꽤맵다.그래서 난더좋았지만 누군가에겐 위험한음식이다...샤브샤브고기먹고 아래 갈비가 200g또있는데 개인적으로 이건미스였다. 아무튼 아주아주맛있고 술안주로 제격이다.포장도되고 배달도된다. 직원분들이 바쁘게움직이신다..(대단).. 아무튼 또가고싶은맛집!",맛있다
143,가산물갈비&백년불고기,쑤J,양 완전완전 많음! 4인 세트 시켰는데 남자3 여자1명이서 다 못먹고 남겼습니다ㅠㅠ 조금 매콤한 맛의 물갈비 그리고 조금 튀김옷이 두툼하지만 오징어도 두툼해 괜찮았던 튀김 모두 맛있었어요!!!본인이 찾아보고 데리고 간 곳인데 같이 간 사람들 모두 만족해서 뿌듯했던 곳!! 가산디지털단지역 근처 맛집 찾기 매우 힘들던데 추천합니당,맛있다
144,가산물갈비&백년불고기,mustit_korea,요즘 직장인 점심수준.#가산물갈비백년불고기 #물갈비맛집 #가성비맛집 #오늘의점심 #점심추천 #회식장소 #회식장소추천 #존맛,맛있다
145,춘천옥,CDS,처음엔 몰랐지만 두세번 가면서 진가가 나오는 보쌈맛집 야들야들한 고기씹는 느낌이 부드러운 음식점점심메뉴는 좀 비싼듯하나 저녁에 막걸리에 보쌈은 강추,맛있다
146,춘천옥,풀롱옹,맛있어요보쌈이랑 김치 궁합이 아주 끝내줘요김치가 한포기 나오는데 약간 매콤하고 아삭아삭해서 보쌈이랑 너무 잘 어울리네요메뉴는 보쌈 막국수 선지국밥 이렇게 3개 메뉴밖에없어요! 그만큼 자신있는 음식만 한다는 뜻인거같네요 포장해가고 싶을만큼 맛나요!!!,맛있다
147,춘천옥,♡모찌돼지♡,양도 적고 달랑  콩나물국  하나 나오고  맛도 그럭저럭괜히  데려갔다가 식구들한테   욕만  잔뜩 먹었음ㅠㅠ,별로
148,춘천옥,Minu,점심 정식 고기는 저번에먹은거보단 퍽퍽했다 그래도 맛있었음옆테이블에 정식 말고 보쌈 소자 시킨사람은 고기가 탱글탱글해보이는거 보니 정식이랑 고기가 다른걸까? 아님 내접시만 좀 퍽퍽했을까,맛있다
149,춘천옥,Minu,망플리뷰 3.3이라 하마터면 안갈뻔했다 큰일날뻔그냥 존맛임 대 존맛,맛있다
150,춘천옥,GD,예전에는 양은 적어도 맛있었는데 요즘은 양과 맛 모두 실망이네요,별로
151,춘천옥,CDS,보쌈 맛있음,맛있다
152,춘천옥,Jolly,꽤나 맛있는 보쌈집이네요둘이서 보쌈 소자(32000)랑 막국수(9000) 주문했어요 보쌈은 금방 나오는데 막국수는 주문받고 면 뽑는지 시간이 좀 걸리더라구요보쌈은 부위자체가 퍽퍽한 부위였는데 부드럽게 잘 삶아냈어요 단골인듯한 분이 주문할때 부드러운 부위로 달라고 하더군요 그분은 윤기가 좔좔나는 삼겹부위로 받았어요ㅋㅋㅋ 아.. 다음부터는 저렇게 해야겠어요ㅋㅋㅋ 저는 살코기부분 위주로 받았지만 그렇게 퍽퍽하지 않았고 원래 퍽퍽살도 잘먹어서 맛있게 먹었어요 보쌈은 가격대비 양이 적은 편이에요 보쌈김치가 굴도 들어가고 시원해서 꽤 맛있어요 보쌈먹으면 항상 김치 남았는데 여기선 클리어!!막국수는 메밀함량이 높은 느낌이었어요 양념도 과하지 않고 보쌈이랑 조화가 좋네요 일반적인 족발보쌈집 쟁반막국수랑은 확연히 다르고 막국수 전문점에서 먹는 느낌이 납니당 와 진짜 엄청 맛있다 까진 아니지만 이정도 하는곳도 드물기때문에 재방문의사는 50프로정도!!ㅋㅋㅋ,괜찮다
153,춘천옥,Oulth,에어컨도 안시원하고 비싸고 음식은 또 엄청 달아요. 진짜 별로.,별로
154,춘천옥,지리적,글쓴이가 태어나기 전부터 부모님이 오시던 단골집. 고기를 어떻게 삶으시는 건지 잡내가 1도 안 나는 야들야들 맛있는 인생 보쌈집 여긴 레알 김치 맛집이라 겨울엔 김치에 굴이 들어가 있고 여름엔 굴이 빠지는 낄끼빠빠 철저한 김치 맛집. 김치는 마늘 향이 많이 나지만 달작 쌉싸름 진정한 김장 첫날 김치맛이다. 막국수는 특별한 게 없으나 열무 때문에 존맛탱 선지국도 나쁘지 않으나 보쌈과 맥국수 추천해 드리옵니다~ Hmall아울렛 바로 앞에 있으니 쇼핑하다가 당 떨어지면 보쌈 드시길Ps. 김치 맛있다고 페이스 조절 못 하고 막 먹다가 더 달라 하면 돈 내야 하니 조절 잘하면서 드세여,맛있다
155,춘천옥,Woody,가산동 보쌈 전문점 <춘천옥>. 남자 둘이 4.5만원짜리 대자를 거뜬히 다 먹을 수 있을 정도로 양에 비해 가격은 센 편이지만 맛은 훌륭하다. 고기도 당연히 촉촉하고 맛있지만 보쌈김치가 압권이다.,맛있다
156,춘천옥,유키누나,맛있는데 평점이 왜 이렇게 낮은지 모르겠네어릴때부터갔던기억이 있는 오래된맛집개인적으로 돼지고기 잘안먹는데 여기껀 냄새없고 부드러워서 잘먹는다김치가 정말 맛있다 포장말고 거기서 바로 먹어야 제맛임,맛있다
157,춘천옥,슈슈슈,보쌈 맛있고 좋은데 막국수가 거기 못따라가는 느낌. 가격 비싼 보쌈은 빨리 나오는데 막국수만 시키면 참 늦게 나온다.,괜찮다
158,춘천옥,MadMaxMarMan,"식당 전체에서 화장실에서 타이머 맞춰서 뿌리는 싸구려 방향제 냄새가 나서 괴로웠다.수육은 잡내 없고 무난한 맛이지만 고기가 퍽퍽한게 단점,막국수는 너무 매운데다 설탕까지 뿌려놔서 무슨 맛인지도 느끼기 힘듬.무엇보다 방향제부터 어떻게 처리해야할듯.",별로
159,춘천옥,우이리,맛있어요. 김치가 좀 달긴하지만 기분 좋네요.,맛있다
160,춘천옥,CS.I,보쌈의 참,괜찮다
161,춘천옥,조미,★★★★,맛있다
162,대구원조까미생막창누네서네,E.T Jun ,생막창,괜찮다
163,대구원조까미생막창누네서네,추억의도나쓰,"돼지, 소막창을 먹었는데 바삭바삭하니 잘 구워지고 맛있더라구요. 쫄깃쫄깃하고 잡내를 잘 잡은 것 같아요. 주변에 맛집이 워낙 없어서 이정도면 이 동네 맛집이라고 할 수 있을 것 같네요. ㅎㅎ  단, 볶음밥 메뉴가 없는건 좀 아쉬워요. 볶음밥으로 마무리를 하면 딱 좋을 것 같았는데 메뉴에 없어서 오겹살을 주문해서 먹었는데 냉동인 것 같더라구요. 막창에 비해 오겹살은 별로였어요. 잔치국수는 많이 짜더라구요.  막창만 먹을거라면 재방문해서 간단하게 회식하기 좋을 것 같아요.",괜찮다
164,두껍삼,09,"음...솔직히 고기 맛은 그냥 그럼~ 요즘 워낙 맛있는 고기집이 많다보니...일단 고기가 숙성이라 하고 꽤나 비싼데 그렇게 부드럽지도 않고 조금 질긴편이라 가격 값을 못하다는 느낌을 받음 둘이가서 삼겹살150g 3인분(14,000원) 특수부위 130g 1인분(가브리살, 항정살 17,000원) 된장찌개, 칡 비빔냉면, 소주 삼병 딱 8만원 나옴. 삼겹살은 내 입맛에는 별로였고 가브리살과 항정살은 쫀득쫀득하니 괜찮았지만 가격과 양이 헬이였음...된장찌개는 딱히 특징있는 맛은 아니고 비빔냉면 또한 면이 너무 흐물거려 먹는데 식감이 떨어졌음 사실 직원분들이 친절하셨고 가계가 깔끔한편이라 괜찮다를 주었지만 그게 아니였으면 별로 였을 집",괜찮다
165,두껍삼,시매영,회식으로 갔건 두껍삼직영점이라 그런지직원분들이 구워주신 고기 진짜 맛있었어요ㅠㅠ타이머로 재면서구워주시는 고기 최고,맛있다
166,두껍삼,MadMaxMarMan,"다 구워줘서 앉아서 먹기만 하면 되는 곳. 단, 입에 넣어주진 않음.이 근처 삼겹살집 중 맛과 서비스가 가장 뛰어나지만 단점으로 바닥이 기름칠갑이 되어있어 의도치않게 문워킹이 시전 될 수 있으니 유의하십시요.",맛있다
167,두껍삼,MadMaxMarMan,구워줘서 흐름이 안끊겨서 좋음.고기도 맛있음.6인분 먹음. ^_______^강력추천.,맛있다
168,하남돼지집,맛있는거먹는호랑이,조낸맛있음 명이나물이랑 싸먹으면 개꿀맛,맛있다
169,바르미샤브샤브n칼국수,다냥,채소도 신선하고 무제한 샐러드바 음식들도 괜찮더라구요~ 사람 많이 없을 오픈 시간에 갔더니 조용하고 좋았어요 마리오아울렛 3관 12층에 위치하고 있습니다! 가산 아울렛 쇼핑 갈 때 든든하고 건강하게 식사하기 좋았어요,맛있다
170,바르미샤브샤브n칼국수,이홍주,"적은 이용시간, 떨어지는 맛, 불친절한 직원, 샐러드바 접시부터 많이 퍼가지말라고 개 불편한 접시. 별로 정도가 아님",별로
171,바르미샤브샤브n칼국수,Jane Lee,정말최악입니다 별1개도 아까워요 음식은 정말 돈버리고 사먹는 맛이고 직원들 불친절함은 최고네요 한국어 하시는분이 없나? 어머님 아버님 모시고 데려갔는데 정말죄송했어요 그냥 가지마세요,별로
172,바르미샤브샤브n칼국수,뭐가맛나지,샤브샤브는 쏘쏘샐러드바는 별루..,별로
173,뽕나무쟁이족발,mustit_korea,#금천 #독산역 #뽕나무쟁이족발..#반반족발 (3.7) : 족발올라간 테이블은 모두 다 반반으로 드시고있어서 눈치껏 따라 주문. 독산역 일타족발답게 비주얼 훌륭하고 맛도 나쁘지 않고 괜찮아요 :) 근데 여기 족발은 야들야들 쫄깃한 느낌은 아니고 입에서 녹아버리는 껍질 느낌이에요. 고기는 결대로라기보단 약간 고기를 버무려서 섞여있는 느낌이에요..스누피 메뉴추천 : 반반족발..#금천구맛집 #독산역맛집 #스누피먹방 #ㅅㄴㅍㅁㅂ #스누피맛집 #ㅅㄴㅍㅁㅈ #스누피금천 #ㅅㄴㅍ금천 #스누피독산역 #ㅅㄴㅍ독산역 #스누피야식 #ㅅㄴㅍ야식 #스누피족발 #ㅅㄴㅍ족발 #스누피삼멍,괜찮다
174,뽕나무쟁이족발,추억의도나쓰,오픈한지 얼마 안 됐는데 저녁엔 항상 족발먹는 사람들로 북적이네요. 족발은 점심에 팔지 않아서 아쉽지만 식감이 부드럽고 입에서 살살 녹아요. 전 매운 족발이 더 맛있는데 매운 정도가 계속 물을 부르진 않아서 배부른지 모르고 먹게돼요. ㅎㅎ  음식이 깔끔하게 나오는 편이랑 회식장소로도 좋아요. 부대찌개는 국물이 깔끔한 편이고 햄과 면사리도 푸짐하게 나와요. 1인분에 7천원이니 점심식사로 가격대도 괜찮은 것 같아요.,맛있다
175,하남돼지집,추억의도나쓰,"생삼겹살과 항정살 모두 두툼한 두께에도 육즙이 살아있어 넷이서 7인분을 먹었다. 생고기 특유의 부드러움과 쫄깃함이 살아있다~ 명이나물을 반으로 썰어서 주긴 하지만 무한리필해주어 좋다. 와사비를 살짝 얹은 고기와 같이 싸먹으면 배로 맛있다.  와사비와 천연 소금, 명이나물, 직원이 직접 구워주는 시스템 등이 문래동 숙달돼지를 떠오르게 하는 집이다. 숙달돼지가 조금 더 맛있지만 ㅎㅎ 여긴 고기 옆에서 김치를 구워 먹는데 그 또한 별미다!  냉면과 계란찜은 먹을만 했는데 김치볶음 도시락은 후추향이 너무 강해서 다신 먹고싶지 않은 메뉴다. 아쉬운 점은 너무 시끌벅적한 분위기라서 같은 테이블 옆사람 목소리도 잘 안 들릴 정도다.",맛있다
176,천지회관,mustit_korea,"#금천 #독산역 #천지회관..#통돼지김치전골 (0.7) : 독산역 김치찌개 내맘대로 No.1  시큼시큼한 묵은지 베이스에 고기도 숭덩숭덩 많이 들어있고, 라면사리 풀어주면 구냥 끝.#계란말이 (0.7) : 모든 테이블에 계란말이 다 올라가있어요ㅋㅋ 왕계란말이여서 두개만 먹어도 배불러욬ㅋㅋㅋ.스누피 메뉴추천 : 통돼지김치전골, 계란말이..#금천맛집 #독산역맛집 #스누피먹방 #ㅅㄴㅍㅁㅂ #스누피맛집 #ㅅㄴㅍㅁㅈ #스누피금천 #ㅅㄴㅍ금천 #스누피독산역 #ㅅㄴㅍ독산역 #스누피한식 #ㅅㄴㅍ한식 #스누피김치찌개 #ㅅㄴㅍ김치찌개 #스누피사멍",맛있다
177,천지회관,추억의도나쓰,"오픈한지 한달정도 된 고깃집이에요. 매장이 깔끔하고 꽤 넓어서 회식하기에도 좋을 것 같아요. 전 점심식사로 비지찌개, 비빔밥, 김치찌개를 먹었어요. 비지찌개는 2인분 이상 주문 가능하고 1인에 8천원이에요. 비지와 돼지고기가 푸짐하고 피가 쫄깃한 만두도 들어가요. 맵지도 않고 밥 한그릇 뚝딱 하기 좋네요 ㅎㅎ비빔밥도 양이 푸짐하고 참기름 향이 고소하니 맛있어요. 김치찌개는 깔끔하게 먹기 좋아요.",맛있다
178,복숭아꽃살구꽃,김집사,"예뻐보여서 갔는데, 생각만큼 예쁘지도 않았고, 그냥 동네 술집.서비스로 주신 파인애플이 제일 맛있었음.",괜찮다
179,광명대창집,추억의도나쓰,"요즘 레트로 분위기의 대창집이 많던데 여기도 그 중 하나네요. 대창 곱창 막창 다 먹어봤는데요, 양념이 살짝 돼있어서 대창도 느끼하지 않고 고소했어요. 대창이 너무 크면 푸짐해보이긴 하나 너무 느끼한데 여긴 크기도 적당하더라구요. 나머지 메뉴 모두 쫄깃하고 탱탱한 식감이 좋았어요. 꽈리고추도 같이 구워먹는게 독특했는데 맵지 않아서 곱창이랑 먹기도 좋았어요. 곱창과 먹기에는 비냉보다 물냉이 괜찮았고 양볶음밥에 양도 큼지막하니 아끼지 않고 넣어주셨더라구요.이정도면 가격대도 나쁘지 않은 것 같아요.  시장 안쪽에 위치해있어서 공영주차장을 이용할 수 밖에 없는게 좀 불편하지만 대창 먹고싶을 때 꼭 재방문 하고싶은 곳이에요.",맛있다
180,본가집가마솥설렁탕,하루별,"주말이라는 이유만으로 마냥 행복한 주말!☺️☺️쯔양도 다녀갔다는 국밥 맛집, 본가집가마솥설렁탕 금천구청본점 다녀왔어요✅ 설렁탕(1.0)한우 사골과 육우 같은 국내산 소뼈를 이용해서 국물을 내어 만든다고 해요! 김치랑 깍두기는 직접 만드신다고 하는데 역시 설렁탕은 국물이 생명이쥬 국물 맛있어서 더 맛있게 먹을 수 있었고 사골국물 맛이 정말 진했어요술 마신 다음날이라 국물 생각 났는데, 매장 간격이 넓어서 밀집되지 않고 넓은 편이라 더 여유롭게 먹을 수 있었던 곳 주차 공간 넉넉해서 더 편하게 다녀올 수 있었어요밥 양도 정말 푸짐해서 든든히 먹은 곳우거지탕에는 선지가 들어있어서 저는 설렁탕이 더 좋았어요",맛있다
181,두껍삼,인유정,"두껍삼 가산디지털단지역점!위치 : 가디역에서 연결된 건물인 우림라이온밸리 A동 2층◾삼겹살 / 목살 - 비싼만큼 간도 잘 베어있고 고기질도 진짜 좋지만 양이 조금 아쉽다.목살은 내가 먹어봤던것 중 제일 부드럽고, 촉촉했다...◾된장찌개- 우렁이 들어가서 씹는맛도있고 건더기가 많아서 맛있었고 무조건 시켜야함ㅎㅎ◽가격 : 지점마다 가격이 좀 다른데 가디역점이 고기값이 2천원정도 비싸다. 가성비가 좋은 가게는아님▪️분위기 : 다 프라이빗한 룸? 처럼 되어있지만 사람이 많아서 그런지 조용한 분위기는 아님. ▫️서비스 : 직접 고기를 구워주심. 고기를 엄청 얇게 잘라주셔서 삼겹살이지만 금방 익는다.",괜찮다
182,채선당,레이지고,일단 기본적으로 특별한 맛은 없지만 맛있어요샤브샤브에 들어가는 채소가 샐러드바?에 있어서리필해 먹을수 있으나 채소 자투리라고 해야하나돈받고 팔기에는 애매한 아이들이 있어요상했다거나 이상한건 절대 아니에요 맛있어요샤브샤브의 채소를 좋아하는 사람이 보면 천국입니다맛있어요 정말정말,맛있다
183,채선당,레드블랙,채선당 체인점 입니다. 공휴일에 방문해서 한우모듬샤브샤브 1인 19000원짜리 먹었어요. 야채가 무한이라 좋았네요~ 고기육수 해물육수는 조미료 맛이 느껴졌어요. 그래도 근처에서 샤브샤브 먹고 싶으면 갈만 한 것 같습니다.,괜찮다
184,문정곱창,가격표는필수,"순곱창 22 모듬곱창 20 볶음밥 2배고픈 저녁 차타고 지나가다 바글바글해서 들어간 집, 대성공!지난번에 가산에서 싼 곱창 파는곳에 갔다 고무 씹고와서..곱창 대창 막창 염통 모두 쫄깃하고 기름지게 맛났다. 우리가 잘 아는 ""맛있는 곱창"" 정석을 적절한 가격에 보여준다.",맛있다
185,문정곱창,코미,이게 진짜 곱창이구나,맛있다
