,가게이름,리뷰아이디,리뷰,맛평가
411,세라즈피자펍,Amish,"Let me tell you about the best pizza place in Seoul and do I dare say it........Korea!If you had ever visited Neighbourhoods in Sinchon then you would have eaten the amazing pizza made by the old owner and chef Stafford Granger with his lovely wife who takes care of the front of the restaurant. At the start of the new year they sold Neighbourhoods to a new owner and have opened up this restaurant at a new location.Sarah's Pizza Pub is the name of their new location and having learned that Stafford and his wife had a new restaurant we had to go see them and eat their amazing pizza and drink some good craft beers.The interior of the restaurant is really welcoming and a really nice atmosphere set out for a good time of eating and drinking. We learned that Stafford has changed his dough recipe and went to San Francisco to learn how to make a wet dough base for his pizza which is great to see that he is always trying to perfect his own pizza and going and learning a new technique of pizza dough making is very impressive.We ordered the half and half pizza and were glad to see they had our favourite pizza, ""Meat Lovers"" and we were recommended to try a new pizza called, ""Sarah's Pizza"". To go with the food there is a great selection of craft beer from a Korean brewery called The Ranch so we got some delcious beers to go with our pizza.The Meat Lovers pizza comes topped with pepperoni, Italian sausage which are all home made and tastes simply amazing, as well as olives and green peppers and the tomato sauce is also home made. What I really love about the pizza is that they will make as much of the ingredients home made which gives you an all together better taste and quality so you know you're eating good food.The 2nd half of the pizza was Sarah's Pizza which comes with pepperoni, Italian sausage, riccota cheese which is also home made, parmesan cheese and basil. This was a wonderful pizza with the home made riccota adding a nice creamy element that married well with the sausage and pepperoni and definitely a winner.I mentioned before that the dough recipe had changed to a wet dough and it was definitely a great pizza base that was soft and crispy. There were ample ingredients on the pizza and the base held itself well and isn't like a typical base you find at a local pizza joint, it is much better than that.In my opinion this is the best pizza place in Seoul that you should go out of your way to visit.",맛있다
412,아웃백스테이크하우스,슬슬슬,스프 => 샐러드 & 치킨텐더 2개 추가투움바 파스타스테이크 이렇게 시켰는데 3명이서 배부르게 먹고 왔어요:)이인 세트여서 후식도 2개가 나오는데3명이라고 3잔 주셔서 감사합니다:)맛있게 잘 먹고 가요!!,맛있다
413,아웃백스테이크하우스,아뇨?뚱인데요?,맛은 있음 가격대비 그정도 맛은 내야된다고 생각을 함향수 때문에 가끔씩 가기는 좋지만 가격대가 너무 높아 특별한 날 or 할인행사 같은 프로모션이 없으면 자주 가기는 힘듦그정도 비용이면 차라리 가성비적으로TGIF 아니면 서가앤쿡이 조금 더 괜찮다고 개인적으로 생각함,괜찮다
414,아웃백스테이크하우스,뭐가맛나지,아웃백은 언제나 맛있어요빵 리필 느린거빼곤 너무조아요,괜찮다
415,아웃백스테이크하우스,MadMaxMarMan,아웃백 중에선 짜지않고 고기도 맛좋게 잘 구워줌.오늘도 역시나 안정된 맛과 친절한 서비스가 좋았음.이번에도 직원의 실수가 있었으나 이번에도 매니저선생님이 쿨하게 처리해주심.메뉴 두 개가 안나와서 보니 주문 누락이라 그냥 준다고해서 싸나이답게 계산 다 해줌.,괜찮다
416,아웃백스테이크하우스,MadMaxMarMan,"날이 갈수록 그 수가 줄어드는 아웃백. 예전같지 않은 맛과 메뉴의 한계가 큰 이유이다.  얼마전 여의도점에선 불친절한 서비스와 짠 맛에 큰 실망을 금치 못하였으나 예전 아웃백의 향수를 살려 다시 한번 도전하였다.현대아울렛에 있는 금천점은 매장도 깔끔하고 직원분들도 친절하며 무엇보다 맛이 있다.투움바 파스타를 보면 그 매장의 맛을 가늠할 수 있는데 짜지도 않고 적절한 간에 알맞은 면의 익힘이 마음에 들었다.스테이크도 레어, 미듐, 미듐웰던으로 모두 테이스팅을 해분 결과 양호하였다.담당서버분이 실수로 메뉴를 잘못 내왔으나 메니저님이 신속하고 후렉서블하게 처리해주셔서 잘 먹고 나왔다.하지만 메뉴의 한계가 극명하여 좀 지겹기도 하였고 무엇보다 아웃백은 줄기차게 나오는 신메뉴들이 제대로 된 것이 없는 것이 참으로 안타까울 뿐이다.",괜찮다
417,더제이케이키친박스,조은짱,"굉 ~장히 쏘쏘한 파스타집.. 가격이 아주 싼 것 같지는 않은데 빠네에 베이컨밖에 없어 당황했어요 ㅜ 면 익은 상태도 이상하고, 메뉴판 이미지와 많이 다른거 감안하셔야 할거같습니당",별로
418,더제이케이키친박스,코미,가격은 정말 저렴해요하지만 왠지 파스타계의 김천같음,괜찮다
419,롱블랙스푼,인유정,분위기가 정말좋아요!가디에서 분위기있게 데이트할만한곳이 그닥 많이 없는데 분위기가 좋구 맛은 그냥 쏘쏘예용! 가격에 비해서 양도 그럭저럭입니당!그치만 가디에서 이태리레스토랑을 찾는다면 롱블랙스푼으루! 소개팅? 하시는분들도 꽤 보이더라구용ㅎㅎㅎ,괜찮다
420,화덕피자 모넬로,elizabeth,"여기 사장님 정말 친절하시고, 핏자 최고 맛있어요.얇은 도우에 화덕에서 바로 구워주시고 그 위에 루꼴라가 수북히 올라갑니다. 마르게리따랑 루꼴라핏자 추천이고요, 할머니, 할아버지도 좋아하시는 콜라가 굳이 필요없는 담백하고 맛있는 핏자였어요.금천구 최애 맛집이예요. ^^",맛있다
421,화덕피자 모넬로,.,엄 청 맛 있 어 요저 피자 별로 안좋아하는데 엄청맛있어요 ㅜㅜ드실때 꼭 꿀 찍어드세용!,맛있다
422,화덕피자 모넬로,amzzing,가성비도 좋고 맛있어요! 도우가 엄청 쫀득쫀득해요 치즈 좋아해서 그런가 콰트로포르마지오 최고 맛났어요 ㅋㅋㅋ 강추합니당,맛있다
423,매드포갈릭,찻집고냉이,"갈릭스테이크(300g, 59500), 버라이어티 갈릭 라이스(25200), 오렌지에이드.사실 맛 자체는 ""괜찮다""정도인데 음식 외 부가적인 친절, 인테리어, 분위기가 좋아서 맛있다고 체크. 연말 모임, 데이트, 사내회식 모두 추천!버라이어티 갈릭 라이스: 중국집 볶음밥 스타일. 앤초비향이 강렬하진않지만 덕분에 이국적인 향이 느겨져서 좋았다.갈릭스테이크: 매드포갈릭의 시그니처메뉴. 갈린 마늘, 통마늘, 버섯과 양파 등이 고기와 잘 어우러진다. 아쉬운건 고기 질 자체가 그닥 좋는지는 미지수. 크게 기대는 안하시는걸 권장.",맛있다
424,매드포갈릭,러스티네일,맛있어요파스타 2인세트로 먹고왔어요아라비아타 : 매콤하고 면이 부드럽습니다. 소스는 라구 느낌도 나는데 부드럽게 잘 넘어갑니다갈릭스노잉피자 ; 완전 맛있어요. 마늘후레이크에 치즈를 많이 갈아서 넣어주시는데 단짠의 조화가 대박.할인을 잘 먹여서 오면 좋을것 같아요정가는 비쌉니다 ㅠ,맛있다
425,매드포갈릭,이진쓰,"시저샐러드- 로메인?양상추? 통째로 나와서 썰어먹어야 하는데 재미있네요. 맛은 무난한데 소스가 조금 썼어요. 카프레제바질샐러드- 양상추를 퍽! 썬 다음에 바질소스올리고 방울토마토랑 귀여운 치즈덩어리 올려주고 마늘후레이크 뿌리고 바질잎 얹으면 끝. 바질소스가 상큼하니 좋았어요. 느끼하지 않아서 전 이게 더 맘에 들었네요.갈릭페뇨파스타- 시그니쳐메뉴. 잘게 썬 할라피뇨로 조리해서 매콤해요. 짭짤하니 간도 잘 되어있구요~ ㅋㅋㅋ느끼한 거 싫어하는 분들은 즐겁게 먹을 수 있는 맛갈릭시즐링라이스- 이거 꿀맛. 베이컨들어가서 꼬숩고, 버터로 볶았는지 되게 고소한 맛이 매력적이에요. 숟가락을 놓을 수 없다구요! 간도 아주 잘되어있고 밥도 꼬뜰꼬뜰갈릭스노윙피자+꿀주세요- 레전드.이게 뭐라고... 얇은 도우에 아주 짜~끄만한 새우 올라가고 치즈올라가고..마늘 올리고..뭐 그냥 그게 전부인 피자인데 이게 왤케 맛있는거죠...미쳣따.갈릭스테이크- 이거 등심인데 고소하고 좋았어요. 육질 괜찮았고 잡내도 없었어요. 위에 다진마늘 양념?이 엄청 많이 올라가서 스테이크 써는데 막 테이블에 떨어지고 난리도 아니었어요 ㅋㅋ하지만 그  절인?양념한?다진마늘들..너무 맛있고 고기랑 잘어울려서 대만족했습니다...디저트는 아포가토: 개비추~ 세트나 쿠폰 쓰는거 아니면 돈내고 사드시는거 너무ㅜㅠㅠㅠㅜ노노해여그러니까 전 시저샐러드랑 갈릭페뇨파스타 빼고 다 좋았어요 호호!",맛있다
426,라티시크릿셰프,happymc,"진짜 맛있고, 진짜 친절하고, 진짜 분위기 좋아요진짜 최고최고!!!안 가시면 손해가시면 왜 이제야 와봤을까 후회하실거예요진짜 강추!!!!!!!!!",맛있다
427,라티시크릿셰프,happymc,"와~~ 독산동에 프렌치레스토랑이라니분위기도 너무 좋고 맛은 진정 최고!!!!!!!!!!가성비, 가심비 최고입니다!!!!!요즘 저의 최애 레스토랑~♡테이블간 거리간격도 넓어서 식사하기 불편하지않아요꼭 가보세요!!!!",맛있다
428,라티시크릿셰프,세진,근처에 이런 슬로우푸드를 즐길수 있는 식당이 생겨서 너무 좋아요. 음식도 하나하나 강남 레스토랑에 절대 뒤처지지 않고 진심이지 가성비 가심비 모두 최고 입니다. 저는 시간 여유가없어 단품으로 새우마리네 파스타 먹었는데 나중에는 꼭 천천히 코스로 먹으러 와야겠어요. 코스도 기대됩니다. 번창하세요,맛있다
429,라티시크릿셰프,레드블랙,8월에 오픈한 후렌치 레스토랑. #부르고뉴달팽이그라탕 #렌틸과크레송퓌레의가리비 #라따뚜이연어파피요트구이  #푸아그라와트러플로시니쇠고기스테이크 #마늘올리브고추버섯스파게티 #베이컨크림새우스파게티,맛있다
430,마드레파스타,우주,근처에 유일한 파스타집. 고개 하나를 넘어가면 또 다른 파스타집이 있긴 한데 거리가 좀 있다. 같은 건물에 영화관이 있어 젊은 사람들이 주로 들르는 것 같다. 생긴지는 좀 됐는데 동네에서 밥을 잘 안먹어서 이제야 방문..가격은 시내에 비해 아주 싼 편이고 맛도 무난하다. 존맛! 을 외치기엔 좀 부족하고 간이 약간 센 편. 에피타이저로 카프레제 비슷한 걸 내어 주시는데 이것도 괜찮았다. 사장님이나 서버 분들이 매우 친절하셨다.,괜찮다
431,에머이,코미,그냥그래요 고기 잡내 예민한사람은 안맞음,별로
432,에머이,테레사메이,맛잇엇다 가산에서 식사애매할때긋 예은이랑,맛있다
433,에머이,박형호,맛있어용~,맛있다
434,에머이,batzerohi,맛은 쏘쏘하지만 가격에 비에 양이 ....전체적으로 담백할듯싶으면서도 기름진 음식들이었다 ㅋㅋ,괜찮다
435,에머이,진진쓰,"아주 잠시 몸담았던 곳이지만 편견없는후기라는 점!!!!분짜: 롤만두는 아침에 다 튀겨놓구 다시 한번 튀겨져 나가구요 숯불고기도 아침에 초벌해놓고 다시한번 구워서 나가는 방식이예요 그래서 아침일찍! 오픈하자마자 가실수록 더더 맛있습니당쌀국수: 생고기쌀국수 지인짜 맛있어요!!! 마리오아울렛 회장님도 생고기쌀국수만 드셔욬ㅋㅋㅋㅋㅋㅋ 손님들 대부분 양지 혹은 차돌만 드시는데 생고기 안드셔보셨으면 꼭꼭 드셔보세요! 애기들도 먹을수있을정도로 부드러워요 다만 생고기 특유의 약간의 비릿한 향? 이 있을수있습니다!*쌀국수 드시면 면, 국물 1번씩 리필가능해요!*위치상 주말엔 항상 사람이 많고 평일점심(12-14시)엔 웨이팅 있을수있으니 피해가시는게 좋아요!",맛있다
436,에머이,MadMaxMarMan,새해 첫 포스팅을 흡족한 맛집으로!에머이는 지점에 따라 편차가 매우 큰데 가산동 마리오아울렛1관에 있는 이 곳은 매우 맛이 좋음.개인적으로 신사점 다음으로 맛 좋음 다만 간이 좀 강하고 기름짐.,맛있다
437,에머이,lamooo,에머이 소문만 듣다가 첨 가봤는데. 맛있다~!!분짜랑 넴을 다 시켜버렸는데. 분짜안에 있는 튀김만두가 넴이었음 ㅎㅎ 분짜도 괜찮은 편이지만 쌀국수가 더 나은 듯. 베트남 현지 맛을 많이 재현한 것 같다는 동행의 평.. 쌀국수 프랜차이즈 중엔 젤 나은 듯 ?!,맛있다
438,반포식스,하루별,양 정말 푸짐해서 넉넉히 먹을 수 있는 곳 이 건물 중에서 있는 식당 중에서는 그나마 가격대가 좀 있는 편이라 그런지 분위기가 그나마 괜찮은 편직원분들 젊으신 편인데 전체적으로 친절하셨구요 ㅎㅎ가성비 좋아서 세트로 시켜서 먹는 것도 좋더라구요개인적으로 팟타이를 정말 좋아라 하는 편이라서 팟타이를 시켜서 먹었는데 안에 들어있는 새우 통통하니 맛있었어요 팟타이 안에 들어 있는 달걀 증맬로 사랑하는데 달걀 양 좀 적은거는 아쉬웠어요샘플러 시키면 튀김류랑 같이 먹을 수 있어서 더 풍성하게 먹을 수 있구요개인적으로 볶음밥 매콤하니 맛났어용,괜찮다
439,반포식스,코코아코,"망플을 켜도 주변에 검색이 많이 안되네요!ㅜ주변에 대부분 체인 음식점이에요~닭고기팟타이, 양지쌀국수,소고기반미로 주문했어요!반미는 ㅜㅜ..빵이 질기고 퍽퍽했어요!ㅜㅜ팟타이는 쌀국수는 괜찮았고 양이 엄청 푸짐합니당!",괜찮다
440,반포식스,오완규,"금천구에서 제일 깔끔한 메뉴를 유지하고 있는 베트남/동남아 음식점양이 넉넉하고 쌀국수 외의 메뉴들도 충실한 편으로 분보싸오, 나시고랭의 맛이 훌륭하다. 가족끼리 자주 찾아가는 단골집이다",맛있다
441,포베이,유리지아,포베이는 언제나 최소한 맛이 없진 않죠쌀국수도 맛있지만 플래터도 가격대비 괜츈여기 근처 직장인들 와서 코로나 전까지는 점심때 사람 엄청 많았음뭐 먹을지 고민될때 강추요여자는 s시켜도 충분히 배부름,맛있다
442,포보스,MadMaxMarMan,쌀국수 국물은 육수의 맛이 안나고 싱겁고 월남쌈은 그냥 그럼.샘플러가 그나마 먹을만 함. 다시 갈 일은 없을듯.,별로
443,포36거리,KimYe Lim,런치 세트가 양엄청 많고 맛있어요ㅠㅠ갠적으로 분짜는 별로.....,맛있다
444,팔람까오,루카스,"가산디지털단지 방문할 일이 있어서 방문했습니다. 직장인 분들이 점심시간에 끼니를 해결하러 오시는 분들이 많은 것 같았어요. 육수가 특별하다고 홍보가 많이 되어있더라구요.런치세트로 쌀국수+볶음밥 세트, 쏨땀, 새우튀김 이렇게 세 메뉴 주문했어요. 볶음밥은 맛있긴 한데 딱히 태국식이라기보다는.. 뭐랄까요 pc방 음식같은 느낌? pc방음식 진짜 간단한데 맛있잖아요 ㅎㅎ 그런 느낌이었고 쌀국수는 생각보다는 무난하게 맛있었습니다. 가성비는 정말 최고였네요. 쏨땀을 좋아해서 쏨땀도 시켰는데 무, 당근이 좀 더 매운끼가 잘 빠져있었더라면 맛있었을 것 같아요. 쏨땀이 원래 맛이 강한 재료들의 향연이지만 좀 더 조화로웠으면 좋았을 것 같은 느낌이었습니다.3피스 나오는 새우튀김이 정말 탱글탱글하고 맛있었어요 가장 추천드리는 메뉴입니다나중에 찾아보니 똠양쌀국수가 가장 얘기가 많네요. 방문하시면 똠양쌀국수 드셔보시는 게 나을 것 같고,가산디지털쪽이 사실 이렇다할 큰 맛집은 없는지라 이정도면 훌륭한 듯 하여 맛있다 드립니다",맛있다
445,팔람까오,hungereeee,뭐랄까 되게 건강한.. 어머님이 해주신 그런 집밥 맛?이 나는 태국 요리는 또 처음이었다. 색다르고 맛있었음! 가성비도 좋고 양도 많다 (쌀국수가 세숫대야냉면 수준)주인아주머니가 친절하셔서 기분 좋게 식사한 곳 :),맛있다
446,팔람까오,미콩,가산 생활 청산 기념 몇 안 되는 맛집 털이 #2가산에서는 엄청 세련된 맛을 기대하면 안 된다. 좀 의문이긴 하다. 젊은 직장인들이 그렇게 많은데 왜 음식점은 하나 같이 60년 전통 해장국 바이브지? 아무튼 여기도 가게 인테리어나 음식 맛을 봤을 때 그렇게 엄청 세련된 곳은 아니다. 하지만 그 특유의 정겨움과 구수함이 있다ㅎㅎ.여기서는 정말 5번 중 4번은 똠양쌀국수만 먹은 거 같다. 양이 정말정말 많고 여기 들어간 오징어가 그렇게 맛있다... 꼬들꼬들하고 부드럽다. 면도 얇고 부드러워서 후루룩 면치기하기 좋다. 나름 토마토의 시큼새큼함도 잘 느껴진다. 다만 태국식 러버 차장님께서는 레몬그라스가 더 많이 들어갔으면 좋았을텐데 하는 아쉬움을 토로하셨다. 나는 태국 음식 잘 몰라서 그냥 맛있었음ㅋㅋㅋ. 국물이 시원뜨끈(?)해서 딱 해장용으로 좋다. 살짝 달달하기도 해서 어린이 입맛이나 태국식 입문자에게도 좋을듯.가산에 여기랑 똑같은 가게 이름인데 조금 더 최근에 만들어진 것 같은 곳이 있는데 알고보니 여기 2호점이다. 사람은 역시 분위기가 중요한건지? 여기가 조금 더 현지 분위기여서 그런건지? 같은 똠양을 시켜도 뭔가 여기가 더 해장 잘 되고 구수한 듯한 느낌이 난다.고수는 따로 말씀 드려서 추가해야 한다. 직원분들이 그렇게 친절한 느낌은 아니다. 함께 먹는 인원이 다같이 입장해야 착석할 수 있다. 점심시간에 웨이팅은 좀 있지만 회전률이 빨라 금방금방 들어갈 수 있다.,맛있다
447,팔람까오,Jolly,합리적인 가격의 태국음식점!! 가산에서는 나름 인기 많아서 점심때 웨이팅이 길던데 근처에 2호점까지 내셨네요ㅋㅋ 엄청 맛있다까진 아니어도 양 많고 거품없는 태국음식점이라 만족했어요 생어거스틴 같은곳 얼탱이 없이 비싸잖아요 여기는 좀더 현지스러우면서 가격도 합리적이에요팟타이는 무난무난하게 맛있구 한국화된 맛이에요 별 특징없고 다음에 굳이 또 시키진 않을듯.. 똠얌쌀국수가 되게 맛있었어요!! 이거 추천현지보다 레몬글라스 향이 좀 약해서 쉽게 접근할수 있는 똠얌꿍 맛이에요 쌀국수로 먹으니 맛있어요 새우랑 건더기도 푸짐하고 국물이 진해요 중독성있는 맛이에요ㅋㅋㅋ텃만꿍도 사이드메뉴로 꼭 시키시길 강추드려요 가격도 저렴하고 새우가 실하게 들어있어요 안시켰으면 후회했을듯ㅋㅋㅋ 다음번에는 똠얌쌀국수랑 파인애플 볶음밥 혹은 커리를 먹을것같아요 사장님도 친절하시고 점심땐 사람많은데 저녁엔 널널해요 가산에 맛집 찾기 힘든데 종종 갈거같아요,괜찮다
448,팔람까오,프로맛돼지,맛있는 현지태국음식을 생각하고 간다면 분명히 실망스러울 맛. 파인애플볶음밥은 맛있어요. 팟타이는 현지화가 너무 많이 되어서 완전 무난한 맛.. 일부러 찾아갔었는데 그럴만한 맛집은 아닙니다 ㅠ,별로
449,팔람까오,ho,가격 저렴하고 양많고 맛있네요,맛있다
450,팔람까오,난나,"팟타이, 톰양꿍, 파인애플 볶음밥 주문.이제까지 갔었던 그 어느 타이 음식점보다 나음.어쩌면 더 특별할것도 없지만 지극히 평범할수도 있는 태국음식맛.너무 달지도 않고 그냥 딱 맞는 맛.  주문하면서 현지식으로 해달라고 주문.가성비도 그렇고 정말 만족한 식당이다.종종 방문하여 그 집 메뉴를 다 먹어볼 예정.",맛있다
451,호세가,유옐,"콤보세트 B를 시켰다. 세트 B에는 치킨타코 2pcs와 브리또보울(선택으로 비프) , 포크퀘사디아, 감자튀김, 윙이다. 세트구성이 잘되어 있는 호세가. 브리또보올도 먹고 치킨타코와 퀘사디아까지.. 느끼하지않고 소스도 적당히 야채와 잘 어우러져있고, 치킨도 부드럽고 맛있었다. 맥주와 먹기 아주 좋았다.",맛있다
452,호세가,정지혜,"Family set 66,000치킨 타코 4pcs, 포크 퀘사디아, 치킨 퀘사디아, 호세가 보울플레이트, 스파이시 후라이즈, 나초 & 살사멕시코식 비빔밥이라는 호세가 보울플레이트는 말 그대로 안에 노란 밥알이 들어있다.레몬을 짜서 잘 비벼준 뒤 타코에 넣어서 소스와 함께 먹으면 된다.먹기 편한 걸 찾는다면 단연코 추천하고 싶은 포크 퀘사디아, 치킨 퀘사디아옆에 있는 스파이시 후라이즈도 진짜 맛있다. 아래엔 소금이 많이 포진된 곳도 있으니까 조심!이것저것 고르기 어렵거나, 멕시코 음식 처음 접하는 사람들도 거부감 없이 좋아할 것 같고 양이나 구성도 넷이 먹기에 딱 좋은 패밀리세트였다.",괜찮다
453,호세가,,먹을만하다3.5/5,맛있다
454,호세가,찻집고냉이,"콤보 세트 A (포크타코 2pcs + 치킨브리또 + 비프후라이즈 + 윙/ 29,000)멕시코 음식 처음 먹어보는 친구와 함께 방문. 예상대로 고수향따위는 없었고 대체로 무난하게 먹기 좋았다. 그런데 이곳의 치명적인 단점은 모든 음식이 차갑다는 것이다! 윙 외 모든 음식은 내가 음식점에 온건지 배달의민족을 시켜서 80분뒤에 받은건지 모를 정도였다. 음식 자체는 무난한데(무난한 만큼 특색은 없음) 웨이팅 많은것도 이해 못하겠고, 음식 나오는데도 오래걸려, 음식은 차가워서 비추천드립니다. 가산 주변에 먹을데가 없긴한데 그렇다고 여길 선택할 필요는 없다고 생각함. 근처 볼일 있어서 방문했는데 친구에게 미안해져서 다음에는 더 좋은 곳 소개시켜준다고 해서 마무리했던 세드엔딩.",별로
455,호세가,홍초,개인적으로 국내 타코 원탑...많은 타코집을 가본 건 아니지만 여긴 진짜 최고로 맛있다...ㅠㅠ불향 제대로 나고 안에 재료들도 신선 그자체단지 매장이 좁아 웨이팅이 긴게 아쉽지만 배달도 되니까 인근 주민이라면 배달도 추천!!,맛있다
456,호세가,박초희,"✔️위치 : 가산디지털단지역에서 10분쯤 걸어서 도착✔️ 메뉴 : ​비프퀘사디아포크 부리또 보울치킨타코윙 / 감자튀김처음 도전해본 부리또볼부리또볼 아래 밥이 있어서비빔밥 먹듯이 쉐-킷쉐킷해서 먹으면되는데 치즈+강낭콩+돼지고기맛이 없을 수가 없는 조합​가게 직원분 너무나 우렁차고 친절하셨고,테이블 수가 5-6개 밖에 안되서타이밍 잘못맞추면 웨이팅 할 것 같지만그래도 재방문 의사 20000%✔️총평 : 가산동 속 보석을 발견#망고하이 #가산동맛집 #호세가​",맛있다
457,호세가,우이리,레드칠리엔칠라다 13500이게 본고장 맛일까?좀 매콤했어요. 양은 다른 곳에서 먹은거보다 적어 보였는데 다 먹고나니 배가 부르네요. 특유의 멕시코 음식향이나는게 너무  좋았어요. 소스에 나초 찍어먹으니깐 정말 좋네요.,맛있다
458,호세가,미콩,"배달로도 맛있는 멕시칸!◇ 브리또볼*. 체소 가득한 무언가를 먹고 싶은데 동시에 자극적인게 땡길 때. 멕시칸만큼 매력적인 선택지도 없다고 생각해요*. 빈, 치즈, 피코데가요, 콘, 양파, 선택한 닭고기, 그리고 그 위에 고수가 아낌없이 들어갔고 아래에는 쌀이 있어요 너무 부담스럽거나 혹은 너무 밍밍하지 않은 멕시칸 특유의 향이 나서 좋았어요 양도 많아서 배도 부르고!*. 브리또볼로 검색하면 가장 먼저 나오는 ㅋ모모 멕시칸보단 훨씬 나았던 것 같아요..ㅎ*. 가게도 예쁘다는데 기회가 된다면 매장도 방문해보고 싶은 ㅎㅎ",맛있다
459,호세가,YuEunjung,"가디에서 분위기도 좋고 맛도 좋은 식당 찾기 힘든데, 이곳은 정말 기적같이 가산동 골목에 숨어있어요. 음식의 간이 좀 짠 것빼고는(어차피 맥주안주로 먹을 거면 상관 없음) 완벽해요. 전통 멕시칸은 아니고 퓨전에 가까운데, 맥주나 다른 칵테일 등이랑 잘 어울립니다. 특별한 날에 오면 좋을 거 같아요.",맛있다
