,가게이름,리뷰아이디,리뷰,맛평가
1397,소울브레드,찹쌀떡,"완전 궁금했던 소울브레드! 밋업덕에 여러종류를 먹어봤는데, 빵자체도 맛있고 크림이 특히 안느끼하고 맛있어요. 원래 팥을 별로 안좋아하는데도 맛있었던 '앙생크치'. 앙버터 비슷한데 팥자체도 맛있고 조화가 잘되네요. 앙버터 먹을때마다 팥안좋아하는데 맛있다고 말해서 이젠 팥 안좋아한다고 말하기도 민망...하지만 맛있었어요! 인상깊었던건 '쑥크림치즈'에요. 아니 생각보다 완전 쑥...!! 쑥향이 아니라 완전 쑥맛이라 신기했어요. 쑥떡의 크림치즈 버전 느낌. 제일 맛있었던건 상큼했던 ""베베레"". 블루베리, 크랜베리, 키위가 들어갔다고 하는데 상큼해서 크림치즈의 태생적 느끼함(?)을 잡아줘요. 맛있음!! 그리고 무화과덕후라 '무화과생크림치즈'가 들어간 것도 넘나 맛있! 동네에 있다면 매일매일 다른 종류로 먹어보고 싶어요. 빵자체도 맛있고 뭔가 위에 부담이 덜 가서 더 많이 먹을 수 있어요.(,,•﹏•,,)",맛있다
1398,소울브레드,맛난거먹쟈,"처음 여길 찾은 이후로 입맞에 맞아서 지속적으로 방문하게된 빵집- 사실 크림치즈샌딩빵을 많이 찾으시는데 이거말고도 식사빵류들이 정말 맛있어요! 특히 당일 사워도우라면 무조건 드셔보세요. 사워도우의 신세계를 맛보실수 있어요. 처음에는 앙생크치라는 메뉴로 시작하셨어요. 생크림크림치즈+수제팥+브라운치아바타로 이루어져있는 빵인데 정말 오리지널이면서 개인적으로 제일 맛있는거 같아요. 이건 반드시 구매하시면 바로 드셔보시길 추천이에요. 생크림크림치즈가 있기때문에 바로 드시는게 답이에요! 저는 구매후 일반적으로 바로 먹는데 그렇지 않았을경우랑(특히 여름철) 좀 차이가 나더라구요:) 물론 모든 크림치즈 샌딩류를 추천드립니다. 취향에 따라 DIY로 드셔보세요! 이곳의 빵, 특히 사워도우나 호밀백프로빵의 경우 소울브레드만의 '향'이 있어요. 꽤 시큼하면서 이곳의 냄새(flavour)가 느껴지는데 너무 매력적이에요-:D **참고: 추천메뉴-앙생크치, 얼그레이크림치즈+슈퍼그레인바게트, 바게트+녹차크림치즈&어니언크림치즈, 소프트치아바타&베베레생크치, 등등* 크림치즈류 중 흑임자, 쑥, 콩고물 등은 그 달마다 다르게 나와요. 공지를 확인하는게 좋으실듯해요. 계절마다 다르게 나오는 (계절)과일생크치도 매력적이에요. 이곳을 안지는 1년이 넘었는데 작년의 당도높았던 무화과생크치가 이제까지 먹은 중에는 최고였어요. 한입먹고 놀랐던!!",맛있다
1399,소울브레드,준영,"다나 누나가 바리바리 픽업해주셔서 먹을 수 있던 소울브레드! 확실히 명성대로 너무 맛있는데 이번에도 양이 많아서 배가 터질뻔했어요..'o' 저는 앙버터, 크림팥, 바나나고구마가 제일 맛있었어요! 앙버터에서 얼그레이 맛이 난다고 생각했는데 다른 빵의 얼그레이 크림이 묻었던 것 같고ㅋㅋㅋ 크림팥은 빠삭한 빵도 팥도 생크림도 그냥 맛있는거 모아놓은거라 무조건 마싯ㅠㅠㅠ 바나나+고구마는 생소한 조합인데 바나나가 의외로 너무 잘 어울리네요!! 무화과는 아직 당도가 너무 낮아 아쉬웠고 다른 빵들도 존맛까진 아니어도 전체적으로 맛있었어요ㅎㅎ 좀 유명한것들은 다 맛있고 다른 것들은 개인 취향 타는 듯! 레몬크림, 얼그레이 크림, 블루베리 크림 다 너무 맛있었고 여기는 크림이 정말 최고인 것 같아요❤️",맛있다
1400,소울브레드,무나&뎅,와우 징쨔마시따ㅠㅠㅠ 전반적인 느낌은 재료를 아낌없이 때려부은 느낌ㅠㅠ 치아바타나 바게트나 다 하나같이 촉촉하며 맛있고 크림도 아낌없이 넣었다. 전반적으로 크림이 느끼하지않고 딱정당하다. 특히 바게트는 바사삭거리는게 진짜 맛있었다. 다양한 종류를 먹어봤는데 제일 독특하고 맛있었던건 쑥생크림치즈빵! 인생사처음먹어본 맛이다. 쑥떡갈아서 크림빵에넣은 느낌인데 쑥맛이 은은하게 나면서 크림도 부드러워 맛있다. 그리고 키위넣은 과일치아바타도 신박하니 신기했음. 빵은 촉촉한데 크림은 새콤하여 빵과 크림 밸런스가 잘어울렸다. 오레오 크림치즈도 달달하면서 부드러워 독특했다. 팥들어간것도 맛있다. 팥을 직접 쑨듯한데 팥알갱이가 잘살아있고 부드러운 크림이랑 정말 잘어울림.전반적으로 여기는 무조건 크림샌딩빵을 먹어야할듯하다. 정말쏘울있는 쏘울브레드였음.,맛있다
1401,소울브레드,보나보나,"짱짱 좋아하는 칭구가 먹구싶다구 해서 빵셔틀을 자처했다 크크 +_+ 정말 위치 빼고 모든게 다 좋은 소울브레드 ㅋㅋㅋㅋㅋㅋ 몇번을 가도 위치는 익숙해지지를 않네요 하하... 오늘은 브라운치아바타+쌩얼크치랑 블랙번+옥수수생크치 샀습니당!언제 먹어도 맛있는 쌩얼크치 (feat.오레오) 단면샷 넘나 예쁘구여... 얼그레이 자기 존재감 뿜뿜하구여.. 생크림도 안느끼하구 적당히 달구 맛있엉 ㅠㅠ 이 바작한 치아바타와의 조합은 사랑입니당..옥수수 생크치는 부들부들한 블랙번으로 선택! 맨날 바작한 빵만 먹다가 부드러운거는 처음 먹어본 것 같은데 이것도 나름의 매력이 있네용 +_+ 6월 신메뉴 옥수수크림치즈 역시 옥수수가 존재감 뿜뿜합니다근데 생크치를 두개나 샀더니 초큼 느끼했어요 ㅠㅠ 다음에는 1생크치 1크치 해야겠어요+) 사진의 앙버터는 꼼다비뛰드 꺼에용!!!!+) 사장님 너무 멋있으세요 ㅠㅠㅠ 갈때마다 반해요,,, 팬이에용...",맛있다
1402,소울브레드,모이모이짱,"오징어 먹물빵에 치즈와 매콤한 고추양념이라니, 태어나서 이런 빵은 처음이지만 맛있다! 이 빵을 먹다가 블랙번 사이로 치즈가 가득 가득 채워진 크림치즈 빵을 먹으니 새콤달콤매콤 신기했다. 고구마가 든 빵은 생각보다 고구마가 물러 조금 밍밍했다. 다시 가서 다른 빵도 먹어보고 싶다.",맛있다
1403,소울브레드,빵쥬,"빵을 정말 좋아하지만 사실 빵만 먹고나면 속이 좋지만은 않다 그래도 그저 좋아서 생각없이 먹었는데 여기 빵을 먹고나서 이렇게 소화가 잘되는 빵도 있구나 싶다. 알고보니 무반죽 빵이라 글루텐 생성을 막는 반죽법을 쓰신다고...!! 역시 모르고 먹어도 속에서 알아주는군 싶었다빵 자체가 맛있으니 속재료는 개인 취향에 따라 알아서 고르면 될듯 싶다:) 사진속 빵은 흑임자,앙생크림,콩고물 생크림치즈!",맛있다
1404,소울브레드,맛난거먹쟈,사진 찾는게 힘들어 몇개만 첨부하지만 오랜 단골집. 얼마전부터 딱딱한걸 못먹는 관계로 안가고 있었고 꽤 오랫동안 못갔지만 마음속으로는 항상 애정하고 가끔 인사드리러 가는 곳. 한창 갔을때는 일주일 두번이상갔던-맛있어요. 더 이상말해 무엇하리제 빵리뷰를 아시는 분들은 아마 이 리뷰가 신뢰가실듯.,맛있다
1405,소울브레드,루루,여기 사기예요너무맛있어요빵이 진짜... 빵수니 두번 말해 입아픕니다꼭드세요 두번드세요평일에 오픈전인 10시 50분쯤 갔는데도 제 앞에 세분계셨고 빵에 크림/생크치까지 고를수있어서 주문 및 대기시간 길어요. 참고참고그래도 기다릴만합니다,맛있다
1406,소울브레드,Kate,"지금은 들어가긴 했지만쑥크림치즈가 요즘 많이 나오는 쑥 메뉴중에가장 쑥향과 맛이 진해서 좋았다.흑임자도 꼬숩고 맛있었는데쑥크림치즈의 향이 너무 압도적이어서..바게트는 굉장히 딱딱해서고소하긴 한데 교정 중인 나에겐 너무 힘들었다ㅠ버터프레즐은 버터에서 단 맛이 나고,프레즐 위에 올라 간 소금이 짭짤해서 단짠단짠.하지만 다음에 꼭 사먹어야겠단 생각이 들진 않고,그냥 무난무난했다.통밀스콘은 통밀이다 보니 부스러지지만크렌베리가 정말 가득 들어서 좋았다.",맛있다
1407,소울브레드,Jessi,평일에도 가게가 꽉 찰정도로 사람이 많아서 놀랐다. 가는데 오래걸려서 억울한 맘에 왕창 사버렸다^^; 일단 샌딩 샌드위치는 브라운치아바타가 적당히 딱딱해서 아주 맛있다 ㅎㅎ1. 딸기 생크치: 상큼한 맛. 딸기가 아주 큼2. 흑임자 생크치: 딸기생크치보다 더 맛있었다. 흑임자 크림치즈 사올 걸 하는 생각이 들 정도3. 쑥크치앙: 기대한 것에 비해선 평범했음. 쑥크림치즈랑 팥앙금 둘다 달지않아서 그런듯. 차라리 쑥생크치였거나 생크치앙이었으면 적당히 달아서 맛있었을거같다4. 동지섣달깜빠뉴: 기대한거에 비해선 그냥 그렇다. 일단 빵피만 있는 정도로 빵부분이 너무 적다ㅠ 팥도 쪼금 더 달았어도 좋을듯함5. 치아바타: 브라운치아바타는 샌딩해서 맛있었는데.. 그냥 치아바타는... 다시는 안사는 걸로... 사워도우라 그런지 신맛이 너무남,맛있다
1408,소울브레드,보나보나,"재방문한 소울브레드! 평소 같이 빵투어하기 좋아하는 친구랑 두개 사서 나눠먹으면서 좋은 시간 보냈어용 꼭 이 친구에게도 먹어보게 하고 싶어서 먼 길 찾아갔어요 히힛 결과는 대성공 오늘은 생얼크치랑 어니언크림치즈 시켰고, 과일생크치는 집에 싸왔어용! 테이크아웃해서 스벅가서 커피랑 냠냠저번에 얼그레이크림치즈를 먹어봤기 때문에 이번에는 두번째로 궁금했던 어니언 크림치즈! 역시나 맛있구여 ㅠㅠ 양파가 안에 들어 있어서 씹혀용!!! 저는 양파를 좋아해서 극호였어요 :D 살짝 달달한 양파랑 크림치즈의 조화가 진짜 세젤맛.... ㅠㅠ 참 신기한게 크림치즈는 원래 먹다보면 질리거나 느끼한데 솔브꺼는 그런게 전혀 없어요! 그리고 진짜 먹어보고싶었던 생얼크치 생크림치즈+얼그레이크림치즈+오레오=사랑❣️ 일단 얼그레이크림치즈 is 뭔들 오늘도 열일하시구요... 생크림치즈는 오늘도 전혀 안느끼하고 넘나 맛있습니다 ㅠㅠ 빠작한 브라운치아바타와의 조합은 사랑 그리고 오레오도 사랑 ㅠㅠ 크림치즈덕후는 오늘도 심쿵사하고 갑니다.....생과일크치는 안에 딸기가 있어요! 비주얼 압ㅋ승ㅋ 맛도 당연히 맛이 없을수가 없는맛이에요 비록 먹으면서 다 옆으로 삐져나와서 예쁘지는 않지만 ㅋㅋ..... 그래도 되여 삐져나온건 따로 먹어주면 되는걸요아 너무 예찬만 했네... 그래도 넘나 맛있는걸요 크림치즈덕후이신분들은 꼭꼭 방문해보시길 추천합니당 담달에 도로주행 연습하러 가면서 또 가야지+) 내일부터 흑임자크림치즈 개시한다구, 시식해보라고 조금 주셔서 먹어봤는데 이거 정식버전 먹으러 다시 갈 것 같습니다. ㅋㅋㅋㅋㅋㅋㅋ 딱 처음 먹었을때 흑임자 맛이 확 나서 고소한데 흑임자맛만 나면 텁텁했을것을 크림치즈가 나서서 잡아줘요! 그래서 질리지 않고 계속 먹을 수 있음.... 이런 은혜로운 신제품 완전 감사합니다. 너 먹으로 재방문할게 아가얌.....❤",맛있다
1409,소울브레드,보나보나,드디어!!!! 가본 소울브레드 ㅠㅠ 항상 위치가 애매해서 방문을 미루고 미뤘는데 마침 양재 근처에 갈일이 생겨서 가봤습니당  매장은 진짜 딱 동네 빵집 느낌으로 있어요! 작은 가게에서 두분이서 (->세분이래요! 저는 두분밖에 못 뵈었네요 ㅜㅜ) 일하시는데 괜히 정감가고 그런느낌...❤ 저는 처음이라! 일단 크림치즈 샌딩되는 빵 종류를 사봤습니당후기 보면 슈퍼그레인빵에 얼그레이 크림치즈를 제일 많이 시키시길래 저도 한번 도전해봤어요! 하 그냥 존맛... 원래 부재료 그득그득한거 사랑하는데 이건 뭐 부재료가 흘러넘칠 정도❣️ 얼그레이맛이 되게 잘 나서 진짜 맛있었어요! 역시 크림치즈 존맛 빵이 약간 딱딱한데 오히려 그래서 더 좋았어요! 만약 부드러운 치아바타였으면 크림치즈가 이만큼 잘 어울리지 않았을것 같아요. 겉부분이 크런치해서 크림치즈랑 더 잘 어울린 듯 아 존맛.두번째 앙생크림치즈치아바타입니다! 일단 생크림치즈인데도 단맛 많이 안나서 좋았어요! 생크림치즈가 달았으면 느끼하고 달아서 금방 물릴것 같은데 부드럽고 생크림같기도 크림치즈같기도 해서 맛있었어요 (솔직히 생크림 크림치즈가 맛이 없을수가 없음ㅋㅅㅋ) 그리구 팥앙금도 인공적인 단맛은 거의없구 딱 맛있는 팥맛이예요❤ 엄청 달 수도 있는 조합인데 전체적으로 거부감 드는 단맛 없이 만들어주셔서 부담없이 맛있게 먹었던 것 같아요 :)근뎅 반씩 먹고 반은 다음날 먹었더니 생크림치즈가 빵에 다 스며들어 버렸... ㅠㅅㅠ 당일에 드시기를 추천할게요  재방문의사 있음 담주 화욜에 또 가야듸~~~~~,맛있다
1410,소울브레드,Jㅐ,"우면동에 위치한 ""소울브레드"". 생활의 달인에서 무반죽 빵의 달인으로 소개되었어요. 티비에 나온 바로는 글루텐이 많이 적은 빵이래요. 오랜만에 빵투어였는데 먼 걸음이 아깝지 않았던 곳. 가장 맛있었던 빵은 '바게트 - 얼그레이 크림'!! 바삭하면서도 겉껍질은 살짝 질깃한 느낌의 식감이 좋았고 빵이 고소해서 진짜 맛있어요. 얼그레이 크림도 달콤해서 와 정말 맛있게 먹었던 빵. 위에 올라간 해바라기씨도 취향저격. 유명한 '팥빵'의 팥은 호빵 속 팥처럼 많이 달지 않아 담백하고 푸슬푸슬한 느낌이에요. '치아바타'는 정말 쫄기잇해서 뒷맛에서 나는 살짝의 시큼함과 함께 즐기기 좋았어요. 건강한 빵이라는 단어가 가끔은 맛없는 빵을 정당화 시켜주기도 하는데 여기 빵은 정말 맛있기 때문에 굳이 건강한 빵이라는 타이틀도 필요 없을 것 같아요. 추천!! : )",맛있다
1411,소울브레드,suahmom,최고의 건강빵집이에요. 요즘 너무 많이 알려져서 늦게가면 빵이 없어요. 전화로 예약해여해요,맛있다
1412,크레미엘,JaehoLee,"아몬드 크로와상, 쿠인아망, 팡오쇼콜라 먹었습니다.아몬드 크로와상을 많이 먹어봤는데 지금까지 먹어본 것 중 제일 맛있습니다. 나머지는 재료가 상당히 좋고 일반적이지 않다는 생각은 들지만 크게 상위권 빵집들과 구분되는 요소를 느끼지는 못했습니다 (다른 의미에선 맛있다는 의미)비파티세리 정도의 수준을 생각하면 될 것 같습니다.테이크아웃 온리라는 점이 아주 조금 아쉽고 메뉴가 좀 더 다양한 메뉴가 있었으면 하는 느낌이 있습니다.측면에 주차가 가능한 공간이 있으나 (보이는 측으로 빠져나오는) 일방통행로이기에 조금 불편할 수도 있습니다.",맛있다
1413,크레미엘,맛되디,"<몰래몰래 까눌레>미카엘&수정, 파티시에 부부의 정통 프랑스 파티스리.----------------------------------------------------------------------------------그 분 덕분에, 격리 중에도 꽤 여러 번 아침 식사로 즐길 수 있었던 뺑오쇼콜라. 버터리함과 코코아 풍미의 조화가 일품인 초코 브리오슈. 다 좋지만 크레미엘의 시그니처 아이템이라 하면 역시 까눌레. 속은 야들야들하고 겉면은 정석적으로 빠작하다. 그럼에도 겉과 속이 그저 따로 놀지 않고 조화로움까지 갖췄다. 보드라운 속살의 은은한 럼 풍미도 분명해 달게 느껴지지 않고 물리지도 않는다. 사실 프랑스에서 황동틀이 도착하기 전인 오픈 초에는 워낙 구하기가 힘들어(정상적인 직딩이 구하기는 불가능에 가까웠다) 포도를 포기한 여우처럼.. 사람들이 유난 떠는 것일 거라 생각하며 마음에서 지우려 한 적도 있다. 결국 아른거리는 걸 못 참고 일요일에 아침부터 무리한 끝에 어떻게든 구하긴 했지만.그리고 그렇게 구한 까눌레 두 개가.. 심지어 제대로 된 형태로 나오지 않은 불량품이었음에도 지나치게 맛있었던 것. 순식간에 내 마음 속 까눌레 일등을 바꿔 놓을 정도로.. 정말 맛있었다. 그 뒤로 한동안은 일요일마다 기꺼이 줄을 섰던 기억이 난다.다행스럽게도 곧 황동틀이 도착하며 크레미엘 까눌레도 비교적 구하기 쉬운, 대중적인 디저트가 되었고! 현재는 주말 오후 느지막하게 들러도 어렵지 않게 구할 수 있다.   구매 예정이신 분들은 굳이 오픈런할 필요 없이 토요일이건, 일요일이건 느지막하게 들러 보시는 걸 추천.   PS)보통 내 방 침대에서 문 닫고 몰래 먹고, 그렇게 먹으면 정말 맛있는데.. 한 번 씹는 소리가 빠그작!!!! 너무 크게 나서 엄마한테 죄다 뺏겼다..ㅠPS2)발렌타인 시즌 동안에만 만날 수 있었던 초콜릿 트러플도 훌륭했다..!PS3)밀린 리뷰들 조금이라도 줄여 보고자! 한동안만 날림 리뷰어 하겠습니다. 안정되면 전부 보완할 예정!",맛있다
1414,크레미엘,카나리아,"압도적인 맛은 아니지만 맛있어요홀릭분들의 극찬이 끊이지 않는 양재역의 신상 빵집 크레미엘. 평일 날 호캉스 할 때 먹으려고 들러봤는데요. 안타깝게도 가장 궁금했던 퀸아망이 품절이라 크로아상과 뺑오쇼콜라를 주문해봤습니다.크로아상은 바쟉한 식감에 은은한 버터향이 나는 맛있는 크로아상이었구요(하지만 이 정도 하는 곳은 여러 곳 있을 법한 맛이었어요). 뺑오쇼콜라는 신기하게도 정사각형이아니라 스틱같은 느낌이었는데, 이 뺑오쇼콜라가 정말 좋았어요. 빠쟉한 느낌의 페스츄리에 초콜릿 자체가 맛있어서 시너지효과가 제대로 나더라구요.다른 페스츄리맛집에 비해 여기가 왕맛집이다!! 까지는 퀸아망을 아직 안먹어봐서 그런지 잘 모르겠지만 충분히 갈 만한 집입니다. 다음에는 조금 더 일찍 방문해서 퀸아망을 먹어봐야겠어요. 재방문의사O",맛있다
1415,크레미엘,스틱스강에맹세하는맛집,"프랑스 사브레 매장과 같이 있는 크레미엘이에요. 고소한 버터냄새가 입구부터 가득가득우선 기본적으로 크롸상이 5,000원 부터에요. 이제 점점 기본 금액대가 높아지는 것 같네요...그렇지만 따끈한 크롸상 하나 먹으니ㅠ..... 더먹고싶다... 란 생각이 드네요.사브레 구경하는 재미도 있구 빵도 맛있어요. 근데 종류가 좀 더 많았으면 하는 생각이..!",맛있다
1416,크레미엘,Saejun,"집에서 도보로 10분 거리에 이런 베이커리가 오픈했다는 건 정말 축복이다. 얼마 전까지 오픈런 줄이 너무 길어서 방문할 엄두도 못내다가 최근엔 조금 여유가 생겨서 방문했다. 매장으로 들어서면 프랑스 직원분들이 친절하게 반겨주시는데 세련된 유럽스타일 인테리어와 맞물려 순간 마치 파리에 온 것 같은 기분이 든다. 6-7가지 종류의 빵을 파는데, 고민에 고민을 거듭하다가 팡오쇼콜라와 쿠인아망을 주문했다. 가격대는 개당 5천원 대로 높은 편.날씨가 좋아서 바로 앞 양재천에서 바로 빵을 먹어보았다. 팡오쇼콜라를 손에 집으니 페이스트리가 바사삭 거리는게 느껴진다. 그 와중에 안쪽은 엄청 쫀득하고 부드럽다. 다만, 단게 당기던 상황이었는데 초콜렛이 기대했던 것보단 조금 적게 들어있어서 아쉬웠다. 하지만 이 아쉬움은 쿠인아망이 3배 이상으로 채워줬다. 달달함과 바삭함의 극치.한번에 다 먹어버리긴 너무 아쉬워, 반정도 남겨두었다 다음날 아침이 되자마자 바로 먹었는데 역시나 황홀한 맛...다음엔 크로아상 종류를 먹어볼 예정.",맛있다
1417,크레미엘,예랑,"한줄평: 유쾌한 프랑스인 파티시에가 오픈한 양재천의 정통 프렌치 파티세리. 예랑Pick은 크로와상 퀸아망 ❤양재천 근처에 이런 곳이 생기다니  올해초 생겨서 이미 핫플레이스로 자리잡은 <파티스리 크레미엘>프랑스에서 온 커틀러리 등을 판매하는 <사브르> 매장과 함께 있는데, 한쪽에서는 빵굽는 냄새가 솔솔~! 크로와상부터 시작해 뺑오쇼콜라 등 다양한 빵종류를 판매한다.가게 이름이 독특해서 무슨 의미인가 물어봤더니 파티셰님의 이름을 따왔다고 한다. (* 나중에 확인해보니 두 파티셰 부부가 운영하는데, 두 분의 이름이 크리스탈 + 미카엘 이라고 한다)(** 사진 찍으려 하니 손하트 해주시는 분이 미카엘 파티셰님 ㅋㅋㅋ)크로와상팡오쇼콜라까눌레퀸아망이렇게 구매해서 먹어봤다.- 우선 크로와상❤프랑스 파티스리 하면 가장 먼저 떠올리는 메뉴가 바로 이 크로와상. 나는 빵중에서 가장 좋아하는게 크로와상이다. 올드크로와상팩토리가 사라진 이후 마음에 드는 크로와상을 찾아 다녔지만... 쉽게 찾을 수 없었다.일단 크레미엘의 크로와상은 외관부터 합격. 정말 먹음직스러워 보이는 갈색빛깔에 겉의 바삭하고 크리스피한 식감이 침을 고이게 한다!한입 베어먹으니 파스스 부서지는 ASMR이 귓가를 자극. 안은 촉촉하고 맛있다. 버터풍미도 적당히 느껴지고 레이어도 겹겹이 쌓여있다. 겉바속촉은 이럴 때 쓰는 말이다. 정말이지 혼자서 얌냠 먹는 맛이 최고다❤- 팡오쇼콜라❤이곳의 팡오쇼콜라는 조금 특이하게 생겼다. 보통은 직사각형 반죽을 반으로 접어서 안에 초콜릿을 넣은 듯한 모양인데, 여기는 길쭉하게 생겼다. 마치 핫도그 같은 모양이랄까? 페이스트리로 겹겹이 감싼 핫도그 빵에 안에 소시지 대신 초코가 들어간 형태. 바삭함은 당연히 크로와상에서 증명됐듯이 말이 필요없다. 안에 곳곳에 가득한 고체형태 쇼콜라가 달콤한 맛을 더해준다.- 까눌레❤겉은 거무스르하게 빠딱하게 구워진 까눌레. 프랑스 보르도에서 먹던 구움과자라 프랑스 파티스리가 갖춰야할 메뉴 중 하나로 꼽을 수 있다. 까눌레는 바닐라풍미가 느껴지면서 겉은 약간 단단한듯한 바삭함과 안은 찐빵같은 촉촉함이 생명이다. 이 집 까눌레 수준이 꽤 높다. 은은하게 느껴지는 바닐라 풍미가 최고다! 홍차 한 잔이랑 같이 곁들이면 더 맛날 것 같다.- 퀸아망❤비파티세리 퀸아망을 정말 좋아하는데, 여기 퀸아망도 꽤 맛있다. 표면이 카라멜라이즈 되어 있어서 약간 딱딱하다는게 어울리는 식감. 이집 빵들 모두 내가 좋아하는 겉바속촉을 제대로 구현한다. 달달한 맛과 빠닥한 식감, 그리고 버터 풍미가 두말이 필요없다~!insta @yeh_rang #먹히영",맛있다
1418,크레미엘,졸리,요즘 핫한 크레미엘! 휴일 오전에 방문했더니 벌써 솔드아웃된 빵들이 있다대요.. 양재천 거리에 어울리는 예쁜 인테리어와 버터 냄새 솔솔 나는 매장이 아주 인상적이에요~ 어쩌면 인스타 감성 빵집으로 볼수도 있겠어요 ㅎㅎ 크기 대비 가격은 다소 사악한 편이나.. 맛있긴 맛있습니다!! 특히 까눌레는 다음날 먹었는데도 식감이 살아있었어요. 개인적인 베스트는 아몬드 크루아상입니다. 크루아상은 약간 아티장 베이커스 스타일이에요. 가면 프랑스인 파티시에 분도 계셔서 분위기 맛집이라고 하네요,맛있다
1419,크레미엘,둘기,"이주의 감동후기에 뽑혀 잼선물 주신다고 하길래 한달도 안 돼서 재방문 껄껄... 이번에는 종류별로 샀는데 오빠한테 나눔하느라 최애인 퀸아망이랑 지난번에 못 먹었던 까눌레만 먹어봤어요! 근데 역시... 퀸아망이 레전드에요 ㅠㅠㅠㅠㅠ 파사삭하고 부서지는 동시에 달콤하게 퍼지는 설탕에 이어서 느껴지는 촉촉함.. 사랑합니다 진짜로요! 까눌레도 존맛.. 다른 분들이 ""빠작!"" 이라는 의성어를 왜 쓰는지 알게 되는 그런 식감이었어요. 부서짐 뒤에 느껴지는 촉촉함을 살리는데 정말 일가견이 있으신듯 하네요. 그런날이 올까 싶기는 하지만 질릴때까지 계속 갈겁니다 ㅋ.ㅋ",맛있다
