,가게이름,리뷰아이디,리뷰,맛평가
960,마오,Hyuck Jun Kwon,양재천 뚝방길 근처 맛집 중 하나. 특히 북경오리가 일품이다. 주차장도 있고 가게 안고 꽤 넓은편 바쁘지 않은 시간에 방문하면 식사 후 잠시 차를 주차장에 놓고 양재천에서 휴식을 취하거나 근처 카페에 들러도 좋다. (cafe607 추천),맛있다
961,펠리즈차이나,맛집판별가,깔끔하고 맛있어요!탕수육은 진짜 꼭먹어야하는 메뉴!!,맛있다
962,펠리즈차이나,bibi_days,"짜장면과 찹쌀탕수육 주문했습니다. 기본적으로 게살스프, 양배추초절임, 단무지, 자차이, 샐러드가 나오구요.짜장면은 유니짜장스타일로 나오고 간이 잘 되어있었고 찹쌀 탕수육은 소스는 부어져서 나오는데 튀김옷 깔끔하고 바삭하고 쫄깃했어요! 전체적으로 깔끔하고 맛있었습니다.",맛있다
963,펠리즈차이나,olga,"집근처에 새로 생겨서 주말 점심이나 먹을까 하고 갔는데 생각보다 맛있어서 놀랐어요지난주에는 사천탕수육이랑  짬뽕,짜장 먹었는데 재료도 신선하고 죽순이랑 고급진 재료가 아낌없이 들어가서 이번주 또 갔어요가격은 비싸지 않은데 맛은 고급 중국집 느낌?이번주는 게살볶음밥이랑 탕수육 백짬뽕 먹었구요볶음밥에 XO소스도 아낌없이 들어가서 괜찮았어요아마 다음주도 또갈듯동네 괜찮은 식당이 생겨서 정말 좋아요시간 지나도 지금처럼 좋은 재료에 맛 유지됐으면 좋겠어요",맛있다
964,쏭쏭루,투명한반창고,"어딘가의 리뷰에서 중국집스럽지 않은 인테리어라 찾았는데아마 다른가게가 위치해있다가 중국집으로 업종변환만 한 곳 같다.중국집스럽지 않게 아기자기한 맛이 났기 때문.메뉴판은 배달 전문임을 강력하게 보여주고 있으며배달 아저씨들이 종종 자리에서 쉬었다가 배달을 나가곤 했다.주문은 간짜장에 일행은 삼선쟁반짜장, 요리로는 탕수육을 주문했다.단무지와 양파에는 식초가 미리 뿌려나오는데 많이 뿌리더라.+간짜장최근에 간짜장으로 표기된 메뉴중에서는 가장 간짜장 스러웠다.초장의 비율이 많은지 짜장면을 먹은지 3시간이 지나도 갈증이 난다.짜장소스는 간짜장과 비슷하게 하려고 했는지 약간 꾸덕꾸덕한 편이며양파도 새로 넣은 티가 제대로 나 미리 볶은 양파가 아니었다.+탕수육바삭한 식감을 살려 튀겼다는 인상이 드는 탕수육.크게 인상적이다정도는 아지만 바삭한 식감이 소스를 부어도 오래간다.전체 크기는 제각기지만 튀김 옷의 두께와 고기의 크기는 비슷비슷하다.부먹식으로 소스는 뿌려져 나오는데 새콤하고도 달콤하다.",맛있다
965,화차이,songpyun,갑자기 짬뽕이 너무 땡겨서 급하게 찾아거 간 이곳!낙지짬뽕이 시그니쳐같아서 가격이 짬뽕치고 살짝 비싸지만 시켜봄(사진은 곱빼기 시켜서 11000원이었음)낙지가 엄청 실한게 나오고 국물이 안짜고 깔끔해서 진짜 너무 좋았다. 면 꼬들한것도 정말 딱 맞음!회사근처에 있는 집이라 종종 생각나면 찾아갈듭,맛있다
966,화차이,호두꽈자,"점심시간에 갔더니...웨이팅이 있어서 깜짝 놀랐네요..직장인들이 많이옵니다 ㅠㅠ이 곳은 중식이지만 퓨전 느낌이 좀 나네요.중식 먹기 싫은데 단체로 와서 끌려온다면, 가지덮밥이나 수제비짬뽕과 같이 약간 퓨전 한식? 같은 느낌의 음식이 있어서 먹을 수 있어요.수제비짬뽕 맛있고, 가지덮밥 괜찮았어요.유니짜장은 패스하고 쟁반짜장을 먹어봤는데 짜장은 좀 달아요 ㅋㅋ맛있긴 한데 애기들 좋아할 맛?멀리서 올 건 아니고; 그냥 올 일 있어서 지나가다 들린다면 괜찮아요.",괜찮다
967,초류향,알초코,2019년에 처음 가본 중국음식점인데 간판이름이 세번째 바뀌었다. 주방장분이 바뀌셨는지 그전보다 훨씬괜찮아졌지만 와 ~~~ 맛있는 중국집에 견주면 맛있다고하기에는... 삼선간짜장과 탕수육 먹었는데 탕수육이 인상깊었다.요즘 유행하는 찹쌀탕수육st인데 안에 고기는 큼직굵직하고 튀김피를 얇게해서 베어무는 순간 육즙이 터진다하지만 나는... 고기가 얇고 쫀득쫀득한 찹쌀튀김피가 더 많았으면 하는 주의라 조금 아쉬웠다. 탕수육킬러인데 한 두점 먹었나..... 재방문은 아마 회사근처라 손님접대로 자주올거같다.다른메뉴도 먹어봐야지 fin.,괜찮다
968,홍차우,으네미*.*,먹을 것 없는 포이사거리에서 가기 좋은 중국집! 깔끔한 맛과 정갈한 플레이팅의 짬뽕은 가끔씩 생각난다!둘이서 나눠먹을 경우 미리 말씀 드리면 반반 나눠주시기도 한다.,맛있다
969,상지원,라일,굴짬뽕밥 주문해봄야채가 그득하고 양이 많아서 만족함같이간 일행은 탕짜면을 주문했는데 양이 많고 가성비가 훌륭했음,괜찮다
970,최고집손짬뽕,JJICJJA,여기 굴짬뽕 진짜 맛있어서 자주 왔었는데 어느날 부터 주방장이 바꼈는지 맵기만 해서 안오다가 오늘 진짜 오랜만에 다시 방문. 수타면이라 면발이 좋음. 짬뽕 - 평범. 간짜장- 양파만 가득이지만 나름 괜찮음. 탕수육 - 튀겨진 고기는 괜찮은데 소스가 시기만 하고 단맛도 없고 완전 맛없음. 나중엔 짜장 소스에 찍어먹다가 결국 남김.,별로
971,용짜장,알초코,"병원갔다가 오전진료마감되버려서 터덜터덜 내려가다가건물 1층 중국집 메뉴에 탕짜면 보고 홀린듯 들어가버렸다짜장면은 첨맛은 옛날 트럭이나 옛날짜장,우동집에서 파는 면맛인데 먹다보니 중국집에서 시켜먹는거랑 비슷했다고춧가루 뿌려먹어도 맛나고탕수육에 넘맛있었다찹쌀이 있어서 일반 탕수육이랑 꿔바로우 어느 중간??그리고 탕짜면은 부먹으로 나오는데시간이 좀 지나도 바삭바삭했다 ㅎㅎ재방문의사 있음fin.",맛있다
972,랑랑,파토,간짜장을 한번 시켜봤더니 실패.양파가 잔뜩 들어가있는건 뭐 나쁘지 않은데너무 덜 볶아서 거의 생양파를 춘장에 섞어서 먹는듯 했음...그날만 그랬으려나.짜장 드실거면 그냥 시그니처인 유니짜장 드세요. 그건 맛있음.,괜찮다
973,이가네양꼬치,고균,양재시민의숲역 바로 앞에있는 이가네 양꼬치집이에요~ 매장도 굉장히 넓어서 언제든 오셔도 다 수용할 수 있을만한 크기인거같았어요~ 저희는 양왕꼬치를 주문! 1인분에 17000원입니다! 굽는 기계에 올려놓고 잠시 대화를 나누며 기다렸어용~ 아무래도 양꼬치는 굽는데 조금 시간이 걸리다보니 천천히 기다렸습니당~ 자리도 요리조리 옮겨주면서요~ 고기도 되게 부드럽구 꼬치에서도 쑥쑥 잘빠져서 편하고 맛있게 잘먹었어용 그 양꼬치찍어먹는 가루 그거에 찍어먹으면 존맛 ㅎㅎㅎ 기분좋게 먹은 양꼬치였네요~,맛있다
974,이가네양꼬치,냠냐룽,"점바이점 편차가 0에 가깝다는 이가네양꼬치입니다! 여긴 그냥 너무좋습니다.. 층고가 낮아서 정말 매우 시끄럽다는 단점이 있지만, 그걸 모두 커버할만큼 맛이 좋습니다. 가지요리는 무조건 드시구요.. 양꼬치는 제일 비싼거 2~3종류 섞어서 시키시면 됩니다.. 고량주도.. 빼놓을순 없겠죠.. 취향껏.. 드셔요..",맛있다
975,이가네양꼬치,장은영,"양등심 꼬치가 엄청 크고 두툼해요~ 그래서 미리 초벌을 해서 가져다 주시더라고요~많이 먹으면 질리는 두께..가지튀김과 볶음밥, 온면 요렇게 먹었는데, 볶음밥이 가격대비 양이 너무 적었어요.온면은 마무리로 속풀이 하는데 딱이었고요. 조금만 친절해도 재방문 하고 싶었을 가게.",맛있다
976,이가네양꼬치,Saejun,매번 출근길에 앞만 지나 다니던 집앞 가게가 맛집일 줄이야..지인의 추천으로 함께 방문. 양갈비와 양꼬치 메뉴가 다양하게 구비 되어있다. 요리같은 경우 꿔바로우와 가지요리 등 여타 양꼬치 집에서 맛볼 수 있는 기본요리들도 모두 판매 중. 양갈비보단 꼬치메뉴가 맛있다는 지인의 추천으로 왕꼬치구이와 기본양꼬치를 반반씩 주문했다. 왕꼬치는 기존 양꼬치 대비 2-3배 정도 큰데 미리 초벌구이가 되어서 나온다. 확실히 더 담백하고 감칠맛이 도는 것이 특징. 여기에 이따금씩 기본 양꼬치를 섞어 먹어주니 균형이 좋았다.저녁시간에 자리가 없을 정도로 손님이 꽉 들어차던 이곳. 다음엔 요리 메뉴도 한번 먹어봐야겠다.,괜찮다
977,이가네양꼬치,진리지안,"주문 강요 좀 그만 하셨으면,, ㅠ ㅠ 밑에 있는 몇몇 리뷰처럼 1) 왕양꼬치를 주문했더니 양갈비 주문 강요 2) 고민하다가 그냥 양꼬치 먹기로 해서 다시 왕양꼬치 주문했더니 이번엔 양갈비살꼬치 주문 강요.. 저희가 먹고 싶은거 먹게 해주시면 안되나요...... 왕양꼬치 크긴한데 다른 양꼬치집에 비해 크게 맛있는 점을 모르겠음. 일반 양꼬치도 걍 평범 ..토마토계란볶음은 맛있었다.",괜찮다
978,이가네양꼬치,예랑,"한줄평: 나의 양고기 베스트3 안에 드는 곳!양재시민의 숲 근처 최고 맛집인 이곳을 소개해준 지인이 있는데, 그 지인과의 모임에서 또 방문했다!이곳은 양갈비가 정말 맛있는곳! 양 잡내는 하나도 안나고, 부드럽고 육즙이 가득! 이곳의 특제 간장소스는 고추가 들어가 깔끔하면서도 계속 먹게되는 중독되는 맛이다 *_*양갈비도 왕이라서 도톰해가지고 구우면 쪼그라드는 다른 양꼬치집보다 더 맛있는듯 하다.이날은 어향볶음이랑 꿔바로우도 먹었는데, 둘다 맛있었음! 하지만 배가 너무 불러서 ㅠㅠ 다 먹지 못하고 남긴게 아쉬울뿐이고 ㅠ_ㅠ",맛있다
979,이가네양꼬치,예랑,"한줄평: 당신이 지금까지 먹은 양꼬치를 의심해라. 양등심꼬치와 양갈비의 기준을 바꿔놓으셨다...! 여기 진짜 미쳤다리... 여기 양갈비랑 양등심꼬치는 다른데랑 차원이 다르다능...! 양갈비나 양꼬치는 다 비슷비슷한 줄 알았는데, 여기는 달랐다!처음 우리나라에 양고기가 유행하기 시작할 때는 쯔란소스(붉은 향신료)에 찍어먹는 정도였다. 고기 질에서는 냉동을 쓰느냐 냉장을 쓰느냐 정도의 차이였다.이제는 갈수록 좀 더 양고기의 퀄리티와 즐기는 방법도 발전하고 있다. 가게마다 양고기 특유의 잡내를 잡아내는 소스를 개발하고 있고, 먹기 좋게 육질이 부드러우며 잡내가 적게 나는 고기 품종이나 나이대를 찾아내고 있다.그런 점에서 이 가게는 소스에서 차별화를 두는 곳이라고 볼 수 있다. 고기 질도 물론 좋아서 부드럽고 오동통해서 육즙이 잘 씹히는데, 거기에 찍어먹는 소스가 진짜 일품이다. 얇게 채썬 파란고추에 간장같은 컬러의 소스를 부어서 고기랑 먹으면 엄지척이 저절로 나온다!!!! 특히 양왕갈비와 양등심꼬치가 진짜 맛있음! 완전 강추. 본점은 분당인가 판교쪽이라고 하고 인기가 많아서 서울에도 분점을 내고 있다고. 여기에 데려와준 동기오빠님 감사합니다(꾸벅) 잘 먹었습니다.",맛있다
980,이가네양꼬치,알초코,"역시나 리뷰대로사람은 엄청많았고 직원분들은 불친절하였으나맛은 있았고 사람들이 왕많았던건 맛이있기에 그런거겠지꿔바로우도 맛있고 역시나 일반 양꼬치는 없었고왕양꼬치부터 있었다직원분들이 불친절함에도 불구하고 정신없이여기가 중국인지 어디인지 모를 뽁짝뽁작함속에서발성이 낮은 나로서는 거의 고요속의 외침속에서 먹었다꿔바로우 잘라먹고싶어서 가위 달라고하니""우린 가위 같은거 없어요""라는 말이 아직도 인상깊다.ㅋㅋㅋㅋ접근성도 좋고 나쁘지않았다fin.",괜찮다
981,이가네양꼬치,haillie,진짜맛있어요!!!!!왕 양꼬치 2인분 + 꿔바로우 = 배터짐다음에는 양갈비도 도전할래요;)양꼬치 원픽 식당 될것같아요ㅠㅠ,맛있다
982,이가네양꼬치,미식한고독가,양갈비가 진짜 맛있다. 그리고 위치가 좋아서 날 선선할때 창가에 앉아 먹으면 시원하고 좋음. 마파두부 서비스로 주셨는데 엄청 듬뿍 주시고 맛있음!,맛있다
983,이가네양꼬치,아~~휴,양재시민의숲 산책후 근처 갈곳없어 방황하다 들어갔더니 빈칸 채워나가듯 차곡차곡 테이블에 앉히려했다 손님많은가보다 그러려니...양꼬치 무난하게 맛있고 고깃집처럼 사이드로  치커리상추파무침과 매운고추 썰어놓은 간장이 나오는게 심심하지않아 좋음 그치만 쌀쌀한 봄밤에 모두 열려있는 공간은 너무 추웠다,맛있다
984,이가네양꼬치,보나보나,"진짜 맛있었던 양꼬치... 사실 일반 양꼬치는 그냥 평범 살짝 이상정도인데 ""왕양꼬치""가 리얼이다. 일인분에 6꼬치 나오는 대신 꼬치에 꽂혀진 고기들이 사이즈가 큰편이라 먹다보면 배불러진다왕양꼬치는 좀 더 양꼬치보다 양갈비 느낌. 양갈비를 꼬치에 꽂아먹는 맛이다(?) 가격은 조금 더 비싸고 꼬치는 조금 덜 나오지만 다음에 가면 왕양꼬치만 먹을것꿔바로우- 튀김도 바삭하구 소스도 새콤달달하니 존맛탱 ㅜㅜ 꿔바로우 맛없는집은 없는거 같다 히히가지볶음- 가지즙 가둔 가지튀김 위에 소스 잔뜩 뿌린, 손이가요 손이가 메뉴이제 여기는 우리의 뉴 아지트다.",맛있다
985,이가네양꼬치,horolorolo,육즙 넘치는 통통한 양고기!양고기 먹은 후엔 매콤 뜨끈한 온면까지 꼭 먹어주야쥬,맛있다
986,이가네양꼬치,주간노호당맨,양갈비가 맛있고 근처에 딱히 갈만한 데가 없어 종종 가는데ㅋㅋㅋㅋ 양갈비 맛있는거 외에는 그렇다할 장점이 없네요... 직원분들 조금 무례하고...,괜찮다
987,이가네양꼬치,디나은,맛있는데 싸가지 없는집의 정석ㅋㅋ직원들이 1호점2호점 할거 없이 일관성있게 싸가지 없음조선족 분들 특유의 말투 때문인가 말도 진짜 짧고 ㅋㅋㅋ불친절은 기본ㅋㅋ메뉴도 양꼬치 시키려고갔는데 양갈비먹으라고 강요함ㅋㅋ재수없게 앤간한 메뉴 다 맛있어서재수없는거 참고 가지만그래도 재수없음ㅋㅋㅋㅋ근데 그래도 맛있음ㅋㅋㅋㅋㅋ잡내안나고 퉁퉁한 양고기에꿔바로 어향가지 이런거도 다잘함ㅋㅋㅋㅋ겁나 많이 시켜서 토달볶 서비스 줬는데도불친절한 느낌 왠지 모르겠음ㅋㅋㅋㅋ,맛있다
988,이가네양꼬치,ANGELA,"양재 이가네양꼬치 2호점 다녀왔어요!양고기 너무 좋아요ㅠㅠ 양꼬치보다 양갈비를 더 좋아하는데 이가네는 기본 양꼬치가 더 맛있어요!새로운 발견은 양고기엔 칭다오보다 하얼빈이!!!! 더 잘어울려요! 목넘김이 더 부드러워서 술이 정말 술술 들어가...버렸......꿔바로우는 괜찮았고, (하얼빈을 너무 많이 마셔서) 서비스로 받은 가지볶음은 양념이 너무 달았어요. 그래도 술과 함께라면 뭐든...ㅎㅎㅎ근방에서 양고기 먹고 싶으면 여기 또 갈거예요! 근처 회사 회식이 많아서 단체는 꼭 예약하고 방문하시는 게 좋을 거예요~",맛있다
989,브루스리,lamooo,분위기도 맛도 괜찮았던 브루스 리. 곳곳에 붙어 있는 브루스 리 포스터도 추억 돋게 만드는 듯. 딤섬이나 우육면이나. 무난한 맛이었어요. 기대 없이 가선지 오히려 음 생각보다 괜찮은데 같은 느낌. 요리 종류도 많던데 오래 이 자리를 차지하고 있는 거 보니 은근 동네선 맛집 같네요.  분위기는 캐쥬얼한 데이트도 가족 식사로도 다 괜찮을 것 같아요.,괜찮다
990,브루스리,jessica,맛 ⭐️⭐️⭐️서비스⭐️⭐️⭐️분위기⭐️⭐️⭐️⭐️가성비⭐️⭐️⭐️재방문의사 없음*입맛성향 느끼한맛>짠맛>단맛>매운맛*연령대 30대 초반동네에서 나름 오래된 맛집이라 종종 갔었는데 옛날에는 정말 맛있었던 기억이 있었는데 요 근래 몇번 더 방문을 했는데 할때마다 점점 더 실망해서 이제는 안가요 ㅠㅠ일단 직원분들도 친절하지않고...음식도 가격대비 양이 적은편이고 좀 이도저도 아닌맛인것같아요 우육면은 특히 예전에비해 너무 맛이 별로...물에 간장이랑 식초넣으맛이였어요딤섬이 젤 먹을만 했네요,별로
991,브루스리,뇽뇽이,외관이 너무 매력적이고 먹져서 딤섬 처돌이는 홀린듯 들어갔습니다. 그치만 맛은 기대치에 많이 미치지 못합니다.. ㅜ 그냥 저냥 일반적인 중식집에서 먹을 수 잇는 맛과 딤섬인듯 합니당.,괜찮다
992,브루스리,최토르맛잘알,딤섬은 4종류를 먹었는데 미리쪄둔걸 살짝 데워준건지 뻑뻑하고육즙이 1도 없었음.. 새우가 아까웠음.완탕은 물에 김탄 맛이었음.. 밀가루피는 안익었고 안에 고기는 뭔지 모르는맛이었음. 계란면은 그냥 인스턴트느낌에 싱거워따..2년만에 왜이렇게 바뀐것인가 주인장이 바뀌었나..?,별로
993,브루스리,happynewyear,"2년에 한번쯤은 꼭 가는것 같은데 왜이렇게 갈때마다 실망을 하게되는지 좀 아쉽다는 생각이 듭니다. 딤섬 이것저것과 검은콩소스로 볶은 계란면, 해물덮밥을 먹었는데 해물덮밥이 가장 맛있더라구요. 샤오롱바오는 딤섬피 자체가 야들야들함이 1도 없이 너무 두껍고 텁텁하고 육즙을 맛보기까지 찐빵을 먹는줄 알았습니다ㅜㅜ 그냥 차라리 찐빵이라고 하면 그러려니 하고 먹을 것 같아요. 그나마 해물덮밥으로 배채웠는데 약간 너무 하다는 생각이 들었어요. 친절함은 기대도 안했지만 불만많은듯한 직원분 말투도 참 불편했어요. 청결도 조금 더 신경써야할것 같다는 생각이 들었습니다. 아쉽지만 어릴때부터 참 자주갔는데 이제는 방문 못할것같네요.",별로
994,브루스리,밥푸린,"하나같이 짜네요. 도대체 왜 유명한건지 1도 모르겠는.. 옆 테이블 사람들한테 안짜냐고 물어보고싶을 지경이었어요 짜사이부터 너무 짜서, 일부러 주문하면서도 짜지않게 해달라고 했는데도 전혀 달라지는게 없고.. 상온에 24시간 둬도 상하지 않을 정도의 염도에요",별로
995,브루스리,예랑,"한줄평 : 실망스러웠던 양재천의 홍콩식 중국집양재천 근처에 있는 홍콩식 중국집. 그래서 이름도 브루스리 인걸까. 외관은 오래된 허름한 홍콩의 골목 식당 같은 분위기다. 네이버 블로그에서는 유린기와 딤섬이 맛있다고 했는데, 결론부터 말하면 실망스러웠다.맛있다던 소롱포는 딘타이펑의 샤오롱바오에 미치지 못했고, 그냥 평범했다는거. 유린기도 주문해서 먹어봤는데, 고기 비린내가 많이 났다. 소스도 자극적이기만 하고 맛있다는 느낌이 안든다. 면도 국물이 느끼하기만 하고, 뭔가 깊은 맛보다는 msg같은 맛이 느껴져서 아쉬웠다.서비스라도 좋았으면 괜찮다를 줄텐데 서비스도 그닥. 손님한테 별로 관심도 없었다. 그래서 재방문의사 제로다. 맛있다는 블로그 리뷰가 1도 이해가 안간다.",별로
996,브루스리,kangster,창펀 !!! 너무 좋아요 전 집 살때 가까워서 자주 갔는ㄷ ㅠ 이사하고는 아무래도 잘못가게 되더라구여 ㅠ 아쉽,맛있다
997,브루스리,mustit_korea,"#양재 #포이사거리 #브루스리..#우육탕 (0.8) : 우육탕 진한맛 생각보다 양이 엄청 많고, 훠궈랑 마라탕 좋아하실 분이시라면 아주 좋아하실 맛이에요 저는 먹다가 목에 걸려서 눈물 한바가지 쏟았습니다ㅠㅠ#소룡포 (0.8) : 피가 생각보다 두꺼워서 소룡포 특유의 살짝 찢어서 육수 마시는 재미가 없었어요ㅠㅠ#탕수육 (2.6) : 탕수육 찐맛집들 특징중 하나가 소스가 코팅된 느낌이다. 여기가 바로 그 코팅된 느낌의 탕수육. 웍에서 소스가 코팅되게 한번 더 볶아주는건데 겉바속촉이 유지되어있어 환상. 딤섬맛집인줄 알았는데 요리맛집이다..스누피 메뉴추천 : 탕수육, 우육탕..#양재맛집 #포이사거리맛집 #스누피먹방 #ㅅㄴㅍㅁㅂ #스누피맛집 #ㅅㄴㅍㅁㅈ #스누피양재 #ㅅㄴㅍ양재 #스누피포이사거리 #ㅅㄴㅍ포이사거리 #스누피중식 #ㅅㄴㅍ중식 #스누피우육탕 #ㅅㄴㅍ우육탕 #스누피사멍",괜찮다
998,브루스리,매덩이,"정말 오랜만에 맛있게 먹은 우육면. 양이 굉장하고, 고기도 연하다.",맛있다
999,브루스리,콜라,"피는 두껍고, 육즙은 별로 없는 맛 없는 만두.. 면요리도 먹고싶어 우육면 시켰는데 미지근하게 나왔어요 미지근한 우육면은 다시 생각해도 충격적. 위생관리도 잘 안되는 느낌이었습니다",별로
1000,브루스리,잔디위꿀꿀잉,평일 저녁에 가서 다행히 웨이팅은 없었고음식도 미리 저녁장사 준비를 해놓으신 탓일지.. 시킨 지 5분도 안돼서 메뉴 두 개가 나왔어요;;ㅎㅎㅎ원래 홍콩음식을 좋아해서 다 맛있게 먹었지만 면국물이 좀 싱거웠어요 ㅎㅎ 샤오롱바오는 맛있게 먹고왔어요. 근처에 가면 다른메뉴로 먹고 다시 평가해보고 싶네요.,맛있다
1001,브루스리,비트심,맛은 그저 그런데 가격이 넘나 비쌈,별로
1002,브루스리,엘따뉜,느낌 있는 만두집,맛있다
1003,브루스리,Chelsea ,한때 유행하고 이제 별로인줄 알았던 브루스리.. 양재천앞에 있는 양재점을 방문했는데 열린 창문밖으로 보이는 천을 보면서 식사하기 좋은곳. 역시 여긴 딤섬이 괜찮도 좀 얇음 누들을 시켰는데 싱가폴에서 먹는 Beehoon-st여서 맛났다. Xiaolongbao괜찮긴한데 다른 딤섬들도 맛있음,괜찮다
1004,브루스리,olga,딤섬은 쇼마이가 쯔위보다는 나아요 근데 계란볶음면은 너무 싱거워요닭튀김은 양념치킨맛인데 먼가 퍽퍽해요전체적으로 평범한 맛이에요,별로
1005,브루스리,푸드그램,샤오롱바오 피가 이렇게 두꺼운 곳은 처음이다... 심지어 여섯개중 두개에는 육수(?)도 없었다;;;,별로
1006,브루스리,맛집찾아삼만리,뭐 이런 짱개집이...우육면의 국물맛이 라면국물 맛이 난다.자리에 앉아서 주문했더니 정말 1분만 나왔다. 대박~,별로
1007,브루스리,윤짱,들어만 보다가 양재천 지나갈일이 생겨서 들른곳. 저녁 시간이었지만 붐비지는 않았지만 손님은 계속 들어왔다. 리뷰를 보면 불친절하다는 이야기가 많은데 내가 갔을때는 바빠보이는거 말고는 막 불친절하다는 느낌은 못 받았다. 그렇지만 그릇중에 좀 파이거나 이가빠진? 접시가 있어서 가게에서 주의해얄듯 보였다. 쇼마이 샤오롱바오 볶음국수를 먹었다. 쇼마이는 평범했고 샤오롱바오는 육즙이 굉장히 기름진 맛이었다. 맛있다는 느낌보다는 이거 원래 이렇게 기름진 맛이 심한가? 라는 생각이 들정도? 볶음국수는 무난해서 맛이 잘 기억이 안난다.  굳이 찾아갈 필요는 없고 지나간다면 한번은 들러볼 집이다.,괜찮다
1008,브루스리,달고나맛있다,다시 오진 않을 듯,별로
1009,브루스리,청계산지기,마치 홍콩에 온 듯한 분위기가 매력적. 딤섬은 성공적. 우육면은 실패.,괜찮다
1010,브루스리,우왛ㅎ,딤섬은 맛있었는데 볶음밥은 별로였어요,괜찮다
1011,브루스리,힛힛힛,현지느낌(현지 안가봄 주의),맛있다
1012,브루스리,고래밥,촉촉한 딤섬을 기대해서 그런지 속안이 땅땅(?)한 딤섬에 매우 실망했다. 우육면도 기름기가 매우많고 정통 중국식인듯?! 호불호가 매우 갈릴것 같은집. 재방문의사는 없지만 한번쯤 가보고 자기입맛에 맞는지는 맛보는게 좋을듯! 왜냐하면 가격이 저렴하고 소박한 중국풍의 인테리어가 꽤 괜츈,별로
1013,브루스리,YangJack,딤섬 가지튀김분위기는 괜찮지만 약간 허름맛은 무난하지만 중국 요리 집들이 많이 생긴 현재 경쟁력이 좀 떨어진다,괜찮다
