,가게이름,리뷰아이디,리뷰,맛평가
474,오징어회세꼬시,Luscious.K,"#양재동 #오징어회세꼬시""의외의 장소에서 맛있는 음식을 만났을 때의 희열""1. 양재역 부근은 이상하게 마음에서 멀다. 직장에서 가기도, 집에서 가기도 애매한 거리에 걸출한 맛집도 <작은공간> 이외에는 눈에 띄지 않는다.그런데 양재역 뒷골목에 먹거리 골목이 있다는 것을 이번 방문으로 처음 알았다. 하긴 강남지역에 오래 살았어도 가보지 않은 동네는 생소하기 마찬가지지만 생각보다 인근 회사원들을 대상으로 하는 정감가는 먹거리 골목이 있다는 사실이 왠지 정겨운 느낌이 드는 동네다.2. 급하게 모임 장소를 잡은 곳인데 양재역 부근에서는 꽤 이름이 나있는 것 같다. 지하의 작은 매장임에도 손님이 가득하다. 횟집 보다는 포차 분위기의 세팅인데 메뉴들을 보면 계절 세꼬시와 오징어회가 메인이고 철마다 달라지는 회메뉴가 보인다.오징어집 답게 식사메뉴에 오징어라면이 있는 것도 재밌는데 그보다 더 재밌는 것은 무려 <8,000원의 짜장라면> 메뉴다.회보다 오히려 더 기대가 됐었다.3. 기본 안주가 뻔데기와 고동이 나오는데 이것만 봐도 이집이 주당집이라는 것을 알 수 있다.김치, 순두부 같은 메뉴는 아무래도 소주 안주로는 약해보인다. 그런데 일식에서 전채로 주는 <오토시> 처럼 번데기와 고동은 따끈하고 단백질이기 때문에 소주 안주로 참 좋다.그러다보니 회가 나오기 전에 소주 1-2병은 거뜬하다.4. 이집 오징어회가 생각보다 아주 좋다.기계로 얇게 썰어내는 국수 같은 기계회가 아니라 칼질로 포떠낸 (마치 맛짱조개 처럼) 회다. 생각보다 질겅거리는 오징어 특유의 끈적거림이 없는 칼놀림이다.일식 같이 정갈한 칼놀림은 아니지만 투닥하면서 오징어의 단점을 극복하는 좋은 솜씨다.5. 광어와 도다리 세꼬시를 섞어 주문했는데, 고소함이 참 좋다.물기도 잘 뺐고 썰기도 얄팍하게 잘 썰어서 꼬들한 식감이 훌륭하다.크게 기대하지 않은 허름한 뒷골목 횟집에서 예상보다 맛있는 회를 만나니 기분이 좋아지는 술자리다.6. 이집 회의 맛을 상승시켜주는 중요한 요소가 <양념장>이다.오징어에는 초고추장을, 세꼬시에는 된장을 주시는데, 초고추장에는 마늘과 깨소금, 청양고추를, 된장에는 마늘과 참기름, 깨소금, 청양고추를 넣어주신다.별거 아닌 것 같아 보이지만 깨소금의 고소함이 여간 아니다. 그러면서 단조로운 회맛에 액센트를 강하게 준다.기가 막힌 양념장들과 회의 궁합이다. 집에서도 꼭 따라하고 싶은 조합을 발견했다.7. 가장 기대했던 짜장라면은 아주 훌륭하다.마치 간짜장처럼 다량의 양파와 고추, 그리고 싱싱한 생오징어를 넣고 볶아냈는데, 선주후면으로 이보다 더 좋을 수는 없을 정도로 “불량”하면서 듬직하다.꼬들하게 씹히는 오징어다리가 키포인트.8. 양재동 뒷골목에서 아주 좋은 횟집을 만났다.부담 없이 선술집 처럼 가볍게, 맛있게 먹기에 참 좋은 곳이다.다음에는 오징어라면에 도전해 뵈야겠다.#동네식당응원프로젝트",맛있다
475,6484쪽갈비,평냉쟁이,매운쪽갈비 은근히 오르는 매웃맛 중독성 있어요 소금 쪽갈비는 담백하여 많이 먹을 수 있어요 삼겹살 질 좋은집 숯도 굉장히 좋은것을 사용 하더라구요,맛있다
476,6484쪽갈비,얌얌,"요즘 맛집 망하기 대왕….. :(소금과 양념을 시켰는데 양념은 주문하고 거의 바로 나왔다. 초벌 구이해서 나오기 때문에 10-15분 걸린다고 써있는데.. 한참 전에 구워놨던거 그대로 나왔나보다. 알바생은 불판에 올려서 바로 먹으면 된다고 하는데 쪽갈비가 식어있다. 심지어 초벌 조차 제대로 안 되있어서 속 살이 안 익어서 한동안 다시 익혔다. 겉은 타는데 속은 안 익는다.. 그리고 고기가 너무 없다 ㅠㅠ 가뜩이나 발라먹을 것도 없는데 초벌이 안 되어있어서 바짝 익혀야하고.. 약간 냄새나고.. 뼈와 살이 잘 분리도 안 되고그나마 소금은 바로 초벌해서 나온건지 양념보다는 나았다. 하지만 양념 보다 나았다는거지 맛있진 않았다. 똑같이 살이 거의 없고, 안에 잘 안 익어져있고.. 원래 초벌 구이 하는 동안 서비스로 나온 돼지껍데기랑 떡을 구워먹고 있음 된다고 하는데, (우린 구워져있던 양념이 바로 나와서 껍데기랑 같이 먹었지만) 돼지껍데기도 별로였다. 처음에 들어가선 껍데기도 있다니 추가 각! 했는데…다 먹고 나왔는데 배가 고팠다.. 다른데서 맛있게 먹었던 쪽갈비 생각하고 갔는데 대실패 ㅠ_ㅠ 슬프다",별로
477,해우름,클짱,"해우름의 계절이 왔다!!!여기는 벌써 한 4-5번째 방문인데 오면올수록 매운탕때문에 오는게 분명해진다.회는 인원수대로만 시킬수 있고 돔,농어,광어 흰살 생선모듬회가 나오는데 숙성을 어떻게한건지 진짜 너무 쫄깃하다. 맛있음. 근데 계속 먹다보면 너무 지루하고 단조로워서 노량진의 다양한 회 모둠이 생각나기도한다.하지만 여기 매운탕은 노량진도 그 어디도 생각나지 않고 오직 여기서만 먹을 수 있는 감칠맛 폭발 매운탕!!사랑니빼고 나서 여기 매운탕 먹으러 왔을정도. 나의 진심이 느껴지는가....ㅎㅎㅎㅎ사랑니빼고도 여기 매운탕에 밥 한공기 뚝딱 말아 먹었다. 다음번엔 술 마실수 있을때, 특히 겨울에 자주 와야지. 가격대는 있지만 너무 친절하시고 다 퀄리티가 좋기때문에 돈이 아깝지 않다. 특히 여기는 매운탕 맛집이니...꼭...매운탕 드셔보시길. 다음번에는 농어머리지리탕으로 한번 먹어봐야겠당",맛있다
478,해우름,클짱,이번에는 다른 친구들 영업해서 또 갔다옴.회 3인분에 매운탕 2인분 시켰는데. 뭔가 첫방문의 충격적인 그 맛이 안나서ㅠㅠ같이 데리고 간 친구들한테 미안했다. 그래도 여전히 다른 곳보다는 맛있는 편이니까...점차 해우름에서 받은 충격적이고 감동적인 그 맛과 느끼은 약해지고 있지만 그래도 아직 이곳을 필적할만한 다른 곳을 찾지는 못했다. 여전히 여기가 내 기준 1등!!,맛있다
479,해우름,오이름,이시국에도 웨이팅해가며 먹는 꽤나명성이 자자한 곳으로 알고있다광어 돔 농어 숙성회를 썰어주셨는데오히려 활어회가 떠오르던...칼칼하게 끓인 지리랑 생선구이는 맛있었다,별로
480,해우름,꺽어멈,"여기 인생횟집 탕탕탕!1인당 25,000 내면 알아서 척척 주신다. 돔,광어,농어를 두툼하게 썰어서 주신다. 처음 음식이 나왔을 때 양이 적을 것 같았지만,, 먹다보니 배부르다! 회 한점이 생각보다 컸고 진짜 저엉말 쫄깃하면서 입에서 녹는 느낌,,, 말로 표현 못함! 먹어보시길,,, 매운탕도 기가막힌다.. 술이 술술 들어간다. 당분간 여기만 갈 것 같아..ㅎㅎㅎ 점심 메뉴가 따로 있던데 시간이 된다면 점심 먹으러 꼬옥 갈 예정.내부가 작아서 예약하고 가는 걸 추천!",맛있다
481,해우름,클짱,"아..여기 진짜 나만알고싶은데..ㅠㅠ막 너무 맛있으니까 모두에게 알려주고 싶기도하고ㅠㅠ아무튼 여기서 인생 회, 인생 매운탕을 만났다. 1인당 25000원으로 흰살생선회만 나오는데 참돔,농어,광어로 구성되어있다. 처음에 나왔을때 양이 엄청 적다라고 생각했음. 근데 회 한점이 되게 크고 두껍고 그래서 2인이 먹기 충분한 양이더라.일단 숙성회라는데 여태까지 먹어본 회중에서 식감이 가히 최고였다. 원래 날거를 잘 안먹는 이유가 사르르 녹는? 물컹한 식감때문인데..여기는 진짜 쫄깃함이 미쳤음 ㅠㅠㅠㅠ엉엉 ㅠㅠ부드러우면서 쫄깃함.곁가지로 나오는 반찬은 번데기, 마카로니 마요 샐러드, 락교? 등 일반 횟집보다는 소주 포차에서 나올법한 반찬이라 좀 안어울리기도 하고 읭? 스러웠다. 아쉽지만 그래도 괜찮다.. 회가 존맛이니까!!!그리고 1인당 25000원에는 회만 나오니까 매운탕은 따로 시켜야하는데 1인분만 시킬경우는 20000원임. 1인분이기때뮨에 양이 적은데 가격은 2만원이니까 가성비가 조금 안나오는 것 같지만..이것 또한 괜찮다. 미친 매운탕 맛집을 발견했으니까!!!아니 국물이 이렇게 깔끔하고 감칠맛 나는건 처음 먹어봄. 조미료의 맛인건가? 아니면 재료 본연의 맛이 이렇게 나는건가? 잘 모르겠는데 너무너무너무 맛있어서 지금도 생각나고 다음주에도 갈 각이다.공간은 매우 작은편으로 금요일 저녁에 방문했을때 꽉차있었다. 양재역 근처 직원들한테는 점심에 낙지볶음 메뉴로도 유명한듯. 최대 4인까지만 방문하는게 좋을 것 같은 협소한 공간이고, 방문전 웨이팅 있는지 없는지 전화로 물어보고 가는 것을 추천!아...진짜ㅠㅠ직장 동료분이 여기가 회 매니아들의 찐맛집이라고 알려주셨눈데 감사합니다. 당분간 나에게 회랑 매운탕은 해우름 미만잡.",맛있다
482,해우름,Raon's father,근래에 먹은 회 중에는 최고. 달달하고 씹히는 맛이 일품이네요. 예약만땅이라 연말에는 헛걸음 할 수 있어요. 1인 25000원 숙성회 먹었는데. 곁들임이나 매운탕 등 없어요. 모두 추가주문 해야함. 고등어회(선예약 필)도 궁금하네요.,맛있다
483,깐부치킨,chloe,생맥주가 마시고 싶을때 가는집.여름 주말엔 무조건 가야함.이집은 진짜 생맥! 깔끔하고 넓직해서 좋음. 다만 화장실 가기 귀찮음 ㅠㅠ,맛있다
484,깐부치킨,Raon's father,반경 500m 안에서 가장 맛있는 맥주 내오는 집. 깨끗한 맥주. 치킨은 프렌차이즈 니 익히 아는 맛. 개인적으로 깐부 후라이드가 제일 좋아요.,맛있다
485,오대산산채식당,알초코,팀회식이라고 해서 기대하고 따라갔다(어딘지 나한테 안알랴줌)팀장님 요기가 최선입니까????건너편 마라우육면집이있는데 혼자 뛰쳐나가서 먹고싶었다곤드레나물밥정식인거 같은데반찬들은 그냥 무난무난에 곤드레솥밥이 나왔다오래된 노포라기엔 잡채도 퉁퉁 불었고 그저그런그리고 갈비구이도 시킨거같은데흠.... 굳이 이돈주고 이정도퀄리티라면글쎄다...재방문의사 없음.fin.,별로
486,오대산산채식당,졸리,"31년 전통이라 해서 똠얌꿍 먹으러가다가 우리동네에 이런게 있었다니! 육식주의자가 없을때 가야해! 하고 샛길로 샜는뎀 결론부터 말하면 비추엿다 ㅠ 어쩐지 사람이 하나도 없을때부터 돌아나가고 싶더라니... 산채 - 산채정식 - 산채특정식인데 산채 -> 산채정식에는 더덕구이와 나물 5가지가 추가되고 산채정식 -> 산채특정식에는 삼합이 추가된다구 한당.. 메뉴판에 안쓰여있어서 결정하기 어려웟는데 3명이 그냥 산채 2인 주문. 저녁에 가면 인당 2천원씩 추가라 손해보는 기분이당... 가격은 약 2만원대. 리필은 인원수에 맞게 주문해야지만 가능! 티비에 나온집이라 그런가 사진찍는 우리를 꽤 배려해주셨다... 그거 말고는 서비스는 그닥 없다... 무소식이 희소식 느낌... 주문이 들어가자 감자전이랑 장떡을 부쳐주시는 듯 한데 기름이 오래되었는지 갓 부친 것 치고는 쩐내가 났다... 나물반찬도 다양하게 나오긴 했으나 뭔가 딱 맛있는 걸 꼽기 어렵고 그래서 리필해서 먹을 필요가 있는지는 모르겟슴... 된장찌개랑 비지, 뚝배기불고기, 약간의 황태가 나오니 산채정식이지만 완전히 야채만은 아니고, 강남 한복판이 가격이 비싼... 것만은 아니라고 하고 싶지만 인원수에 맞게 시켰으면 정말 후회했을거 같다. 서울에서 맛있는 산채정식 찾는게 웃기긴 한데 (산이 아니니...) 정말 어려운 것 같긴 하다... 재방문 의사도 없고 누군가 간다면 말리고 싶다... 저녁에는 안주만도 파시는거 같더라 - 나중에 단골로 추정되는 손님이 한분 오셨는데 단품으로 주문하셔서 막걸리랑 드셨음! 단품 중에 하나를 고르라면 나는 도토리묵무침! 묵은 시판인것 같지만 소스가 새콤하니 괜찮았다~신축년 이벤트 #2. 오“대”산 산채한정식",별로
487,화돌농장,투명한반창고,"간만에 점심먹으러 들렸더니 사장님의 한마다.오늘까지만 영업하고 폐업하신다는 쓸쓸한 말.2011년 개업했으니 10년이 조금 넘은 곳이다.사장님 말로는 사람 구할수도 없어 코로나 기간동안 고생해서(특히 와이프분이) 폐업을 결정하셨다고.이전도 아니고 잠시 쉬신다고 한다.이러다가 예랑님 말대로 망고플레이트의 주호민이 되는걸까...점심에는 오리 혹은 대패삼겹 쌈밥을 하는 곳이다.보통 삼겹보다는 오리고기를 먹는 비중이 높고이 쌈밥에는 쌈뿐만 아니라 솥밥이 나오기도 하다.솥밥으로 지은밥인 만큼 밥에 윤기가 남다르다.오리고기는 어디서 먹어도 비슷한 맛이긴하나오리고기가 구워지며 나오는 기름으로 볶는콩나물, 김치, 부추를 먹는게 묘미이다.",맛있다
488,화돌농장,투명한반창고,"점심으로 오리고기를 먹을 수 있는 화돌농장.점심시간이 한 시간으로 풀리고 나서 몇 번을 도전했는데 자리가 만석이거나 돌솥밥이 안된다는 이유로 몇 번의 실패 뒤에 찾게 되었다.점심특선으로는 삼겹쌈밥세트와 오리쌈밥세트가 있는데 보통은 오리쌈밥세트를 먹게 된다.+구성이 날 방문에 반찬은 파전, 버섯과 야채쌈, 청국장이 나왔다.김치, 부추, 콩나물이 오리고기와 같이 볶아 먹기 때문에 이 것들이 자연스레 반찬이 된다.+오리쌈밥세트불판이 다소 특이 한데  오리고기를 굽는 불판과 밥을 할 수있는 솥이 일체형이다.오리고기를 먼저 먹으면서 밥이 익기를 기다리면 된다.오리고기를 구우면서 나오는 기름이 부추와 김치, 콩나물을 적시며 익어가면 이 것 또한 이 것대로의 별미가 된다.갓 지은 밥을 각자 옮겨 담고 물을 부어 숭늉까지 만들어 먹으면 점심 한끼가 끝나게 된다.",맛있다
489,화돌농장,투명한반창고,양재시민의 숲에서 이쪽 동네를 걸어오면 가장먼저 만나게 되는 곳.연이 닿아 이동네에서 일했을 때 회식으로 간다면 꼭 여기를 선택하더라.삼겹살도 있지만 오리고기가 있다는게 매력이랄까.그러고보니 오리고기 안 먹은게 꽤 오래전이다.+오리쌈밥세트점심메뉴 오리고기+솥밥만 먹어도 배부른다 할 수있다.오리고기는 가볍게 데우는 정도만으로 먹을 수있으며 만 원이라는 가격을 생각한다면 양이 넉넉하다 할 수있다.오리고기가 구워지며 생긴 기름이 부추에 적셔지면 부추만 한 단 먹을 수있을 것 같다.김치도 콩나물도 역시 그러하다.갓 지어진 솥밥은 밥 한공기를 뚝딱 비워내기 충분하며 구수한 시레기국에 말아먹어도 어울린다.,맛있다
490,깐부치킨,Raon's father,사장님이 완전 친절하심. 맛은 프랜차이즈에서 기대하는 수준만큼. 개인적으로 깐부는 마늘전기와 후라이드를 최고로 보는데. 전기구이 안해서 아쉬움.,괜찮다
491,공준호힘찬낙지,carpediem,"낙지덮밥 낙지가 많지는 않지만 맛있고 괜찮다. 참기름,김도 준비되어있고 순두부도 있다. 배부르게 먹을수있음",맛있다
492,공준호힘찬낙지,이눔식걍,여기 집앞에 생겼길래 가봤는데 맛있었음먹어본 낙지중엔 젤맛있었음,맛있다
493,공준호힘찬낙지,손전등,산낙지 볶음이 이렇게 양이 많을수가 있나요 ??파전이 피자인가요 ?? 양이 엄청 많네요 ~~심지어 맛도 굳귣귯  잘먹고 갑니당,맛있다
494,보글이부대찌개생태탕,투명한반창고,"같이 팔기엔 어울릴거 같지 않지만 그런 집이 하나 있다.이번이 두 번째로 첫 방문에는 생태찌개를 먹었고 이번에는부대찌개를 먹기 위해 찾아보게 되었다.두 번째 부대찌개로 이어진건 생태찌개의 맛에 대한 기억으로이정도 맛이면 부대찌개도 기대해도 되지않을까라는 생각이 들어서였다.+반찬이 집이 마음에 들기 시작하는 부분은 반찬에서 부터.맛깔스러운 반찬은 찌개가 나오기 전에 밥 한 공기를비울 수 있는 기세로 먹을 수도 있을 것 같았다.찌개까지 먹기 위해선 방심하면 안됀다. 가지볶음과 지난 번에도 먹은 어묵볶음, 단무지 무침과 김치가 나왔다.가지볶음은 간장과 볶았는데 고소하면서 물컹하긴해도 가지같지 않은 느낌이 재밌다.어묵볶음은 젓갈을 쓰는지 비릿한 맛이 나는데 생각보다 잘 어울린다.+부대찌개스팸, 소세지, 베이컨으로 햄이 주는 맛이 제대로 난다.유사 스팸이 아닌 진정한 스팸을 사용하는 점도 좋다.어떨지 모르니 덜어서 한 번, 다 먹고 국물까지 한 번.""오호라.. 매운탕 스타일의 부대찌개 같은데?""라는말과 함께 흥미로운 스타일의 부대찌개라 생각이 들었다.쑥갓, 숙주, 팽이 버섯이 만들어주는 부분이 아마도 지난 번에 먹은 생태찌개와 오마쥬 되면서그런 생각이 들었지 않았을까 생각해본다.생태찌개보다는 양념이 되있는 편.심심하지 않다.",맛있다
495,보글이부대찌개생태탕,투명한반창고,"부대찌개와 생태매운탕.전혀 연관없는 두 가지 메뉴를 팔고 있는 곳이다.손님의 주문도 반반인걸보면 둘 다 괜찮은 모양. +반찬조명을 받아 반짝반짝 빛이나는 네 가지 반찬.부드러운 오뎅은 기름진 맛과 감칠 맛.묵은 시판용이지만 양념장 맛을 잘냈다.멸치볶음은 호두와 땅콩으로 고소하다.김치는 양념 맛 위주로 익으면 맛이 더 좋아질 것 같다. +생태탕한동안 기다리며 끓였는데 처음은 슴슴하고 깔끔한 맛의 국물.고추가루가 들어가도 강하지 않고 조미료 맛이 강렬하지 않다.냄비에 들어간 각 재료에서 맛을 잘 뽑아냈달까. 조금 더 얼큰함을 얻고싶어 먹는 내내 끓여본다.변화가 없는가 싶다가 다대기가 깔린 바닥까지 가니고추가루의 칼칼함이 드러나기시작한다.강렬한 얼큰함이라기보다 시원한 얼큰함이랄까. 어제는 술을 마시지 않았지만 속풀리는 기분의 국물이다. 생태살은 얼리지 않은 생선살의 부드러움,곤이는 몽글몽글 부드러운 촉감을 가진다.담백한 알은 입에서 자잘자잘하게 흐트러진다.미나리는 굵어 단단할것 같았으나 끓이고 나면 먹기좋게 부드러워진다.",맛있다
496,보글이부대찌개생태탕,Gwen Lee,찌개도 아닌 볶음도 아닌 짜글이같은 해물철판.해물도 싱싱하고 양도 보기보다 은근 많아요~술안주로 딱!!,맛있다
497,동지섣달꽃본듯이,스꾸비,"매번 갈때마다 정식먹어보라고 하셔서 이번엔 정식을 먹어봤어요.1인당 18000원으로 비싼 가격이지만 엄청 배부르게 먹었어요.근데 나물이 대체로 다 짜고, 주문하자마자 잡채, 메밀전병이 나와서 미리 조리한게 아닌가라는 생각이 들었습니다...ㅠㅠ정식은 너무 배불러서 또 시켜먹진 않을것 같아요.수육도 기름 많고 좀 실망했어요.",괜찮다
498,동지섣달꽃본듯이,스꾸비,메뉴판 그림이 인상적인 곳!4.3/5.0재방문의사 O오늘은 메뉴판을 찍어왔습니다 :)정말 그림이 너무 이뻐요묵은지삼겹찜 대 사이즈로 4명이서 먹었는데 먹으면서 좀 부족한것 같아서 메밀전병도 시켜서 먹었어요. 메밀전병은 8조각 나옵니다.묵은지삼겹찜 김치가 정말 맛있고 비쥬얼도 정말 최고ㅠㅠ다른 친구는 밥 두공기 시켜서 먹었어요.저는 밥 한공기 조금 남겼습니다.,맛있다
499,동지섣달꽃본듯이,스꾸비,⭐4.7청계산 등산하고 내려와서 오른쪽으로 좀 들어가아보면 나오는 집!메뉴판에 그림이 그려져있는데 정말 맛있게 그려져 있어서 다른 메뉴도 먹어보고 싶게 만든다.아주머니말로는 정식을 가장 많이 시켜먹는다고 하셨다. 다음번에 오면 정식이나 묵은지삼겹살을 먹자고 친구들이랑 얘기했다.[솥밥 된장찌개]솥밥 밥이 정말 맛있다. 밥만 먹어도 맛있었다. 그냥 솥밥만 시키면 5천원이라서 좀 비싸긴하다.[메빌전병]쫀득쫀득하고 맛있다.[물냉면 비빔냉면]전형적인 냉면 맛이다.,맛있다
500,원조부안집,Jinny,"육즙대박 삼겹살까진 아니었지만, 숯불향 나고 고기도 괜찮았던 곳! 고기땡기는 날 집앞으로 먹으러가기 괜찮겠어요~목살을 추천해주셨는데, 목살100g / 쫀득살100g/ 삼겹살 100g 주문! 세 종류 모두 두툼하고 좋았지만 꼬들꼬들 식감있는 쫀득살이 이 날 베스트였습니다!근데 굳이 찾아와서 먹을 곳은 아니었습니다~",괜찮다
501,원조부안집,영쯔,"체인점이라는데 사무실이랑 가까운 양재점으로 가봤어요. 먼저 들어가자마자 불판 주변에 쫙 깔린 반찬들이 아주 맘에드네요. 종류만 많은것도 아니고 밑반찬이 다양하면서도 굉장히 맛있어요! 목살과 쫀들살 시켜먹었는데 고기는 둘 다 맛있었는데 특히 목살이 진짜 육즙이 장난아니였습니다. 목살 추천드립니다! 그리고 사이드로 대파라면은 쏘쏘한 맛이고 오히려 기본으로 나오는 김치찌개에 고기가 엄청 많이 들어가있고, 버터가 함께 나오는 10분밥이랑 같이 먹으면 존맛. 이 조합 꼭 추천드립니다.",맛있다
502,원조부안집,아구구,"육즙 장난 없는 고기집><요즘 프리미엄 돼지고기집이 많이 생겨서 행복하다. 여기도 돼지고기집인데, 삼겹살 보다는 목살과 쫀득살이 특이하다.목살은 엄청 두툼하게 나오는데, 육즙이 장난아니다. 목살에서 이렇게 육즙을 느껴본것은 처음인듯...쫀득살은 비계부분이 많고 고소하면서, 엄청 쫀득하다. 식감이 좋았고 다음에 가도 또 목살*쫀득살 조합으로 먹을듯!!가격도 다른 프리미엄 고기집보다 안비싼편!",맛있다
503,교대이층집,아구구,"꽃삼겹 , 삼겹, 항정살 이렇게 먹었다. 직원분이 정성스럽게 구워주신다. 일단 제일맛있는것은 떡인데, 기본으로도 나오고 추가해서 먹을수 있다!  꼭 추가해서 드시길!! 그리고 꽃삼겹은 여기서만 먹을수 있는것으로 돌돌말아서 꾹 누른것같다. 삼겹살안에 파절임, 마늘, 고추절임등을 넣어서 싸먹는다! 고기로 싸먹는다는게 새롭다! 그리고 삼겹살이랑 항정살도 프리미엄 삼겸살집인만큼 육즙 장난아니다! 다 퀄이좋다..그리고 나가는 길에 우유 아이스크림은 필수니까 꼭 챙겨서 입가심 하세요!!",맛있다
504,교대이층집,호두꽈자,"[두 번째 리뷰]김치부대전골 7500 * 2인[맛]정직하게 김치찌개에 베이컨, 다진 고기, 소세지, 햄 등이 들어가 있다고 해야 하나요. 먹어보면 정말 김치찌개 베이스에요.고깃집이다 보니 간이 세서 좀 짜긴 한데, 고기에서 냄새가 안 나서 좋았습니다 ㅋㅋ엄청 특별한 맛은 전혀 아니고 계속 반복하고 있지만ㅋㅋ김치찌개에 햄 넣은 건데 그냥 평타치게 무난합니다.라면사리는 돈 내고 추가하는 거 같습니다하지만 이 곳은 돈가스가 계속 리필이 되서 그냥 라면을 안 먹었다는 ㅋㅋ근처라면 그냥 한 끼 정도 시도할 만한, 하지만 간 센 거 싫어하시는 분은 과감히 패스하세요 ㅎㅎ",괜찮다
