,가게이름,리뷰,맛평가
599,꽃돼지식당,"기승전결로 달려가는 그 모든 프로세스가 만족스럽습니다.꼬!들!살! 삼!겹!살! 밑반찬으로 나오는 명이나물, 기름종지에 구워먹는 마늘과 파채와 양파까지.고기가 일단 맛있어요. 적당히 도톰한데 누린내도 안나고요.암만 밑반찬이 맛나도 고기가 맛이 없으면 말짱 도루묵인데 말이죠.진짜 오랜만에 ""와, 고기 맛있다!""하고 감탄하며 먹었어요.꼬들살이라는 부위를 처음 먹어봤는데, 정말 꼬들꼬들하니 씹는 맛이 있어요.그래도 전 제게 익숙한 삼겹살이 너무너무 좋아요.다 먹고 맛있게 볶음밥도 볶아먹고 우리네 사는 행복이 여기 있네요^.^원래 이 집은 술밥이 환.상.양은 냄비에 나오는 자작한 된찌에 밥풀어서 나오는데 짭쪼름한 술밥에 소주 한 잔 마시면 ...캬.....고기가 그리워질 때 달려갈 홍제동 꽃돼지식당",맛있다
600,사조미가,2만원 미가 정식 먹었는데 반찬이 깔끔하네요. 종류도 많아서 괜찮아요 각각 방이 프라이빗하게 되어있어서 단체모인 식사하기 좋을듯요! 게다가 방도 좌식인데 의자에 앉고 다리내리는 구조라 편함 흐흐,괜찮다
601,째보식당,"남자친구랑 연희동맛집 찾다가네이버리뷰 검색해보니까 평이 너무 좋길래 방문했어요.ᐟ.ᐟ 가게가 일단 넓고 청결깨끗한데 직원분들이 다들 친절하셔서 기분이 너무 좋았구요⌯’ ▾ ‘⌯ 제가 해산물을 별로 안좋아해서 사실 별 기대안했는데 아니 이게무슨일이야 짜지도않고 비리지도 않고 밥도둑 미쳤음요ㅠㅠㅠㅠㅠ 아 쓰면서 갑자기 생각나네ㅠㅠㅠ 암튼 너무너무 맛있어서 남친앞에두고 두그릇 조졌(?)습니다,, 옆테이블 말씀하시는거 들어보니까 원래 군산본점에서는 기본 한시간 웨이팅은 기본이라고 하시더라구요.ᐟ 다음엔 양념도 먹으러 가려구요 ㅎㅎ 데이트하기에도 너무너무 좋은 장소임유ㅠㅠㅠ 다만 너무 맛있어서 내숭 그게뭐야 두그릇씩 비우게 돼서 문제^^*",맛있다
602,째보식당,간장세트 먹었는데 비린맛 숨길라고 짜게 안담궈서 좋았음. 짠음식 싫어하는데 부담없이 잘 먹었고 밥 추가 주문하면 계란 노른자 올려주는데 비주얼이 좋았음.특히 가격대가 다른 게장 요리집에 비하면 엄청 가성비라고 생각함. 비주얼 좋아서 데이트 코스로 넣고 베이커리 카페가면 좋다고 생각함 양식집 갔다가 베이커리가면 물림,맛있다
603,째보식당,예전에 군산여행에서 맛있게먹은 기억이있어서울에도 생긴걸 보고 지인들과 방문했습니다일단 간장모둠과 꽃게라면 주문했는데간장모둠은 짜지않아 괜찮았고꽃게가 특히! 알이 생각보다 실해서 놀랐네요라면에 들어간 꽃게도 살이 꽉차있더라구요군산에서 먹었을때와 맛이 똑같아서여행갔을때의 추억을 다시 느낄수 있어 좋았네요!,맛있다
604,째보식당,연희동 특성상 나이든 사람이 많은 지역이라연화식이 아닐경우 장사가 쉽지않다오히려 인스타사진용 연남동이었으면 잘될지도 모르겠으나데이트할때 먹기도 불편한음식이다2층 보리밥집이 시장조사는 더 잘한것 같다간장모듬셋먹었고 맛은 애매하다인스타에 광고를 오지게 하지만 폐쇠적인 연희동에서 맛이없으면 1회성에 그칠수밖에,괜찮다
605,째보식당,"군산 핫플 째보식당이 서울 연희동에도!군산 가면 꼭 들리고싶었던 곳인데 웨이팅 없이 갈 수 있어서 좋았어요.간장 모둠 세트가 유명합니다 (36,000원)꽃게장, 전복장, 새우장, 소라장, 연어장에 + 참기름 두른 공기밥 2공기가 나오니 가격은 나쁘지 않아요.간장에 절인 찬만 먹으면 짜지 않을까 걱정했는데 의외로 짜지 않구요. 해산물 비린내도 없이 신선했어요.개인적 취향은 연어장이 일등! 그 다음 전복장 > 꽃게장 > 소라장, 새우장.다만 양이 2인이 먹기엔 많고, 간장베이스의 맛이 계속되니까 먹다보면 물리는 점은 있어요. 모둠도 좋지만 좋아하는 장 종류 정식으로 골라서 시켜도 괜찮을 것 같습니다!",맛있다
606,와규앤다이닝,"고기질이 좋기는 한데 그가격에 그정도는 당연한거 아닌가? 지나가는 길에 마침 배가 고프고 또 때마침 소고기가 땡기면 모를까, 굳이 찾아가서 먹을거야 없을 듯.",괜찮다
607,와규앤다이닝,"#기본찬이_wow#와규시키면_작은숯불화로#돼지고기시키면_가스불판#얼큰차돌박이탕_대박@와규앤다이닝지난 10월쯤 친구소개로 들렸다가12월 다시 방문한 와규앤다이닝쌈장, 기름장, 들깨가루, 소금, 야채절임이 들어있는 기본찬 세트가 1인당 하나씩 나와서깔끔하게, 또 있어보이게 먹기 좋아요.가운데 반찬으로는 김치, 마카로니샐러드,그리고 (애정하는)명이나물이 나옵니다!지난 번에는 소고기와규를 시켰는데특별히 싼 편도, 양이 많은 편도 아니지만참 깔끔하게 나와서 좋아요!숯불화로가 따로 나오거든요~지난 번에 와규2인분, 돼지1인분 시켰을 때는 괜히 미안한 마음이 들기도 했답니다.돼지고기는 또 가스불에 불판을 가져다 주셔서요~돼지삼겹살이나 목살(12000)은 싼 건 아니지만초벌구이 후 나와서연기가 별로 안나요. 불판도 탐나고ㅋㅋㅋㅋㅋ고기 시키면 콩깍지와 아스파라거스가 함께 나옵니다.얼큰차돌박이탕이 정말 예술입니다.고기먹고 느글느글한 속을 다스려줍니다.2인분이 기본이라서사람이 많아야 시킬 수 있다는 단점이 있지만ㅠ차돌박이가 가득 들어간 불맛 나는 짬뽕 맛이에요.꼭 면사리 추가해 드세요!!!와인, 맥주, 소주 등 주종도 다양하고고기 외에도 파스타, 돈가스 등 다양한 메뉴를 팔고 있어요(소바는 친구가 맛없대요, 피하세요)2-4인 가면 편하게 먹을 수 있는데지난 번에 6인 방문했을 때는넓은 자리 달라고 미리 예약까지 했는데도인간적으로 자리가 너무 협소했어요.6인 중 두 명이 초등학생이었는데도ㅠㅠㅠㅠ홍제에서 깔끔한 디자인에깔끔한 음식과 찬을 원한다면 추천합니다.(홍제 쪽은 외식할 곳이 참 없으니까!!!)주차는 가게 앞에 하면 됐어요~",맛있다
608,파파양대창,음...,별로
609,파파양대창,친구한테 엄청난 맛집이라는 소문을 듣고 방문한 파파양대창!!! 듣던대로 존맛이었다...냄새도 하나도 안 나도 꼬들꼬들 고소.... 소곱창이라서 가격이 비싸긴했지만 돈이 아깝지 않은 맛...!!! 이런 데가 대박나야되는데ㅜㅜ 위치가 골목에 있어서 사람들이 잘 모를 것 같다는데 아쉬웠당..분기에 한번씩은 꼭 가서 먹어야지...♥︎ 아 그리고 양볶음밥인가? 그건 배가 터지더라도 꼭 드시길ㅎㅎㅎ,맛있다
610,고향촌,"여기는 삼겹살집이긴 하지만 9900원에 한상 멋들어지게 나오는 점심특선을 먹어야 합니다. 골목길에 숨어 있어서 아는 사람만 먹는 곳 같아요. 의외로 안 알려진 맛집점점 반찬 가짓수가 줄어들어서 아쉽긴 한데 그래도 만원 안되는 돈으로 제육볶음, 4색 계란찜 등 배불리 먹을 수 있어서 좋아요. 제육볶음에 야채도 많이 들고 간단히 찌개도 맛있습니다.원래 좌식이었는데 리모델링 하면서 의자로 바뀌었고 인테리어도 예쁘게 바뀌었습니다. 조명이 좀 어둑어둑해서 여기서 점심 먹으면 뭔가 저녁같은 느낌에 회사 복귀하기 싫어지는게 단점.저녁에는 삼겹살 위주로 판매하는데, 사실 저녁메뉴는 그냥 그랬어요.#직장인점심메뉴",맛있다
611,고향촌,"5호선 지하철 서대문역 2번 출구에서 도보 2분 거리에 있는 한식당입니다. 누군가가 글씨로 쓴듯한 메뉴판을 보면 숙성 삼겹살이 150g에 16,900원 입니다. 삼겹살 가격만 보면 엄청 비싼 집입니다. 그런데 사람들은 이 식당을 가성비 좋기로 유명한 집이라고 합니다. 그건 바로 서비스로 나오는 음식이 엄청 많기 때문입니다. 전복까지 서비스로 주는 집은 처음 본 것 같습니다. 결론부터 말하자면 회식을 하기에 최적의 장소입니다. 고기나 반찬들이 맛이기도 하지만 저는 특히 제일 마음에 드는게 바로 적절한 온도로 냉동시킨 슬러시 소주와 맥주입니다. 술이 시원하니 너무 땡겨서 과음에 주의하셔야 합니다. 거기에 소주 조명 받침대까지 제공되어서 분위기를 한 껏 더 띄워줍니다. 다만 의자식 테이블이 아니라 좌식인 것이 다소 불편하기는 합니다.",맛있다
612,봉일천장군집,"잡내제거를 위한 기본양념정도만 한집부속구이는 자체맛이 강하므로 잡내만 잡는게 가장 맛있는 조리법인것같다. 파채에 뿌리는소스가 살짝 매콤하면서 단맛이 강하게 올라와 중간중간 올려먹기 좋다. 하루종일 굶고 혼자가서 3인분을 먹었는데 앉은자리가 가게 입구 근처여서인지 마지막 부속을 올릴쯤 약해졌다 ㅜㅜ..자체? 간장소스에 간마늘,다진청양고추넣어서 섞고 부속구이에 청양고추 올려먹거나 껍데기는 콩가루, 항정살은 소금 , 막창엔 파채올려먹으니 끝없이 들어간다. 일반고기는 400을 못먹는데 부속은 750 먹은거보면 부속은 계속들어가는게 맞는듯..",맛있다
613,봉일천장군집,"부속고기 전문점 장군집, 모둠을 시키면 이것 저것 맛볼 수 있게 나온다. 처음 오면 모둠을 시켜 먹어보고 그 다음부터 맘에드는 부속을 이것 저것 시켜 먹는게 정석 루트인 듯! 개인적으론 부드럽게 씹히는 유통과 오독오독 암뽕, 고소한 갈매기살이 맘에 들었던 집!",맛있다
614,백년약수골,홍제역에서 마을버스를 타고 올라가면 산 중턱에 자리잡은 곳이다.야외에서 먹을 수 있는곳이라 여름이 오기 전 몸보신을 하기 제격이다.쑥갓이 산더미처럼 올라간 칼칼한 닭도리탕이 맛이 좋다.푹 끓여내서 살이 사르르 뼈에서 발라져 나온다.압렵솥에 푹 삶아낸 백숙과 깔끔한 도토리묵은 필수!저녁 8시반이면 마무리를 해서 조금 아쉬움이 있다.,맛있다
615,백년약수골,백숙을 드시려면 최소 1시간 전에 예약 필수! 저는 당일 오전에 예약했는데 그래서인지 뷰 좋은 야외 테이블은 이미 예약이 끝났다고 하시더라구요ㅜㅠ 며칠 전에 예약 하고 가시는걸 추천 드립니다.⠀● 백숙 (45.0)일단 닭이 진짜 커요. 큰 닭은 살이 퍽퍽한 경우가 많은데 살도 부드러웠어요. 백숙이랑 같이 커다란 냄비가 같이 나와서 당황... 죽 양도 진짜 많습니다ㅋㅋ⠀● 도토리묵 (15.0)사장님께서 센스 있게 두 접시로 나눠 주셨어요. 사진에 있는건 절반 양입니다! 담백한 백숙이랑 빨간 양념의 도토리묵이랑 잘 어울렸어요.⠀,맛있다
616,백년약수골,숨겨진 맛집가파른 경사를 한참 올라가면 산밑에 있는 곳인데 다들 어떻게 아신건지 갈때마다 손님이 꽤 있다전화로 미리 예약하면 백숙 한마리를 준비해 주시는데 양이 엄청나다닭 자체도 맛있지만 죽처럼 된 밥이 진짜 별미백숙에 동동주 한 주전자면 행복~~,맛있다
617,오징어세상,그냥 지나가다가 해물 먹고 싶어서 들어간곳.오징어+방어 세트(40000) 먹었는데 원래 오징어회로 나오는데 오징어통찜으로 바꿔달라고 부탁해서 찜으로 먹을수 있었다.오징어통찜 정말 보드랍고 너무 맛있었다.내장도 고소하고... 방어도 괜찮았지만 오징어가 땡겼어서 오징어를 맛있게 먹었다.하지만 서더리매운탕과 알밥은 너무 맛이 없 었 다.매운탕은 라면스프맛이 강했고 알밥은 뉴슈가를 넣으셨는지 너무나도 달았다.,괜찮다
618,이백사호,"실비집 컨셉 코스 안주라니 나야 너무 좋지만 쉽지 않은 길을 가시는구나 싶어 기대반 걱정반으로 방문했다. 결론부터 꺼내자면 대만족이었지만 역시 타겟층은 좁겠다 싶었던.  여름보양코스는 온센타마고, 전복찜, 차소라스테이크, 병어무침, 정구지전, 고등어조림, 능이버섯닭곰탕 순서. 차게 나오는 온센타마고는 우니, 이꾸라의 풍미에 상큼한 유자폰즈가 더해져 전채로 제격이다. 이어서 나오는 전복찜은 녹진하게 씹히는 맛 부드러운 전복에 들깨로 버무린 방풍나물이 고소함을 배가해준다. 병어를 세꼬시처럼 먹는건 처음인데 된장에 무친게 이렇게 잘어울릴줄이야. 씹히는맛도 좋고 5년 묵혔다는 집된장은 거의 향긋할 지경이라 아주 만족스러웠다. 버터리한 갈릭향이 황홀한 정구지전은 바삭한 테두리에 크리미한 속이 딱 취향이었고.콜드 디쉬들에 비해 메인격이어야할 고등어는 밥 없이 먹기엔 좀 짜고 밋밋하다. 그치만 이어서 나온 능이닭곰탕의 시원한 국물에 감동받아 약간의 아쉬움은 금새 잊었다.이정도 안주로 대접받았으면 응당 술을 궤짝으로 주문해야할텐데 컨디션이 못받쳐준게 통탄할 노릇일뿐...이파리의 세컨브랜드답게 전통주 라인업이 훌륭하다.  코스로만 주문가능하니만큼 예약 방문하는걸 추천.",맛있다
619,조개일번지,푸짐하고 신선한 조개찜 ㅎㅎ 대왕가리비 달달한 맛이 정말 좋았다. 잘잘한 조개는 별로없고 가리비와 굴이 많았다. 굴이 더 많았어도 좋을것 같다. 대짜라고 하기엔 양이 많진 않았다. 굴찜만 따로 팔아도 좋을것 같은 느낌?ㅎㅎ 칼국수를 추가 하고 싶었지만 칼국수는 냄비를 가져가서 주방에서 끓여나오신다길래 그냥 매콤 해물라면 주문 했다. 라면에도 새우에 조개가 듬뿍 들어가있고 국물이 얼큰해서 좋았다.주차는 골목에 눈치껏 하거나 공용주차장 이용해야한다화장실은 남녀공용이고 하나뿐이라 편하다고 볼 순 없다.,맛있다
620,조개일번지,"조개찜(대) 59.0서대문역 근처에 있는 조개구이, 조개찜 전문점대자라는 닉값과 가격에 비해 양이 많지는 않지만 조개살 하나하나가 잘 쪘구나...라는 생각이 들 정도로 맛있었다퇴근시간 이후 사람들이 정말 많았는데 이 근방에서 먹을만한 곳이 몇군데 없기도 하고 이곳 요리가 나쁘지 않았다퇴근후 회식으로도 추천",맛있다
621,꾼활어회집,"전복치 소자 (100,000)광어 중자 (55,000)오 이 대박집을 아무도 리뷰하지 않았다니..!!가락 수산시장에서 내가 제일 좋아하는 집도 이에 비할 바가 못 된다.우선 전복치 식감이 기가 막히다.. 쫄깃하면서 사각사각하게도 부드럽게도 느껴진다. 비싼 값을 한다!! 평생 먹은 회 중 단연 탑인듯. 광어는 개인적으로 계속 먹으면 물리는 편이라서 그리 선호하지 않는 편이나 여기 광어는 초장 안 찍고도 계속 손이 갔다.기본 안주가 다양하다. 1. 청어구이는 부드럽긴하나 쏘쏘.2. 미나리+날치알 조합이 이렇게 어울릴 줄 몰랐다. 채소 잘 안 먹는 편인데도 미나리 향이 좋아서 자꾸 손이 갔다.3. 자연산 비단멍게는 그렇게 짜지 않아서 좋았고, 해삼이 오독오독하니 아주 싱싱해서 마음에 들었다. 양식멍게, 전복, 새우는 내가 아는 그 맛.4. 산낙지도 쏘쏘.전체적으로 맛있는데다가 사장님께서 친절하시고 서비스도 많이 주셔서 정말 마음에 든 집. 재방문 의사 200%",맛있다
622,선어도,"TL;DR: 충정로 근처 점심 장소 추천을 찾는다면 이 곳 - 두 번 다 점심으로만 방문했는데 저녁에도 분명 매력적인 장소일 것 같다. 점심 메뉴는 회 백반(15,000￦) 하나다. - 회 백반은 도다리 세꼬시(뼈없음) 한 접시와 알곤이매운탕 그리고 밥& 쌈 야채이다.- 내가 이곳을 떠올리면 가장 먼저 생각나는 건 여기 시그니쳐 막장이다. 깻잎과 상추에 도다리 세꼬시와 밑에 깔린 무채를 넣고 막장을 한 숟갈 듬뿍 퍼서 쌈 싸먹으면 ‍최고다. 같이 나오는 매운탕도 그냥 주는 메뉴가 아니라 따로 단품으로 팔아도 될 정도로 알곤이도 듬뿍 들어갔다. 게다가 마지막에 후식으로 나오는 수제 식혜도 엄청 맛있다.- 콜키지 프리인데 와인도 판매한다. 가격이 바틀당 9,900￦~이라 점심인데도 와인 한 병 하고싶은 마음이 늘 간절하다.",맛있다
623,서대문아구찜,"대구탕 9.0 아구찜(소) 35.0!아구 싱싱, 양 많음, 양념도 굿 대구탕은 속까지 시원해지는 맛!코시국에 2시 넘어서 갔는데도 동네 아줌마 아저씨들이 테이블 여럿 차지하고 계셨음. 그저 맛집 ...",맛있다
624,쌍대포생소금구이,"고기와 밑반찬 모두 맛있어요, 동네 고기집 이상급아저씨가 굵은 소금을 뿌려주십니다~",맛있다
625,한도올,저렴 중간,괜찮다
626,한도올,"숙주 차돌박이랑 오징어젓갈 볶음밥 맛있어요. 젓갈 볶음밥에는 생마늘, 버터, 숙주가 섞이는데 가격도 합리적이고 맛도 굿! 삼겹살은 비추. 라면이랑 여름에만 파는 계절메뉴 소바도 맛있다고 친구가 그러네요. 사장님이 독특하고 식당운영에 대한 철학이 있으심. 친구 사귀려고 식당 하신다고;;;",괜찮다
627,홍성녹우촌,갈비탕 안에는 마구리뼈 없이 왕갈비만 3대 들어있다. 갈비에 살점은 질기지 않고 입 안에서 살살 녹을 정도로 육질이 부드럽다.국물은 조미료 맛이 강하게 나지 않아서 개운하고 맛있다. 인적이 드문 아파트 상가에 있는데도 사람들이 계속 찾는 이유가 있었다.,맛있다
628,백마강,"모듬회를 먹었는데 밑반찬도 푸짐하고 (콘치즈, 쭈꾸미볶음, 멍게 등) 매운탕과 튀김까지 깔끔한 구성친절한 느낌이 없어 아쉽지만 불편하진 않았다",괜찮다
629,평동집,"살다살다 이런일이 있을줄은 몰랐다.동네 주변 식당 검색하다가 해장 겸 곱창전골 먹고 싶어서 검색해서 찾아간 이 곳.점심을 먹기 위해 친구 두명을 데리고 들어갔는데 사람이 하나도 없었다. 저 멀리서 사장인지 직원인제 모를 여자가 오더니 여러 방 중에 여섯 테이블 정도가 있는 방으로 안내하면서 여기 앉으라고 햇다. 옆방을 열어보니 단독으로 된 방이 있엇고, 우리는 그 방에 앉겠다고 얘기햇다. 그러자 아줌마가 썩은 얼굴고 테이블 위에 까는 종이를 들고 원래 자기가 앉으라고 햇던 테이블에 종이를 깔더니 우리 말은 다 무시하고 그냥 여기 앉으라고 햇다. 표정이 ‘그냥 닥치고 내가 앉으란데 앉지 왜 말이 많지?’ 하는 표정.... 그래서 우리가 가려는 단독방이랑 뭔 차이가 잇냐고, 우리 저 방에 앉고싶다고 하니, 엄청나게 짜증나는 표정으로 아무말도 안하고 우릴 노려보고 있엇다. 참지못한 내 친구가 “아줌마 표정이 왜 그모양이냐고, 우리가 구걸하러 온 사람이냐고, 돈주고 먹겟다는데 왜 그런식이냐” 얘기를 하고 나가려고 하니 우리 뒤에 대고 ‘재수없어서 소금뿌려야 겠네” 하면서 쉬는 시간에 받아줫더니 어쩌구 저쩌구... 그 말을 들은 다른 친구가 빡이 돌아서...ㅠ.ㅠ쉬는시간이면 우리가 들어갔을때 지금 브레이크 타이이라고 죄송하다고 하던지... 돈 벌어 쳐먹고 싶어서 쉬는 직원들 일시켜서 손님 받으려고 했던 사람이 그런식으로 우릴 대하는게 너무 화가났다. 이런 글 쓰는거 귀찮아서 안하는데... 이런 식당은 무슨술 써서라도 망하게 하고 싶다. 손님이 왕일 필요는 없지만 장사좀 된다고 손님을 거지취급 하는 데는 빠른 시일 내에 장사 접어야 한다. 맛은 아직 본적에 없어서 모르겟지만, 저런 사장에 하는 곳이라면 어떤 더러운 재료로 손님한테 음식을 낼지 상상이 가는 곳이다. 절대 가지 마세요. 쓰레기 만도 못한 곳입니다.",별로
630,엄지숯불갈비,양념돼지고기 우삼겹먹었다 양돼 특별히 맛있단 느낌은 없었다우삼 맛은 있음 근데 우삼이야 안맛있을수가 없지않은가?? 일요일 낮시간 두세시쯤였고 요즘처럼 코로나 시즌인데 흔한 음료수 디씨도 없다특별히 맛있는것도 아닌데 서비스마인드 꽝장사 잘못하시는것같다,별로
631,연희동태찜,참기름범벅이고 동태살 실종,별로
632,연희동태찜,흐 정말 맛있다..! 알고니 추가도 물론해야하고 볶음밥도 물론 먹어야하니 둘이서가면 양이 좀 많을듯 ㅜ (물론 그래도 다 먹음^^) 글케 맵지도 달지도않은 적당한 양념이 부드러운 동태살에 잘 배어있어서 너무죠타 막걸리까지 한입 마셔주면 크~~ 밑반찬도 다 맛나당 히히 이런 정겨운 맛집 죠음,맛있다
633,연희동태찜,"급하게 해장할 곳을 찾았는데 마침 동네에서 평점도 높고, 메뉴도 딱이라 방문. 해장국은 보통 콩나물국밥보다는 북어 맛이 많이 남. 내 취향은 아니었지만 그런 거 따질 컨디션이 아니었기 때문에ㅎㅎ동태찜은 중(2.9)자 시켰는데 콩나물이 한가득이겠거니 생각한 것과 다르게 양이 많았다. 미나리도 넉넉히 들어 있어서 좋았음. 굳이 비교하자면 연희동 ㅇㅅㅊㅍ동태찜보다 훨씬 간이 약하고 덜 자극적인 맛. 그래서 평범하게 느껴질 수도 있지만 만족스러운 해장이었다!",괜찮다
634,연희동태찜,찐이였어요! 둘이 동태찜  중자(2.9)로 먹었는데 양이 적당했어요!은근히 맵지도 짜지도 않지만 다 먹고나면 물을 벌컥벌컥 마시게 되더라고요. 아무래도 양념을 많이 먹게 되니까요. 미더덕은 없고 큰 동태! 미나리 콩나물이 들어있어요. 동태가 정말 크고 살이 많아요. 고니와 알을 드시고 싶으시면 1만원 추가해야 하는데 저희는 안 했어요. 어느정도 먹고나서 밥 볶아드세요~! 한공기(0.2) 볶았어요. 저희가 먹던 동태찜 양념을 조금 덜어가셔서 주방에서 쎈불에 볶아져 나와요. 누릉지 타이밍 신경 안써도 되서 편했어요.,맛있다
635,연희동태찜,맛 맛있음생선찜이라고 해서 맛없을 줄 알았는데 생각보다 엄청 맛있었다. 별미를 먹고 싶을 때 생각나는 곳,맛있다
636,연희동태찜,너무 맛있는 동태찜! 가기전에 ‘난 동태 싫엉.. 난 생태좋아!’라고 말하고 갔는데 코 박고 먹었다. 동태도 살이 야들야들하고 실하다. 알 추가 했는데 접시 넘치게 나온다. 밑반찬도 빠짐없이 맛있는데 기본적으로 음식솜씨가 좋다. 동태찜 간은 강하지 않고 깔끔해서 계속 들어가는 맛! 숨은 생선찜맛집이다,맛있다
637,연희동태찜,맛있어요~,맛있다
638,연희동태찜,생각보다 엄청 매움,괜찮다
639,연희동태찜,"600번째 리뷰는 연희동에 위치한 동태찜 전문점!! 보통 빨간 양념의 생선 찜 요리를 싫어하는 편인데 여긴 처음 가보고 맛있어서 정말 일주일에 한 번씩 갔다고니 등을 추가 하면 정말 넉넉한 양을 즐길 수 있는데 여자라면 가장 작은 크기를 시켜도 세네명이 먹어도 충분하다 동태찜을 다 먹은 후 볶아 먹는 밥도 별미인데 배불러 죽겠어도 1인분이라도 꼭 시켜 먹는다 짜지 않고, 적당한 양념의 이 동태찜이 난 왜 그렇게 좋은지 생전 어디 가서 절대 안 시켜 먹는데ㅋㅋ연희동 주민이 소개해 준 곳이니 역시 믿고 먹을 만! 동태찜 뿐 만 아니라 여기는 밑반찬이 참 정갈하게 잘 나온다 전부 다 맛있어서 동태찜 나오기 전에 하나 둘 집어먹어서 배가 불러온다 간신히 자제하고 동태찜이 나오면 와사비 장에 찍어 먹는 그 알싸한 맛이 참 좋다 집에서 가까우면 더 자주 가련만 ㅠㅠ",맛있다
