,가게이름,리뷰,맛평가
1646,아이덴티티커피랩,"아이덴티티커피랩_필터커피부문 맛집(5)<연남,연희 커피투어 #3>최근방문_’22년 3월1. 사실상 이번 카페투어의 목적이 이 ‘아이덴티티 커피랩’이다. 덕분에 겨우 연희동의 끝자락에 걸쳐있어, 택시를 타고 이동을 해야만 하는 위치였음에도 끝내 빼지 못하고 방문을 했다. 원래 망원동에 있던 카페였지만, 더 좋은 더 큰 로스팅기를 사용하기위해 임대료가 낮은곳으로 옮겨 크기를 키웠다고 들었다. 그만큼 커피에 진심이신분이라고 한다ㅋㅋㅋ (들었던이야기로, 다음엔 꼭 물어봐야겠다.)  << 총 4곳의 카페에서 무려 18종류의 원두를 맛봤다 ㅋㅋ 덕분에 맛의 기억은 메모에 의존할수 밖에 없어, 조금은 실제와 다른 뉘앙스로 표현될수 있는점 양해 바랍니다.>>2. 아이덴티티커피랩은 워낙 명성이 자자한곳이라, 꽤 예전부터 가고싶었던곳이었는데, 정말 오게 된 계기는 카페 ‘궤도’에서 마신 원두였는데 ㅋㅋㅋ 이번에 궁금증도 풀고, 맛도 즐기고 아주 신나는 방문이었다.  - 온두라스 부에나비스타, IH-90, 워시드 (Hot, 6,-)    : 부에나비스타 농장의 원두는 예전부터 마셔보고 싶었는데, 이제서야 먹게될줄은 몰랐다. 기본적으로 밸런스가 상당히 좋다. 가벼운 산미와 은은하게 사탕수수 뉘앙스의 단맛이 올라온다. 부담없이 가장 커피스러우면서 기분좋은 단맛이 매력적이다.  - 케냐 야라, SL28 etc., 워시드  (Hot, 6,-)    : 내가 원래 분명히 바디감이 강한 케냐, 콜롬비아 커피를 싫어했는데, 요즘들어 입맛이 바뀌고 있나보다. 케냐 특유의 바디감이 강하고 좋은 산미를 가지고 있고, 워시드 특유의 커피맛이 지배적이라 다른 향도 죽었는데ㅋㅋ 나쁘지 않게 마셨다. 조금마셔서 그런가 ??;;  - 에티오피아 시다모 벤사 아보레, 74110&74112, 허니 (Hot, 6,-) **    : 우와… 아보레 허니는 서초동의 ‘룰커피’에서 마셔봤던 단맛이 기가막힌 커피였는데, 여기는 또 다르다 ㅋㅋ 내 취향에 훨씬 가까운 커피다. 강한 단맛과 풍성한 다양한 과일이 느껴지는데, 점점 시트러스향이 강조되고 스파이시함이 섞여, 단맛과의 조화가 상당히 매력적이다. 이건 진짜.. 원두가 없어서 못산게 너무 아쉬울 따름이다.  - 과테말라 엘인헤르또, 게이샤, 워시드 (Hot, 8,5-) ***    : 첫 방문한 ‘프로토콜’에서도 맛봤던 원두인데, 정말 카페마다 추구하는 맛이 다르다는것이 확실히 보인다. 밸런스가 상당히 좋고, 시트러스하고 플로럴함이 좋다. 정말 인헤르또 농장의 원두를 종종 마셔보지만, 손꼽히는 풍성한 커피였다.  - 과테말라 부에나비스타, 아나카페14, 무산소발효 (Hot, 5,-)    : 무산소발효의 특징을 꽤 잘 나타낸다. 스파이시하고, 선명한 자두향과 지나치지 않은 발효취까지 매력적인 커피다. 아쉬운건, 가장 커피다운 워시드뒤에 마셔서인지, 이제 무산소발효에 지친덕인지 인헤르또 게이샤를 한층더 매력적이게 생각하는 계기가 되었다.3. 큰 로스팅기 등 사장님 욕심은 알겠으나, 조금 접근이 편한곳으로 와주시면 얼마나 좋을까 하는 생각이 든다. 사실 처음엔 내 취향과 비슷한 곳이 아닐까 생각했는데, 직접 맛을 보니 오히려 반대다. 취향과는 다름에도 인정을 하게 되는 원두에 대한 이해도가 상당히 높으신 장인이 계신가보다. ※ 결론왜 유명한지 이유를 알것만같다.",맛있다
1647,아이덴티티커피랩,"필터커피에 빠진 날 3커피 장인의 진심, 연희동 <아이덴티티커피랩>. 균형잡힌 부드러움?!향긋한?!늬앙스가 지배적. 찻잔도/깔끔한 분위기도/상냥한 바리스타님도좋은데커피 맛이 제일 매력적! 조금 한적한 언덕배기에 있어 접근성 아쉽다 생각했는데알고보니 어릴 때 다니던 도서관 근처 ㅋㅋㅋㅋ큐ㅠ 차분한 커피 타임이 필요할 때 다이어리 하나 들고 놀러 갈 듯!",맛있다
1648,포포브레드,"밤식빵, 무화과깜빠뉴, 애플크럼블-애플크럼블둘이 노나먹긴 좀 적은거 같고 혼자 다 먹자니 좀 많은거 같은 정도의 크기에요. 크럼블이 많이 부서졌고 코코넛오일 향이 좀 강했어요. 이건 호불호 있을거 같아요. 졸여진 사과가 들어가는데  이게 많이 달았어요.빵이나 크럼블 자체는 달지않고 슴슴했습니다.-깜빠뉴샤워도우처럼 엄청 발효된 느낌은 아니었어요. 식빵 같다는 느낌을 받았습니다. 저는 빵이랑 부재료 비율이 이 정도 되서 좋았어요. 그냥 먹을땐 퍽퍽하다 느꼈는데 발뮤다에 식빵모드로 먹으니까 엄청 쫀득했어요. 맛있어요~! ㅎ.밤식빵밤식빵이 제일 맛있어요. 식빵에서 버터맛 나는거 안좋아했는데 버터맛없이 느끼하지 않고 엄청 고소하구요.쌀식빵이라 엄청 쫀득해요. 밤도 달지않고 포슬포슬하고. 맛있어요~!!  비건음식 싫어하는 남편도 식빵이랑 깜빠뉴는 맛있다고 잘 먹더라구요.",맛있다
1649,포포브레드,"#쌀빵중에최고밀가루 안먹는 가족과 먹는 빵이라고 친구가 사다준빵단호박빵은 재료맛이 잘 느껴지는, 뭔가 가공이 덜된 느낌이 들었는데 맛있었다.쌀이 베이스라 그런지 빵보단 확실히 목이 메인다. 근데 먹순이인 나는 그래서 좋다. 부푼 빵보다 좀만 먹어도 확실히 밀도있게 두둑한 느낌이다.더 먹어보고싶다.밀가루를 끊을 수는 없겠지만 줄이고플때 여기는 필수일듯!",맛있다
1650,포포브레드,"초코타르트랑 비건세트, 올리브 치아바타를 구입했는데가게에서 먹은 오초타르트가 감동적으로 맛있었다.치아바타는 감동까진 아니었지만 은은한 짠맛과 쫄깃한 식감이 어우러져 맛있었음.비건세트의 스콘과 쿠키는 하루 지난 뒤에 나눠먹었는데조금 퍼석해져서 달달한 라떼로 밸런스를 맞춰야 했다.안내 브로셔에 나온대로 냉동을 하면 더 맛있었을까 싶음.+) 포장용기 환영하는 매장이니 제로 웨이스트 하시는 분은 참고하시면 좋을 듯.++) 보관법 질문이 길어지니 조금 귀찮아하시는 것 같았는데 카운터나 진열대에 브로셔를 하나 붙여두셔도 좋지 않을까 하는 생각이 들었다.",맛있다
1651,포포브레드,"비건브레드가 이렇게 맛있을 수 있다니 놀랐습니다. 우유,버터,계란 없이도 이런 맛을 낼 수 있구나 신기했어요. 역시 르꼬르동블루인가 싶기도 했고요! 커피 맛도 괜찮았습니다. 가게 내부는 아담하고 다들 대부분 포장해가시는 것 같았어요. 뒷편에 주차도 되고 앞으로 자주 찾게 될 듯하네요!",맛있다
1652,포포브레드,"서대문 맛집을 찾다가 망플을 통해 찾은 곳이에요.집 갈 때 가는 버스 정류장 바로 앞이라 들렀습니다.토마토 바질 스콘, 오초 타르트, 메콩 마들렌을 주문. 스콘은 퍽퍽해서 먹기가 많이 힘든 편이었어요.바질 향이 살짝 나지만 토마토 맛은 모르겠구요.바질을 좋아해서 먹긴 했으나 맛 자체는 무난한 편. 오초 타르트가 뭔가 했는데 오렌치 초코 타르트네요타르트에 들어가는 크림이 두부로 만든 것 같아요.제주 감귤 초콜릿 먹을 때처럼 오렌지 맛이 나는데,맛 자체는 평범한 초콜릿 타르트 맛이었습니다. 메콩 마들렌은 베스트 메뉴라서 주문한 디저트예요.메이플 시럽이 들어간다는데, 저는 잘 모르겠구요.콩가루 단맛이 강하게 나는 편인데, 피칸의 단맛과어우러져서 고소하고 단맛이 나는 건 좋았어요. 이번에 사온 디저트가 입에 딱 맞는 건 아니에요.하지만 지금까지 가봤던 비건 베이커리와 달리,비건이 아닌 것과 맛에서 큰 차이가 없어 좋았어요.그냥 일반적인 디저트를 먹는 느낌에 가까웠네요.맛 자체는 그리 특별하지 않다는 생각이 들지만비건 베이커리 중에서는 맛있게 먹어서 [맛있다]로.",맛있다
1653,커피가게동경,0. 여름 호우 기간에 통창을 열어 비 내리는 밖과 연결된 것을 보고 이 가게에 가고 싶다 라고 생각했는데 결국 눈 오는 겨울이 되서야 방문. 1. 마포에서 본점이 이미 유명하다고 하는데 못 가봤고 여기 처음 방문. 2. 아몬드 모카 자바 주문했고요. 저렴하네요. 자리는 많이 없는 편. 달거라 예상했고 예상대로 달아서 좋습니다. 깊은 단맛? 3. 자리가.. 조금 불편하긴 한데요. 좁고 등받이가 없고? 사람이 없어야 괜찮은데 평일에도 반 절 이상은 차있는데 흠? 그래도 추천. #위드인기맛집,맛있다
1654,커피가게동경,"연희동에 위치한 '커피가게동경'- 아인슈페너 5,000원- 아몬드모카자바 5,000원감각적인 분위기의 커피가게동경! 점심시간대에 갔더니 북적북적했어요. 테이블도 한 4개정도..? 많은 편은 아니에요!아인슈페너는 부드러운크림과 농도짙은 산미의 커피가 잘 어우러졌어요. 입안에서 엄청 다양한 맛이 맴도는.. 개인적으로 산미가 나는 커피를 별로 선호하지않아서 맛이 조좀 세게 느껴지긴했지만 맛있긴했어요!개인 취향으로는 아몬드모카자바가 더 맛있었어요. 부드럽고 달달한 크림 최고,, 커피도 달달하니 맛있었어요! 먹다보니 이 메뉴도 산미가 느껴졌어요.보통 카페들 가보면 크림이랑 따로 노는 아인슈페너가 많은데 이곳은 확실히 잘 어우러져서 만족! 다음에는 따듯한 메뉴로 먹어보고싶어요.",맛있다
1655,커피가게동경,"#커피가게동경 #연희점아 .. 진짜… 아른아른의 정석.. 끝판왕 .. 많아지는 점들 속에서 제 마음이 느껴지시나요 .. 자신있게 명불허전 아인슈페너 최고라고 외칠 수 있는 곳.연희와 망원지점 두 군데 있는데지하에 있었던 망원점과 달리 창 없는 밖을 통해 동네의 매력을그대로 느낄 수 있는 연희점.시그니처 커피인 아인슈페너, 아몬드 모카자바를 마셔봤는데기호에 맞는 커피 스타일에 따라서달달하지만 찐한 아메리카노에 크림을 선택 할 것인지많이 달지 않지만 역시 진한 초콜릿이 들어간 라떼에 크림을 선택할 것인지 쵸이스 하시면 됩니다 ! 전 아몬드 모카자바가 더 .. 요즘같이 추운 날엔 스위트 카푸치노도 먹어봐야겠어요.참고로 개인 차이일 수 있지만,동경의 카페인이 굉장히 쎄다고 느끼는 편입니다.아무튼 .. 동경 사랑해 ㅠ ㅠ",맛있다
1656,커피가게동경,"매번 테이크아웃만 하다가 간만에 가게에서 커피마시고 온 기념 리뷰쓰기 연희동 주민이라면 반드시 꼭 무조건 가봐야 할 카페입니다 망원에 본점이 있는데 그냥 연희동이라는 점 때문인지 왠지모르게 연희점이 더 정감이 가는 그런 마음...에스프레소와 밀크티가 짱이고 유명한 메뉴인 아몬드모카자바도 너무 달지 않고 맛있어요! 자리가 마땅하지 않아서 그런지 대부분 테이크아웃 손님인데, 가끔은 앉아서 틀어주시는 재즈 엘피 들으며 바깥 구경하면서 잠깐 마시고 가는 것도 하루를 행복하게 해주는 좋은 방법 같습니다. 음악과 커피를 좋아하신다면 꼭 방문해보세용 제가 다시 연희동으로 돌아올 때까지 사라지지 않기를",맛있다
1657,커피가게동경,"연희동에 동경이 생겨서 좋아요. 사러가 갈때마다 들릴 수 있어요. 이 날은 이른 아침에 갔었는데, 테이크아웃 손님만 있고 내부엔 사람이 없어서 한적하게 음악 즐기면서 커피 마실 수 있었네요! 사러가 주차장에다 주차하시면 되어요!",맛있다
1658,커피가게동경,매일마다 커피 컨디션을 확인하는 집맛을 꾸준히 유지해서 더 좋은곳,맛있다
1659,커피가게동경,한국 비엔나 커피의 원조격인 커피가게동경의 연희점. 연희 사러가 건물에 위치해있습니다.비엔나 커피의 경우 커피부터 시럽으로 가당이 되어있어 크림과 따로 노는 일 없이 어우러지는 점이 특징입니다. 그만큼 달기도 한 점은 호불호가 갈릴 포인트겠네요.,맛있다
1660,커피가게동경,여기는 산뜻하게 뭘닝커퓌하기 너무 좋은 것인거 같당 사람도 많이 없고 노래도 너무 좋고 풀멍하기 딱 좋고ㅇㅇ 너무 기분좋게 아침을 시작할 수 있는 곳인거 같당 그리고 왠지 직원분들이 매우 커피에 진심인거 같아서 좋았당 여기 시그니처인 비엔나 커피랑 스위트 카푸치노?를 시켰는데 개인적으로는 카푸치노가 더 취향이었던 거 같당 비엔나도 맛있긴 했는데 다른 데서도 볼 수 있는 맛이어서 아주 임팩트 있진 않았던거 같당 스위트 카푸치노는 달달하고 거품도 있어서 부드럽고 아주아주 취저였음,맛있다
1661,에브리띵베이글,베이컨 에그엔 치즈 (플레인) 7500 & 아보가도 캐나다 (에브리띵?) 11000베이글... 이리도 질긴가?반갈라서 굽지않아서인지 바삭함은 없고 질긴감이 있네요.내용은 좋은데 먹다보니 빵이 입에 남아요. 내용물이 좀 더 많았으면... ㅡㅡ연어는 훈제가 아닌 익힌... ㅡㅡ,괜찮다
1662,에브리띵베이글,"오랜만에 방문한 내 최애 베이글 가게. 할로윈이나 추수감사절에 스페셜 에디션 베이글/크림치즈를 기획하는데 올해는 꼭 놓치지 않고 먹어보고 싶다. 2년 전 리뷰에서 꽤 디테일하게 썼지만 이 가게의 베이글은 그 쫀득한 식감과 고소한 풍미 자체가 너무 강해서, 이 베이글의 매력을 최대치로 느끼기 위해서는 내용물이 가득한 샌드위치 보다는 그냥 크림치즈만 발라먹는게 가장 좋다. 위층 매뉴팩트 커피에서 커피를 주문하면 베이글과 함께 먹을 수 있어 하나만 크림치즈를 발라달라고 요청했다. 크림치즈 자체가 짭짤하니 베이글은 그 savoriness를 받쳐줄 수 있는 에브리띵 펌퍼니클로 구매. 밝은 녹색 빛깔의 크림치즈는 생각보다 베이컨의 짠 맛이 적고 오히려 고소하고 시금치 크림 같은 크리미한 풍미가 돋보인다. 나머지 베이글들은 냉동해넣고 하나씩 토스트해먹는데 진짜 이 가게에서 구현하는 베이글의 밀도는 넘사벽인 듯.▪️Pumpernickel bagel (plain/everything) 2,500원 ⭐️▪️Plain & whole wheat bagel 2,500원▪️Blueberry/Pretzel bagel 3,000원▪️Spinach bacon cream cheese (seasonal) 3,000원▪️Scallion/Maple walnut/Blueberry/Plain cream cheese 2,500원",맛있다
1663,에브리띵베이글,"한줄평: 연희동에서 만난 제대로된 뉴욕 베이글 맛집!연희동에 미팅 갔다가 사가지고 온 <에브리띵베이글>뉴욕에서 오래 거주한 사장님이 직접 베이글 만드는 법을 배워와서 오픈했다고. 주말에는 무지개색, 할라페뇨체다, 건토마토 베이글도 판매한다고 한다! (무지개색이라니!) 안에서 먹고갈 곳은 없고 테이크아웃만 가능!나는 통밀에브리띵 (참깨 흑임자 양파/마늘가루 귀리) 베이글과 기본 플레인 베이글 그리고 무화과 크림치즈를 사와서 집에서 먹어봤다.진짜 뉴욕 여행가서 먹어봤던 제대로 된 베이글 맛이다. 에어프라이어에 구웠더니 겉은 바삭하고 안은 촉촉. 진짜 베이글이 쫄깃하면서 담백하다! 통밀에브리띵은 올라간게 많아서 조리할 때 자꾸 참깨랑 흑임자가떨어지긴 하지만, 덕분에 고소하다.포비나 뉴욕라츠오베이글이랑은 또 다른 느낌의 베이글이었다. 솔직히 여기랑 뉴욕라츠오가 진짜 뉴욕에서 먹는 것 같은 베이글 맛이었다. 근처 산다면 여기 베이글 추천!insta @yeh_rang #먹히영",맛있다
1664,에브리띵베이글,"“베이글의 모든 것”<‘에브리띵베이글’의 록스앤쉬미어>베이글에 대한 10가지 사실. 1) 동유럽계 유대인들이 뉴욕 등 북미 동부로 이주해오면서 전파되었고, 언젠가부터 뉴요커를 상징하는 대표적인 음식이 되었다. 2) 반죽을 끓는 물에 데쳤다 굽는다. 전분이 날아간 표면은 반짝거리고 텍스쳐는 쫄깃쫄깃해진다. 국내의 일부 베이글들은 이런 과정 없이 스팀 오븐에서 만들어진다. 3) 음식에 대한 유대인의 규율인 ‘코셔율법’의 영향을 많이 받았다. 4) 고기와 유제품을 함께 먹을 수 없다는 코셔율법에 따라, 전통적인 베이글은 버터, 우유 없이 물, 밀가루, 소금, 이스트로만 만든다. 5) 미국을 넘어 세계적으로 보편적인 음식이 되면서 버터, 우유가 들어가거나, 밀가루 대신 통밀, 통호밀(품퍼니켈)을 쓰거나, 브레첼처럼 양잿물을 활용해 만드는 등 그 형태가 매우 다양해졌다. 6) 토핑 없이 겉표면을 매끈하게 만든 것을 ‘플레인’으로, 참깨나 양귀비씨 등을 토핑한 것을 ‘에브리띵’으로 부른다. 7) 베이글을 반으로 잘라 안쪽 표면을 굽고 크림치즈를 바른 것을 ‘쉬미어’라고 부른다. 8) 전형적인 뉴요커의 아침은 쉬미어와 커피지만, 브런치나 조금 배부르게 먹을 땐 베이글 샌드위치 형태로 즐기기도 한다. 9) 코셔율법에 따르면 크림치즈는 고기와 함께 먹을 수 없기에, 대신 염장한 연어(록스)를 많이 사용했는데, 이 것이 ‘록스앤쉬미어’다. 10) 훈제한 것은 ‘스모크 살몬’, 훈제 없이 염장만 한 것이 ‘록스’지만 지금은 두 단어 간 경계가 많이 허물어진 상태다.—서울에서 앞서 말한 “베이글의 모든 것”을 제대로 경험해 볼 수 있는 곳이 있다. 이름부터가 ‘에브리띵베이글’.록스앤쉬미어에 잘 어울린다는 추천을 받아 품퍼니켈 베이글을 선택했는데, 호밀 특유의 밀도감과 투박함이 베이글 특유의 쫄깃함과 교차되는 게 정말 매력적이었다. 쫀득쫀득한 록스도 예술. 여기 베이글이라면 연트럴파크의 낯부끄러운 네이밍도 버틸 수 있을 것 같다.instagram: colin_beak",맛있다
1665,에브리띵베이글,"베이글 좋아하면 꼭 가야하는 곳!쫄깃한데 질기지 않고 밀가루의 퍽퍽함이 전혀 없는!베이글 샌드위치로 주로 먹어요.특히 연어 들어간 샌드위치만 주구장창 먹었는데 이번에 신메뉴가 나왔더라구요.기존에 있는 것이 숙성연어인 크림치즈앤럭스.새로 나온 것이 훈제연어인 아보카도캐나다.훈제보다 생연어 좋아하는데 아보카도캐나다 너무 맛있어요. 1000원 더 비싼 이유가 차고 넘치는 맛..크림치즈앤럭스는 기본적으로 쪽파크림치즈를, 아보카도캐나다는 고추냉이크림치즈를 발라줘요. (플레인에 고추냉이 바른 거일 수도..)베이글은 원하는 것으로 선택 가능~아보카도캐나다 완전추천합니다.",맛있다
1666,에브리띵베이글,"전에 오후에 갔더니 다 팔리고 문을 닫아서 매우 당황했던 기억.. 그래서 이번엔 각잡고 아침에 방문했는데 오전 9시에도 웨이팅 줄 있는거 실화냥ㅇㅇ 난 여기가 이렇게 핫한 곳인지 몰라찌.. 진짜 맛있긴 한거 같은게 외국인 손님도 마니 보여따 뭘 살까 고민하다가 매장 이름과 똑같은 에브리띵 베이글이랑 주말에만 나온다는 할라피뇨 체다 베이글을 시켜보아따 크림치즈도 종류가 갱장히 많았는데 그 중에서 쪽파 메이플월넛 훈제연어 이렇게 세가지를 시켜따 개인적으로 베이글은 할라피뇨 체다가 더 맛있었고, 크림치즈는 연어>메이플월넛>쪽파 순서로 맛있었음!! 연어는 진짜 와오.. 대박임ㅇㅇ 넘나리 추천하고픔",맛있다
1667,에브리띵베이글,[★★]맛있다. 베이글도 쫀득하고 스프레드 종류도 여러가지 있고 추천 부탁 드리면 본토 발음으로 추천 해주신다. 여기 베이글이랑 위에 메뉴팩트 커피랑 같이 먹으면 찰떡연희동만의 분위기도 물씬..,괜찮다
1668,에브리띵베이글,"일찍 일어나는 새가 벌레를 잡는다. 부지런한 사람이 먼저 이득을 보고 기회를 잡을 수 있다는 뜻의 속담이다. 옛 성현들의 말은 틀린게 없다. 일찍 일어나야 원하는 베이글을 쟁취할 수 있는 이 곳은 연희동 에브리띵베이글이다. -태어나서 먹었던 베이글중 제일 맛있었다. 서울 3대 베이글 안에 드는 친구다. 그중 한군데인 이곳밖에 안가봐서 여기가 서울 베이글 일짱이라고 말은 못하겠지만, 일단은 현시점 먹선생에게는 일짱이다. -한입 먹으면 헛웃음만 나온다. 여태까지 먹었던건 베이글이 아니라 탄수화물덩어리였을까. 시야를 틔워주는 맛이다. 대신 오픈이 아침8시라 시야를 틔우기 힘들다는 단점. 마감은 16시다. -먹선생은 빵류를 못먹는다. 없어서 못먹는다. 뭐 동네 빵집이던 파리바게트던 고급빵집이던 앵간하면 다 맛있어서 뭐가 특출난지 구별을 잘 못하고, 그래서 빵 관련 피드가 별로 없다. -하지만 이곳은 다르다. 딱 먹어보면 다르다. 90년대생인 나, 70년대생인 어머니, 50년대생인 할머니와 40년대생인 할아버지 모두 똑같이 한입먹고 동공이 커지는 경험을 했다. -레인보우 베이글은 주말 한정판매라고 한다. 아침 8시 15분에 입장했는데 이미 플레인베이글은 솔드아웃이였다. 꼭 먹고싶은게 있다면 무조건 오픈어택 하길 바란다. -크림치즈는 쪽파크림치즈를 추천하고 샌드위치는 에그소세지나 연어나 다 맛있다. 빵은 알아서 어울리는거 골라서 만들어주세요 라고 하면 편하다. 소세지도 이탈리안 소시지라고 태어나서 처음 먹어보는 맛이지만 입안에 착착 달라붙어서 거부감이 전혀 없었다. -제 점수는 10점 만점입니다. 코로나로 인해 포장주문만 가능하지만 주변에 공원에서 후딱 먹고가는 방법도 있으니 참고.",맛있다
1669,에브리띵베이글,최애 베이글집이 된 에브리띵호밀이 있다는 점이 가장 좋았다(호밀빵 러버)크림치즈들도 취향에 맞아서 이것저것 조합하는 재미가 쏠쏠 :)은근 쟁여놓듯 많이 사가시는 분들이 많아서 인기있는 건 품절이 빠른듯하다,맛있다
1670,에브리띵베이글,맛있다다른메뉴도 먹어봐야지,맛있다
1671,비하인드리메인,"햇살 좋은 날 방문했던 연희동 비하인드 리메인~~~아이스크림이 올려진 키오스크 프렌치 토스트가 맛있다고 해서 갔는데, 폭신폭신한 프렌치 토스트에 달달~~한 아이스크림의 조화가 맛없없 ㅜㅜ 순삭했다… 앞의 정원도 아기자기 귀여워서 봄~여름에 테라스에서 여유를 즐기기 좋을듯 !!",맛있다
1672,비하인드리메인,프렌치토스트가 맛났었어요. 사진은 못찍고 재방문해서 다시 마신 딸기에이드도 넘 달달상큼 좋았습니다. 프렌치토스트는 차와 커피와 곁들여 먹기 좋았고날 좋을 때 야외자리에 앉아서 있는 것도 좋았어요.,맛있다
1673,비하인드리메인,"연희동에 위치한 '비하인드리메인' ***- 아몬드허니크림치즈 프렌치토스트 4,000원- 밀크티 7,500원너무 애정하는 카페입니당,,분위기, 맛, 가격 뭐 하나 빠지는게 없어요!!초록+나무의 분위기가 마음을 정말 차분하게 해줘요 ㅎㅎ 야외 자리도 있더라구요!!:)저렴한 가격에 엄청난 맛의 프렌치토스트를 맛볼수있어요! 정말 부드러운데 입안에 달달한 맛이 가득차요! 너무 행복해지는 맛이에요 ㅎㅎ밀크티는 정석대로 너무 맛있더라구요!! 가격이 좀 있지만 양이 엄청 많아요.. 주전자로 나왔는데 따라도 따라도 끝이없더라구요 ㅋㅋㅋ 한 네번 따라마신것같아요 ㅎㅎ맛있는거 먹으면서 힐링하고싶을때 생각나는 곳이에요! 너무 추천하는 곳입니다 :)",맛있다
