,가게이름,리뷰,맛평가
1122,롱보트스모커,"아이돌 전소미의 아버지가 하시는 곳이라고. 아이돌도 훈제연어도 아무것도 몰랐지만 일단 짝꿍을 따라감. 입구 문 열자마자 엄청난 훈연 향이 난다. 매장은 좁은 편이고 작은 쇼케이스 안에 숙성된 연어들이 진공팩에 담겨 있음. 치즈도 있고 어포도 있다. 콜드스모크와 핫스모크로 나뉘는 듯 한데 처음 왔다고 하니 엄청 오랫동안 자세히 설명해주시면서 시식도 어마무시하게 많이 시켜줌. 나는 엄청난 편식쟁이이기때문에 연어를 먹지 않아서 노감흥 상태였는데 눈을 빛내며 시식을 주셔서 먹지 않을 수 없었음. 나는 연어 특유의 맛과 향을 너무 싫어하는데 훈연 향이 엄청 강해서 내가 싫어하는 연어 향이 아예 느껴지질 않았다. 어란도 주시고 어포도 주셨는데 받아먹기 바빠서 사진은 연어파테뿐. 파테는 내 취향은 아니었는데 어포는 엄청 맛이 좋았다. 콜드 하나, 핫 하나, 어포 하나 해서 6만원대인가였고, 처음 먹는 사람+요리를 많이 하지 않음을 배려해서 부위별로 추천해서 담아주셨다. 엄청 친절하시고 한국말도 되게 잘 하시는 편. 식사용보단 와인 안주로 먹기 제격이다. 카나페 세트나 크림치즈도 판매해서 이대로 사서 홈파티에 써도 괜찮을듯.",맛있다
1123,롱보트스모커,"확실히 시판으로 흔히 접했던 훈제연어와는 다르다... 라기보단 더 깊은, 완성도 높은 맛이었습니다. 시즈닝같은 경우는 좀 더 간이 쎄고 독특한 향도 났습니다. 한끼도 안먹고 가서 시식만 했는데 다음 식사전까지 입에서 훈연향이 가시질 않았네요(과장아님)ㅋㅋ 모 유투브 영상으로 접한 후에 먹었기에 가격과 가성비에 대해 왈가왈부하진 않겠습니다만 확실히 모르고 갔을 때엔 흠칫할 만한 가격이긴합니다. 다른 음식과 곁들여 먹는 걸 추천드리고 가게의 사장님 사모님이 정말로 친절하셔서 설명도 한참 해주시고 계산하는데까지도 유쾌했습니다.  1시오픈이었는데 제가 2시반에 갔다 오고 얼마지나지 않아 솔드아웃된 점 참고하세요",맛있다
1124,롱보트스모커,맛있다난 치즈가 더 맛있더라,맛있다
1125,롱보트스모커,"어머 아직 리뷰가 없다니, 첫 리뷰라니?! ㅋㅋ 호호호훈제연어에 사실 큰 관심은 없었으나 이 매장 오픈을 계기로 직접 훈제한 연어의 맛을 알게 되었다. 6월 초쯤 오픈했었나.. 처음 방문해 시식, 구입을 하고 인사도 나눈 이후 몇 번 재방문하게 될 만큼 다 맛이 좋았다. 일단 치즈와 연어 모두 진정한 smoked! ㅋㅋㅋ 갓 훈제한 치즈의 경우 냉장 보관 중이었는데도 불구하고 정말 코에 연기가 들어오는 느낌이다. ㅎㅎㅎ. 매운 것은 아니지만 코에 훅 들어오는 풍미, 이어서 부드럽게 끝나는 치즈의 원래 맛. 새로운 경험이었다!! 그래서 맥주나 와인과 함께 곁들인다면 아주 훌륭하거나 혹은 마리아쥬가 안 좋을것 같은 생각이 들었다. 크리스피한 화이트 와인? 아니면 풍미가 좋고 개성있는 에일맥주? 글쎄 잘 모르겠다. 그리고 이 곳 제품은 유통기한 같은 것이 2개 적혀 있는데 더 긴 날짜 기준으로 그 전에 먹으면 숙성이 잘 되어 좀더 편안하고 고급스러운 맛이 될 것 같다. 그러나 개인적으로는 연어의 경우 좀더 빨리 먹는 것이 더 촉촉하고 부드럽고 덜 짜게 느껴져 더 맛있었다. 숙성된 이후엔 더 단단하다. 그냥 먹어도 좋지만 계란 등과 요리하여 먹는다면 아주 훌륭한 식재료가 된다. 방문 때마다 사장님이신 소미아빠가 무표정으로 매우 친절하게 설명해주고 안내해 주신다. ㅎㅎ 그리구 어떤날은 소미엄마께서 엄청 밝고 친절하고 유쾌하게 반겨주신다. ㅋㅋ 잠시 직원으로 계시는 친척조카분도 매우 밝고 친절하시다. ㅋㅋ 어느 날은 갑자기 냉장고에 있던 두텁떡도 얻어먹고 옴. 가격은 싸지 않지만 특별한 식재료로 한번씩 사면 좋은 곳. 글레이즈 코팅된 연어도 나오고 훈제초코(?????!!!!!)도 나왔다고 하니 조만간 또 가야겠다.",맛있다
1126,링키지버거,linkage burger link to burger 라는 의미랍니다~버거사이즈가 크진 않지만 알차다주문하면 바로 패티부터 굽고 빵도 구워서 굽는다주로 버거 안좋아하는데 배고파서 그런건지 한숨에 다 먹었다mushoom burger 먹었는데 버섯에서 트러플 향도 났다!,맛있다
1127,링키지버거,이름을 바꾸신듯? 번이 정말 매력적,맛있다
1128,링키지버거,"☆페퍼민트 패티 주문 ! (시그니처 메뉴인 듯) 여긴 카운터석으로만 이루어져있고, 청년 두분이서 운영하신다. 살짝 젊고 열심열심한 분위기지만 날티나지는 않고 편안한 느낌인데, 버거 맛이 딱 그랬다. 연륜이 느껴지는 응축된 맛도, 어떤 개성이 느껴지는 강한 맛도 아니지만, 기본은 지킨 맛이다. 재료 중 어느 하나 과하게 튀지 않았고 전반적으로 잘 어우러지는 맛이었다. 특이했던건 적양파가 가득 씹혔던 점. 풍미가 좋게 느껴졌다. 그리고 여긴 프렌치 프라이가 맛있다! 맛은 자극적이지않고 평범한데 식감이 좋다. 여리여리한 느낌? 케첩 없이 먹는게 더 맛있었다. 속이 되게 부드러웠고, 감자의 향이 잘 느껴져서 좋았다. 맞다 콘샐러드도 시켰는데, 막 당기는 맛은 아니지만 허브솔트가 들어가있는게 인상적이었다. 버거랑 같이 먹기에 좋았다. 멀리서 찾아올 정도의 맛은 아니지만, 셰프이자 직원분이신 분들도 넘 친절하셨고, 맛도 준수해서. 근처에 산다면 가끔씩 방문할 것 같은 맛이다.딱 한가지 아쉬웠던 건 카운터석 의자가 넘 높고 띄엄띄엄 놓여져있어서 불편했던것..? 테이블이 넘 낮게 느껴져서 편히 앉는 느낌이 없었고,같이 온 사람들이랑 좀 붙어서 먹고 싶어도 그럴 수가 없었다 ㅠ 아! 직원분들 요리 끝나시고 마감 준비하시는지 그릴 위 후드를 정말 박박박 닦으셨는데 그게 그렇게 인상적이더랬다.. 깔끔하게 식당을 운영하겠다는 그 진심이 느껴졌달까. 응원하고싶은 집이다 !for. 혼밥러, 2인(친구사이)not for. 4인이상 모임, 데이트",맛있다
1129,링키지버거,여기 미국에있는 햄버거 보다 더 맛있어요!!!,맛있다
1130,링키지버거,요약 : 소스 빼고는 글쎄…?페퍼민트 버거- 번에 버터 맛이 은은하게 느껴져서 좋다- 소스가 맛있다. 새콤한 맛은 줄이고 단 맛을 끌어올린 타르타르 맛이랄까? 잘 어울린다- 고기나 채소 맛은 평범한데 양은 적은 편. 특히 패티는 여자 주먹만해서 배가 허전하다. - 버거 2개는 먹어여 배가 찰 듯버팔로윙- 냉동 윙을 그대로 튀겨서 사용한다. - 맛은 평범한데 양은 적은 편.- 버팔로 윙 말고 차라리 버거 2개 먹는 걸 추천,괜찮다
1131,링키지버거,연희-연남 수제버거 집 중 탑티어가 아닐까.그리 짜지 않으면서 맛을 내는 건 어려운데 그걸무난하게 내어 준다.,맛있다
1132,링키지버거,나는 햄버거에 진심인 남자다. 지난 10년간 미국에서 살면서 햄버거란 햄버거는 다 찾아먹어봤다 자신할 수 있다. 내 취향이 많이 반영된 의견인지도 모르겠지만 집 근처 로컬 수제버거집이 좀 더 잘되길 바라는 마음에 평소에 남기지도 않는 리뷰를 감히 몇자 적고 싶어져 적었다.패티라는 이름을 건 수제버거집인만큼 패티 퀄리티는 괜찮다. 허나 일반적인 수제버거 프랜차이즈들의 패티와 크게 차별화된 점이 없어보인다. 시즈닝은 좋았고 개인적으로는 같은 양을 쓰더라도 패티의 두께를 늘리면 어떨까하는 바람이 있다. 제일 마음에 들지 않았던 점은 소스다. 소스의 양이 많아도 너무 많아서 햄버거 패티에 집중하기 너무나도 어려웠다. 소스의 양을 줄이고 패티의 육향과 시즈닝을 좀 더 느낄 수 있었으면 좋았을 것 같다. 제발 마요네즈 소스를 반 이상 덜어냈으면 좋겠다.감자튀김에 사용되는 감자 품종도 일반적으로 튀김용으로 사용되는 감자가 아닐 것 같다. 속은 촉촉한 찐감자/삶은감자와 같은 식감인걸 보니 수분이 많은 품종을 사용했을 것이라 생각된다. 튀김에 적합하지 않은 품종이라 여겨지지만 갓 튀겼을 때 한정 오히려 일반적인 튀김용 품종보다 더 맛있었던 것 같다. 벨기에 느낌으로 마요네즈나 몰트식초등을 구비해놓으면 좋을 것 같다. 만원이 넘는 세트메뉴인 만큼 평가의 허들도 많이 높았던 것 같다. 사실 남이 공들여 만든 작품을 익명성 뒤에 숨어서 이렇게 평가하는 내 자신도 그리 떳떳하지 못하고 이런 리뷰를 쓰는 것도 기분이 썩 좋지는 않다. 다만 앞으로도 좀 더 번창하길 바라는 마음에 몇자 적고 싶었다.,괜찮다
1133,링키지버거,머슈룸 버거를 주문. 트러플오일을 넣은 크리미한 소스의 버섯이 들어간다. 빵은 버터리하진 않지만 아주 부드러운 식감. 패티도 맛있다. 감튀대신 선택 가능한 고구마 튀김도 아주 좋다. 개인적으론 찾아갈 정돈 아니지만 동네에있으면 자주 갈 것 같은 준수한 곳.,맛있다
1134,링키지버거,페퍼민트패티 두번째 방문또 생각나서 다시 방문한 페퍼민트!딱 점심시간에 가서 10분정도 웨이팅했어요여전히 맛있더라구요!사실 지난번이랑 다른거 먹어볼까 했는데제일 기본을 선호해서 똑같은 페퍼민트버거 선택했어요버거 안에 생양파가 들어가는데그게 느끼함을 잡아줘서 굿!다음번엔 배달시켜서 식어도 똑같이 맛있나 먹어보려구요,맛있다
1135,링키지버거,"햄버거를 좋아해서 예전에 브루클린더버거조인트나 길버트버거앤프라이즈 같은 수제버거 가게들이 생겨나기 시작했었을 때 여러 수제버거 가게들을 방문했었는데 소수의 가게를 제외하고 대부분은 수제버거 유행을 타고 급 생긴 것 같거나 아니면 한국화된 버거를 내놓아 나한텐 별로인 가게들이 많았어서 수제버거에 대한 흥미를 잃었었음.그러다 원스타올드패션드햄버거를 방문하면서 다시 흥미가 생겼고 후에 방문했던 가게들 중에 이태원의 캘리포니아키친앤크래프트펍이나 빌리언박스, 홍대 올드루키스버거, 더리얼치즈버거 등이 나름 맘에 들었었고 더 최근에 들렀었던 팻보이즈의 프라이드어니언버거나 핫치킨샌드위치는 흠칫 놀랄 정도였어서 원스타올드패션드햄버거와 같이 최애 햄버거 가게가 될 정도였음.여기 페퍼민트패티는 가게 이름에 페퍼민트란 단어가 들어가선지 입 안이 화해지는 느낌이어서 햄버거 가게 이름으로 당기지 않아 패스했던 가겐데 인스타에선가 아메리칸버거위크란 프로모션을 보게 됐고 참가 업체들 중엔 그나마 이 가게가 내 타입일 것 같고 망플 평도 좋아 프로모션이 끝나기 전에 들르려고 지난 주말에 오후 5시쯤 들렀는데 솔드아웃이어서 발길을 돌렸었고 오늘 오픈시간에 맞춰 다시 한 번 들러봄.한 번 왔었어서 위치를 알아 금방 가게 앞에 서니 내가 첫 손님이었고 아담한 가게로 들어가니 젊은 남자 사장님 둘이 계셨고 입구쪽 카운터에서 아메리칸버거위크 프로모션에 관해 설명을 듣고 사진에서 봤었을 때 내가 좋아하는 저렴한 슈퍼마켓화이트번이 아닌 브리오슈번을 쓰는 느낌이어서 치즈버거 같은 심플한 버거보단 머쉬룸버거가 나을까 해서 주문할까했는데 소스가 스리라차마요소스여서 머쉬룸버거가 은은히라도 매콤한 건 내 타입이 아닐 것 같아 그냥 시그니처 메뉴인 페퍼민트 패티를 세트로 주문하고 프로모션 20% 할인을 받음.음료 선택을 얘기하셔서 내 최애 소다인 닥터페퍼가 있는지 문의를 하니 펩시콜라와 스프라이트, 진저에일만 준비되어 있다고 하셔서 펩시콜라를 부탁드리고 카운터석에 앉음.매일 아침에 준비한다는 패티를 팬 위에 올리고 번도 반을 갈라 역시나 팬 위에 올린 후 프렌치 프라이즈도 튀기기 시작하심.적당히 패티가 익어갈 때쯤 베이컨 두 장도 올리고 패티 위에 아메리칸 치즈도 올려 적당히 녹을 때 까지 기다렸다 준비해서 내어주심.펩시콜라는 지난번 더리얼리치즈버거처럼 미국 느낌 뿜뿜인 빅사이즈의 컵에 얼음 듬뿍인 정도는 아니지만 그래도 제법 넉넉한 사이즈의 유리잔에 얼음을 넣어 제공됐고 페퍼민트 패티 버거는 보니 볼륨감이 비교적 아담한 편이어서 여자손님들은 좋아할 것도 같은데 남자손님한텐 살짝 아쉬울 것 같은 느낌이고 프렌치 프라이즈는 흔한 제품감자여서 딱히 할 말은 없음.카운터 위엔 케첩과 머스터드만 준비되어 있어 프렌치 프라이즈는 마요네즈에 찍어 먹는 걸 좋아해 마요네즈를 부탁드림.페퍼민트 패티 버거를 들어 한 입 베어무니 신선하고 밑간이 잘 된 패티는 나름 좋은데 역시나 브리오슈번인지 암튼 번의 겉 껍질이 은근 신경이 쓰이고 신선하고 밑간이 잘 된 패티는 요즘 웬만한 가게에선 흔히 보는 거라 인상적이겐 안 느껴짐.프렌치 프라이즈도 마요네즈에 찍어 맛을 보니 정성들여 튀기시던데 흔한 제품감자지만 그래도 조금 낫게 튀겨졌던 더리얼치즈버거의 느낌보단 덜 좋아 역시나 평범한 느낌임.이런 느낌의 버거라면 지난번 올드루키스버거가 여러모로 좀 더 낫게 느껴짐.전체적으로 아메리칸버거위크 프로모션 찬스를 이용해 참가업체들 중 제일 끌렸던 여기 페퍼민트패티에 들러봤는데 버거 자체로는 나쁘진 않았어서 프랜차이즈 느낌의 쉐이크쉑 같은데 갈 바엔 여길 들르겠지만 근처가 아니라면 일부러 들를 것 같진 않은 방문이었고 응원의 맘을 담아 맛있다로 할까하다 평이 넘 좋은 느낌이어서 괜찮다로.",괜찮다
1136,링키지버거,연희동 페퍼민트패티항상 다른 곳에서 배달로 버거 시켜먹었는데따뜻한 버거를 바로 먹고 싶어서 방문했어요!결과는 대만족입니다!저는 페퍼민트버거+프렌치세트+병맥으로 변경했어요지금 심지어 이벤트중이라서 5월2일까지 세트는 20%할인!바로 앞에서 패티 굽는 것도 보고바로 뜨거운 버거를 먹으니까정말 너무 맛있었어요!평소에 먹던 다른 곳보다 훨씬 맛있었어요;)다음엔 배달로도 시켜먹으려구요!,맛있다
1137,링키지버거,맛있다아무래도 기본이 맛있다 패퍼민트버거고구마튀김이 맛있는데 가끔 썩은 고구마도 있더라그래서 왠만하면 감튀만 시킨다,맛있다
1138,링키지버거,패티의 존재감이 뚜렷했던 버거간만에 수제버거다운 수제버거였다... 가게의 특색이면서도 개인적으로 맘에 들었던 부분은 음식점이 칵테일바처럼 주방과 테이블이 합쳐져 있는 구조라서 버거가 만들어지는 과정을 다 지켜볼 수 있다는 점이다. 음식의 청결함이나 맛에 대한 신뢰도가 높아져서 기분이 좋다. 기본 페퍼민트버거와 불고기버거를 주문했다. 가격대는 8-9천원대로 나름 합리적이다. 패티가 두툼하고 맛있고 식감도 좋아서 맘에 들었다. 식감이 다른 수제버거집이랑 다른 느낌이었는데 뭔가 떡갈비스럽기도 하고... 암튼 존재감이 뚜렷했다. 또 가볼만한 곳이다,맛있다
1139,링키지버거,"첫방문이라,제일 베이직한 치즈버거+감자튀김 그리고 딸아이를 위한 딸기쉐이크 먹었는데, 다~~맛있었어요°.다음엔 고구마튀김 꼭 먹어보려구요~°°.하교 후 학원가기전 영양든든한 간식 시간 이었어요",맛있다
1140,링키지버거,"연희동의 수제버거집 페퍼민트 패티에 다녀왔어요.  버거의 미학이라면 뭐니뭐니해도 크게 베어물어 와구와구 먹어치우고 잔뜩 오른 포만감에 기분 좋게 가게를 나오는 음식이라고 생각하는데, 딱 그런 느낌의 식사를 했어요.다이너 스타일의 아메리칸 빈티지 풍으로 꾸며진 인테리어는 사실 그닥 새로운 면은 없지만, 컬러 포인트와 타이포를 조물조물 잘 버무려서 예쁜 가게를 만드셨더라구요. 거기에 유니폼과 메뉴판까지 전체적으로 브랜딩이 잘 된 가게. 키친이 한 눈에 보이는 바 스타일의 좌석 배치도 좋았어요. 착석하면 테이블 위에는 머리끈이, 테이블 아래에는 가방을 걸어놓을 수 있는 행거가 있는데 이런 세심한 배려 아주 고맙습니다...폭닥한 번과 부들부들하게 육즙이 살아있는 패티, 그리고 (양파의 경우는 아무래도 호불호가 있겠지만 저는 호에 가까운) 아삭아삭한 야채의 조합이 참 좋았고 무엇보다 고구마 프라이 !!! 넘 맛있었어요. 요샌 프렌치프라이 말고 고구마를 옵션으로 내어주시는 가게들 많던데 특히 이 집에서 먹었던 고구마 튀김이 진짜 인상 깊더라구요. 그리고 찐득달달한 바닐라쉐이크까지 ... 쉐이크 위에 휘핑까지 아낌없이 올려주시니 맛과 동시에 죄책감까지 쑥 올라갔지만 그래도 행복한 맛이였어요. 또 먹으러 가고싶다 ! 필히 재방문 예정.",맛있다
1141,링키지버거,예전 연희동 맛집 몽고네 자리에 새로 생긴 수제버거 맛집! 페퍼민트패티!  이 동네에서 가장 맛있는 수제버거가 아닐까 싶다. 매장은 협소한 편인데 깔끔하고 바 자리에서 패티를 굽고 버거를 만드는 모습을 직접 볼수가있다. 추천메뉴는 머쉬룸버거!,맛있다
1142,링키지버거,연희동에 생긴지 얼마 안 된 수제버거집입니다. 크기는 조금 작지만 엄청 맛있어요! 선배 언니가 사주신 거라 더 맛있게 느껴진 걸 수도 있어요ㅎㅎ 감튀까지 엄청 신선하고 맛있어서 재방문의사 있습니다!,맛있다
1143,링키지버거,"머쉬룸 버거 프렌치 세트 12,900불고기버거 스위트 포테이토 세트 13,900버거 음료 프렌치프라이 구성의 세트메뉴 주문했어요젊은 청년 두분이서 운영하시는 것 같은데매장 인테리어도 깔끔하고 예쁘게 잘 꾸며놓으셨더라구요머리끈도 있고 화장실도 깔끔하고 좋았어요햄버거 크기나 프라이 양에 비해 가격이 좀 센 느낌이라가성비가 좋은 느낌은 아니지만 맛있었어요흔히 먹을 수 있는 프렌치 프라이도 맛있었지만오랜만에 스위트 포테이토 먹으니까 너무 맛있더라구요소고기 패티는 직접 만드시는 건진 모르겠지만저렴한 맛이 아니어서 좋았어요 생각보다 두툼했고양파 토마토 야채도 싱싱했어요주문 즉시 바로 패티와 빵을 구워 버거를 만드시는데구운 패티 위에 치즈를 올려서 패티 위에 사르르 녹아내린치츠도 참 맛있었어요가성비가 좀 아쉽긴 하지만 또 가고싶어질 것 같아요..냠냠 맛있게 잘 먹었습니다!",맛있다
1144,링키지버거,"미국식 분위기에 깔끔한 매장 + 시끌벅적한 노랫소리. 딱 햄버거 먹기 좋은 분위기에요. 바 형태의 좌석 구조에, 오픈키친이라 음식 나오기전까지 구경하는 맛도 있고 전체적으로 서비스는 친절한 편이에요. 젊은 남성 두분이서 운영하시는데, 뭔가 노력하시는 모습이 상당히 인상적이었던.. 그런 곳입니다.제가 먹은 버거는 페퍼민트패티(7900원)고, 세트는 4천원 추가에요. 음료수 단품은 2천원이구요. 맛 자체는 맛있다와 괜찮다 사이 정도이나, 세트로 먹었을 때 12000원 가까운 금액에 부합하지는 않는다고 생각했어요.일단 패티의 맛과 질은 맛있는 편이에요. 다만, 카라멜라이징한 양파가 아닌 생양파라는 점과 번이 제 스타일이 아니었네요. 부드럽고 촉촉한 번을 좋아하는데, 번 자체가 맛있다고 생각들진 않았어요. 속 채소나 고기는 전체적으로 잘 어우러지고, 소스도 맛있는 편이지만 아쉬웠던 부분이 좀 남는 감이 있네요...그리고 감자튀김이 별로였어요.수제버거가 땡길 때 재방문할 의사는 있지만,  가격과 맛을 고려하면 자주 올 것 같지는 않은 곳이네요.",괜찮다
1145,링키지버거,"페퍼민트패티-분명 버거를 파는 식당인데, 적당한 조용함과 살가움이 존재하는 공간. 고요하면서도 정다운 연희동 감성을 완벽하게 이용했다. 연희동에 수제버거집이 생긴다면 이런 느낌일텐데라는 생각을 정확하게 노린 곳.프랜차이즈와 유명 수제버거집 그 사이, 시끄럽지도 부담스럽지도 않다. 미국에서 먹었던 작은 수제버거집이 절로 생각난다.--200201 방문패티가 훌륭하다. 씹는 식감이 아주 좋고, 건강한 수제패티라는 느낌이 딱 온다. 물론 실제로 건강할지는 모르겠지만. * 패퍼민트 패티 (7.9) : 일단 왜 이름이 페퍼민트 패티인건지 궁금하다. 민트 맛이 나지는 않는다. 약간 렌치?비슷한 시그니처 소스?가 있다고는 하는데, 사실 나는 잘 못 느꼈다. 같이 간 지인은 맛있었다니 할 말은 없음. 베이컨은 바삭하고 로메인은 싱크럽다. 크게 자극적이지 않고 무난한, 수제버거의 정석 같은 느낌.* 머쉬룸 버거 (8.9) : 느타리버섯과 트러플 오일이 들어갔는데, 일단 향부터 물씬 느껴진다. 버섯 맛이 꽤 진해서 호불호가 크게 갈릴 듯 하다. 그렇지만 일단 머쉬룸 버거를 시켰다는 건 어느정도 버섯 맛을 아는 사람이겠지? 그렇다면 충분히 감동할 만한 맛. 느타리버섯이 가득 들어 있어 버섯 식감도 가득가득 느낄 수 있다. 스리라차 마요 소스를 사용했는데 크게 맵지는 않고, 자칫 과할 수 있는 버섯 맛을 잡아준다.* 세트 : 프렌치 프라이, 스프라이트 (4.0) : 무난한 프렌치 프라이. 두껍긴 한데 살짝 비싼 느낌.--연희동에 드디어 생긴 수제버거집ㅠㅠ 생각하지 못 한 거리에 생겼는데, 잘 어울렸다. 오래 갔으면 좋겠다...크다고는 할 수 없는 공간인데, 잘 사용했다 싶었다. 2인용 테이블 2개에 bar형 자리 10개 정도 있던 걸로 기억. bar형은 테이블도 큼직큼직하고 조리하는 모습도 볼 수 있었다. 앞치마, 휴지, 포장지에 가게 이름을 적어둔다던지, 머리끈을 준비해둔다던지 하는 디테일함과 주방을 깨끗하고 정갈하게 유지하려는 모습이 보여 저절로 기분이 좋아지는.-#아무리뷰--+생각 덧붙이기연희동에 청년창업의 공간들이 점점 많아지는 듯하다. 청년창업의 매장은 딱 들어서자마자 특유의 힙함을 느낄 수 있는데, 공통적으로 디테일에 신경쓰면서 시그니처 메뉴(가게이름을 땄다면 100%다)가 존재한다. 분위기는 ""우리는 열린 공간을 지향하고 제공합니다, 하지만 당신의 생활을 방해하지는 않을게요"" 느낌이다. 사실 나도 내가 뭐라는지 잘 모르겠음.. 언젠가 이 생각을 잘 정리해봐야지. 암튼 SNS(특히 인스타그램)에 의해 만들어진 이 시대의 핵심 아이디어, 뭐 이런 느낌인데, 인스타가 주춤하는 순간(사실 이미 진행되고 있다고 본다) 어떻게 될지 궁금하면서도 걱정되는 부분.근데 사실 외국에서 이런 분위기의 매장이 아직까지 어느 정도 인기를 누리고 있는걸 보면, 우리나라에서 이런 매장의 수명은 조금 더 남았겠지. (5년은 가지 않을까 한다)",맛있다
1146,제니스카페,"여유로운 식사제니스카페는 점심 세트가 알차요.빵도 맛있고, 스프도 집에서 만든듯 재료가 꽉 차있죠.메인 파스타도 세련된 맛은 아닌데, 장소와 딱 어우러져요.소박하지만 여유로운 느낌.즐거운 식사였습니다.",맛있다
1147,제니스카페,"여전히 맛있는 곳이었어요. 이렇게 추워지기 전에 갔었는데.. 테라스 창문을 활짝 열어놔서 와인 한 잔하면서, 커피 한 잔 하면서 맛있는 음식을 음미하기에 너무 좋았어요. 주차되는건 더더욱 좋고요! 네이버로 예약했는데, 예약 미리 해줬다고 서비스도 주셨어요 기분 좋은 식사시간이었습니다",맛있다
